http://www.the-star.co.ke/news/2013/02/09/ford-k-hopeful-evicted-by-odm_c736495,Ford-K hopeful ‘evicted’ by ODM,www.the-star.co.ke › Local News › Western,"Feb. 09, 2013, 12:00 am","['A Ford-Kenya candidate in Busia on Thursday cried foul after she was left out of a joint ODM candidates campaigns launch.', ' ', ""Women representative, Cynthia Mutere had arrived at Amagoro from Budalang'i ready to join the ODM team but she was denied the opportunity."", ' ', 'Speaking to the press, Mutere blamed the incident on ODM county chairman, Patrick Obongoya and women leader Rose Idewa whom she claimed engineered her eviction. Obongoya and Idewa however rubbished her claims.', '\n']"
http://www.the-star.co.ke/news/2013/02/09/the-media-has-a-right-to-criticize-leadership-in-every-society_c735973,The Media has a right to criticize leadership in every society,www.the-star.co.ke › Siasa,"Feb. 09, 2013, 12:00 am","['Some people dont want to hear radio stations like Sauti Ya Mwananchi criticising their favourite leaders. They consider them flawless, that they never err and should they do anything wrong, their positions in society put them above criticism. But to understand the right of the media to criticise leaders, let me cite five main functions of any radio station.', 'Medias first responsibility is to inform their audiences or readership of whatever is happening in the country, good or bad. But in informing people of whatever they must observe fidelity to truth, however painful. But the pain of truth is like the pain of giving birth. It has sweet consequences. ', 'The second function of media is to educate its readership or audience on the many things in the world whose existence they dont know and if they do, they dont understand.', 'The third function of a radio station is to criticise society and leadership when they get lost. To do this, many radio stations allow their radios to serve as platforms for self-criticism or criticism of leaders. When society rejects self-criticism or criticism, it is like a human being that will not bathe. It stinks.', 'The forth function of a radio or television station is to entertain its audience with music, films, plays or narration of stories. In entertaining however, every station must not undermine by violating its dos and donts in order to undermine its culture or morally pervert its youth by exposing them to things that corrupt their behaviour and character. Media should therefore not promote pornography.', 'The fifth function of the media is to engage in advertising business selling its airtime as a commercial enterprise. But this business must be conducted through obedience to laws like the Public Procurement and Disposal Act. ', 'Nor should media use falsehood to promote profits. Since media are the ultimate critics, they should avoid corruption when they may not self-criticise.', 'In the days of one party dictatorship, people could not criticise leaders even if they walked naked in the market by denying them the right to use a government radio station like KBC whose only work was to praise the president, entertain him, spread his propaganda and broadcast news about him only. All news that the government media broadcast was to praise the president while denigrating and demonising political enemies.', 'Under Kenyatta, every KBC reporter who dared criticise the president would be taught a lesson while all people including KBC were all the time advised to chorus the presidents song like a parrot or risk being detained without trial.', 'Courtesy of our new constitution and democracy, a private radio station has a right to criticise any leader who does wrong but as the musician Munish will say, it is the right of those who listen to a radio not to listen to that criticism if it grates their ears.', 'In offering criticism to society, a radio station must not discriminate. It must not have those it will criticise with alacrity and sacred cows whom it will never criticise. ', 'When a radio criticises Kibaki, it should also criticise Raila, and when it criticises Uhuru, it must also criticise Kalonzo Musyoka. As the saying goes, media must not have some of the stomach and others of the back.', 'Here we need to understand that according to democracy, the job of criticising leaders, exposing their weakness and mistakes to avoid their recurrence, belongs to media as its way of protecting people from leaders who are inclined to oppression and other evils just because they have the power to oppress. Indeed, media should be regarded as enemies of society if they should shy to criticise leaders out of love or fear.', 'In its criticism of leaders or its education of people, there are certain things a radio may not do deliberately.', 'First, where it criticises all human deities, it may not criticise God.', 'Second, criticising a radio station will ensure it does so with responsibility, making sure it puts public interests and truth before everything else. ', 'Equally, when a radio station criticises a leader, it must ensure it does not violate his rights. It must also give a right of reply to all those who think they have been criticised unfairly. Criticism of a radio must also go along with readiness to give credit where due.', 'It must also be understood that to criticise deeds, policies, utterances and works of a leader does not amount to attacking the person. Unfortunately many dont understand this.', 'A leader who is above criticism is a dictator and people who protect such leaders from criticism aid and abet dictatorship even when they are its victims.', 'Unfortunately, dictatorship has a tendency to keep people as slaves who dont know of their rights and spend all their time defending dictators who the primary source of their problems.', 'Worse, when tyranny is constructed, common people forget about their interests. They only think of the interests of their leader. And for fear of dictatorship, poor people never dare utter a word about their problems. When the leader catches a cold, they sneeze.', 'During elections, poor people have no agenda. To them, the agenda of leaders is the agenda of elections. In fact it saddens that when people talk during elections, they hardly mention problems they want solved after elections.', 'Ultimately the freedom of expression is the freedom to criticize leaders and government. When people surrender this freedom, they deny themselves democracy and commit suicide. But a society without a voice is a slave society that must be liberated. This is the plight of Kenya today.', '\n']"
http://www.the-star.co.ke/news/2013/02/09/odm-loses-grip-in-nyanza-as-candidates-decamp-to-smaller-parties_c734955,ODM loses grip in Nyanza as candidates decamp to smaller parties,www.the-star.co.ke › Siasa,"Feb. 09, 2013, 12:00 am","['The dominance of ODM in Nyanza is under serious threat ahead of the March 4 elections. This is a result of numerous disputes that resulted in mass defections to other Cord-affiliated parties after the shambolic nomination process.', 'Unlike before when nominations in Nyanza determined who would win in the general election, this time round no one can tell with certainty who will emerge as a winner come March 4.', 'ODM leader Prime Minister Raila Odinga recently criss-crossed the region in a bid to convince the electorate to vote for him.', 'On Monday, Cord Effect Team, a lobby group campaigning for the PM went to Kisumu and told residents that they were only campaigning for the PM and were not interested in who becomes the MP or county representative so long as they were from the Cord-affiliated parties.', 'Ababu Namwamba led the team that comprised, John Kiarie, Mumbi Ngaru, Nancy Abisai, Joyce Lei and Rosa Buyu. Siaya county is one of the areas where ODM governor aspirant Cornel Rasanga Amoth is expected to face stiff competition from William Oduol, who is running for the seat on a National Agenda Party of Kenya ticket.', 'Oduol, PM Railas brother Oburu Ogingas challenger during the recent party primaries decamped to NAPK after they were both disqualified by ODM following a dispute as to who won the nomination. The party decided to hand the nomination certificate to Amoth.', ""Former Alego Usonga MP Sammy Weya who will be vying for the area's parliamentary seat on a NAPK ticket expressed optimism that they will carry the day after Amoth picked little known Bondo parliamentary seat loser Ouma Onyango as his running mate."", 'Onyango was Oburus preferred candidate for the Bondo parliamentary seat but was trounced by Gideon Ochanda who had earlier declared interest for governor but later pulled out to run for Bondo MP.', 'We have no problem with Raila Odinga\'s presidency. We will campaign for him but what we are calling for is respect for multi-party democracy. We must not put all our eggs in one basket. We must be ready to elect development-conscious and progressive leaders and desist from the culture of voting for people basing on the political parties they belong to,"" Weya said.', 'He called on the public to fully support the ODM candidates who won their nominations fairly.', '""The people who must be rejected are those who were handed nomination certificates unfairly after being trounced. This is not the democracy the PM has been preaching. Before the sham primaries, the PM promised to work with whoever the people elected. He must now be ready to work with any candidate regardless of his or her political party after the elections, Weya said.', 'But Lands minister James Orengo is of a different opinion. He has warned that rival political parties have infiltrated ODM strong zones to scuttle Prime Minister Raila Odingas presidential bid. Orengo asked voters to be wary of newly-formed parties especially in Nyanza purporting to support Raila yet they are ""agents of doom"".', ""Wary of Oduols immense influence in Siaya county, Orengo said a Raila government requires trusted lieutenants not gullible leaders who will be swayed by money to betray its course. He asked voters in Siaya to elect a governor who will work in harmony with Raila's government in delivering services to wananchi."", 'Immigration Minister Otieno Kajwang is also expected to face stiff competition from PDPs Hilary Alila. Alila expressed optimism he will trounce the former Mbita MP on March 4. ', 'We want our people to elect development-conscious leaders and not mere party soloists who do not have the interest of their people at heart, Alila said.', ""It will also be tricky for Wilfred Machage of ODM who is said to have lost in the ODM primaries to former Migori county ODM chairman John Magaiwa in the senator's race. Machage will battle it out with independent candidate Oluoch Kanindo. "", 'During the ODM primaries, majority of members of the Luo community voted for Magaiwa who hails from Kuria but the certificate was issued to Machage.', 'In Muhoroni constituency, outgoing MP Ayiecho Olweny is facing major hurdles in his bid to recapture the seat. Olweny will not have it easy after James Onyango Koyoo defected to Magaras Peoples Democratic Party citing unfairness in the ODM primaries.', 'The people of Muhoroni made the right choice by voting for me but it is unfortunate the ODM certificate was handed to Olweny. However, I am ready to give him a run for his money while campaigning for the PM, Koyoo said.', ""In Kisumu Central constituency, ODM's Ken Obura is facing stiff competition from businessman Abdulqadir Omar of Ford-Kenya. Omar decamped from ODM citing irregularities in the party primaries."", 'I tried to step down for Obura but my supporters would hear none of it. I am now fully in the race after being cleared to run on a Ford-Kenya party ticket, Omar said.', 'Other constituencies where ODM will face competition include Gem, Alego Usonga, Nyando, Karachuonyo and Uriri. In Gem, Federal Party of Kenyas Elisha Odhiambo Akubah who was declared winner against former MP Jakoyo Midiwo in the ODM primaries but the nomination certificate given to his rival and Booker Omole of Social Democratic Party (SDP) have vowed to teach Midiwo a lesson.', 'In Alego Usonga, outgoing MP Edwin Yinda will battle it out with Wiper Democratic Partys (WDP) Omondi Mulwan. Former Nyando MP Fred Outa will also fight it out with Ford-Kenyas Jared Okello. Former Karachuonyo MP James Rege will fight it out with Wipers Adipo Okuome who claims to have won the ODM primaries.', 'In Uriri constituency, former MP Ojwang Omollo who defected to Ford Kenya after being denied the ODM certificate has promised a bruising battle against his opponent Enock Kobado. Former Kisumu Town West MP Olago Aluoch defected to Ford-Kenya after being trounced by Rosa Buyu. ', 'Buyu beat Olago in a fair nomination contest. In 2007, Olago was declared winner in a shambolic nomination. This time round, Buyus supporters have expressed confidence she will beat Olago.', 'Those who defected to other parties affiliated to Cord have accused ODM of being insincere to its partners by terming them projects in their campaigns. They are now seeking the intervention of their party bosses to ensure a level playing ground with their ODM competitors.', 'Pastor George Weda who is running for Kisumu senator on the Farmers Party ticket faulted calls by some aspirants for ""six-piece"" voting saying this will affect democracy in the region.', 'The six-piece calls may lead to voter apathy that will also affect the PMs votes in the region hence it must be shunned, he said. Weda warned that if the PM comes out openly to campaign for his ODM candidates, it will lead to suspicion among Cord coalition partners that may threaten their unity.', 'It is this kind of suspicion that can even lead to Cord breaking just like the Pentagon team of 2007, he added. Weda promised to give ODM candidate for the Kisumu senate seat Anyang Nyongo a run for his money.', '\n']"
http://www.the-star.co.ke/news/2013/02/09/odingas-blunderd-in-machakos-and-bungoma_c735983,Odingas Blunderd In Machakos And Bungoma,www.the-star.co.ke › Siasa,"Feb. 09, 2013, 12:00 am","['Prime Minister Raila Odinga has had an unusually difficult time on his own home turf in recent weeks for being seen to endorse a number of candidates over and above the wishes and expectations of the electorate.', ' ', 'The discontent culminated in the extraordinary scenes in Luo Nyanza this week in which a grassroots backlash against cronyism made itself so powerfully felt, right in front of the PM himself, that some media outlets characterised it as the Homa Bay Uprising.', ' ', 'In rally after rally in his Nyanza political backyard, Raila witnessed scenes of passionate protest by his most ardent supporters, men and women who are totally dedicated to his presidential bid but who cannot abide being directed, even by him and his closest advisers, on how to vote for governor, senator, MP, civic representative and womens representative.', ' ', ' ', 'It is surely time for the Prime Minister and his innermost circle of strategists to read the mood inside ODM and Cord and move fast with some critically important damage control. ', 'Things are so bad that members of the PMs family itself have suffered reputation damage and a PR crisis at the worst possible time in the election cycle, the build-up to the biggest and most crucial general election of them all so far  the March 4 event.', ' ', 'There is no doubt that Railas support is not in question. But his millions of supporters in and beyond Nyanza very strongly reject being told to support specific candidates, including manifest non-performers and perceived political pests who left the Civil Service or were in Parliament only the other day. The people clearly want to make their own choices at the grassroots.', ' ', 'This brings us to the biggest blunders that Raila has made in this regard outside Luo Nyanza in totally ill-advised moves that are quietly building up such resentment and perceptions of maximum disrespect that his preferred candidates are heading straight for humiliating defeat. ', ' ', 'On Tuesday, January 15, 2013, three days before the initial Independent Elections and Boundaries Commissions (IEBC) deadline for the all-party nominations, Raila travelled to Kakamega and endorsed his second co-principal in Cord, Trade Minister Moses Wetangula, for senator, a gesture that went down very well with the electorate as it was taken as a salute and a show of respect for his coalition partner. However, in the very same breath, the PM also endorsed an assistant minister in his office, Alfred Khangati, for governor of Bungoma, an ODM candidate.', ' ', 'The Khangati endorsement was instantly and widely viewed as a slap in the face and a kick in the teeth for Wetangula, given the fact that Ford Kenya has a very substantial candidate for governor of Bungoma in Ambassador Jack Tumwa. Where else will Wetangula, Ford-K and ourselves get a governor if the PM imposes Khangati? is a lament that has been heard throughout Bungoma and its diasporas, both inside and outside Kenya, since then.', ' ', 'Reports this week to the effect that Khangati has actually quit the race, citing lack of funding, and communicated this momentous decision to the PM by SMS and by letter to the IEBC returning officer in Bungoma, were instantly taken by the electorate to be insufficient to remove the disrespect to Wetangula occasioned by the initial endorsement at Kakamega. The mood on the ground is that the PM should revisit the region and acknowledge Tumwas bid.', ' ', 'In Ukambani in late December, the PMs wife, Ida Anyango Odinga, endorsed the assistant minister in charge of Youth Affairs in the Ministry of Youth Affairs and Sports, Wavinya Ndeti, for governor of Machakos county. ', 'Mrs Odinga and her advisers did not pause for one moment and ask themselves how this maximum disrespect of the second Cord principal, Vice President Kalonzo Musyoka, whose Wiper party already had former government spokesman Dr Alfred Mutua as gubernatorial candidate, would go down in Ukambani. She said Ndeti had done a sterling job as Kathiani MP.', ' ', 'Mrs Odinga did not stop there in her endorsement sprees. At the end of 2012, she endorsed Minister of State for National Heritage & Culture William Ntimamas daughter, Lydia Masikonde, an ODM candidate, for the women representative in Narok county.', ' ', 'What on earth has possessed the PM and his wife and made them so insensitive not only to their own grassroots at home but also to his co-principals in Cord? This is a case both of bad strategy and the worst possible political timing. ', ' ', 'But while there has been no booing in Bungoma and Machakos, the people of these places are no different from the people of Migori, Siaya and Homa Bay. They are willing to support the PM and Cord to the last man and woman, but he must allow them to exercise their choice for the other five elective seats on the ballot.', ' ', 'Raila is in a very tight place barely a month before the General Election. He needs everyone. Above all, he cannot afford to lose viable candidates or to step so wantonly on his co-principals toes. ', 'Having blundered, Mr and Mrs Odinga should be seen to exercise some damage control. The next time they revisit the scenes of their deeply unpopular endorsements, they must apologise and make amends.', '\n']"
http://www.the-star.co.ke/news/2013/02/09/a-watchful-world-the-obama-factor_c735889,A Watchful World: The Obama Factor,www.the-star.co.ke › Siasa,"Feb. 09, 2013, 12:00 am","['The 44th President of the United States is an authority on elections and oratory. He has handily won two classic presidential contests (2008 and 2012) and has since 2004 delivered a series of what are clearly the American political speeches of the 21st Century thus far.', 'On Tuesday this week, President Barack Obama made an extraordinary gesture full of far-reaching implications  he addressed a YouTube video message to the people of Kenya on the occasion of their forthcoming 11th General Election.', 'All of Kenya sat up and paid maximum attention, including reading between the lines and divining subtle signals of a political, diplomatic, international peace and security nature.', 'Though he botched his Kiswahili greetings, saluting Kenyans everywhere as Habari Yako instead of Habari Yenu, Obama made a number of powerful advisory points. It was a carefully crafted message, well aware of Kenyas multiple presidential candidates, party loyalties and deep divides.', 'The oratory and sense of occasion were much in evidence: You can show the world you are not just a member of a tribe or ethnic group but citizens of a great and proud nation. I cannot imagine a better way to mark the 50th anniversary of Kenyas Independence.', 'Whether Prime Minister Raila Odinga or Deputy Prime Minister Uhuru Kenyatta wins the presidential race, either and his supporters will claim Obamas remarks as significantly prefatory to their victory.', 'Obamas message, touching as it did on the two scheduled apex political events of 2013 in Kenya, the polls and the Golden Jubilee of Independence, means all things to all sides of the Kenyan political divide. Indeed, the Jubilee Coalition presidential pair of Uhuru and William Ruto were among the first politicians to salute the Obama message, clearly relieved that it neither expressed a political preference nor deplored their status as crimes-against-humanity suspects with cases to answer at the International Criminal Court at The Hague. ', 'All Obama said was that if the elections are credible, if the elections were credible, you will continue to have a strong friend and partner in the United States of America.', 'And Obamas message was unique  he has not dispensed such country and event-specific good advice to any other nation on his presidential watch so far. It was a message to the people of the land of his forefathers, a country from which he is only one generation removed.', 'But the most significant aspect of the message to Kenya is the impression that, this time, the world is really watching, is all eyes and ears, monitoring every step of the way towards Kenyas next presidential polls, the first since the disputed results of the 2007 poll that led straightaway to the post-election violence in which 1,300 died, 650,000 were displaced and the economy almost went into a tailspin, falling from an impressive 7% growth to below 4%.', 'Kenyans have held a national electoral event after the trauma of the PEV, the National Referendum on the new Constitution in August 2010, which went off without a hitch and to world-class standards rarely witnessed in Africa.', ' But a national plebiscite, with its starkly simple Black and White, Yes and No choice, is a much less complex affair than the forthcoming biggest and most complicated General Election of them all, an event that is likely to generate all manner of disputes and counter-claims.', 'As for dispute resolution, Obama advised Kenyans, Kenya must reject intimidation and violence, and allow a free and fair vote. Kenyans must resolve disputes in the courts, not in the streets.', 'The kind of scrutiny that the Obama Administration is bringing to bear on the Kenyan General Election is unprecedented and the top members of the political class and their strategists, whether outgoing or incoming, educated in America or not, will be forgiven for feeling more self-conscious than usual.', 'For millions of Kenyans, particularly prospective voters in the hotspots of 2007, this is no bad thing. In fact, the message should also have been broadcast on radio in its entirety, given the fact that the vast majority of Kenyans outside the ruling and middle classes and the far-flung Diaspora are not users of YouTube, but they do listen to FM radio keenly and broadcasting has a 24/7 cycle inside Kenya, including in Kiswahili and a large variety of the 42 vernacular languages and their dialects.', 'The US Presidents gesture places Kenya very high up on the list of his second-term foreign policy priorities. And it will almost certainly be followed by another key message in the aftermath of the 11th General Election. ', '\n']"
http://www.the-star.co.ke/news/2013/02/09/former-beauty-queen-attracts-politicians-in-her-projects_c736133,Former Beauty queen attracts politicians in her projects,www.the-star.co.ke › Lifestyle › Word Is,"Feb. 09, 2013, 12:00 am","['Former Miss Kenya Shamilla Kiptoo maybe not be in the limelight much, but her work away from the camera should be a lesson for any former, current and even future beauty queens. ', ""When she won the title in 2006, the 58 tall model stated that her mission would be to offer a hand and support to abandoned children. Six years later, her Shamilla Kiptoo Foundation has become a household name in childrens' homes around the country. She works to support these abandoned children."", ' On Tuesday afternoon, Shamilla, media entrepreneur Sir Henry and aspiring Deputy Governor of Nairobi Jonathan Mueke visited the Flomina Childrens Home in Kayole. Shamila felt that Mueke needed to experience a matter that she believes should be on the priority list of anyone who will run the county of Nairobi after the forthcoming general elections. The youthful Jonathan Mueke has been picked by Dr Evans Kidero as his running-mate.', ' I decided to work with Sir Henry and Jonathan Mueke because they are both young people who understand our issues. I have specifically brought Jonathan here before  he is elected so that he can have a first-hand experience and remember us if he makes it after the elections, said the beauty queen.', 'The three toured the home that houses 56 children. The home is sustained by the help of well-wishers and organisations like Haki Water who recently installed a chlorination unit to purify the homes borehole water.', 'Shamilla played with the children and helped with their school work after donating goodies to the home.', ' ', ' ', ' ', '\n']"
