http://www.the-star.co.ke/news/2013/02/12/slots-increased_c737663,Slots increased,www.the-star.co.ke › Sport › Local,"Feb. 12, 2013, 12:00 am","['Ken Abuto of Royal Nairobi, Boniface Simwa, Ali Kimani of Vet Lab, John Wangai and Paul Thuo have earned themselves belated qualification slots to the Barclays Kenya Open starting at the Karen Country Club tomorrow.', 'Professional Golfers of Kenya (PGK) Chairman Rizwan Charania said the qualificationn of the golfers is a major boost to the countrys fortunes at the prestigious eventwhich is a round of the European Challenge Tour.', 'The inclusion of the five top players brings the total number of Kenyans in the prestigious event to 33including 27 professionals and six amateurs. ', 'Charania said 27 is a huge number for home-based pros and by extension a huge step in right direction.Kenyan brigade will feature a blend of youngsters and veterans. Among the youngsters are Stefan Andersen of Muthaiga who turned pro last year and Greg Snow also from Muthaiga. ', 'It is really exciting that five of the pros came through at Karen during the weekend qualifiers, said Charania during the conclusion of Jamii Telecom PGK Masters which was won by Kisumus David Odhiambo.', 'Justus Madoya won the amateur category followed by Tom Omuli. Both Madoya and Omuli will be playing as off-scratch amateurs in the Kenya Open.', ' Every time we have a Kenya Open, there is always a tournament to prepare our pros just before the event. Participation in the Jamii event was unbelievable this year. Jamii has set a standard not only for professional golfers in Kenya but for the development of golf as a whole. We pros need to play 2 or 3 events in a month if we are to match the standards in the European Challenge Tour. We therefore urge sponsors to come on board, said Charania. ', 'Amateur players, who have made the cut for the Kenya Open include Nelson Simwa who finished second to Goty 2012 and champion David Opati. Opati has since turned professional and is among the 27 Kenyans who will line up for the prestigious show.', 'Kenyan Brigade: Amateurs Tony Omuli (Golf Park), Justus Madoya (Great Rift Resort), Nelson Simwa (Vet Lab), Mathew Omondi (Vet Lab), Francis Kimani (Limuru), Jay Sandhu (Royal Nairobi).', 'ProfessionalsDismas Indiza (Mumias), Brian Njoroge (Vet Lab), Ganeev Giddie (Sigona), Stefan Engell Andersen, Anil Ashok Shah (Royal Nairobi), Rizwan Charania (Windsor), Nicholas Rokoine (Muthaiga), Simon Ngige (Thika), David Odhiambo (Nyanza), Jacob Okello (Golf Park), David Wakhu (Great Rift Valley), Richard Ainely (Nakuru), Sullivan Muthugia (Thika), Ajay Shah, David Opati (Golf Park), James Mungai Karanja (Limuru), Ken Abuto (Royal Nairobi), Boniface Simwa, Ali Kimani (Vet Lab), John Wangai and Paul Thuo.', 'Others are  Hesbon Kutwa, Kopan Timbe (Nyali), Njuguna Ngugi ( Railways), Nelson Mudanyi (Muthaiga)', 'John Kagiri (Limuru), Greg Snow (Muthaiga) and David Opati (Golf Park).', '\n']"
http://www.the-star.co.ke/news/2016/05/27/french-embassy-drops-iebc-talk-at-last-minute-after-railas-name-came_c1358628,French Embassy drops IEBC talk at last minute after Raila's name came up,www.the-star.co.ke › National News,"May. 27, 2016, 5:00 am","['Everything was going well until Railas name was brought up. They called the embassy and the event was cancelled', ' ', 'The French Embassy was yesterday put on the spot after abruptly cancelling a public debate to discuss the IEBC impasse.', ' ', 'The debate was to be televised live on KTN yesterday morning but the embassys change of heart on Wednesday, at around 6pm, forced the organisers, the Kenya Human Rights Commission under the Kura Yangu Sauti Yangu initiative, to cancel the event.', ' ', 'The event was to take place at the French-owned Alliance Francaises auditorium. Cord leader Raila Odinga, Amani National Congress leader Musalia Mudavadi, Narc Kenyas Martha Karua, educationist James ole Kiyiapi, former MP Peter Kenneth, Senior Counsel Paul Muite and the IEBC chairman Isaack Hassan were to attend.', ' ', 'Former director of the Committee of Experts on Constitutional Review Ekuru Aukot had also confirmed attendance. The Jubilee government side led by Deputy President William Ruto and National Assembly majority leader Aden Duale declined the invitation.', ' ', 'According to a source at the KHRC, everything was going on well until Railas name was mentioned by the organisers as they surveyed the auditorium on Wednesday evening. They called the embassy and the decision was made that the event be cancelled. They were furious that they had not been informed which VIPs were attending, he said.', ' ', ' We wanted both camps present', ' ', 'A source said the French embassy was furious Jubilee leaders were not attending the debate which would be televised live on a local station.', ' ', 'They said that if Jubilee and the IEBC were not attending, then it is better it be cancelled, the source said. However, Alliance Francaise executive director Herve Braneyre told the Star the decision was informed by security reasons because the venue is a sensitive place.', ' ', 'We get instructions from the embassy on how to organise events and the cancellation was made because of the failure by the organisers to get people from both sides, he said.', '\n']"
http://www.the-star.co.ke/news/2013/02/12/adel-fancied_c737635,Adel Fancied,www.the-star.co.ke › Sport › Local,"Feb. 12, 2013, 12:00 am","['Algerian Adel Amrouche is a firm favourite to be named the new coach of Kenyas national football team Harambee Stars when the Football Kenya Federation,FKF unveil a new coach in the next ""few days"".', 'This was revealed by a source privy to the recruitment process as the Football Kenya Federation look for the man to replace Frenchman Henri Michel who quit in December last year.', 'Amrouche, born on March 7, 1988 in Kouba, Algiers, is a former Burundi coach. He has impressed the FKF because he is known to be hands on man who knows regional and African football well.', 'The federation wanted someone who was low key but capable of doing a good job. Someone who could build on the improvements seen in the national team in recent times as as well as build a team capable of competing with the very best teams on the continent, said the source who did not wish to be named.', 'He appears to have beaten the competition provided by Belgian Luc Eymael as well as two others. Amrouche began his playing career in Algeria playing for clubs that included CR Belouizdad, USM Alger, JS Kabylie, OMR El Annasser, Olympique de Medea and AS Ain Mlila. He then moved to Austria briefly to play for Favoritner AC.After that, he played for a number of Belgian clubs like La Louviere and Mons, as well as amateur clubs KAV Dendermonde and SK Lombeek.', 'His managerial career began in 1988 coaching the youth ranks of local club OMR El Annasser while playing for the senior team. He held the same role during his playing stints with USM Alger and RC Kouba.', 'In 2002, he was appointed as the manager of Congolese club Daring Club Motema Pembe.', 'In 2007, Amrouche became the coach of the Burundi national football team. On January 1, 2011, Amrouche turned down an offer to take over the vacant managerial role of Algerian club ES Setif, preferring to continue in his role with the Burundi national team. On February 29, 2012, Amrouche resigned as the manager of Burundi, just a day after a 2-1 win against Zimbabwe in the 2013 Africa Cup of Nations qualifiers.', 'Last Friday FKF chairman Sam Nyamweya revealed, without naming the three coaches shortlisted to take charge of the Stars with the support of stand in coach James Nandwa when the World Cup qualifiers resume next month with the match against Nigeria on March 22.', 'We have interviewed three coaches who we want to work with the current team of James Nandwa who have done exemplary work since they were given the mandate to take charge of the team,stated Nyamweya.', 'The FKF supremo added that they are looking to settle on a coach who will at least be able to speak English to stave off the communication problems that dogged Michel', 'Amrouche resigned as coach of Burundi surprisingly after guiding the Swallows to a 2-1 win against Zimbabwe in the 2013 Africa Cup of Nations qualifiers and was replaced by Egyptian Lofty Naseem who early last month steered Burundi past Harambee Stars in the qualifiers of the CHAN tournament.', 'FKF are believed to be working hard to ensure that a new hear coach is in place weeks before the qualifiers of next years World cup in Brazil resume next month.', '\n']"
http://www.the-star.co.ke/news/2013/02/12/sanctions-dont-scare-us-says-jubilee-team_c737239,"Sanctions don't scare us, says Jubilee team",www.the-star.co.ke › National News,"Feb. 12, 2013, 12:00 am","['The Jubilee Alliance yesterday told the international community that they will not be intimidated by threats of sanctions. ', ""Nairobi Metropolitan minister Jamleck Kamau, Joshua Kutuny, Charles Keter and Murang'a TNA candidates Mwangi Wa Iria (governor) and Wanjiru Chege (women representative) described the warning by Western envoys as dictatorial and blackmail. "", ""Speaking at a rally at Ihura Stadium in Murang'a, the politicians said Jubilee stands for a government elected by Kenyans for Kenyans. "", 'Uhuru and Ruto will not be intimidated by threats of sanctions by foreign countries, said Kuttuny.He said foreigners have no right to tell Kenyans who to elect and that voters should be left to elect their leaders freely. ', 'Jamleck and Wanjiru said some foreign diplomats have resorted to issuing threats after they realised that Uhuru and Ruto are headed for victory. ', 'They said Kenya has other friends who will cooperate with Jubilee to implement its policies.Keter said Uhuru and Ruto will be cleared off the charges they are facing at the ICC. ', 'I am sure Uhuru and Ruto will be free. We know Kenyans are with them 100 per cent, he said.US assistant secretary of state Johnnie Carson last week warned that Kenya faces consequences if the Jubilee coalition wins the elections. ', 'Switzerland, Britain and France alseo warned of sanctions should Uhuru and Ruto be elected.', ' ', ' ', '\n']"
http://www.the-star.co.ke/news/2013/02/12/policeman-shot-dead-in-mandera_c737939,Policeman shot dead in Mandera,www.the-star.co.ke › Latest News,"Feb. 12, 2013, 12:00 am",['\n']
http://www.the-star.co.ke/news/2013/02/12/veteran-tikolo-proves-point-as-he-steers-swamibapa-to-victory_c737676,Veteran Tikolo proves point as he steers Swamibapa to victory,www.the-star.co.ke › Sport › Local,"Feb. 12, 2013, 12:00 am","['VETERANS David Tikolo scored an unbeaten century to steer Swamibapa to the semi-finals of the Nairobi Provincial Cricket Association (NPCA) 50 overs tournament.', 'David, an elder brother to former national team captain Steve Tikolo and younger brother to NPCA boss Tom Tikolo scored 101 not out as Swamibapa beat hosts Ngara Sports Club by 42 runs.', 'Batting first, the visitors made 220 runs for the loss of nine wickets. Tikolo, who batted at four, faced 123 balls hitting nine fours as his side recovered from 67 for 4 to score the total. Tikolo put on a stand of 40 with Navin Varsani that got the scores to 107 after early loss of the wickets of Shashikant Sangani (13), Avnish Khoda (8), Mayur Pindoria (12) and Narendra Kati (9). Varsani made 32 from 54 balls before he was trapped by John Mariga. Mukesh Hirani only made three in a 12 runs stand with Tikolo.', 'Pankaj Kerai (10) and Sameer Hirani (16) were the only lower order batsmen to have accorded Tikolo a hand at the tail. Mariga who got the wickets of Sangani, Navin Maya and Hirani finished with 3 for 30. Akash Shah and Nikul Patel ended with 2 for 47 and 2 for 53 respectively.', 'In reply, Ngara had a tough time on the middle as they kept on losing wickets at regular intervals.The first wicket fell with the scores on 22 and the second and third followed on 36 and 43 respectively.', 'Nikul Patel (26) and Harsh Patel (21) were the only top scorers at the top order.Mariga (16), Nikel Patel (35) and Mehul Patel (28) brought life in the middle order but it wasnt enough as Swamibapa bowlers and fielders put on a great show.', ' Harshil Jesani revolt with 31 at number nine proved to have come too late as Swamibapa bowlers completed the allotted overs with three wickets in hand.', 'Mayur Pindoria and Sangani picked 2 for 20 and 2 for 29.', '\n']"
http://www.the-star.co.ke/news/2013/02/12/police-fire-at-iebc-chairs-car-in-mistaken-identity_c737678,Police fire at IEBC chair's car in mistaken identity,www.the-star.co.ke › National News,"Feb. 12, 2013, 12:00 am","[""Police mistakenly shot at a vehicle assigned to the IEBC's chairman Isaak Hassan while responding to a distress call at Karen's Hardy estate on Sunday night."", ""Sources say the IEBC chairman's bodyguard and two other police officers who were in the vehicle rushed to answer the distress call."", 'A group of officers on patrol mistook them for gangsters and fired eight time at the vehicle during the 9:45 pm incident. ', ""The officers are said to have thought Hassan's vehicle had robbers on board. Apparently, a vehicle had been snatched from its owners in the area who reported the incident to police."", ""The officers on patrol are said to have been pursuing the gangsters when Hassan's vehicle came speeding towards them."", ""Police are treating the incident as 'friendly fire' and although a report has been recorded, no action is being taken against the officers involved."", '""It is a straight forward case of mistaken identity and fortunately no one was injured or killed. As is the practice, an inquest file will be opened to investigate the circumstances surrounding the shooting to establish if it could have been avoided,"" a senior police officer said.', 'Langata DCIO James Manuni visited the scene and questioned the officers before briefing his seniors. Speaking to the press, Hassan confirmed that his vehicle was shot at and that noone was injured after the driver jumped out of the vehicle, hid in a bush and identified himself as a police officer.', '\n']"
http://www.the-star.co.ke/news/2013/02/12/cck-withholding-materials-claims-royal-media-group_c737670,"CCK withholding materials, claims Royal Media Group",www.the-star.co.ke › National News,"Feb. 12, 2013, 12:00 am","['THE Communications Commission of Kenya is yet to submit materials it collected while investigating Royal Media Services and its chairman SK Macharia for using illegal services, a court heard yesterday.', ' ', 'The DPP had directed CCK to submit the respective files and investigative materials regarding the case. RMS through lawyer Issa Mansour further told Justice Lydia Achode that despite an order issued by her counterpart Issack Lenaola that barred CCK from cancelling the frequencies, the commission obtained an order from the subordinate courts.', 'RMS argues that the resident magistrate who issued the orders disregarded earlier orders that were issued by the High Court in a pending petition.', 'She committed a contempt of court and ignored the hierarchy of courts set out in chapter six of the constitution. She issued warrants which were used to shut down RMS broadcast transmitters at 17 sites despite the fact that there was an order in court preventing that from happening, said the company.', ""RMS argued that the CCK abused its powers and contravened the media house's rights to access justice by rendering unimportant the protection given by the court."", 'The media house, in the court documents, seeks to restrain CCK from charging its chairman or any other officer of the company. It also seeks to set aside the warrants that were meant to seize the offending transmitters.', 'DPP Keriako Tobiko had last week ordered the communications regulator not to press any charges against Royal Media Services and its bosses.', 'He said he was guided by Article 157 of the constitution which gives him the obligation to ensure that any exercise of the state powers of prosecution by him does not include an abuse of the legal process. The case will be heard on Thursday.', '\n']"
http://www.the-star.co.ke/news/2013/02/12/uhuru-is-wrong-kenya-needs-the-west_c737580,"Uhuru is wrong, Kenya needs the West",www.the-star.co.ke › Opinion › Others,"Feb. 12, 2013, 12:00 am","[""It is unfortunate and tragic for Uhuru Kenyatta and his running mate William Ruto are misleading Kenyans about Kenya's role in the community of nations, its relations and foreign policy."", 'Uhuru, like any other presidential candidate, should respect Kenyans, who through their parliamentary representatives, decided to have those bearing the most responsibility for the 2007-08 post-election violence tried at the Inernational Criminal Court.', 'The international community was not involved in this decision. Ruto and Uhuru had their chance to try and persuade fellow parliamentarians to have these cases tried locally.', 'It is therefore highly hypocritical for Uhuru and Ruto to turn around now and pretend that the international community is intimidating Kenyans and browbeating them into choosing their leaders.', 'I would urge Uhuru to recall and be guided by the words of the late Internal Security minister, Prof George Saitoti, who said There comes a time when the nation is bigger than any individual. Uhuru should realise that Kenya is far bigger than himself or any other presidential candidate.', 'Uhuru and Ruto should also realise that in as much as we may not depend on the international community to balance our budget, we need these countries for their markets.', ""An attempt at ridiculing, ignoring and or dismissing the roles that these countries have to play in our country's economic development is a lack of understanding about how our country's development is interlinked with the West."", ""It would be more useful for us if Uhuru can tell us which markets and which countries are willing to take up our horticulture, flowers even miraa crop at the rate at which the countries he is demonizing are doing. How soon should we expect this 'East' to step in?"", 'Western nations as development partners are only interested in the enhancement and promotion of good governance and democracy with integrity.', 'They have no stake in Kenya and have very little to lose or gain if Kenya collapses or sinks as a nation. It is myopic and childish to claim that western nation has anything to gain or get in Kenya whether Uhuru, Raila or whoever is elected president or not.', 'Uhuru should embrace the international community and the ICC to prove that he is not irresponsible and that he respect the rule of law.', 'Making wild allegations and public statements especially in political rallies demeaning and discrediting the international community and ICC is itself criminal and suspect. Such utterances only serve to reinforce the perception that they are inciters and therefore, may be correctly before the ICC.', ' ', 'The writer is the executive director for the Institute for Democracy & Leadership in Africa.', '\n']"
http://www.the-star.co.ke/news/2013/02/12/state-paying-uhurus-hague-fees-bett-says_c737705,"State paying Uhuru’s Hague fees, Bett says",www.the-star.co.ke › National News,"Feb. 12, 2013, 12:00 am","['THE government is using state resources to defend Jubilee Coalition candidates at the International Criminal Court, Roads minister Franklin Bett has claimed. ', 'Jubilee presidential candidate Uhuru Kenyatta and his running mate William Ruto face charges at The Hague. ', 'Bett, the Cord Executive Board chairman, faulted Head of Public Service Francis Kimemia and the provincial administration for mobilising Kenyans to vote for Jubilee . ', 'Were all aware that the civil servants code of conduct does not allow them to actively participate in politics. I want to urge Kimemia to keep off politics, Bett said. ', 'He was speaking yesterday at the Cord Secretariat head- quarters in Nairobis Lavington. ', 'Last week, Kimemia said he prefers to believe US President Obama rather than Ambassador Johnnie Carson  the Assistant Secretary of State for the Bureau of African Affairs  on how America will react if Uhuru wins the presidency. ', 'Obama had last Tuesday said the US will respect the outcome of the March 4 elections.', 'However, Carson warned on Thursday that electing Uhuru and Ruto will have consequences for Kenya. ', 'Bett accused some government officials of demanding national IDs in exchange for relief food in some parts of the country. ', 'He warned members of the public against surrendering their IDs for food. I want to tell Kenyans that relief food is given without any conditions, he said. He, however, refused to give details of the scam.', '\n']"
http://www.the-star.co.ke/news/2013/02/12/flower-exporters-increase-orders-ahead-of-valentines_c737534,Flower exporters increase orders ahead of Valentine's,www.the-star.co.ke › Business › Local,"Feb. 12, 2013, 12:00 am","['Flower exports are steadily rising ahead of Valentine day on Thursday with a major flower grower in the country, Finlays delivering 450 tonnes to the UK market this week, it has emerged.', 'The UK high commissioner in Nairobi Christian Turner said yesterday via his official twitter page: ""UK company Finlays have this week delivered 13 million roses, 5 million other flowers (450 tons) in four full 747s (Boeing aircrafts) from Kenya to Britain.""', ""Locally, vendors hope to sell one week's worth of flowers over the next three days as Valentines day spending catches on."", ""Kenya Flower Council is however concerned with the high cases of arbitrary levies and taxes being demanded by local authorities in various flower growing and selling towns, taking advantage of distributors' need for urgency in delivery ahead of Thursday."", '""We already pay tax to the Horticulture Crop Development Authority but some councils workers are stopping trucks on the road to demand for money and you know right now the farmers will just pay it because they need to get the flowers to the market as fast as possible,"" said KFC chief executive Jane Ngige.', 'KFC said Valentines day alone accounts for 20 per cent of annual flower sales. Rough estimates indicate that last year about 120,000 tonnes of flowers were sold in local and foreign markets. She added that daily an average 300 tonnes are exported by Kenyan growers while on eve of Valentines an estimated 500 tonnes are exported.', 'According to chairman of Flower Vendors Association Elvis Wainaina, flowers sold in the country would normally be a volume of three tonnes in one week adding that they are likely to sell four tonnes over the next two days.', '""The City Council has allowed us to put up temporary tents in town (Nairobi CBD) and some areas out of town on 12th, 13th and 14th,"" said Wainaina.', 'Valentines day is marked annually on February 14. It is a day set aside to celebrate love whereby most people exchange candy, flowers and other gifts as a way to show appreciation to their loved ones. It has become highly commercialised over the years.', 'Wainaina said flower tents will be placed along Koinange, Mama Ngina, Moi Avenue and Muindi Mbingu streets of Nairobi. Others will be located at the Sarit Centre and Jacaranda in Westlands, outside the Westgate mall, Nakumatt highridge and Nyayo stadium and at Kenyatta Avenue.', 'British Airways regional commercial manager George Mawadri could not immediately give exact figures of flower cargo it had exported recently as data was being compiled.', ' ', ' ', '\n']"
http://www.the-star.co.ke/news/2013/02/12/mombasa-candidates-spell-out-their-plans_c737578,Mombasa candidates spell out their plans,www.the-star.co.ke › Local News › Coast,"Feb. 12, 2013, 12:00 am","['Five Mombasa governor aspirants yesterday spelt out priority areas to the business community in their plan for an improved economy.', 'The Kenya Association of Manufacturers organised the governors debate as a way of weighing the candidates plan for the business community.', 'Abdallah Mwaruwa (TNA), Tendai Mtana (independent), Ibrahim Babangida Khamis (Republican Congress Party), Suleiman Shahbal (Wiper) and Isaac Malila said the Sh4.6 billion allocated for Mombasa is not adequate.', 'They offered different plans they said would raise additional revenue without affecting the interests of the traders. Mwaruwa, a former Kenya Ports Authority managing director, said he will prioritise the tourism sector by cleaning up the county to attract more tourists.', 'He pledged to ensure value addition to products harvested in the region, including coconuts and fish. We should export finished products and earn more from them, he told the traders at the Whitesands hotel.', 'Babangida pledged to focus on job and wealth creation, saying he said he does not believe in giving all the six constituencies equal amounts of funds.', 'Mtana said he will address social amenities such as roads and quality services to ensure investors realise improved revenue.', 'Malila said he will ensure the cost of running businesses in the county is reduced by removing fees but did not specify the charges he would remove.', 'Shahbal said he plans to create six mini-cities out of the six constituencies and allocate each a budget complete with an implementation plan.', 'The aspirants said planning is mandatory and will involve all stakeholders. The last plan for Mombasa was drawn in 1962. ODMs Hassan Joho, Kadu-Asilis Anderson Chibule wa Tsuma and Lawrence Kamau did not appear for the discussion.', '\n']"
