http://www.the-star.co.ke/news/2013/02/12/artiste-wants-to-exploit-money-from-me-says-ida_c737611,"Artiste wants to exploit money from me, says Ida",www.the-star.co.ke › National News,"Feb. 12, 2013, 12:00 am","['Prime Minister Raila Odingas wife Ida is seeking to have her name struck off from a suit filed by a musician, accusing the artist of extortion.', ""Alphonsius Nyasetia sued to stop Ida and ODM from using two of his songs in their campaigns. Nyasetia said ODM's Sibanduki Secretariat officials approached him last March and requested he compose the songs for Raila's presidential bid."", 'He said his Studio Kenya colleagues agreed to the deal and composed two songs, Agwambo and Sibanduki. I performed the songs at various campaign rallies organised by the party where more than 400 CDs were sold, he said.', 'However, according to Ida, Sibanduki is not an entity known to the law or a company where officials can be used. She also denied being an official to the lobby group-Sibanduki.', 'She told Commercial judge Jonathan Havelock that Nyasetia filed the case to extort her because she is the Prime Ministers wife.', 'Ida also denied entering into any contract, agreement or representation with the artist. His claims she said are based on a non-existent agreement to which she is a total stranger.', 'I did not give any financial support to the said Alphonsius Nyasetia and Masha Wa Maitha. Either personally or in the name of their lobby group, she said.', 'Nyasetia however claimed that a contract does exist and that the two songs were made and tailored for ODM campaigns.', 'He says that the party has continuously used the songs in its campaign rallies yet he has not been paid for his works. Sibanduki is said to be headed by Ida and Masha wa Maitha. Justice Havelock will deliver a ruling on Friday.', ' ', '\n']"
http://www.the-star.co.ke/news/2013/02/12/ballots-for-march-4-poll-ready-by-friday_c737644,Ballots for March 4 poll ready by Friday,www.the-star.co.ke › National News,"Feb. 12, 2013, 12:00 am","['Smith and Ouzman, the British security firm contracted to print ballot papers for the March 4 polls will finish their job on Friday. ', 'According to sources at the Independent Electoral and Boundaries Commission and the British firm, only parliamentary and county assembly ballots are not ready. ', 'All the ballot papers have been printed except those for MPs and county assembly representatives that are awaiting a NIS report. Hopefully that report will be ready today (yesterday), a source at the IEBC said. ', 'The printer expects to complete the job on Friday and to begin the delivery immediately. ', 'Chief electoral officer James Oswago recently told reporters that Smith and Ouzman had completed the first batch which consists of presidential ballot papers. ', 'The commission is prepared for elections. We have procured the materials and we know the arrival date for the ballot papers as well as their flights, Oswago said. ', 'The ballot papers, estimated to weigh about 700 tonnes, will be airlifted by up to seven chartered cargo flights to Nairobi for distribution to IEBC county warehouses ahead of the polls. ', 'Each of the six elective posts will have a ballot paper with distinct colour to minimise confusion among voters. ', 'IEBC has published samples of the ballot papers showing that the presidential ballot papers will be white and will contain a passport photograph and names of the candidates. ', 'The running mate on the other hand will only have his or her name adjacent to the presidential candidate.The ballot papers for governors will be blue, those for senators will be yellow and green for MPs. ', ""Women representative ballots will be purple while county assembly representatives' will be beige."", ' ', ' ', '\n']"
http://www.the-star.co.ke/news/2013/02/12/iebc-clears-13-for-nakuru-senator-race_c737509,IEBC clears 13 for Nakuru senator race,www.the-star.co.ke › Local News › Rift Valley,"Feb. 12, 2013, 12:00 am","['The Independent Electoral and Boundaries Commission has cleared a 13th candidate for the Nakuru senate seat. ', 'Samuel ole Nairoshi received the certificate from IEBC on Friday after he was locked out on January 31 by the County Returning Officer Catherine Kiarie over discrepancies in his identification documents. ', 'Nairoshi presented a petition before the Political Parties Disputes Tribunal which had been set up to arbitrate over nomination issues which then directed IEBC to clear him after he presented proof of his legal name change. ', 'Kiarie hesitated to clear Nairoshi who is vying on a Kanu ticket after he presented two passports bearing different names. ', 'On Monday, the candidate said he would use the next three weeks to mount rigorous campaigns across Nakuru County to ensure he wins the March 4 election. ', 'The communications specialist faulted an order by police to ban debate on land issues while on the campaign trail, saying it was one of the most important issues in counties such as Nakuru that have been plagued by conflicts over land issues. ', 'We cannot keep postponing the problem. It must be addressed once and we need to know what each candidate intends to do to address the problem, he said. ', 'He dismissed as ""inflammatory"" discussion on possible repossession of land from individuals and called for mature discussions on how best to implement the land policy. ', 'He said top on his agenda would be to unite the people of Nakuru county to work and live in peace. ', 'My leadership would work to ensure all communities living in this cosmopolitan county are represented in positions of leadership so as to oversee an era where there will be equitable distribution of resources, he said. ', ""Nairoshi will face 12 other candidates, including TNA's James Mungai, Bernard Muiruri (People's Patriotic Party), civil society activist Ben Gathogo (UDF), Stanley Karanja (Kenya National Congress), Andrew Yatich (National Vision Party), Charles Ayub (Safina), Kenneth Odongo Otieno (Agano Party) and Job arap Siror of URP. "", 'Others include Narc Kenyas Jayne Kihara, former Subukia MP Koigi Wamwere (Chama Cha Mwananchi), ODMs Dr Samuel Ogada and GNUs Josepha Mambo.', ' ', ' ', ' ', ' ', '\n']"
http://www.the-star.co.ke/news/2013/02/12/pope-benedict-in-surprise-resignation_c737708,Pope Benedict in surprise resignation,www.the-star.co.ke › National News,"Feb. 12, 2013, 12:00 am","['Kenya Catholics yesterday reacted with surprise at Pope Benedict XVI announcement that that he will be resigning at the end of the month.', 'In a statement released by Vatican yesterday Pope Benedict XVI said he will resign on February 28 after nearly eight years as the head of the Catholic Church.', ""He said he is too old and frail to continue at the age of 85.  He became Pope in April 2005 following John Paul II's death."", 'After having repeatedly examined my conscience before God, I have come to the certainty that my strengths, due to an advanced age, are no longer suited to an adequate exercise of the Petrine ministry, said the Pope.', 'In todays world, subject to so many rapid changes and shaken by questions of deep relevance for the life of faith, in order to govern the bark of Saint Peter and proclaim the Gospel, both strength of mind and body are necessary, strength which in the last few months, has deteriorated in me to the extent that I have had to recognize my incapacity to adequately fulfill the ministry entrusted to me, added the Pope.', 'A papal conclave will follow to elect his successor, who will be in place by the end of March, and perhaps in time for holy week on 24 March.', 'The pope said he wished to continue to serve the Catholic church ""through a life dedicated to prayer"". There was absolute silence when the pope told cardinals the news, according to Mexican prelate Monsignor Oscar Sanchez, who witnessed his resignation.', 'Benedict made his decision over the last few months, Vatican spokesman Federico Lombardi said, and it took all his closest aides by surprise. He will honour his commitments until he steps down. Lombardi said this was Benedicts own personal decision. Upon resigning, he will go to the papal summer residence near Rome, and then will move to a cloistered residence in the Vatican, which may make life difficult for his successor.', 'Bookmakers have made Ghanas Cardinal Peter Turkson favourite to succeed Benedict. Angelo Scola, the conservative archbishop of Milan, is another top candidate.', 'There was also immediate speculation in South Africa that Cardinal Wilfrid Napier, archbishop of Durban, could be a candidate to be the next pope.', 'A spokesman for the Southern African Catholic Bishops\' Conference said: ""It would be sheer speculation but for a long time our church has been saying the next pope should be selected from a \'missionary territory\', which means Africa, Asia or South America. Cardinal Napier is right up there."" Napier is already a match for Benedict XVI when it comes to tweeting.""', 'The Archbishop of Canterbury, Justin Welby, the head of the Anglican church, said he had learned of the pope\'s resignation with a ""heavy heart but complete understanding"".', 'The last pope to resign was Gregory XII, in 1415. Prior to this, between 1032 and 1048,  Benedict IX the only man to be pope more than once and the only one ever to sell the papacy stepped down, essentially for cash. Accused of \'feasting on immorality,\' committing ""many vile adulteries and murders\' and being \'so vile, so foul, so execrable\' Benedict ostensibly resigned to get married but not before he had sold the office to his godfather, who became Gregory VI  who had to resign the following year.', 'Celestine V resigned after just five months in 1294 citing ""the desire for humility, for a purer life, for a stainless conscience, the deficiencies of his own physical strength, his ignorance, the perverseness of the people, his longing for the tranquility of his former life"". His successor, Boniface VIII, however, refused to allow him to return to a life of solitary contemplation and instead had him locked up in a castle where he died in May 1296.', ' ', 'Yesterday, Father Dr Dominic Wamugunda said Catholics worldwide had become used to popes dying in office. ""We have  become used to the Pope ruling the church until his death. Maybe this is a sign of a new way of running the church, said Wamugunda. He said it will be the first time in living memory of most Catholics that the church will have two popes alive at the same time.', ' ', ""Father Michael Mwangi, a philosophy lecturer at the University of Nairobi said the pope's resignation might be construed as 'giving up.' Retirement is understandable, but resignation should not be there.It is like giving up, said Mwangi."", 'Without the customary mourning period that follows the death of a pontiff, a meeting of the cardinals to elect his successor, called a conclave, could begin by mid-March.', ' ', 'A new Pope will be elected by the end of March with 120 cardinals expected to participate in the conclave. Cardinals aged above 80 are not eligible.', ' ', '\n']"
http://www.the-star.co.ke/news/2013/02/12/uk-born-free-actress-and-kenya-airways-fight_c737327,UK 'Born Free' actress and Kenya Airways fight,www.the-star.co.ke › Lifestyle › Word Is,"Feb. 12, 2013, 12:00 am","['The launch was held on Sunday at the Ivory Burning Site in the Nairobi National Park. Titus Naikuni, Group Managing Director, Kenya Airways said that preserving our wildlife has a multiplier effect that benefits a lot of people and asked the leaders to push for the passing of the Wildlife bill.', 'Naikuni then launched an in-flight coin collection campaign to raise funds to help facilitate the work of Born Free Foundation in ensuring that poaching is stopped.', 'Virginia who starred in the hit movie about saving Elsa the lion said, Coming to Kenya we have noticed how poaching is destroying wildlife, Ive heard stories of 12 elephant killed in Tsavo East and the horror stories. What has not been talked about is the story of the individual animals particularly when there is a little orphan standing by and watching.', 'She continued: Born Free is lobbying with other interest groups and governments to ban lion trophies. We have worked with Kenya Airways before, we have done five rescues in Europe to bring the animals back to Africa. Im so excited and grateful for bringing us in as a partner.', '\n']"
http://www.the-star.co.ke/news/2013/02/12/china-must-stand-up-against-poaching_c737255,China Must Stand Up Against Poaching,www.the-star.co.ke › Opinion › Dr Alex Awiti,"Feb. 12, 2013, 12:00 am","['Africa is in the throes of another horrific elephant extermination. Demand for ivory in China is flourishing as never before and is driving the illegal killing of elephants.', 'Conservation groups believe poachers are killing off tens of thousands of elephants a year. The one-off sale of legal ivory harvested from elephants culled in Southern Africa endorsed in 2008 by the parties the Convention in International Trade in Endangered Species (CITES) may have triggered unbridled demand among the Chinese.', 'Trade monitoring information collected by the Elephant Trade Information System (ETIS) and International Fund for Animal Welfare (IFAW) have shown that the majority of ivory now on sale in China comes from illegal sources.', 'Moreover, there is growing evidence that poaching increases in elephant-rich areas where Chinese construction workers are building roads.', ""In 2012, more than 150 Chinese citizens were arrested across Africa, from Kenya to Nigeria, for smuggling ivory. According to the Kenya Wildlife Service, 90% of ivory seized at Kenya's airports implicates Chinese citizens."", 'Jane Goodall, the foremost conservationist of our time, has made an impassioned plea for a worldwide ban on the sale of ivory to forestall the imminent extinction of the African elephant.', 'Here is a snippet of what is evidently an unconscionable catastrophe. Today only 6,000 elephants are left in the wild in eastern Congo, down from approximately 22,000 before the civil war.', 'In December 2012 a Tanzanian MP declared that poaching was out of control with an average of 30 elephants killed everyday.', 'In southern Sudan the elephant population, estimated at 130,000 in 1986, has crashed to 5,000. Chad, home to 15,000 elephants in 1979, has less than 400 left.', 'Last year poachers killed at least 360 elephants in Kenya, up from 289 in 2011. We all recall the massacre last month of family of 11 elephants in Kenyas Tsavo East National Park.', 'Chinas fabled economic boom has created a vast demand for ivory products, pushing the price to unprecedented levels, $1,000 for just less than half a kilogram, on the streets of Beijing.', 'China presents a vibrant and unfettered market for ivory bookmarks, rings, cups, combs and chopsticks. Experts believe that up to 70% of illegal ivory flows through China.', 'Iain Douglas-Hamilton, a leading authority on the African elephant, believes that with an estimated value of $7.8  $10 billion per year, illegal wildlife trade is the 5 largest illicit transnational activity globally.', 'INTERPOL and the United Nations Commission on Crime Prevention and Criminal Justice have both recognized the increasing involvement of organized crime syndicates in wildlife crime.', 'In December 2012, 24 tonnes of ivory was seized in Malaysia. This and other seizures of large ivory consignments is clear evidence that a well-oiled criminal network now underwrites illegal ivory trade.', 'It is inconceivable that hundreds of kilograms of tusks could be moved across the globe without the help of corrupt government officials.', 'Poaching and ivory trade has become dangerously militarized. Similar to blood diamonds from Sierra Leone or Angola, ivory is the new conflict resource in Africa.', 'Conflict, weak enforcement and corruption have made it possible to trade for ivory for weapons. According to reliable accounts, Africas most pernicious groups are killing elephants and trading ivory to buy weapons to perpetrate atrocities.', 'Organized crime syndicates are now believed to be linking up with rebel movements such as the Lords Resistance Army, Al-Shabaab and the Janjaweed to obtain and move ivory through conflict zones and international ports, with the aid of corrupt state officials. Syndicates carry out detailed planning, have significant financial support, understand and utilize advanced information technology.', 'In comparison with other forms of transnational crime, the risks and penalties associated with the illegal poaching and trafficking of wildlife are small.', 'For instance, four Chinese men who pleaded guilty in a Kenyan court to smuggling ivory worth $24,000 were fined $340 each last month.', 'If unchecked the unbridled demand for ivory could exterminate the African elephant, exacerbate existing conflicts in Africa and foment new conflict. Tackling the demand for ivory must be a global priority.', 'As the epicenter of illegal ivory demand, China must understand that its global leadership derives not from the scale of its wealth or military power but from its moral courage to stand up against international crime.', 'It behooves China to declare an indefinite unilateral moratorium on ivory imports. The 40th Anniversary of CITES on March 3rd 2013 and the 16th meeting of the Conference of the Parties to be held in Bangkok is a chance to send strong and clear messages on combating the illegal trade in wildlife.', 'But seriously, the very idea of killing and trading in high value wildlife as an incentive for conservation is morally reprehensible.', ' ', 'Dr. Awiti is an Ecosystems Ecologist based at Aga Khan University, Nairobi', '\n']"
