http://www.the-star.co.ke/news/2013/02/09/corridors-of-power_c736831,Corridors Of Power,www.the-star.co.ke › National News › Corridors of Power,"Feb. 09, 2013, 12:00 am","['A little bird has told us that some of the presidential candidates are developing cold feet over appearing in the much awaited Presidential debate which will be aired live on all the eight television and 34 radio stations. It seems they are afraid their rivals might come with documentary evidence of alleged past scandals which they will want to unleash during the debate scheduled to be held at the auditorium of the Brookhouse International School in Nairobi.', ' ', '===', ' ', ""Whats in a name? For some in the police SERVICE reference to them as a FORCE by some of the leading politicians in their campaigns is demoralizing and defeating the attempts being made by the police to endear themselves to the public. What they don't seem to realize is only through their actions will the public start trusting them. A rose by any other name will still smell just as sweet. Calling the police a service is not going to change the public's belief and perception that they are a force!"", '===', ""After a video clip was posted on YouTube showing TNA Nairobi gubernatorial candidate Ferdinand Waititu addressing and thereafter dishing out wads of what is allegedly cash, several lawyers have been collecting this and other evidence of electoral malpractises which they hope will persuade one of his rivals to file a case in court to challenge his suitability. What many don't realize is that the IEBC on its own mandate can disqualify a candidate for breaching electoral rules which include and are not limited to voter buying and or bribery"", '\n']"
http://www.the-star.co.ke/news/2013/02/09/why-uhurus-political-career-is-finished_c734369,Why Uhuru’s Political Career Is Finished,www.the-star.co.ke › Siasa,"Feb. 09, 2013, 12:00 am","[""Lets face it. Contrary to Uhuru's and Rutos efforts to make the crimes against humanity they face look as though they are no big deal, they, in fact, are more than a big deal."", 'The truth is in Uhurus case. His political career is over notwithstanding the ICC outcome simply because of the seriousness of the charges.', 'This is not just making a statement for the sake of it. It is an informed statement based on what happens to individuals who get charged with serious crimes like the ones Uhuru faces. ', 'To be sure, there are not many individuals who face crimes against humanity but, the many examples we knoweven of a lesser gravity in seriousness, tell us Uhuru is done.  Take the example of OJ Simpson.', 'OJ or the Juice, as he was popularly known at his peak, was a star US professional football player like none seen before his time. He was the first professional football player to rush for more than 2,000 yards in a season, a mark he set in 1973, which was quite a feat considering no other player had ever racked up such yards in a 14-game season. ', 'He also holds the record for single season yards-per-game average, all of which earned him selection to the Professional Football Hall of Fame.', 'Following his retirement from professional football, OJ went on to become a sportscaster and actor and the sky appeared to be the only limit until the murder of his girlfriend in 1995 and one other person for which OJ was arrested and charged. ', 'Although he was acquitted of the murders after a lengthy trial that attracted a global following, in 1997, a civil court awarded a judgment against Simpson for their wrongful deaths.', ""The arrest and being charged with the murders marked the end of OJ Simpson's glory days and in all other respects. To seal it all, OJ was again arrested in Las Vegas, Nevada, and charged with numerous felonies, including armed robbery and kidnapping for which he was found guilty and sentenced to 33 years in prison, which he is still serving."", 'Why did OJ become a non-entity after being arrested and charged with the murders even though he was not found guilty? Because thats the nature of the charges he faced, namely, the cold-blooded murder of two people. People believed he committed the murders despite being acquitted.', 'This is exactly the same situation Uhuru finds himself in because most people will still believe he committed the crimes he is charged with even if he is acquitted. In essence, Uhuru being president with ICC over his head even as an acquitted indictee is a form of impunity; in fact impunity of the worst kind.', 'This is one of the many reasons Uhuru cannot be our president given the circumstances he finds himself in. First, as practical matter, were the duo to be elected, both will be absentee president and vice-president as they will be spending all their time at the Hague defending their cases.', 'Ruto has said they can use technology to run the country from the Hague but this is a joke and the fact that they even raise this as a possibility is the more reason why they should not be elected.', 'There is no going around the fact that its impractical to govern a country when one is defending himself in The Hague, which requires their physical presence during trial now estimated to run for two to three years.', 'Second, given this fact, one must assume that the two intend to abscond and not attend their trial, or if convicted, not to show up for punishment, which is no less criminal. In fact, absconding ICC trial is criminal under the Rome Statute and consequences for doing so are not only specific to the absconding suspects, they are even more importantly national in scope.', 'For example, were Uhuru and Ruto to abscond once elected, Kenya will be made a pariah state like Sudan. This means we can forget any gains we hope to get from full implementation of our constitution, which may not happen, anyway, with the two in power. ', 'One consequence of being labeled a pariah state is that Kenya will be subjected to economic sanctions and none of its officials will be given visas to travel to other countries, especially those that matter to our welfare.', 'If Kenya is cut from the world economic chain, that will be the end of our country. You have no idea what the consequences of such economic sanctions can be. ', 'Just the other day, Sweden banned the importation of miraa to that country, a decision which miraa exporter Dan Aritho says is certain to adversely impact the economy of Meru county.', 'One need not be an exporter like Aritho to understand the devastating impact of shutting the country from the world market. It goes without saying we shouldnt even entertain the thought of being slapped with sanctions of this nature.', 'Third, besides economic sanctions, the election of Uhuru and Ruto will most likely see the United States, European Union states, and others that support the ICC process shun us diplomatically.', 'Uhuru was quoted as saying recently Kenya does not need the West. This is simply another reason he should not be elected as president because he fails to understand the importance of maintaining our relations with the West. ', 'That being the case, the only thing this writer and many others see as Uhurus only option were he to salvage his political career, is to first step-aside from vying for the presidency and chart a path of redemption. That starts with forging a good working relationship with Raila.', ' Working with Raila makes sense because hes likely to be our next president and even if Uhuru were to give him a run for his money, hell ultimately fall short as he sees his friend being sworn in as president.', 'Indeed, the best thing Uhuru could do is simply step-aside and endorse Raila. There is nothing wrong in doing so other than entrenched old notions of political beliefs we must shake off from our body politic.', 'Stepping aside and endorsing Raila will bring with it immediate and long term benefits for Uhuru that wont exist were Uhuru to defy common sense and continue in his ill-advised quest for the presidency.', 'One such immediate benefit is that Uhuru would have elevated himself to a statesman by putting the interests of the country firstsomething very few politicians ever do in life. ', 'By elevating himself as such, he can then find ample time to defend his case at the Hague and notwithstanding the outcome, he will have a far larger constituency sympathetic to his situation, especially if hes convicted than he otherwise would.', 'The latter, coupled with a president in office willing to utilise state resources to bring these cases to an end consistent with national security interesta case Uhuru cannot make as president for the reason that most people oppose his candidacy because they believe and rightly so that Uhuru wants to use the presidency to defy the ICC process.', 'The irony of it is, this would be no different were Uhuru to endorse someone other than Raila as that will clearly be seen as a project designed to do just that, namely, thwarting or altogether defying the ICC process.', 'However, endorsing Raila will be different because it will first be one significant unifying event of the country that can only be furthered by Raila acting in the best interests of the country in seeking an end to the ICC process consistent with the rule of law and justice for the victims. ', '\n']"
http://www.the-star.co.ke/news/2013/02/09/search-down-to-3_c736824,Search down to 3,www.the-star.co.ke › Sport › Local,"Feb. 09, 2013, 12:00 am","['FKF narrow down choices for Harambee Stars head coaching job', 'Football Kenya Federation have narrowed the search for national team Harambee Stars head coach to three candidates. The job has been vacant since Frenchman Henri Michel resigned in December last year.', 'Football Kenya Federation chairman Sam Nyamweya revealed this at Moi International Sports Centre Kasarani yesterday where a breakfast thanksgiving was held for the national team on their return from Tunisia where they beat Libya 3-0 in an international friendly on Wednesday.', 'We have interviewed three coaches we want to work with the current team of James Nandwa who has done exemplary work since he was given the mandate to take charge of the team, Nyamweya stated.', 'The FKF supremo stressed the fact they are looking for a coach who will at least be able to speak English in order to stave off communication challenges that faced Michel.', 'We do not want to disrupt the technical bench which must be given credit for ensuring the win over Libya which was one of the best results during the Fifa international friendly week, Nyamweya added.', 'He stressed FKF will still continue to do all in their power to ensure the national team continues to perform well and are ready for the World Cup qualifiers where they have only managed one point in two matches against Malawi and Namibia and face Nigeria in a month when the qualifiers resume. We are organising high profile friendly matches for the national team and next month we have two possible encounters against Egypt or Congo Brazzaville, Nyamweya revealed.', 'The Stars players led by assistant captain Duncan Ochieng were given their remaining allowances plus bonuses totalling Sh550,000 for the victory over Libya.', 'FKF chief executive Michael Esakwa and finance officer Joseph Ogolla accompanied Nyamweya while Nandwa, his assistant Kennedy Odhiambo as well as team manager Gabriel Olang were with the home based Harambee Stars players. At the same time Nyamweya also revealed he will be traveling to Europe to concludea kitting deal with apparel providers Kelme.', '\n']"
http://www.the-star.co.ke/news/2013/02/09/shilling-flat-versus-dollar-in-tight-market_c736702,Shilling flat versus dollar in tight market,www.the-star.co.ke › Business › Local,"Feb. 09, 2013, 12:00 am","['The Kenya shilling held its ground against the dollar on Friday, supported by the tight hold the central bank is keeping on banking sector liquidity and resulting rises in interbank lending rates. ', 'At 0700 GMT, commercial banks posted the shilling at 87.50/60 per dollar barely changed from Thursdays close of 87.55/75, around which it has held steady for the last four sessions. ', 'The central banks persistent mopping up of excess shillings from the market through repurchase operations pushed the main interbank rate to 7.99 per cent on Thursday, the 17th straight session of gains, from 5.43 per cent on January 15. ', '(The shilling) should be supported by the interbank rates and the repurchase agreements, said Dickson Magecha, a senior trader at Standard Chartered Bank.', 'A Bank of Africa report said with inter-bank interest rates gradually edging up, most banks had opted to cut any long dollar positions to avoid missing out on the return they get on assets held in shillings.', '\n']"
http://www.the-star.co.ke/news/2013/02/09/season-of-promises-and-more-promises_c735825,Season Of Promises And More Promises,www.the-star.co.ke › Siasa,"Feb. 09, 2013, 12:00 am","['Once again, Manifesto Season is upon us. Assurances, pledges and vows are in the air. Four weeks until this great countrys 5th General Elections, and camps are rolling out their blueprints in colorful extravaganzas. I bet Uhuru Kenyatta himself has not read his. Neither has Raila Odinga. If they had, some inadequacies would not appear in those very carefully constructed pledges of commitment.', 'A manifesto, in essence, is a public declaration of policy and aims. The word itself is derived from the Latin manifestum, meaning clear or conspicuous. ', 'The Communist Manifesto, probably the most notable, begins with the famous words ...The history of all hitherto existing societies is the history of class struggles. One would imagine that Marx and Engels penned these words with a passion borne out of beliefs, which 165 years later constitute Politics 101.', 'So, have Kenyans, in the latest banquet of promises, been served a game-changing manifesto? Hardly. What has been dished out are ideologies salvaged from the bins of our partisan history. ', 'They are what my boss would call original and interesting. Where the original parts are generic, ambiguous, and worse still, uninspired. The interesting parts are reminiscent of the KANU, PNU and DP manifestos. In short the original parts are not interesting and the interesting parts are not original.', 'The Jubilee Coalition this week transformed the Kasarani stage into a high tech marvel, while the CORD coalition dazzled Kenyans with a film of smoke and fireworks.', ' I somehow find it hard to imagine a Kenyan somewhere reading a manifesto, and saying to their family over the evening meal; at last change is nigh! Why? Been there, done that. Kenyans have reached record highs of skepticism. We have officially been numbed to promises.', 'The Jubilee manifesto has a chapter aptly named, Land Reforms: A property owning democracy The content reads; ...Millions of Kenyans today have no property to call their own, yet remarkably, only 20% of Kenyas land is privately owned.', 'Public land is 13% of the land in the country with 67% being community land, which has been traditionally managed by local authorities, with communities who actually live on it having little benefit. A significant portion of private land is untitled, with poor records of ownership, which in some areas is made worse by absentee landlords.', 'Who are the  absentee landlords of whom you speaketh?? Of the 20% of the land in Kenya that is remarkably privately owned, what percentage is held by those in the Jubilee Coalition? ', 'It is a bit audacious for a person with so much land to include a clause that criticizes people with so much land. This is a classic case of not only living in a glass house and throwing stones, but also putting those damning stones in your MANIFESTO; Your roadmap for the next four years.', 'Does Mr. Raila know that Chapter 4 in the CORD Manifesto quotes (without acknowledgement) Jean Jacques Rousseaus Social Contract? Probably not. ', 'No big deal anyway. However, the obviously well thought out document denounces corruption in all its forms, including nepotism. This comes weeks after the Odinga family is scandalized for forcefully placing various members of their family in nomination slots, causing uproar in Nyanza.', 'That is why, among numerous other oversights, I am convinced both gentlemen barely skimmed through the pages of the document on which the next five years of their potential tenure is founded on.', 'So how do we consume these manifestos? We find holes in them. There are multiple flaws in the Blueprints. On the one hand we will criticize the empty promises but demand that there be more, otherwise it just confirms to us that they were thought out at the last minute and strung together for the purposes of campaigns. ', 'Why, for instance is infant mortality omitted from the manifestos, while Kenya ranks dismally in the W.H.O infant mortality index, tying with Cambodia and Azerbaijan in the late hundreds?', 'Two, they couldve been more pragmatic. How exactly will the would-be Jubilee government execute the promise of solar laptops for each school going child?', ' And a daily packet of milk, for good measure? And two vehicles for every police ward (when do they get them, and do they come with inexhaustible fuel vouchers)? Lofty promises.', 'Granted, Policy and Party agenda are rarely on Kenyans, let alone politicians lips. We are not blind to the tragic fact that our votes are cast on the aspirants personality, charisma and, the elephant in the room, tribe. That is why candidates can shift parties like the ocean tide; frequently and in opposite directions.', 'I propose that that Kenya should have two main standing parties, so you are either in one or the other. And their ideologies can build over the years. ', 'Our war on tribalism will not be won unless we eliminate some of the drivers, party and coalition politics being but some of them. Then maybe we can shift from power dynamics and focus on issues.', '\n']"
http://www.the-star.co.ke/news/2013/02/09/ncpb-risks-auction-over-sh-500-million-debt_c736409,NCPB risks auction over Sh 500 million debt,www.the-star.co.ke › Business › Local,"Feb. 09, 2013, 12:00 am","['The National Cereals and Produce Board risks having its assets sold over a disputed Sh500 million debt arising from a cancelled maize supply tender.', 'The dispute arose after a government decision in 2004 to purchase white maize to replenish the Strategic Grain Reserves. Consequently the board on behalf of the government contracted five firms to supply the maize among them Erad Supplies and Contractors Ltd which won a court case over the Sh500 million dispute.', '""The firm was supply 40,000 metric tonnes but did not do so. The matter went to court and and we can not comment further on it. We have faith in country\'s legal system and believe just will prevail eventually"", said NCPB managing director Misoi in a statement released on Friday.', 'Erad on the other hand maintains the contract was unfairly terminated.', ""He assured farmers that it has confidence in the court's ability to deliberate on the matter."", 'Farmers in the North Rift Valley have protested against the planned sale proposes sale.', 'The Kenya Farmers Association through director Kipkorir Menjo appealed to the government to intervene and save the public assets from being sold saying this would inconvenience farmers.', '""We have asked the government to intervene and look into ways of sorting out the debt disputes at NCPB because the problem will affect operations of the board which is supposed to be preparing for this year\'s planting season,"" said Menjo.', 'The farmers who me tin Eldoret said the board should be supported to import adequate fertiliser for this planting season instead of being embroiled in long running debt disputes.', 'Auctioneers this week advertised the planned sale of cars, buildings and other NCPB assets in a bid to recover the debt.', 'The board has appealed High Court the ruling which granted Erad the award.', '\n']"
http://www.the-star.co.ke/news/2013/02/09/nairobis-elections-junkies-go-into-frenzy_c735231,Nairobi’s elections junkies go into frenzy,www.the-star.co.ke › Sasa › Nairobi Living,"Feb. 09, 2013, 12:00 am","['If you live in this town, then you know that March 4 is the day that Kenyans go to polls for the first time under the new constitution.', 'Many countries, some in our continent, host elections on a regular basis without much fuss. In Nairobi however, we have a strange relationship with elections.', 'Under normal circumstances, most Nairobians are warm and intelligent people who discuss most topics with utmost sobriety.', 'However, when an election like the forthcoming one is around the corner, this reasonable person undergoes a strange transformation. They go into a frenzy collecting every little information about the candidates running, the parties and every slogan that has to do with this special time.', 'These days, every conversation involves, in large parts, a discussion on the coming weeks when folks will be ticking ballot papers in booths up and down the country.', 'This is the time when many people exhibit behaviour that could only lead a professional counsellor to referring to the typical Nairobian as an election junkie. A significant minority will also be diagnosed with election fatigue.', 'A junkie is a person who is addicted to a substance that usually affects their lives in a negative way. They will seek their fix at all costs and once they get it, they sit down and revel in it. When the effects of the drug die down they go into depression until they are access the drug again.', 'The problem here is that as soon as their bodies get used to the drug, they will need more and more quantities to ensure that they get high. They will go to any lengths to get their fix to the detriment of their careers and even loved ones.', 'Observing Nairobians, I have to say that many are currently in the throes of an addiction that we all can easily diagnose; the election addiction. Every conversation, whether with a friend or stranger has the election as a major part of the narrative. At the beginning of the chat, the people engaged in the conversation keenly look out for hints to know whether they support the same candidate.', 'If they are in your camp, they will proceed to unveil the reasons why you are in agreement. The conversation will be very enjoyable for both parties as they bring points that they believe will paint their candidate in good light.', 'If the two parties are in opposing camps, discussions will usually be civil at the beginning but they can turn ugly very fast, depending on the temperament of the discussants. Heaping praises on their preferred candidates and defending them against accusations from opposing camps give the discussants the fix they desperately need.', 'The election junkie also gets his need fixed by being fixated on political TV and radio content.These include live debates, election specials where communications experts explain the body language of candidates and vox pop.', 'The junkie also feeds on every form of literature with politics in it, be it in the newspapers or the internet. Mind you most of the content in the newspapers and websites is old information souped up to sound new. Some election junkies have to go downtown and join Kamukunjis, usually of guys, who are discussing their favourite candidates.', 'The sudden deluge of election content now means that news programmes that usually last only 30 minutes take two hours as every election-related news report has to run in full. There are bigger things happening elsewhere in Africa and the world in general but Kenyans are fixated on local politics. Africa is in the throes of its biggest football tournament but every discussion this weekend is about which presidential is ahead. ', 'Its only a matter of time before Nairobians get to the point where theyll be seen in dark alleys literally eating newspapers with the latest election content.', ' ', 'Getting to Crow Daddys pub last Friday was quite the chore. I had to take a number 34 Double M bus to the Tassia estate, take a turn to Outer-Ring Road before taking a little eight-seater vehicle to the venue. The pub is a few metres away from the famous Nyayo Estate which houses many middle class Nairobians.', ' I was being frisked by the security personnel at the door, I thought that I was entering your typical estate pub. But once I was inside I got an entirely different experience as I was transported to a world I rarely see in the Eastern part of Nairobi city.', 'There was a large room with a counter hugging the right wall. I headed there, sat and ordered a cold Tusker which was retailing at Sh140. Not bad a price for the last weekend of the dreaded month of January. Crow Daddys decor is really good. The main colours are red and black and there were TVs that screened programmes on wildlife.', 'The seating was almost luxurious and many people lounged on the comfy chairs. On the right side was a little room which the barman told me could be hired for special occasions. I made my way to the upstairs section and looked around. At the corner of the building, there was a pool table where some people were playing. I joined them and embarrassed myself comprehensively as I was thoroughly beaten. ', 'The area is designed to get the most from the elements as it has no roof. Large umbrellas stand above several tables. The setting would be great in an afternoon but not in the chilly Nairobi evenings. This section had its own reasonably-sized counter, TVs as well as washrooms which were quite clean. The crowd was mainly urban professionals and they seemed to be residents of Nyayo Estate. ', 'The emergency exits were not clearly labelled, especially at the upstairs section, so this is one of the places I wouldnt want be found in during an emergency. ', '\n']"
