http://www.the-star.co.ke/news/2013/02/05/royal-media-fails-in-bid-to-extend-switch-off-order_c734856,Royal Media fails in bid to extend switch-off order,www.the-star.co.ke › National News,"Feb. 05, 2013, 12:00 am","['The fate of 17 Royal Media Services transmitters hangs in the balance after the court failed to extend an order stopping them from being shut down.', 'High court judge David Majanja yesterday said the Communications Commission of Kenya acted within the law when it shut down RMS frequencies that were operating illegally.', 'Majanja declined to extend the orders that were initially issued on Sunday. He instead directed the parties to go back to court on February 14 to argue the case before Justice Erick Ogola.', 'The two parties were also asked to exchange court documents before the hearing date. Yesterday, CCK accused RMS of duping the court when it obtained the special orders.', 'Lawyer Wambua Kilonzo told Majanja that RMS is aware of a court order, dated January 30, allowing it to shut down the illegal transmitters.', '""The warrant to confiscate (the transmitters) was duly issued by a magistrate court and it was shown to RMS guards manning the transmitters,"" said Wambua.', 'The lawyer said the transmitters will be used as evidence in a criminal case against RMS. The dispute between the CCK and RMS began on August 9 last year when the regulator accused the company of operating in unauthorised locations.', 'The CCK ordered RMS to instead relocate the stations to undefined designated broadcast sites failure to which they will be switched off. The state regulator accuses RMS of failing to obtain licenses for the transmitters operating in Narok, Nakuru, Malindi and Ukambani.', 'Some of the transmitters, located in non-designated broadcasting sites, are causing harmful interferences to other broadcasters, aviation and other critical services.', 'The stations affected by the switch-off include Citizen Radio, Maa, Inooro, Musyi, Wimwaro, Muuga and Citizen TV. Initially, CCK had asked the company to install suitable band pass filters to prevent interference with other frequencies.', 'According to a letter sent to RMS on August 3 last year, the regulator accused the media company of failing to install band pass filters for its stations and failing to obtain approval for transmitters in Limuru, Webuye, Eldoret, Londiani and Kisekini.', 'CCK says the illegal transmitters are interfering with other broadcasters in East Africa and the avionic communication, thus threatening the safety of Kenyas airspace.', '\n']"
http://www.the-star.co.ke/news/2013/02/05/uk-bound-students-in-gala-dinner_c734523,UK-bound students in gala dinner,www.the-star.co.ke › Lifestyle › Society,"Feb. 05, 2013, 12:00 am","['Students set to join universities in the UK had a great time at Splash Waterworld in Langata, Nairobi in a gala dinner on Saturday evening. The event was organised by Uniserv a company which helps ease the process of getting suitable universities abroad and saw guests including UK university delegates, school heads and career teachers, students and parents.', ' ', 'The company main aim is to take away the burden of finding appropriate universities for these students as well as obtaining visas for them. Many students from East Africa are seeking admission into British Universities mostly because there are limited seats in the local universities. ', ' ', ' ', '\n']"
http://www.the-star.co.ke/news/2013/02/05/safaricom-free-to-increase-m-pesa-charges-githae_c734743,Safaricom free to increase M-Pesa charges - Githae,www.the-star.co.ke › Business › Local,"Feb. 05, 2013, 12:00 am","[' Treasury will not take any action against any money transfer service provide who choose to pass on the additional 10 per cent tax to consumers. ', 'Finance Minister Njeru Githae says although he expected the companies to absorb the tax and pay out of their profits, the government has no way forcing them. ', 'Safaricom announced it has increased its M-Pesa money transaction charges by 10 per cent starting this Friday, for its estimated 16 million customers. ', 'It is a free market and we cannot interfere, Githae said. At best, we can only give advice, but it is upon them to agree or reject. ', 'He said the government had no other option of raising funds to pay teachers, doctors and lecturers who were on strike at the time the tax was proposed in February last year. ', 'There was no alternative and we had no intention of running into deficits, said Githae ', 'He said they are now targeting plugging of tax revenue leakages through counterfeits where an estimated Sh30 billion is lost annually, as well as cutting out crooks in motor industry inspection and road licences through removal of cash transactions. ', 'He said beer, wine and spirits revenues will be increased through installation of Kenya Revue Authority stamp tax gadgets at manufacturing plants and use of mobile automatic tax stamp readers to counter illegal sale of counterfeit products.', ' ', ' ', '\n']"
http://www.the-star.co.ke/news/2013/02/05/limuru-club-women-members-seek-justice_c734823,Limuru Club women members seek justice,www.the-star.co.ke › National News,"Feb. 05, 2013, 12:00 am","['Women members of Limuru golf and country club who have been denied voting rights yesterday took the case to the ministry of sports and the Gender commission.', 'The women were banished by the club management for expressing interest in elective posts within the association. The club also passed a by-law to take away the voting rights of women, consigning them to mere guests during the general meetings.', 'The women sought help from the ministry where they met the commissioner of sports Gordon Oluoch and the Gender Commission chairperson Winfred Luchuma.', 'We want a repeal of the draconian rule. Our names have been sent to all golf clubs yet we are reasonable women who enjoy our golf, said Rose Mambo, their leader. They were led by lawyer Philip Murgor.', 'This is to do with your rights. That move is very outdated. Every sport is played by both genders. Even the sports act 2012 prohibits discrimination, Oluoch said.', 'He sad he will call a meeting bringing together all the stakeholders in the sports industry to solve the matter.', 'Its unfortunate that we have such draconian rules. We are in the process to have all sports organizations to adjust their Memorandums and Articles of Association to conform to the countrys constitution, he told the women.', 'The women expressed fears that they risk being completely expelled club if the ministry does not take quick action. Gender Commission Chairperson Winfred Luchuma told the women her commission has a legal team that will take up the matter.', 'However, the clubs board chairman Yasin Awale said the boards position is that they havent exhausted all dispute resolution mechanisms. ', ' ', '\n']"
http://www.the-star.co.ke/news/2013/02/05/witnesses-reject-icc-move-to-arusha_c734686,Witnesses reject ICC move to Arusha,www.the-star.co.ke › National News,"Feb. 05, 2013, 12:00 am","['ICC witnesses have rejected a proposal to move the Kenyan ICC trials to Tanzania. The witnesses said they would not be willing to testify in Arusha for fears about their safety.', 'We have learnt of the plan with surprise and we will not support it because it obviously puts our security at risk,"" said a witness who rang the Star yesterday from a European capital.', 'The trials of Deputy Prime Minister Uhuru Kenyatta, former Eldoret North MP William Ruto, former Civil Service chief Francis Muthaura and broadcaster Joshua Arap Sang are due to start on April 10 and 11. They are charged with crimes against humanity arising out of the post-election violence in 2007/8.', 'Last year the witnesses rejected a plan to relocate them to African countries after the trials are over and said they need to stay in Europe to ensure their safety.', 'There will be 80 witnesses at the two trials. The identities off those under ICC protection will only be disclosed to the defence on February 11 and those not under protection will be disclosed on March 13.', 'Last week the ICC asked Tanzania, Kenya and the International Criminal Tribunal for Rwanda to make submissions on whether the Kenyan cases can be heard in Arusha.', 'The trial chamber led by Judge Kuniko Ozaki also wants the ICTR to advise whether the facilities in Arusha for the Rwanda genocide trials would be suitable for the ICC.', 'ICC Chief Prosecutor Fatou Bensouda, legal representatives for the victims, and the ICC registry have also been asked for their opinions.', 'The ICTR is now winding up its work. It has four trial chambers in Arusha with support infrastructure of detention cells and offices. Since it started, the tribunal indicted 92 persons of whom three are still at large. ', 'It has finished 50 trials. There are 32 individuals currently serving prison sentences, 13 who have finished their sentences, and three who died in prison.', 'Last year Uhuru and Muthaura asked the court to consider moving their case to Arusha but the judges told them to apply to the ICC President.', 'Ruto and Sang also applied to ICC presidency on the possibility of having the venue of the cases changed. Attorney General Githu Muigai also wrote to the ICC requesting to have the cases heard locally.', 'Yesterday the witnesses said they had not been consulted but had decided that it would be very unsafe for them to agree to the plan.', 'We are told the prosecutor will seek our opinion on the matter but we already know that such a plan is not workable at all because it will expose us to many dangers, said the witnesses.', 'Even before they ask us about our opinion we will communicate to them so that we know the actual position early enough, said the witnesses.', 'Defense teams have argues that the trials at The Hague would take the suspects away from their homes, friends and family, and their work and other vocations.', ' We too have concerns particularly on our security because we believe this for us is a big sacrifice, said another witness. Bensouda has already complained about threats against the witnesses and she will file her opinion on the matter.', 'Uhuru and Ruto are running for President and Deputy President in the March 4 election and may still apply to have the cases deferred, espcially in case they win the polls.', '\n']"
http://www.the-star.co.ke/news/2013/02/05/five-get-iebcs-green-light-in-bungoma-race_c734170,Five get IEBC’s green light in Bungoma race,www.the-star.co.ke › Local News › Western,"Feb. 05, 2013, 12:00 am","[""Five candidates have been cleared to run for Bungoma governor. New Ford Kenya's Ken Lusaka, Alfred Khang'ati of ODM,  Cosmas Barasa of TNA, Ford-Kenya's Jack Tumwa and UDF's Wabwoba Walinywa were given the green light by Bungoma IEBC chief Madahana Mbaya."", ""Lusaka's and Khang'ati's campaign convoys brought traffic in Bungoma town to a standstill as they addressed supporters at various stop overs on Friday shortly they were cleared. "", 'Lusaka, who was his running mate Hillary Chemoiywo, said he was delighted by the formal nomination. He said he will conduct civil campaigns and urged his rivals to focus on  issues and  avoid violence.', ""The former PS said the county  lags behind economically because of poor leadership and urged the electorate to elect visionary leaders with new ideas on how to exploit the region's potential to realise rapid growth."", 'Khang\'ati unveiled his running mate, John Mukholi arap Soet, shortly after he was cleared by the IEBC.. He he picked on Soet, who holds a degree in economics, ""after a long search.', ""The Internal Security assistant minister said mismanagement of resources is the county's undoing. He  promised to put in place systems  and hire competent staff to ensure the resources are used well."", ""Lusaka's and Khang'ati's  choice is seen as a move aimed at attracting Mt Elgon votes. Chemwoiywo is from Kaptama in the north while Soet comes from Cheptais in the south."", ""Catherine Wambilyanga, who is running for women's representative on the Ford Kenya ticket, was also cleared. She is facing UDF's Kellan Wavomba, Reginalda Wanyonyi of New Ford Kenya and Salome Mwangale."", '\n']"
http://www.the-star.co.ke/news/2013/02/05/efficient-improved-wood-stove_c728462,Efficient Improved Wood Stove,www.the-star.co.ke › Lifestyle,"Feb. 05, 2013, 12:00 am","['While the three-stoned traditional cooking stove remains popular in the rural areas, it has its share of problems including that of venting smoke in the home, fuel and heat wastage.', 'Paul Musyoka who has been actively promoting energy saving has a new product. This time he is selling a new improved wood stove that meets the need of the rural population and is energy and time saving too.', ' ', ' The M5000 wood stove model goes for Sh3,000 and takes only two pieces of wood to cook a meal for at least 15 people. The cooking stove is demand driven in the rural places where people still use firewood. You can cook a lot of food but with a little firewood. It is an excellent replacement for the three stone open fire stove and the idea here is to save on heat loss while using less firewood hence reduce deforestation, says Musyoka. ', ""The stove is durable, portable and reduces wood fuel consumption by 50 per cent and comes with a five year guarantee. Firewood and charcoal account for 80 per cent of Kenya's total energy use with demand surpassing supply. As a result, this has increased deforestation which is made worse by inefficient use of wood fuel that causes wastage."", ' ', 'He is also promoting another new charcoal stove which is bigger and has a high capacity of heat storage. The CH 5200 model which costs 3,500 to 4,000 can accommodate a bigger sufuria unlike the other models. Musyoka says the CH 5200 model made by Envirofit International is still very new in the market and he is yet to get feedback from those who have bought it.', ' ', 'Not only do the stoves reduce smoke inhalation in the kitchen but they also help reduce many deaths that are smoke or carbon monoxide related. If every Kenyan could use an energy saving cooking stove, the amount of pollution in the air would be reduced by almost 50 per cent, he says.', ' ', 'Musyokas innovations which he established last year were driven by necessity when he couldnt seem to make ends meet. Armed with only Sh3,000 which was to be his rent money, Musyoka decided to buy a cooking stove and held a demonstration on its effectiveness to a group of teachers in a primary school near his home in Nairobi.', ' ', ""His risk paid off and he got five orders and he was able to repay back his rent money with some profit. From then on I would go to events where they were groups of people and demonstrate the use of the stoves and how efficient and time saving they are. I haven't looked back since, he says."", 'On a good day Musyoka sells a minimum of five cooking stoves which totals to about Sh15,000. After deducting his expenses, he takes home a profit of between Sh5,000 to Sh7,000 a day.', ' ', 'I have no doubt I made the right decision and I hope one day I will have an office of my own and be able to employ people, says the former personal driver.', ' ', 'He pitches camp in areas where he can reach a large number of people such as offices, during agricultural shows and other SMEs exhibitions in Nairobi. He now plans to go countrywide and next he will exhibit the cooking stoves at a number of places.', ' ', ' ', 'For more information on the improved cooking stoves contact: Paul Musyoka 0731 772384 or 0723 222060.', '\n']"
http://www.the-star.co.ke/news/2013/02/05/ruto-title-for-idps-farm-was-forged_c734805,RUTO TITLE FOR IDP'S FARM WAS FORGED,www.the-star.co.ke › National News,"Feb. 05, 2013, 12:00 am","['THE land title for a farm belonging to an IDP in Rift Valley was forged before it was sold to former Eldoret North MP William Ruto. Yesterday a Lands ministry official told a Nairobi court that the title was ""fake"".', 'Fraudsters apparently hijacked the identity of Dorothy Jemutai Yator and portrayed her as the owner of the land before selling it to Ruto.', 'According to documents produced before Justice Rose Ougo, Yator would have been six years old when the title was allegedly issued to her by the Lands registry.', 'The photo attached to the land transaction documents also did not resemble Yator who appeared in court for the first time yesterday. Principal Land Administration Officer Kiogora Mburugu said Yator was a victim of ""misrepresentation and forgery.""', 'Mburugu said the ministry was still ""investigating"" the fraud. No-one at the Lands Ministry has been charged with any offense or disciplined to date. Ruto, Uhuru Kenyatta\'s running mate in the presidential election, bought the 86 acre farm in Turbo, Uasin Gishu in September 2008.', 'However Adrian Gilbert Muteshi then filed a case claiming that he had owned the farm since 1968. Last year Ruto held a press conference where he said the court case was part of a ""grand scheme"" to link him land grabbing after the post-election violence. Later he agreed to return the farm to Muteshi but the agreement foundered after the IDP demanded compensation as well.', 'Yesterday the former MP was in court but opted not to testify. He had previously stated that he had done due diligence and had no reason to doubt the validity of the land title.', 'Hosea Ruto, a friend of William Ruto, yesterday told court that the ex-MP dealt with with two middle men who worked at the Uasin Gishu district settlement office and who were handling the transaction on behalf of Yator. ', 'Hosea said he personally went to inquire about the ownership of the land on behalf of the then MP. He said he went to the Uasin Gishu district settlement office where he met Peter Kosgei and Bethuel Kipsang who showed him the title deed and took him on a tour of the land.', 'The two men informed him that the land belonged to Yator who was ""part of them"" and that Yator was married to a Mr Kiptugen who works with the Lands ministry.', 'Hosea then introduced the two men to Ruto who paid for the farm in several installments with the final payment of Sh600,000 being handed over by Hosea himself. Hosea said he never heard Muteshis name during the transaction.', 'Muteshi filed his case in 2010 accusing Ruto of grabbing his 100 acre farm in Turbo, Uasin Gishu District. He said he farmed the land until 1992 when his business was temporarily interrupted by tribal clashes. He resumed farming after the violence but had to abandon the farm again following the chaos after the disputed 2007 election.', 'He was informed that Ruto had taken over the land when he returned to his farm after the turmoil. Muteshi said his six workers were evicted from the farm.', 'He claimed he acquired the land in the Kaptabei Scheme in the 1960s from Mr Edmund who was the white settler owner. Muteshi said that he applied to the then Lands minister, the late Jackson Harvester Angaine, for approval to buy the land in May 1968, . ', 'The application was approved on October 3, 1968, after paying the required amount plus development cash, Muteshi said. He signed a sale and loan agreement with the Settlement Fund Trustees at the same time and was expected to repay the loan over 30 years. However he only acquired a land title in 1989.', ""Muteshi must be honest. Allegations that he was at the farm in 2008 is actually a fraud. I've been the area MP for 15 years and nobody lived on that farm. The last time somebody was seen on the farm was in 1992. Muteshi was not living in the farm in 2008, Ruto told a press conference last year."", '\n']"
http://www.the-star.co.ke/news/2013/02/05/kitui-wiper-losers-join-jubilee-over-stolen-election_c734640,Kitui Wiper losers join Jubilee over ‘stolen election’,www.the-star.co.ke › Local News › North Eastern,"Feb. 05, 2013, 12:00 am","['Two politicians in Kitui County have declared the launching of a serious offensive against the Wiper Democratic Movement ahead of the March 4 polls.', 'The now Jubilee-inclined Caxton Munyoki, a former Kenya Broadcasting Corporation Managing Director, and Nairobi businessman Kennedy Ngumbau, lost the race for Wiper tickets for the Mwingi west parliamentary seat and Kitui governorship respectively.', 'The two said the Wiper party and its leader Kalonzo Musyoka who hails from Kitui County had let down their constituents and supporters.', 'They told Jubilee campaign rallies in Mwingi west constituency that they had joined Jubilee after being unfairly locked out of the ballot during the Wiper primaries.', 'I am a very bitter man. These people stole my vote because they had a preferred candidate for this constituency. I will use my energy and resources to ensure the dictatorial Wiper party team is defeated by candidates in jubilee Alliance, said Munyoki.', 'The former KBC boss was speaking at Migwani, Nzawa, Kanyaa, Kakululo and Nzalae market centres. I am bitter that although the Wiper party is associated with a person who hails from our home area, they have not shunned the  dictatorial Kanu ways, said Munyoki.', 'Ngumbau, who has joined Narc party and has been picked as a running mate for the governor aspirant,  Kiema Kilonzo, said he had set in motion a machinery to vanquish Wiper in Kitui at the March 4 poll.', 'I am a disgusted man because I invested a lot of resources campaigning for the Wiper nomination for the Kitui governors ticket only for my votes to be stolen in broad day light. The Wiper party has to pay for the injustice. Its candidates must lose the election, Ngumbau said.', '\n']"
http://www.the-star.co.ke/news/2013/02/05/yu-gets-sh13bn-capital-injection-from-essar_c734790,Yu gets sh13bn capital injection from Essar,www.the-star.co.ke › Business › Local,"Feb. 05, 2013, 12:00 am","['Mobile operator Essar Telecom Kenya has received Sh13.05 billion ($150 million) capital injection from its parent company Essar Group to pay its bank loans. ', 'This will enable the telecom operator finance its operating expenses from internal revenues as it seeks to raise funds for further expansion. ', 'yuMobile CEO Madhur Taneja said the company has been incurring huge interest costs from the loans but will now be able to finance its expenses internally and comfortably. ', '""We have paid off all our debts for the existing business. That is the biggest burden for any telecom. We do not have any debt at all, its all equity,"" said Taneja in an interview with the Star yesterday. ', 'Last year, there had been reports that the Indian conglomerate, which owns 80 per cent was planning to pull out of yuMobile, but Taneja said the capital injection shows contrary. It has already invested about Sh43.5 billion ($500 million) in Kenya in the telecom business in Kenya in the last four years. ', 'yuMobile is now expecting to receive Sh8.7 billion ($100 million) loan in March for capital expenditure. This will be the first tranche of its $200 million funding needs for the next few years. ', 'The new money will be invested in expanding capacity in voice, data and yuCash business and other radio frequency and transmission technology. ', '""We are borrowing money but that is for expansion not for operating expenses, that does not become a debt burden for us, interest servicing cost is not there,"" Taneja said ', 'He said Essar has already identified international banks where they are able to get the loans in dollars with attractive interest of around 7 per cent. It had contracted transaction advisors BNP Paribas to evaluate the possible funding options. ', '""Telecom business is extremely capital intensive. And you see returns you break even 5-8 years. so you need to bring in a substantial amounts,"" ', 'yuMobile is the fastest growing network. According to CCK figures, its customer base grew from 1.3 million to 3 million users in the year up to September 2012. it aims to gain 1 million new subscribers each and turn profitable by 2014.', ' ', ' ', '\n']"
