http://www.the-star.co.ke/news/2013/02/09/when-it-is-all-about-the-money-and-how-to-get-it_c734484,When it is all about the money and how to get it,www.the-star.co.ke › Sasa › G Spot,"Feb. 09, 2013, 12:00 am","['Two of the biggest South African stories during the last week of January this year were all about money. One involved an amazing act of philanthropy and the second was tied up in the murky world of political donations, slush funds and possible bribery and corruption. ', ""Both stories reminded me of similar Kenyan events and as one who loves to draw such parallels, I couldn't help myself."", "" The philanthropist's tale was for me the most heart-warming. It featured the man known as the richest Black South African, Patrice Motsepe."", ""Motsepe, who is recognised by the Forbes Rich List as one of Africa's wealthiest people, announced on Wednesday, January 30 that he would be donating half of his estimated R20bn (Sh194,206,000,000) to improve the lives of the poor especially in the fields of education and health."", "" According to his Wikipedia profile, Motsepe was born in 1962 to a schoolteacher turned small businessman who owned a Spaza shop, the South African equivalent of a Kenyan tea kiosk, in Soweto that was popular with black mine workers. So it is not like he was born with the proverbial silver spoon in his mouth. The profile writer says it was from exposure from his father's kiosk that Motsepe learnt basic business principles and received firsthand exposure to mining."", "" A lawyer by training, Motsepe became the first black partner in the prestigious law firm Bowman Gilfillan in 1994 and specialised in mining and business law at a time when the new government had begun the process of promoting black empowerment and entrepreneurship. The SA government's black economic empowerment policy mandates that mining companies be at least 26 per cent black-owned."", ' Eventually by 1997 Motsepe set up a firm to begin buying the operating mines that would become the source of his wealth.', ""Motsepe's great act of generosity should put the spotlight on other wealthy Africans and I am hoping that In Kenya, wealthy people other than the nation's best known philanthropist, Manu Chandaria, will take the hint."", "" I still for instance cannot believe that there are still internally displaced people whose circumstances have not changed much since the abortion that passed for a general election in December 2007. I know we Kenyans like to leave everything to the government to do (Serekali isaidie), but some of the wealthiest Kenyans have enough money to spare to sort out the IDPs and other landless/homeless Kenyans with the stroke of a pen. Come on people, do something. After all, you can't take it with you when you die."", "" The second cash money story that grabbed my attention was that of Helen Zille, the leader of South Africa's main opposition party who was shoved into the spotlight after a spat with one of the country's most politically connected business families, the Guptas. The Gupta family of South Africa are the majority shareholders of a SA national daily, The New Age newspaper. The Guptas are also widely said to be benefactors of the ruling ANC and are known to have strong ties with President Jacob Zuma."", ' The newspaper, in conjunction with the state broadcaster and a number of parastatals are involved with the live TV broadcast of a regular breakfast briefing that gets leading government figures including President Zuma and politicians such as Mrs Zille to attend and answer questions from a ticket buying public as well as the breakfast TV audience.', "" Recently Zille and her party withdrew from the breakfasts claiming they were sponsored by state-owned enterprises and this 'misuse of public funds' was of benefit to the Gupta family through their newspaper. Zille claimed that she and her party colleagues had only spoken at the breakfast under the assumption that it was funded by The New Age and members of the public who had bought tickets to attend."", ' Immediately after Zille and Co. withdrew sections of the media came out with stories saying that Zille was being economical with the truth and quoting unnamed sources who claimed that Zille had gone to the Gupta family estate in Saxonwold, Johannesburg, in 2011 to ask for a donation and that she had left with a substantial cheque.', "" Zille denied the accusations but eventually had to admit to receiving money from a Gupta employee 'in his personal capacity.' My thoughts were immediately cast back to the case of Kenya's Goldenberg scam and it's chief architect Kamlesh Pattni who once famously produced a damning list of politicians, journalists and others who had received cash from him. I also remembered all the politicians who by day claimed to be opposed to former President Moi but by night sneaked into his home to eat Ugali with him."", "" Don't politicians and other leaders ever learn from the mistakes of others?"", '\n']"
http://www.the-star.co.ke/news/2013/02/09/the-phenomenon-of-dog-whistle-politics-in-kenya_c735887,THE PHENOMENON OF 'DOG-WHISTLE' POLITICS IN KENYA,www.the-star.co.ke › Siasa,"Feb. 09, 2013, 12:00 am","['Wikipedia defines dog-whistle politics as political messaging employing coded language that appears to mean one thing to the general population but has an additional, different or more specific resonance for a targeted subgroup. Wikipedia adds, It is an analogy to dog whistles, which are built in such a way that their high- frequency whistle is heard by dogs, but is inaudible to humans.', 'Most Kenyans have never heard of the term, including highly educated men and women, some of them toting PhDs in political science, but once they grasp it they never forget it  this is the phenomenon of dog-whistle politics. ', 'However, never having come across it in the English language is not the same thing as saying that many of our politicians are not in fact unwitting experts in dog-whistle politics.', ' ', 'Dog-whistle politics have long been a strategy of Kenyan political oratory, with the foremost exponent being the late Mzee Jomo Kenyatta and the foremost living exponent being Prime Minister Raila Odinga.', ' ', 'Coded Language', ' ', 'Wikipedia defines dog-whistle politics as political messaging employing coded language that appears to mean one thing to the general population but has an additional, different or more specific resonance for a targeted subgroup.', ' ', 'Wikipedia adds, It is an analogy to dog whistles, which are built in such a way that their high-frequency whistle is heard by dogs, but is inaudible to humans.', ' ', 'Dog-whistling can take place in many contexts, including a corporate annual general meeting or a church sermon, but it is overwhelmingly a phenomenon of the political realm.', ' ', 'The most prominent use to which dog-whistle politics has been put in 2013 is easily Railas ferocious baiting of Deputy Prime Minister Uhuru Kenyatta on the Land Question. ', ' ', 'Raila is the leader of two political formations  the Orange Democratic Movement (ODM) and the Coalition for Reform and Democracy (CORD) and is seeking the presidency for a third time in a decade-and-a-half at the March 4 General Election. ', ' ', 'Similarly, Uhuru heads up two massive formations, The National Alliance (TNA) and the Jubilee Coalition, and is seeking the presidency for the second time in a decade. ', ' ', 'These two are the sons, respectively, of Kenyas founding Vice President, the Jaramogi Oginga Odinga, and the founding President, Kenyatta. The rivalry between the two men is the culmination of one of the longest political feuds of Kenyan politics, the fallout in the mid-1960s between their fathers which has now crossed a number of generations.', ' ', 'The Kenyattas are among Kenyas largest landowners of all races and nationalities, with their assets having been acquired during Jomo Kenyattas 18 months as the first Prime Minister of Kenya (June 1, 1963, to December 11, 1964) and 14 years as founder-President (December 12, 1964, to August 22, 1978).', ' ', 'The Odingas are also among the wealthiest Kenyans, with assets denominated in the billions of shillings, but clearly not in the Kenyattas class, which defines Old Money in this countrys African population. There are Europeans and Asians in Kenya who are quietly seriously wealthy and multiple millionaires even in the worlds hardest hard currencies, which makes them multiple shilling billionaires, some of whom are landowners on a scale to rival the Kenyattas, but they remain well under the political, or indeed any other, radar, except the taxmans.', ' ', 'Who Let the Dog-whistle Politics Out?', ' ', 'However, the Odingas have long cultivated a populist brand of politics, even veering far leftwards towards Marxism-Leninist rhetoric at the height of the Cold War, when Odinga Snr was a frequent and honoured guest in the chancelleries and capitals of the then Soviet Union and China. ', ' ', 'The Kenyatta political brand changed from fiery to establishmentarian a long time ago and has remained a pillar of the status quo for 50 years. After the deadly decade of the 1950s, when the British jailed him as Manager of Mau Mau and the freedom fighters in the forests promptly rephrased the Christian Lords Prayer handed down by Jesus Himself to substitute', ' Our Father who art in Kapenguria for Our Father who art in Heaven, the Kenyattas have long defined Kenyas home-grown capitalist establishment and have had no truck with any flavor of socialism.', ' ', 'Raila denounces Uhuru, his strongest opponent for Fourth President of Kenya, as the status quo incarnate and positions himself as the consistent face and agent of change, reform and social equity. ', ' ', 'But it is the land issue, for more than 100 years the most delicate and explosive issue in Kenya, that Raila has seized on and woven a dog-whistle politics narrative around it like none other since Jomo Kenyatta himself was denouncing the Mau Mau and they were claiming him for themselves as godhead and fountainhead in the 1950s.', ' Raila is travelling the length and breadth of Kenya on the campaign trail with one key message  that the Kenyattas own too much land for Uhuru to be a real reformist or to take Kenya to the next level of reforms, the full implementation of the Constitution of Kenya 2010.', ' For a nation of peasants and slum dwellers, and some of the worst income inequality indices in the world, this is a potentially incendiary message. However, Railas true audience, his real dog-whistle politics target subgroup, are the Rift Valley grassroots of Uhurus running mate Ruto. ', 'Uhuru pulled off the political coup of 2012 when he got Ruto to join him in the Jubilee Coalition. It was a stunning move and it generated the biggest realignment of political forces in a decade, since Raila himself led the exodus from then ruling party Kanu in October 2002 to form the National Rainbow Coalition (Narc) and scuttle President Daniel arap Mois succession agenda, which had Uhuru as its centerpiece. ', ' ', 'Uhurus move was based on such a radical proposal, an electoral union of the vast Mt. Kenya region and the Rift Valley vote blocs, that Vice President Kalonzo Musyoka of the Wiper Democratic Movement (WDM) ran all the way into a political union with Raila in CORD.', ' ', 'As we have often noted in these columns, the Kikuyu and the Kalenjin have never voted together in a presidential poll or a national referendum. However, the Kalenjin voted wholeheartedly for Uhuru in the 2002 race at President Mois urging but the rest of the country went for Mwai Kibaki as Third President of Kenya, overwhelming the Kanu ticket. ', ' ', ' ', 'At the core of the Land Question in Kenya is Kikuyu settlement in the Rift Valley. The political violence, both pre- and post-polls, of the multiparty era that begun in 1992, with the exception of the presidential transition poll of 2002, has had Rift Valley and the Kikuyu-Kalenjin divide as its focal point. The feat Uhuru and Ruto achieved in coming together ahead of only the second presidential transition poll in Kenyan history (and the first one with a runoff option) is the promise of erasing the Kikuyu-Kalenjin divide.', ' ', 'It is very specifically aimed at the Kalenjin in their Rift Valley redoubt. Raila is cleverly contriving to remind the Kalenjin that Rift Valley land was acquired on a massive scale by Kenyas biggest and therefore most land-hungry community  the Kikuyu  at a time when the regions most senior politician, Daniel Moi, was Vice President of the Republic. ', ' ', 'And though the Kalenjin then had no numbers imposing land hunger on them, their population has since exploded. Railas intention is to downgrade and degrade Rutos value to the Uhuru presidential campaign by reminding the Kalenjin that another Kikuyu President, a Kenyatta, imposed his terrific will on another Kalenjin deputy president, Moi, and if Jubilee takes State House history is likely to repeat itself. ', ' ', 'But only the Rift Valley audience hears this narrative, hence the dog-whistle paradigm. And that is exactly what Raila intends  that the Kalenjin Rift Valley audience hears him.', ' ', 'In Central Kenya, Railas dog-whistling on land issues is perceived quite differently. There, it is detonating all manner of conspiracies theories, including very dark suspicions indeed that Raila has a land redistribution agenda up his sleeve. ', 'This is a dreadful prospect for well-to-do Mt. Kenyans and an intriguing one for the millions of landless. The Kikuyu FM stations are full of speculative talk all the way into the wee hours of Railas real portent in harassing Uhuru so relentlessly on the land issue.', ' Caller after caller says Raila will change the Constitution to factor in land-grabs and redistribution as a way of addressing historical injustices; will therefore destabilize Kenya Big Time; will keep the Mt. Kenyans tied up in endless litigation over land issues; will make the Rift Valley, now pacified after such hard work by Uhuru and Ruto, once again a dangerous place.', ' ', 'Early in the week, Inspector General of Police David Kimaiyo issued a security advisory urging politicians not to revisit contentious land issues on the campaign trail. ', ' ', 'Responding directly to Kimaiyo in a campaign speech at Migori in his Luo Nyanza political backyard, Raila declared: The police cannot prescribe what we should or should not discuss.The directive also negates free speech, which is guaranteed in the Constitution.', 'This spectacle generated a shiver up and down Mt. Kenya and social media and the FM stations, including online, with Diaspora Mt. Kenyans, also commenting. ', ' ', 'Kimaiyo is not just another senior police officer in Railas perspective. He was his security consultant during the ill-fated 2007 presidential campaign; his candidature for the top Kenya Police Service position was a very special one indeed as he maintains the most cordial relations with Ruto and Uhuru on top of receiving the PMs own endorsement; and he hails from the Rift Valley, the nations epicenter of controversial land issues. Raila was instrumental, too, in the appointment of the Chief Justice and President of the Supreme Court of Kenya, Dr. Willy Mutunga, a one-time fellow political detainee and exile.  ', ' ', 'There has not been a top cop in Kenya of Kimaiyos political fault-line-bridging credentials since the late James Kanyotu, Kenyas longest-serving national spymaster. For Raila to treat him so brusquely so promptly on the issue of the Land Question is a signal being interpreted in Mt. Kenya as a sure-fire indication of the strength of the PMs near-future intentions for a radical rethink of land policy in Kenya.', ' ', 'Such a rethink has long been dreaded by the landed Mt. Kenya elite, owners of the nations choicest agricultural land and real estate. The real estate boom of the Kibaki era has signaled the arrival of Kenyas biggest and richest middle class yet  and it is still overwhelmingly Central Kenyan.  ', ' ', 'Also joining in the fray were Government Spokesman Muthui Kariuki and National Integration and Cohesion Commission Chairman Mzalendo Kivunjia, both of whom asserted that controversial land ownership issues belong to forums other than emotive political rallies, for instance the courts and other arbitration channels. Kariuki spoke of discussing land issues at political rallies as a powder keg and called it potentially lethal.', ' ', 'Raila and Kalonzo strenuously disagreed with Kimaiyo, Kariuki and Kivunjia. The VP, a lawyer, said he had reviewed the top cops advisory and it amounted to gagging the political class and Kenyans generally on a burning issue of national interest.', ' ', 'Is Railas dog-whistling strategy on land issues a vote winner? His treatment of IG Kimaiyos pioneering security advisory for campaigning politicians would seem to indicate that the strategy is too important for him to amend, let alone drop.', ' This can only mean there must be some indications on the ground of some success, or likely success, for Raila to hold on with such tenacity to the dog whistle on the land issue.', '\n']"
http://www.the-star.co.ke/news/2013/02/09/aipca-archbishop-evanson-ndungu-kibe-passes-on_c736745,Aipca archbishop Evanson Ndung’u Kibe passes on,www.the-star.co.ke › Local News › Central,"Feb. 09, 2013, 12:00 am","['The Africa Independent Pentecostal church of Africa AIPCEA) is mourning the death of Archbishop Evanson Ndungu Kibe. Kibe passed on yesterday at Nazareth hospital in Kiambu county.', 'According to his son Paul Muthee Ndungu Kibe, his father had been battling Asthma for a long time. Last night his health deteriorated and was rushed to Nazareth hospital.', 'He was pronounced dead on arrival. His body has been moved to Monalisa funeral home.', 'Ndungu took of as the head of the AIPCEA church in July 2011 from Archbishop Samson Mwangi Gaitho who also died shortly after handing over.', ""Archbishop Evanson Ndung'u Kibe had last year in July met prime minister Raila Odinga where the AIPCA church has been petitioning the Kenya government over schools it established before independence."", 'Its a very big blow to us as a church as we lost Archbishop Samson Gaitho towards the end of 2011 and Ndungu has only served the church slightly more than one year, Pastor George Ngigi said.', '\n']"
http://www.the-star.co.ke/news/2013/02/09/nine-killed-in-turkana-village-raid_c736607,Nine killed in Turkana village raid,www.the-star.co.ke › Local News › Rift Valley,"Feb. 09, 2013, 12:00 am","['Tension is high in Turkana after nine people were yesterday killed when heavily armed bandits raided a village in Turkana South. Among the dead are three women and two children. The raid took place on the border between Pokot and Turkana counties.', 'The DC, Elijah Kodo, said two men from the Turkana community and one of the raiders were killed when the bandits raided Kaptir village and stole 2,500 goats. Three other people were injured in the raid.', 'Kodo said police were immediately deployed to track down the attackers. School and government institutions facilities were shut down as most people fled from the area fearing further attacks.', '""There was a heavy exchange of fire between the raiders and police officers and Kenya police reservists,"" said Kodo. The DC said the raiders escaped with the animals.', 'He said the raiders shot at women and children as they fled the attack. Kodo and police boss John Bosco Mutu visited the area and said GSU and Anti-Stock Theft Unit officers had been sent to fend off the attackers. Mutu said he suspected the raiders were Pokots.', 'Turkana herders armed themselves for revenge attacks against the Pokots, but police kept vigil along the boundary to prevent any skirmishes. The latest attacks came just days after bandits killed three police officers and six people in Baringo county.', 'The government has since opened five GSU and police camps in Baringo to help fight cattle rustling. Extra vehicles have been supplied to police officers in the region. Last week, nine people including three police officers, three civilians and three bandits were killed.', 'Baringo county commissioner Bernard Leparamarai said the government has sent in an additional 100 officers. Chiefs in the bandit prone areas have complained that the number of police officers deployed is not enough to effectively deal with the cattle rustlers. The chiefs said they should also be given arms just like the police reservists.', '\n']"
http://www.the-star.co.ke/news/2013/02/09/when-the-finally-dust-settles-part-one_c734631,When the finally dust settles: Part One,www.the-star.co.ke › Sasa › Bushman Adventures,"Feb. 09, 2013, 12:00 am","['I had woken up early to start my game drive before the torturous heat of the Tsavo region inconvenienced our outing. It was getting to 9am and the heat was starting to hurt. I wanted to drive back to the lodge. I was reluctant since we had not seen a soul during the three hours we had been driving through the bushes of Tsavo East National Park. ', 'I thought of putting on the AC in the van then discovered that it could not be effective with the roof of the van open. So we decided to sweat it out in the bush for one more hour and return to the cool comfort of the lodge. ', 'The additional hour we gave ourselves did not bear fruits. We drove back to the lodge at 10am. The sun was already so hot that the clients had to simply stay in their rooms and run the air conditioning units at full blast. I did not want to go to my room.', ' I chose to stay by the poolside and enjoy the breeze and the sound of music coming from a nearby acacia tree which was swarming with the southern masked weavers busy weaving their nests. The lodge staff were good enough to allow me to have a cold drink at the pool bar, although the bar was closed for service. ', 'As I sipped my drink and scanned the endless plains before me, I noticed something unfamiliar, so far away. I had to use binoculars to see clearly. It was dust. A cloud of red dust was forming in the distance, making devilish curves and meandering like a giant snake from hell. It got me interested immediately because the line of dust seemed to head directly towards the lodge.', 'I quickly grabbed my camera, which has a more powerful zoom than the binoculars. When I focused on the approaching cloud of dust, I saw huge silhouettes of elephants completely swallowed into the red dust. ', ""There were so many of them that their movement looked like a river slowly flowing towards where I stood. Since we had been in the bush the whole morning and had not seen anything, I saw it necessary to rush to the clients' rooms and call them. As I turned my face away from the view of the dust cloud, something else caught my eyes. "", 'On my left and unseen till now, was another huge cloud of dust. This was even closer to the lodge than the one I had been watching. I did not need the binoculars or the camera, to see the hundreds of buffalos also heading towards the lodge. This group was mixed with small counts of gazelles and zebras and other smaller grazers pulling the rear.', ' The excitement was overwhelming. I had to call my clients. Suddenly, I felt a hand on my shoulder. I turned around to find the owner of the friendly hand. It was one of my clients. In my excitement, I had failed to watch my back. My clients had seen the spectacle building in the distance from the balcony of their rooms and came down to the pool side to see better and probably get some shots. ', 'All the animals arrived at the waterhole almost at the same time. Then the commotion started. Elephants wanted to dominate the waterhole. The bull buffaloes would not allow themselves to play second fiddle. The elephants had the size, but the buffaloes had the numbers. None would give in. ', 'Though there was enough water for all, they still fought so hard for control of the resource. While the elephants used their trunks to siphon the water even from the deep end of the hole, the buffaloes had to literally enter into the waterhole, drink from within and then lay themselves in the water to cool and wallow. ', 'This infuriated the elephants. Regardless of their sizes, the juvenile elephants who were agile enough also dipped themselves in the water, displacing most of it that flowed out into the shallow end of the hole. This was the blessing that the small animals, which had now increased in number, were waiting for. The left overs. ', 'Watching the political scenes playing at the moment all around the country, I could not help to draw parallels to what I was watching here. A different forest, same animals. Different trees but the same monkeys.', '\n']"
