http://www.the-star.co.ke/news/2013/02/09/mosoriot-all-set-for-duel_c736627,Mosoriot all set for duel,www.the-star.co.ke › Sport › Sports Local,"Feb. 09, 2013, 12:00 am","['<<ATHLETICS>> North Rift hold their provincial cross country championship today', 'IT will be a battle of might amongst athletes as North Rift holds its provincial cross country championships at the Mosoriot Teachers College today.', 'And with the region harbouring most of the countrys top athletes, riveting action is expected due to the limited slots allocated for national trials. The athletes will come from Turkana, Uasin Gishu, Elgeyo Marakwet, Trans Nzoia, Baringo, Pokot counties and the hosts Nandi.', 'Nandi, the region that boards most of the world junior international runners will field world junior 3000m Steeplechase champion Consensus Kipruto in the 8km junior men, Wilson Cheruiyot and Willy Ngelel.', 'AK/KCB cross country series jackpot winner Agnes Chebet lines up for the 6km junior womens race with Ruth Chebet and Margaret Chelimo.', 'Nelly Cheptoo, Violah Cheptum and Nancy Cheptoo headline the senior womens field while Titus Tanui, Felix Kipchirchir and Ezekiel Tanui are in the 12km race.', 'From Uasin Gushu representing Wareng district will be Nelphat Sirma, Simion Kiplagat and John Koech in the 12km. Sophy Jepchicrchir, Sammary Jerotich and Veronica Jepkosgei will be seeking honours in the 8km women.', 'Silas Keitany, Stanley Kipkirui and Timothy Yator top the 8km junior mens field while Brenda Kibet, Sharon Kosgei and Valentine Serum are in the 6km junior womens category.', 'Elgeyo Markwet has Emmanuel Kipsang, Wilfred Kimitei and John Kemboi in the 12km men as Irene Jebet, Rispar Kimaiyo and Ruth Matebo line up for the 8km senior women.', ' Gloria Kite, Jeptoo Kiprop and Jackline Jepkirui qualified for the 6km women while Peter Emase and Cedic Cheruiyot will brave it out in the 8km junior mens division.', 'Attraction at the championships will also be the overseas athletes who, traditionally, have been gracing local meetings in the region. They have been pulling in the crowds as well as giving the competition an international image.', 'Brothers Jake Robertson and Zane Robertson from New Zealand will be leading the overseas athletes.', 'Our local races have gained an international image due to the presence of overseas athletes. This, apart from top athletes, has been attracting the crowds, David Letting AK Rift Valley branch secretary general said. The championships will be used to select its team for the IAAF Permit-cum national trials set for February 16 at Uhuru Gardens.', '\n']"
http://www.the-star.co.ke/news/2013/02/09/swearing-in-to-be-held-in-kasarani_c736708,Swearing in to be held in Kasarani,www.the-star.co.ke › National News,"Feb. 09, 2013, 12:00 am","[""The inauguration of Kenya's fourth president will be held at the Moi Kasarani stadium and not the Nyayo stadium as earlier planned, the head of public service and chair of the government committee on the assumption of Office of the President Francis Kimemia said yesterday."", 'He said that the Kasarani stadium could accommodate more peoplea maximum of 60,000 than the Nyayo stadium which can only sit between 30,000 and 35,000 people.', ' ', 'We also think Kasarani is more suitable even on issues of security, he said adding that the recent refurbishment of the stadium meant it would not cost as much as Nyayo stadium to spruce it up.', ' ', 'The 2002 inauguration of President Kibaki was a chaotic event held at Uhuru Park attended by thousands of people. The event presented a security nightmare for those detailed to provide security for the scores of VIPs presented.', 'At one stage during the event, hordes of people surged towards the motorcade of then outgoing President Moi even as they booed and chanted songs ridiculing his regime. ', ""Kibaki's inauguration for the second term was a hurried affair conducted at State House late in the afternoon and with only a few invited guests present.  "", "" The then outgoing president Moi's presidential elections, Mwai Kibaki was sworn it at Uhuru Park in a ceremony attended by thousands of Kenyans and hordes of invited dignitaries. But after the controversial December 2007 victory, Kibaki was hurriedly sworn it at State House with only a few of invited guests."", 'Yesterday, Kimemia, who was accompanied by among others Inspector General of police David Kimaiyo, said the inauguration ceremony will be held within the capital city as provided by the law.', ' ', 'Article  141 (1) of the constitution states that the inauguration and swearing in of a president elect should be held in public before the Chief Justice or in his absence, before the Deputy Chief Justice.', ' ', 'Kimemia said those aggrieved with the choice of the venue can raise their objection through a memorandum to his committee. According to the schedule prepared by the committee and released last week, the inauguration ceremony will be held on March 26 if there is no re-run. In case there is a petition and it is dismissed, the swearing in will take place on April 16. ', ' ', 'In case of a run-off for the presidency, the new president will be sworn in on April 30, and June 18 if there is a repeat of the election. Kimemia said the committee will seek the views of the various presidential candidates regarding the program of that day. ', ' ', 'He said the candidates have also been asked to think about the guests they want invited in case they are declared the winner. At the same time, the Judiciary has announced the appointment of 47 judges who will swear in governors across the country. ', ' ', 'Judiciary chief registrar Gladys Shollei announced that Chief Justice Willy Mutunga has also appointed 47 deputy registrars who will assist the judges in swearing in of the governors. Shollei said those appointed have already been notified.', ' ', 'The Transitional Authority said it has identified premises where governors will operate from in each of the 47 counties. He said venues where county assemblies will operate from have also been identified. ', '\n']"
http://www.the-star.co.ke/news/2013/02/09/muthoni-the-drummer-queen-to-perform-at-afcon-finals_c736407,Muthoni The Drummer Queen to perform at AFCON finals,www.the-star.co.ke › Lifestyle › Word Is,"Feb. 09, 2013, 12:00 am","['Blankets and Wine CEO Muthoni the Drummer Queen has been selected as one of the artistes who will perform at the African Cup of Nations finals in South Africa. ', 'The Closing Ceremony will show off a more contemporary side to the continent, complete with urban vistas, cityscapes and high-energy performances.', ' The performances, the dance routines have a really high-octane energy feel to them, an appropriate conclusion to a really dramatic tournament  the crowd is definitely going to love it! said Orange AFCON South Africa 2013 Lebo Hlatshwayo events and ceremonies manager.', '\n']"
http://www.the-star.co.ke/news/2013/02/09/fke-to-hold-parties-to-their-poll-pledges_c736750,FKE to hold parties to their poll pledges,www.the-star.co.ke › Business › Local,"Feb. 09, 2013, 12:00 am","['EMPLOYERS will use the manifesto of the winning party to vet its government and demand that it incorporates the plan in the national economic development policy, they said yesterday.', 'Under the banner of Federation of Kenya Employers, the group expressed concern over the ""glossy manifestos"" that various political parties have unveiled ahead of the March 4 elections.', '""We shall hold them accountable to their manifestos to ensure that the promises remain true,"" said FKE executive director Jacqueline Mugo yesterday.', 'According to the Cord coalition whose presidential candidate is Raila Odinga, pledges made include: set up of one major industry per county and establishment of a 24 hour economy in major urban centres; reintroduction of free agricultural extension services and introduction of a pension scheme for those aged above 65.', 'It has also promised to invest at least 10 per cent of GDP in development and introduce a modern integrated rail infrastructure that connects Kenyans among others.', ""The Jubilee Coalition's promises to allocate 2.5 per cent of national revenue per year towards a youth enterprise capital fund to give interest free business loans to young people without collateral; engage with economic powers like USA, Britain and other European countries to secure Kenya's economic and security priorities. "", 'It also pledges to mould relationships with emerging players such as China, Brazil, India and Russia and to increase the police citizen ratio from one police for every 1,800 people to one police per 1,150 people.', '""The new constitutions gives Kenyans power to hold elected officials and public servants accountable,"" said Mugo.', '\n']"
http://www.the-star.co.ke/news/2013/02/09/nairobi-park-diary-skilled-hunter_c734446,Nairobi Park Diary: Skilled hunter,www.the-star.co.ke › Sasa,"Feb. 09, 2013, 12:00 am","[' ', 'It was late in the afternoon as I entered the East Gate. The weather was fairly gloomy and cloudy. I had not prepared my camera to be ready for any natural event. As I drove along, suddenly a flash of grey movement appeared on my left. It was a large magnificent Secretary Bird (Sagittarius serpentarius), and it was hunting.', ' I dived down to prepare my camera for the action. The bird moved quickly and jumped into an acacia tree to dislodge an agama lizard with its talons. It then repeatedly stamped on the fateful lizard until it was dead. In a swift movement the lizard was lifted in its beak and flicked upward into its open mouth and quickly swallowed. Wow! What a sighting. ', 'Then just as I was about to drive away the bird continued to hunt and within minutes had found another smaller lizard and repeated the same hunting technique with practiced skill. After consuming that lizard, the Secretary Bird walked away into the acacia shrub, leaving me really impressed at this highly skilled hunter. ', 'The Secretary Birds name is popularly thought to derive from the crest of long quill-like feathers, lending the bird the appearance of a secretary with quill pens tucked behind the ear, as was once common human practice. ', 'A more recent hypothesis is that ""secretary"" is borrowed from a French corruption of the Arabic saqr-et-tair or ""hunter-bird. Their range is widespread over Sub-Saharan Africa and prey may consist of insects, mice to hares and mongoose, crabs, lizards, snakes, tortoises, young birds, bird eggs . ', 'So next time you are out in the bush and do see a Secretary bird, stop for a while. They are always very rewarding to watch. ', ' ', 'The park is open daily from 06h00 to 19h00. ', 'For more information on the park you can link to the following websites www.kws.org or www.nairobigreenline.org or on Facebook.', '\n']"
http://www.the-star.co.ke/news/2013/02/09/kimaiyo-wrong-to-gag-kenyans-over-land_c736284,Kimaiyo Wrong To Gag Kenyans Over Land,www.the-star.co.ke › Siasa,"Feb. 09, 2013, 12:00 am","['The land question is back in the limelight with a twist. Inspector General of Police David Kimaiyo has given a directive to the effect that land should not be one of the issues on the campaign trail because it is so emotive and can trigger violence. In his opinion, politicians who engage in such talk are not self-respecting.', 'A liberal Kenyan mind will wonder how an officer of that rank can say that in the 21st century realities. That remark will clearly have a lonely space in our annals of history by an officer that high in government in the new dispensation.', 'What does stopping discussion on land mean? If we decided to reconstruct our national history deleting ramifications of land as a motif force in political processes, what shall we be left with? ', 'By his edict, Kimaiyo just banned politics. Kimaiyos wish was only viable in the primitive communal mode of production where land had no bounds, was least populated, and packed with wild crops and animals ready for harvest by any animal in need. ', 'The slave, feudal, capitalist, colonial and neo-colonial modes of production rendered communalism obsolete centuries ago launching land politics all the days of the year.', 'If the African people gave in to a colonial ban on discussions on land, we would still be colonies. We would still be waiting for the Mau Mau insurrection to save Kenyans from all the consequences that come with colonial domination.', ' South Africas African National Congress, Samora Machels Freelimo, Agostino Netos MPLA of Angola, Joshua Nkomos ZAPU and Mugabes ZANU Patriotic Front of Zimbabwe would still be waiting for their moment in history if they obeyed the colonial equivalent of Kimaiyo.', 'Kimaiyos call is familiar and harmonises well with mainstream history. The first independent Kenyas assassins bullets hit grumblers over land: Generals Baimunge and Chui were shot dead on January 27, 1965 in a forest in Mount Kenya by the Kenyatta administration. ', 'The two were Kimathis successors in the Kenya Land and Freedom Movement who had insisted that land be availed to liberation war survivors. ', 'When Kimaiyo calls land emotive, he is telling us the side on which his sympathies are as far as the land question in Kenya is concerned. ', 'He seems to agree with the ownership regime of beach plots by non-coastal in Nyali. Taita Taveta land inequalities should be maintained. ', 'He is uncomfortable with the mandate of the Truth Justice and Reconciliation Commission (TJRC) whose chief business is to guide national political dialogue on land with a view to addressing historical injustices.', ' His position at the helm of our armed law enforcers may tread in the footsteps of those who violently instructed JM Kariuki not to talk about the land question.', 'Worse still, he does acknowledge that the politics of this years elections is founded on four pillars developed national leaders in partnership with the team of African Eminent Persons. ', 'Need I itemize the Agenda Four issues which prescribe land reforms through political discussion as a panacea to national strife and violence? ', 'The General must be aware that his appointment arose out of the desire to have a Commander who is ideologically non-partisan and embraces democratic values and culture to resolve conflicts. ', 'There were better options. He could have called for a meeting with all presidential aspirants for dialogue on what he considers contentious rather than issue a directive that isolates those supporting the entrenchment of land reforms. ', 'How does the position he took portent for his integrity and impartiality during the upcoming General Election? Should we brand him as one other step in the wrong direction similar to the Nancy Barasa saga in the reform trajectory? One hopes that this was a slip of the brain and an apology is being processed for quick delivery.', 'One mans story tells it all. Bildad Kaggia rejected 300 acres offered to him by Jomo Kenyatta. He told Kenyatta that he would only take the land if all his constituents were offered the same number of acres. ', 'At a public rally where Kaggia was seated, Kenyatta spoke something like this Its three years into our independence. Now Paul Ngei has developed estates for himself, Kaggia what do you have for yourself?', ' We were with Kungu Karumba in prison, now he has huge tracks of land and coffee estates. Kaggia what do you have for yourself. We were with Fred Kubai in prison, now he has ....Kaggia what do you have for yourself?', 'When the late Ntai wa Nkuraru and I visited Kaggia in 1998, he told us that he stood up and approached Kenyatta on the dais and asked him to give him a chance to respond to the land question but Kenyatta declined telling him to organize your own rally. ', 'Kaggia was subsequently thrown out of parliament and jailed for addressing an illegal meeting in Homa Bay. Kaggia was forced into retirement never to get a public forum to challenge the Kenyatta gag on land as a national agenda item. Every time I hear Raila Odinga speak on Land, I know he does it for Bildad Kaggia who did not live long enough to enjoy current freedoms. ', '\n']"
http://www.the-star.co.ke/news/2013/02/09/project-to-clean-up-river-kisat-launched_c736562,Project to clean up River Kisat launched,www.the-star.co.ke › Local News › Western,"Feb. 09, 2013, 12:00 am","[' THE Lake Victoria Basin Commission has begun the process of rehabilitating the polluted Kisat river in Kisumu.', ' ', 'Speaking yesterday at the conclusion of a series of consultative meetings in Kisumu, LVBC principal administrative officer Odeth Bateta said various stakeholders are needed to jointly implement the project saying it would benefit many.', ' At the end of this project, transporters, fishermen, industrialists, water users and other members of the private sector will work in a less polluted, more comfortable and profitable city, she said.', ""Speaking on behalf of the LVBC Executive Secretary, Canisius Kanangire, said the consultative meetings brought together interested parties who all contributed to recommendations arrived at in river Kisat's rehabiliation project."", ' River Kisat is a four kilometer river in Kisumu that flows through farmland, informal settlements and part of the industrial area, before discharging its waters into Lake Victoria at Kisumu Bay.', ' ', ' It faces pollution from municipal waste from the Kisat conventional sewage treatment plant, industrial waste, dirt from surrounding informal settlements, oil and mechanical waste from informal car garages and molasses waste from informal alcohol brewing sites.', ' ', ' Participants thanked LVBC for spearheading the idea of the rivers rehabilitation saying they will fully participate in its implementation.', 'LVBCs senior operations officer Lily Kisaka, who is coordinating the project preparation efforts, informed stakeholders that the Commission intends to finalise the projects concept by early March 2013. She said resource mobilisation will begin immediately thereafter. ', '\n']"
http://www.the-star.co.ke/news/2013/02/09/bensouda-opposes-icc-in-arusha_c736724,Bensouda opposes ICC in Arusha,www.the-star.co.ke › National News,"Feb. 09, 2013, 12:00 am","[' ', 'ICC chief prosecutor Fatou Bensouda has opposed the transfer of the ICC cases from the Hague to either Arusha or Nairobi. She filed an application to the trial judges on Thursday in response to a request by defence lawyers.', ' She said the Kenyan cases had unique security challenges and unprecedented level of witness interference although on principle she supported having the trials held as close as possible to the victims.', 'The trials of Jubilee presidential candidate Uhuru Kenyatta, his running mate William Ruto, former Cabinet Secretary Francis Muthaura and broadcaster Joshua wrap Sang on charges of crimes against humanity charges start at the Hague on April 10 and 11.', ' Yesterday, Bensouda said there had been extrajudicial killings, forced disappearances and threats against her witnesses. She also said there were also persistent and systematic attempts to bribe her witnesses from testifying at trial or to provide only false exculpatory testimony. ', ' The prosecutions concern is that the attempts to interfere with trial witnesses would increase if the trial were held in Kenya and, to a lesser extent, in Arusha, Tanzania, where the accused have significant influence, where the public interest in the trial is extremely high and where the Court has no infrastructure in place to ensure the security of trial witnesses, she said. ', ' She said some witnesses and victims would be unwilling to testify in East Africa.  Bensouda challenged the defense claim that the Kenyan public would welcome a regional trial. Bensouda said the issue of venue should not be used to delay the trial.', ' The prosecution wishes the trial to begin as expeditiously as possible and thus the logistics for any proceedings in Kenya or in Arusha should be organized between now and the trial date,"" she said.', ' She was however not opposed to portions of the trial being held in Nairobi or Arusha. Such portions could include the opening and closing statements as well as testimonies of the accused and international experts. ', ' Hearings of this nature could strike the right balance between bringing the trial as close as possible to the affected region and thus satisfy the public interest in the case, and the need to protect witnesses, she said. ', 'A lawyer for the victims in the Uhuru case, Fergal Gaynor,  confirmed that 151 of the 155 victims she was representing would prefer the trial to be held at the Hague. ', 'Bensouda still wants to add the use of guns in the Naivasha attacks into the final charges against Uhuru and Muthaura.  On December 28, the trial chamber rejected the inclusion of the use of guns in Naivasha in the final charges. ', 'On January 22 this year, Bensouda formally applied to the pre-trial chamber to re-insert the guns claim she had fresh evidence. She said further investigations did not end with the confirmation of charges and cited the precedent set in the Thomas Lubanga case that the duty to establish the truth is not limited to the time before confirmation hearing.', ' ', 'On Thursday, the gun allegations were further given credence by Jane Waruguru Mwangi, the wife of former Mungiki leader Joseph Maina Kangethe aka Maina Diambo. ', ""Diambo went missing on July 6, 2008 after he was called by a top government official to collect a Sh3 million donation for the burial of Mungiki leader Maina Njenga's wife Virginia Nyakio who was murdered a few months earlier."", ' ', 'According to the ICC, Diambo attended a meeting at State House to plan the revenge attacks in Naivasha.   In an interview with the BBC reporter Karen Allen, Waruguru claimed that her husband was a tormented man by the time he disappeared.', ' I saw big, large amounts of money (on him). I saw him washing guns, she said.', '""He told me he was tormented by something he did. He did not tell me and he warned me that if l kept asking him questions, he would go crazy,"" said Waruguru.', ' Uhuru and Muthaura are opposed to the inclusion of the guns in the charges saying Bensouda ought to have established this before the confirmation of charges. ', 'They claim the prosecution is grossly exceeding the period for post-confirmation investigations. The victims however support the continued investigations.', ' Several expressed the view that the Chamber must be made aware of the full scale of the crimes that took place in Nakuru and Naivasha, including the true number of people killed and the methods employed to kill, said their lawyer Gaynor.', '\n']"
http://www.the-star.co.ke/news/2013/02/09/we-were-not-heckled-tna-hopefuls_c736656,We were not heckled – TNA hopefuls,www.the-star.co.ke › National News,"Feb. 09, 2013, 12:00 am","['Nine TNA candidates in Muranga have refuted reports that they were heckled during a public debate last weekend. There was no heckling, there was no snatching of the microphone as claimed, said Mwangi on Friday.', 'Led by the outgoing Kiharu MP Muturi Mwangi, who is defending his seat on the Grand National Union ticket, the aspirants accused their TNA opponents of using various tricks to discredit their campaigns.', 'Mwangi said TNA candidates are not happy that they will face opposition from other parties. The debate at Ihura Stadium, in Muranga town was organised by a local vernacular radio station to provide a forum for the candidates to articulate their issues.', 'Mwangi called on the candidates to respect each other and conduct peaceful campaigns without resulting to tricks and malice. He said media should be fair and balanced in reporting the election coverage without favouring any candidate.', 'All what we want is fair play where candidates respect each other and what is reported is fair and balanced without taking sides, he said.', 'Those who are said to have been heckled include Mwangi and Julius Kaberere, who is eyeing the governor seat on Alliance Party of Kenya (APK) ticket.', 'Other candidates vying for posts outside TNA in Muranga County include former Kanu secretary general Joseph Kamotho who secured GNU ticket to run for Senate.', ""Peter Kenneth Kenya National Congress (KNC) has Moses Mwangi for governor, outgoing Muranga mayor Mercy Kimwe for women's representative and Nduati Ngugi for Gatanga parliamentary seat. TNA candidates include Mwangi wa Iria for the governorship and Kembi Gitura for Senate seat "", '\n']"
http://www.the-star.co.ke/news/2013/02/09/kibaki-presides-isiolo-airport-groundmaking-ceremony_c736829,Kibaki presides Isiolo airport groundmaking ceremony,www.the-star.co.ke › National News,"Feb. 09, 2013, 12:00 am",[]
