http://www.the-star.co.ke/news/2017/07/18/nkaissery-always-put-kenya-first_c1598358,Nkaissery always put Kenya first,www.the-star.co.ke › Opinion › Others,"Jul. 18, 2017, 2:00 am","['Immortalised in the annals of English literature is a line from William Shakespeares play, The Tragedy of Julius Caesar, which reads: Cowards die many times before their deaths. The valiant never taste of death but once. A defiant acclaim for those who choose not to cower at the presence of adversity, but instead, decide to face it with courage.', 'In many ways, the late retired Maj-Gen Joseph Kasaine ole Nkaissery epitomised that valiant spirit, that defiance, that indefatigable refusal to cower in the face of difficulty. He personified the singular Kenyan spirit of resilience, valour, hard work and true patriotism.', 'As we gradually come to terms with his demise, I am reminded of the exemplary service he led throughout his career and the immense sacrifices he had to make over time in order to fully devote himself to serving the country, safeguard its people and uphold its integrity.', 'From when he enrolled to serve in the Kenya Army in 1973 to defend our nation against threats from yonder, to when he was elected to Parliament to represent the people of Kajiado Central constituency; and later to heading the Interior Security docket, his was an archetypal leadership that has influenced many.', 'I had the pleasure and the privilege of working with him both when we served together in Parliament, and during my term as President. Throughout that time, I found him an exceptional public servant. He was direct: He did not mince words. He was efficient: He did not waste time or resources. He was a patriot: He loved this country and all its people, which is why he dedicated his life to protecting it, and to keeping Kenyans safe.', 'When he joined the administration as Cabinet Secretary for the Ministry of Interior and Coordination of National Government, we were facing challenges in our nations internal security - mainly from extremist terrorist attacks.', 'At that point, I could not think of anyone better to take leadership of the docket. In itself, it was an immense sacrifice to resign from his role as MP for Kajiado Central, to take on a bigger responsibility for the nation.', 'Naturally, unrestricted by his then political party allegiance, he accepted the job of serving the people of Kenya in my administration, demonstrating his resolve to serve the national interest by putting the country above party politics.', 'The impact of his leadership in the docket was immediate. On his watch, there was better coordination of security operations, leading to reduced attacks, and enhanced prevention of crime.', 'More recently, his insights were critical in the formulation of my plan for strengthening our nations security, which seeks to expand the Integrated Command, Control and Communication Centre to cover other cities and towns outside Nairobi; enhance community participation in security by strengthening the Nyumba Kumi initiative (community participation in policing as he often called it); strengthen the Anti-Terrorism Police Unit by acquiring more specialised vehicles; provide modern equipment and trained officers to expand our border protection capacity; expand the capacity of the Anti-Stock Theft Unit; modernise the National Police Service Air Wing to improve aerial surveillance; build 20,000 houses annually for police officers and prison warders and establish a level 5 National Police Service hospital; and equip the newly completed Forensic Laboratory to enhance science-related criminal investigations. His passion for the safety and security of all Kenyans is evident here.', 'To say that Maj-Gen Nkaissery has left big boots for us to fill is by no measure an overstatement. The onus, I dare say, is on us to emulate him going forward to ensure that we, collectively as a nation, place the country above self-interest and political ambitions to see that we move forward to achieve the dreams that our forerunners set for us many years ago.', ' Let us take a moment to reflect on the life of a man who repeatedly put the countrys interest above self, and choose to emulate that principle for a more prosperous, peaceful and united country.', 'Uhuru Kenyatta is President of the Republic of Kenya and Commander-in-chief of the Defense Forces', '\n']"
http://www.the-star.co.ke/news/2017/07/18/nairobi-gymkhana-fall-to-simba-union-in-npca-league_c1598631,Nairobi Gymkhana fall to Simba Union in NPCA league,www.the-star.co.ke › Sport › Sports Local,"Jul. 18, 2017, 2:00 am","['Nairobi Gymkhanas batting line-up failed to cope with Sikh Unions bowling as they were cleared for 80 runs before succumbing to a 201-runs defeat in the Nairobi Provincial Cricket Association (NPCA) Super League action on Sunday.', 'Chasing 281, the hosts were no match to the visitors with only skipper Karan Kaul and Harsh Patel reaching the double digits with 25 and 13 runs respectively.', 'Pratik Ghallare with 3 for 11 was the outstanding bowler with Sandip Adole and Tarandeep Singh adding on two wickets each.', 'Gurdeep Singh gave Sikh Union the platform for the final total with 81 from 65 balls. He was ably assisted by Abdul Rehman and Paramveer Singh who scored 43 runs each. Martin Okoth was the peak of Gymkhanas bowling with 3 for 48. At Sir Ali, Alfred Luseno gave his side a winning comeback with an impressive display that saw their opponents, Obuya Academy, bowled out to the lowest league record of 49 and eventually handed his side a 147-run win.', 'Luseno made amends on his poor performance on the opening day when he pegged Obuya Academys top order on the back-foot with a fiery display. Maxwell Ager might have started well with the dismissal of the opener in the second over but it was Luseno who scuttled the Obuya Academy batting line up. After Ager had removed Steve Odhiambo (2), Luseno went on to remove David Obuya (6), Amit Inbal (0) and Kennedy Obuya (0) to reduce them to 25 for 4 from what looked like a comfortable position of 25 for 1.', 'Aman Gandhi then chipped in with two middle order wickets to reduce them to 41 for 7 before Zaheed Abbas wrapped up the inning for the lowest score of 49 with two wickets. Luseno ended his spell with 3 for 17 while Ager finished his six overs spell with 2 for 8. Ken Owino, Hamza Malik and Thomas Odoyo all scored 37 as the home team posted 196 runs with eight balls to play. Mujib Ashraf chipped in with 28 runs as Sir Ali shared some crucial partnerships at crucial stages of the match.', 'At Eastleigh High School, hosts Kanbis easily beat Kongonis by six wickets to make it two wins out of two. Chasing 142, the hosts lost four wickets courtesy of Emmanuel Opuras three wickets before winning the match in 19.1 overs.', 'At Nairobi Jafferys, Maurice Ouma scored a century (109) as Swamibapa raced to 331 for 6 before beating Ruaraka by 180 runs. Ouma shared a third wicket stand of 196 runs with Babu Katukala (87) to get them to 273 in 43.2 overs. Oumas knock that included five sixes and seven boundaries came off 102 balls.', 'Mitesh Sangani and Jadavji Bhimji bagged three wickets each as Ruaraka were bowled out for 151 in 38.1 overs.', 'Elsewhere, defending champions Stray Lions beat hosts Cutchi Leva by seven wickets. After losing the toss, Stray Lions restricted the home team to 147 in 34.1 overs with skipper Hiren Varaiya bagging 4 for 20. In reply, Manyala Pranith hit 74 off 40 balls that had 10 fours and four sixes as Stray Lions reached the target in just 13.5 overs. Ashwin Hebbar was also brutal in his batting, hitting three sixes and four sixes on his way to unbeaten 46 off 20 ball']"
http://www.the-star.co.ke/news/2017/07/18/scientist-reveals-how-to-brew-perfect-cup-of-tea_c1599270,Scientist reveals how to brew perfect cup of tea,www.the-star.co.ke › Latest News › Off Beat,"Jul. 18, 2017, 12:00 pm","[""It's the drink that's as British as a Cornish pasty or a Bakewell tart."", 'But many of us are making our daily cup of tea in the wrong way, a scientist has said.', 'Dr Stuart Farrimond, an expert in the science of tea making, shows TV presenter Cherry Healey how to brew the perfect cup of tea on a new series of Inside the Factory on BBC Two, which airs on Tuesday night.', 'And according to Dr Farrimond you have to brew tea for exactly five minutes for a healthier and more delicious beverage, and he also claims the colour of the mug you choose can really make a difference to the taste.', 'As a nation Brits drink more than 165 million cups of tea in a day, and 96 per cent of them are made using a teabag, according to the programme.', ""So it's crucial then to know exactly what to do in order to create the perfect tasting cuppa."", 'Dr Farrimond told Cherry, who hosts Inside the Factory with MasterChef judge Gregg Wallace, that there are four golden rules to follow to ensure you get a perfect cup of tea every time.', 'His first tip is to never drink from a styrofoam cup.', 'He said: ""Styrofoam absorbs the flavour molecules, reducing the tastiness of the tea.""', 'He revealed there is a lot of psychology behind what we choose to drink from, and it can really affect the taste of our beverage.', 'Tea drunk from a red or pink mug will taste sweeter than from a white or blue one, research has shown.', 'Studies have found that saltiness is associated with the colours white and blue, while sweetness is associated with red and pink.', ""Dr Farrimond's next tip is to always use a filter if you live in an area with hard water before boiling the kettle."", 'He said this will prevent the scum that sometimes forms on top of cups of tea from appearing. ', 'He added: ""What happens when you use hard water to make a cup of tea, you sometimes get that scum on the top. ', '""What\'s happening is some of the flavour compounds are reacting with the calcium and they form this scummy layer, so you\'re actually losing flavour, the flavour is being lost in that scum.""', 'Filtering the water first will remove calcium and magnesium residue which will prevent the scummy later from forming. ', 'But the most important rule, according to Dr Farrimond, is to always brew tea for five minutes exactly. ', 'He told Cherry: ""The amount of time we steep our teabag for really makes a difference.\'', 'Cherry was unconvinced, however, and replied: ""Surely the tea will be ruined.""', 'But Dr Farrimond revealed that caffeine and antioxidant levels increase the longer you brew your tea for. ', 'He said: ""Tea is a great source of antioxidants and these are natural substances that our body uses to help fight disease so it is important you leave it to brew.""', 'A cup of tea that was only brewed for 30 seconds only contained 35 milligrams of caffine, compared to a mug brewed for five minutes that contained 50 milligrams, a scientific study revealed.', 'The tea that had been brewed for longer also contained double the antioxidants, the test showed. ', ""When Cherry tastes a cup of tea that has been made according to the four golden rules, and compares it to one of her own making that was only brewed for 30 seconds, she agrees that Dr Farrimond's method works."", 'She said: ""This actually has flavour and tastes delicious. It makes [mine] taste like hot water.', '""This is without doubt the perfect cup of tea.""', 'Every week on Inside the Factory, Cherry and Gregg visit a factory in the UK to find out how a specific type of product is made. ', 'This week, they visited the Typhoo teabag factory in the Wirral.', '\n']"
http://www.the-star.co.ke/news/2017/07/18/kenya-hope-to-bid-for-the-2020-world-u20-show_c1598790,Kenya hope to bid for the 2020 World U20 show,www.the-star.co.ke › Sport › Sports Local,"Jul. 18, 2017, 2:00 am","['After the just concluded IAAF global under-18 championship, Kenya is yet again prepared to host the 2020 World Junior Championships. ', 'Being the final edition of the World Under-18 Championships, the country defied all odds to successfully stage the event at Moi International Sports Centre Kasarani.', 'The Ministry of Sports Principal Secretary Peter Kaberia, said they are keen to bid for either the World 2020 or 2022 Junior Championships. ', 'The legacy left after the championships gives us the power and the energy to meet the world and say we too in Kenya can host the world. I think in the next two to three days, we will be bidding for the 2020 or 2021 World Under-20 Championships.', 'His sentiments were echoed by the World Under-18 Championships Local Organizing Committee (LOC) chairman Mwangi Muthee, who asked IAAF to consider Kenya to host many more global events in future. The success realised in the championships will inspire many people to partner with us in sports. Bring in the World Championships and we will host it without any qualms. Before, we were known to be great athletes and now we have another reputation that Kenya can organise big events. Its important especially when you want to tap the huge resources that happen to be sports business for the future.', 'The youth show attracted over 55,000 fans on the final day of the youth event. The event has opened doors for so many possibilities and I think the maintenance of Kasarani and its upkeep has drawn interests of so many people but the ministry will take full responsibility. Between now and the next 20 years, we will make sure there is a fixed line for its maintenance in order not to lose it to degradation as it has been the case before, said Kaberia. ', 'The Local Organizing Committee for the championships is set to hand over the facility to Chan Cup organizing committee for adequate preparations of next years continental tournament.']"
http://www.the-star.co.ke/news/2017/07/18/corridors-of-power_c1596474,Corridors of Power,www.the-star.co.ke › National News › Corridors of Power,"Jul. 18, 2017, 1:00 am","['With just 20 days to the August 8 General Election, word has it that there is discord within the NASA presidential campaign secretariat. A top campaign strategist is frustrating efforts by teams committed to ensuring flagbearer Raila Odinga (pictured) secures a first round win. It is said the strategist is thwarting people who spend their own money to mobilise and manage issues he is supposed to oversee and this could cost NASA dearly. Corridors has been told the strategist is fighting a very dedicated team working on the Adopt-a-Polling-Station concept, considered to be NASAs winning formula against Jubilee. The strategist is said to even deploy a person believed to be working with an outspoken Mt Kenya governor to head NASAs marketing, which amounts to frustrating the entire campaign team effort.', '===', 'A once-outspoken Mt Kenya Jubilee MP before being trounced in the party primaries is very cautious in what he speaks, lest he offends his former bosses. Word has it that the MP, who is defending his seat as an independent candidate, no longer speaks freely, despite pleading with his staunch Jubilee constituents not to deny him votes for a second term in Parliament when they vote for President Uhuru Kenyatta. Although some Mt Kenya independents blamed Deputy President William Ruto for having a hand in their loss, the MP openly distanced himself from his colleagues, not to spoil his relationship with Jubilee and suffer out in the political cold if he loses and his former bosses retain power. It is said the MP has never believed he was beaten in the nominations and he is confident of a rematch win.', '===', 'A group of ODM aspirants from Homa Bay county were yesterday heard complaining bitterly how NASA presidential candidate Raila Odinga veered off the six-piece debate, when he took his campaigns to the county. The agitated aspirants wanted Raila to pronounce himself on independent candidates they consider are growing horns. They lamented how Railas silence on the matter will give the independents bragging rights they fear the upstarts could capitalise on and hoodwink voters that it was an endorsement just 20 days to the polls. They are now planning to have the opposition chief return to the region without the other NASA principals to denounce independents by preaching the six-piece vote lineup.', '===', 'Are Jubilee leaders plotting to infiltrate NASA by having some opposition MPs who win seats in the August polls on their side if they retain power? UhuRuto operatives are funding some candidates allied to the opposition. It is said Deputy President William Rutos 2022 presidential bid game plan could complicate the situation.', '\n']"
http://www.the-star.co.ke/news/2017/07/18/you-sang-our-worries-away-family-eulogises-total-man-biwott_c1599084,You sang our worries away: Family eulogises Total Man Biwott,www.the-star.co.ke › Latest News,"Jul. 18, 2017, 9:00 am","['Former powerful minister Nicholas Biwott has been eulogised as a noble, wise man who helped many including people he did not know.', ' ', ' ', 'Biwott did not marry the mother of his eldest child, Esther Koimett. He had six children with the other three women.', ' ', 'Hannie remembered her husband as noble and full of wisdom during a requiem mass at AIC Milimani in Nairobi on Tuesday.', ' ', '""My husband was a friend to everybody...I met a French woman and we became friends in a little while. She told me she was troubled and explained this to my husband,"" she narrated.', ' ', 'She said Biwott helped the woman and one of her relatives and that he never took advantage of his opponents.', ' ', '""He was a humble man...Kenya will remember and appreciate him forever...I am thanking God for the privilege of being his wife, a mother and great grandmother...look how proud I am.""', ' ', 'Hannie further said Biwott influenced the family with his high standards and educated his own children and those of his brother.', ' ', ' ', ' ', 'STRONG, COOL-HEADED, NEVER PETTY', ' ', ""Biwott's children said he inspired them and sang their worries away."", ' ', 'Esther said her father was a very fascinating man who was full of wisdom.', ' ', '""I learnt so much from you...you simplified complex issues and found solutions where none seemed to exist.""', ' ', ' ', '""You always maintained objectivity, paid attention to detail and had the ability to stay the course on any issue that mattered,"" she said.', ' ', 'Biwott was also described as a man who remained ""cool-headed"" during adversity and whose generosity and visionary leadership were exemplary.', ' ', '""I will forever remain grateful for your example,"" Esther said.', ' ', 'Kiara said Biwott encouraged him and let nothing pull him down.', ' ', '""I was once anxious about the launch of a project...I remember daddy saying \'Kiara, this is your time to shine. Don\'t let anything or anyone steal your glory\',"" he said.', ' ', '""Like magic, he could calm you down regenerate your spirit and confidence...I will miss you, daddy...""', ' ', '""HE MADE US STRONG""', ' ', 'Rita said her dad told her she was the medicine but noted he was the one who made her strong.', ' ', 'Rhoda said when she was a baby and Biwott a student in Melbourne, he studied with her on his lap.', ' ', '""And 50 years later (two weeks ago) while he was in hospital, we sat together laughing while watching Jemutai live on You tube.""', ' ', 'Gloria said whenever she rang her dad he would answer by singing, setting the mood for conversation.', ' ', '""...and instantly my face would beam. Whenever he suspected I was troubled, he would start singing \'whatever will be will be\'...effortlessly singing my anxiety away.""', ' ', 'Manu said: ""Dad would walk into the office to find me working on my computer and he\'d say ""what is your computer telling you today\'? My dad never understood how people relied so much on computers.""', ' ', 'He added his father was always practical and tagged him along on his trips.', ' ', '""He wanted me to learn the things he did. I enjoyed how he taught me...he would tell me to listen to people he knew were the best,"" he said.', ' ', ' ', 'Maria said it was an honour to have the name of her grandmother.', ' ', '""Thank you for the lunch dates, the love, the mentorship and most importantly, the time. Thank you for the memories.""', ' ', ""Famously known as The Total Man, Biwott served alongside Kenya's first three presidents Jomo Kenyatta, Daniel arap Moi and Mwai Kibaki and with many significant public figures in post-independence Kenya, including Bruce McKenzie and Tom Mboya."", ' ', '\n']"
http://www.the-star.co.ke/news/2017/07/18/five-charged-with-selling-sgr-tickets-without-permission_c1598575,Five charged with selling SGR tickets without permission,www.the-star.co.ke › National News,"Jul. 18, 2017, 1:00 am","['Five people have denied selling SGR tickets without authority from the Kenya Railways Corporation.', 'The accused are said to have been arrested while selling the tickets, which should only be sold by authorised agents or employees of the corporation.', 'There are no authorised agents in the country. Hilder Wanjala, Maureen Gatwiri, Richard Nderitu (pictured, R), Jimmy Muriungi (left) and Jabez Ochieng were charged in a Mombasa court with selling the tickets between June and July. The accused are said to have committed the crime at Mahogany Investment Company in Mtwapa, Kilifi.', 'They allegedly sold the tickets to enable other people to travel using the SGR train without being authorised employees of the KRC. Principal magistrate Edgar Kagoni released the accused on Sh10,000 bail. The case will be heard on July 31.\n']"
http://www.the-star.co.ke/news/2017/07/18/no-tribe-is-fleeing-nakuru-over-chaos-commissioner-says_c1598629,"No tribe is fleeing Nakuru over chaos, commissioner says",www.the-star.co.ke › National News,"Jul. 18, 2017, 1:00 am","['No community is fleeing Nakuru county for fear of electoral violence, Nakuru West deputy county commissioner Elmi Shafi has said.', 'There were reports that some communities were travelling upcountry before the August 8 General Election.', 'Shafi said investigations show that those travelling upcountry are doing so based on personal arrangements, not politics. ', 'He urged Nakuru town residents to have no fear, as their security is guaranteed.', 'Shafi spoke to journalists on Monday after a security forum with police officers.', 'The deputy county commissioner said they are working round the clock to prevent chaos.', 'Nakuru East deputy county commissioner Omari Haji, who was also in the meeting, said any leader caught inciting supporters will not be spared.']"
http://www.the-star.co.ke/news/2017/07/18/vote-for-selfless-leaders-aspirant-tells-residents_c1597109,"Vote for selfless leaders, aspirant tells residents",www.the-star.co.ke › National News,"Jul. 18, 2017, 1:00 am","['Nyeri Senate Jubilee candidate Ephraim Maina (pictured) has urged voters to elect selfless leaders.', '\n', 'Speaking when he met over 2,000 leaders in Karatina, he claimed some politicians only seeking elective seats so as to live lavishly.', '\n', 'Maina urged leaders who would be elected to fight for affordable basic needs such as maize flour and sugar.', '\n']"
http://www.the-star.co.ke/news/2017/07/18/ive-more-votes-than-uhuru-i-will-beat-him-raila-claims_c1598530,"I’ve more votes than Uhuru, I will beat him - Raila claims",www.the-star.co.ke › National News,"Jul. 18, 2017, 1:00 am","['NASA presidential candidate Raila Odinga is confident he has more votes and will beat President Uhuru Kenyatta at the August 8 poll.', ' ', 'Raila said from the current voters register, NASA has realised it hadmore registered voters in its strongholds compared to those of President Kenyattas Jubilee Party.', ' ', 'He said it was the responsibility of their supporters to turn up in large numbers and cast their ballots on Election Day.', ' ', 'Addressing a rally at Kendu Bay Showground when he toured Homa Bay county yesterday, Raila assured his supporters he would win the race. ', ' ', 'Weve compared our numbers in the IEBC register to those of my opponents and discovered that I will outshine him during the election, Raila said.', ' ', 'The leader claimed he would get a landslide victory if NASA supporters came out in large numbers to vote.', ' ', 'I dont want to lose even a single voter to my opponent. We should all turn up and vote, he said.', ' ', 'The adopt-a-polling-station strategy, will ensure all your votes are safe, he added.', ' ', 'The opposition leader promised to lead a peaceful revolution in the leadership of the country when elected president. He said his leadership would transform the Kenyan economy.', ' ', 'Raila accused the Jubilee administration of messing up the countrys economy, describing it as being in an Intensive Care Unit.', ' ', 'He said the economies of countries such as South Korea, Singapore and Malaysia were equal to that of Kenya in 1963, but are now far much better than that of our country.', ' ', 'It is unfortunate that Kenya relies on industrial goods imported from these countries. Kenya has enjoyed 54 years of independence, but cannot manufacture even a needle, he said.', ' ', 'The opposition leader also accused the Jubilee administration of hoodwinking the youth with false promises in a bid to retain the presidency.', ' ', ' Raila was accompanied by NASA presidential campaign teams Gladys Wanga (the county woman rep) and nominated MP Oburu Oginga. ', ' ', ' He steered clear of the contentious debate on six-piece voting during the General Election.', '\n']"
