http://www.the-star.co.ke/news/2017/07/25/princess-diana-documentary-with-william-harry-scores-international_c1603841,"Princess Diana documentary with William, Harry scores international buyers",nan,"Jul. 25, 2017, 12:00 pm","['A host of international broadcasters have bought ""Diana, Our Mother: Her Life and Legacy,"" the documentary that features Princes Harry and William talking about the life of their mother, Princess Diana.', ""The 90-minute program aired Monday evening on ITV in Britain and on HBO in the U.S., a month ahead of the 20th anniversary of Diana's death in a car crash. Sales are being handled by U.K.-based Drive, which has now also sold it to Canadian public broadcaster CBS."", 'In Australia it has gone to free TV network Seven, and Three has picked it up in New Zealand.', 'In Europe, ""Diana, Our Mother"" has been acquired by Norway\'s NRK, Finland\'s YLE, and Denmark\'s TV2. Deals are expected to close soon in Spain, where pubcaster TVE is tipped to buy the show, and other territories including Japan, Italy, Sweden, and Russia.', '""The response from international broadcast partners has been phenomenal,"" said Drive joint managing director Ben Barrett. ""We look forward to announcing more broadcast partners for this landmark film in the weeks ahead.""', '""Diana, Our Mother: Her Life and Her Legacy"" was produced by Oxford Film and Television. ', 'A spate of documentaries and films has been ordered to mark the upcoming anniversary of the princess\' death. Channel 4 in the UK and PBS in the US ordered ""Diana: In Her Own Words"" this week, and the BBC has a one-off drama about the princess, ""Diana and I.""', '\n']"
http://www.the-star.co.ke/news/2017/07/25/investigate-sonko-bodyguard-for-assault-on-three-men-magistrate-orders_c1603335,"Investigate Sonko bodyguard for assault on three men, magistrate orders police",nan,"Jul. 25, 2017, 12:00 am","['A Nairobi court has ordered police to investigate claims by three men that they were assaulted by Nairobi Senator Mike Sonkos bodyguard.', 'Milimani chief magistrate Francis Andayi ordered OCS Capitol Hill police station to conduct investigations into the claims by Felix Kioko, Emanuel Baraza and Benjamin Anuago, who were charged yesterday with maliciously damaging property belonging to the senators lawyer Alphonce Mutinda.', 'Andayi ordered the OCS to table a report in court on Wednesday explaining the action he has taken. He also ordered that he take Anuago for treatment.', 'The three said that during their arrest they were assaulted by the bodyguard.', 'They are accused of destroying a house on July 22 in Upper Hill, Nairobi.', 'They denied the charges and were released on Sh200,000 bond each with alternative Sh70,000 cash bail, pending the hearing of their case on August 16.', '\n']"
http://www.the-star.co.ke/news/2017/07/25/rasanga-political-advisor-escapes-death-by-whisker-after-thugs-raid_c1604191,Rasanga political advisor escapes death by whisker after thugs raid his home,nan,"Jul. 25, 2017, 6:00 pm","[""Governor Cornel Rasanga's political adviser escaped death by a whisker on Monday after he was attacked by unknown persons."", ""A group of unknown people invaded Ochieng' Mawere's home in Kipasi, Bondo and petrol bombed his house and car at around 3am."", 'Mawere, who was woken up by the loud bang, said the thugs locked all houses in the compound before they blew up the petrol bomb.', '""I peeped through the window and saw a huge fire at my packing lot. I tried to open the doors but they were locked from outside.""', 'The county official said he was rescued by neighbours who broke the locked doors before the police arrived at the scene.', '""I suspect the attack was politically instigated. On several occasions, I have received threats to stop campaigning for Rasanga.""', 'Mawere said the gang did not steal anything in the compound apart from hurling petrol bombs.', '""I have reported three threat incidents at Bondo police station,"" Mawere said adding that he expects the police to arrest those behind the attack.', 'Bondo OCPD Paul Kiarie said they have launched an investigation to ascertain who was behind the attack.', '""We have taken some of the samples from the scene for fingerprint identification. In not less than a week, the culprits will be in custody.""', ""This came barely a week after Bungoma governor Kenneth Lusaka's chief campaigner Edward Barasa was shot dead at his Kibingei home."", '\n']"
http://www.the-star.co.ke/news/2017/07/25/iebc-races-against-time-to-put-final-touches-on-poll-plan_c1603268,IEBC races against time to put final touches on poll plan,nan,"Jul. 25, 2017, 12:00 am","['IEBC is racing against time to finish up essential poll preparations that are key for delivering a credible election.', '\n', 'The commission has at least five crucial activities pending in its calendar, which it hopes to accomplish within the remaining 13 days to guarantee a successful poll on August 8.', '\n', 'Top on the list is the ongoing testing of the digital equipment to be used in voter identification and result transmission from polling centres to constituency centres and finally to Bomas of Kenya.', '\n', 'On Sunday, the commision conducted a nationwide test run of all the equipments to gauge their functionality and to ensure they are in perfect condition. Last week, IEBC won a case allowing the use of manual back up in places the system fails to work.', '\n', 'The opposition had demanded that the whole election process from identification to transmission be done electronically. Commissioner Roselyn Akombe yesterday told the Star training election clerks, training political parties agents and final touches are being put on the national tallying centre at Bomas of Kenya remains top on the IEBCs to-do list.', '\n', 'Bomas of Kenya has been cordoned off from the public and access is allowed only to poll officials from July 1 to August 31 when it will be re-opened for public use.', '\n', 'The shutdown is meant to make room for major security preparations to make sure the facility is compatible with the election results transmission format that IEBC will use in transmitting and relaying results.', '\n', 'The commissions communication manager Andrew Limo said journalists will be allowed in today for a site seeing tour of the national tallying centre and for an elaborate explanation on how the results relayed would be accessed.', '\n', 'IEBC chairman Wafula Chebukati, who is the returning officer for presidential election, will declare the winner at the historic venue.', '\n', 'The electoral agency is, at the same time, working round the clock to finalise nationwide voter education and ensure all voting materials to be used in the key exercise arrive in good time at all the 41,000 polling stations.', '\n', 'In addition, IEBC must before the elections resolved pending cases lodged before the Electoral Code of Conduct Enforcement Committee.', '\n', 'The commission is also upbeat it will resolve by Friday this week the over 100 cases it has so far received following the publication of Party nomination Lists. ', '\n', 'IEBC will also have to accredit political parties appointed agents within the remaining days.', '\n']"
http://www.the-star.co.ke/news/2017/07/25/samis-survive-gymkhana-scare-in-npca-supr-league_c1603293,Samis survive Gymkhana scare in NPCA Supr League,nan,"Jul. 25, 2017, 12:00 am","['Swamibapa had to use all the arsenal at their disposal before beating a hard-fighting Nairobi Gymkhana with just two wickets as the 2017 NPCA Super League entered the third round on Sunday.', 'While Swamibapa seemed to struggle in their pursuit for 181 at Nairobi Gymkhana, other venues were raining runs with six centuries being scored across three venues.', 'National team skipper Rakep Patel achieved the top score of the runs-filled day when he cracked 200 as Kanbis demolished Ruaraka by 216 runs at Eastleigh High School. Vinod Rabadia added on to his first day century when he scored an unbeaten 108 in the same in inning.', 'Divendra Poriya was not left out on the centurys list scoring 102 runs as Ruaraka made only 227 in pursuit of Kanbis 443 runs.', 'Collins Obuya was the man of the match as his 124 led defending champions Stray to 180 run victory over Kongonis.', 'The last ton of the day was scored at Sikh Union, where Gurdeep Singhs 102 led the home team to 90 runs win over Sir Ali.', 'Chasing a score of 181, Swamibapa were heavily reliant on Mitesh Sangani (46) and Emmanuel Bundi (38) to earn their third successive victory.', 'Things looked dicey for Swamibapa when they lost Alex Obanda and Maurice Ouma in two balls with the board on 32 and were again reduced to 77 for 4 before Sangani and Bundi got lifted them to 156 with a fifth wicket stand of 79.', 'They again lost three quick wickets for 19 runs to bring tension in the dressing room but the lower order held their nerves to secure the victory with 9.5 overs to play.', 'It was hard fought, Onyango said. I think its really good that weve been in this kind of situation and have come out with a win. I think the more were in those situations the more were going to learn.', 'Sijoray Virajut and Rushabh Patel were the anchors of Gymkhanas final total of 181 with 54 and 56 runs respectively after Swamibapa 30 for 2 and then 74 for 4.', '\n']"
http://www.the-star.co.ke/news/2017/07/25/farmers-get-new-maize-seed-thats-resistant-to-striga-weed_c1602888,Farmers get new maize seed thats resistant to striga weed,nan,"Jul. 25, 2017, 12:00 am","['Researchers have developed a maize seed that is resistant to the harmful striga weed, which has been a big problem to farmers.', '\n', 'Agriculture CS Willy Bett on Friday said the noxious weed has destroyed crops in more than 741,316 acres in Kakamega, Busia, Bungoma, Siaya, Migori, Kisumu, Homa Bay and Vihiga.', '\n', 'Homa Bay is the worst-hit county.', '\n', 'Due to the infestation, farmers have left their land to lay fallow as they feel they are spending more than they are harvesting. Others have resorted to planting crops that are not affected by the striga weed, including beans, cassava and sweet potatoes, Bett said.', '\n', 'Besides the striga weed, Kenya is grappling with the fall armyworm, which has spread to 25 counties.', '\n', 'The maize lethal necrosis disease has also attacked many counties, with symptoms ranging from drying maize plants, Bett said while launching sale of the resistant maize.', '\n', 'African Agricultural Technology Foundation executive director Denis Kyetere said the striga control seed, also known as Imazapyr Resistant Maize, decreases the level of striga on the farm through direct attacks on the striga plants and seeds.', '\n', 'He said striga control methods have not been widely adopted by farmers because of limited knowledge of the striga lifestyle, lack of land for crop rotation and because their benefits come about over the long term.', '\n', 'Herbicide applications are also expensive and ineffective, since the crop is already damaged before striga emerges, Kyetere added.', '\n', 'The striga control seed is being promoted under the trade name StrigAway by AATF. This is done with the support of the Feed the Future Partnering for Innovation programme for Sh332 million.', '\n', 'The technology has been developed by scientists from the Kenya Agricultural and Livestock Research Organisation, International Maize and Wheat Improvement Centre, and Weizmann Institute for Science and BASF chemical company.', '\n', 'Commercialisation of the IR maize seed is key so that farmers from all corners of the region can access it. So far, seven seed companies are producing this innovative seed, commercialisation lead Brenna Mckay said.', '\n', 'We call upon more to come on board to increase access to the smallholder farmer who is the main target.', '\n']"
http://www.the-star.co.ke/news/2017/07/25/lempurkels-nanyuki-case-pushed-tired-lawyers-say-they-didnt-prepare_c1603923,"Lempurkel's Nanyuki case pushed, 'tired' lawyers say they didn't prepare",nan,"Jul. 25, 2017, 3:00 pm","[""Mathew Lempurkel's case on threatening to burn a police station did not proceed on Tuesday after his lawyer sought an adjournment."", 'The case against Lempurkel, who is Laikipia North MP, was to be heard at a Nanyuki court.', 'Amos Chweya, representing senior counsel James Orengo, applied for the adjournment saying they needed time to prepare the defence.', 'Chweya told chief magistrate Lucy Mutai that the MP was arraigned in Kibera on Monday so his lawyers did not have enough time to prepare.', 'Lempurkel appeared in court yesterday over racial contempt following his arrest on Saturday.', 'He was released on Sh300,000 bond or Sh100,000 cash bail in the case that will be heard on Friday.', 'Chweya also said the lawyers were tired as they were involved in preparations for NASA presidential candidate Raila Odinga to debate for the general election.', 'He added Lemurkel needed to seek medical attention.', 'The prosecution objected the application saying the two cases are not related and that he had prepared four witnesses. He added they spent most of Sunday and Monday looking for Lempurkel.', 'Since his arrest on Saturday, the MP was held at Nanyuki, Timau, Naromoru, Ndaragwa, Nyahururu and Oljororok police stations before being taken to KIbera law courts.', 'The legislator has been charged with threatening Nicholus Kipruto as he handled report office duties at Rumuruti police station in Laikipia West sub-county on July 31, 2016.', 'He allegedly threatened to set the station ablaze in a demand for the release of prisoner Dominic Lenyamile. ', 'A court heard that he did so with the aim of breaching peace.', 'The case will be heard on September 7.', '\n']"
http://www.the-star.co.ke/news/2017/07/25/wainaina-aukot-kaluyu-attend-second-tier-presidential-debate_c1603390,"Wainaina, Aukot, Kaluyu attend second tier presidential debate",nan,"Jul. 25, 2017, 12:00 am","['Three presidential candidates yesterday criticised Jubilee and NASA rivals for perpetrating tribalism and corruption and asked voters to reject them on August 8.', ' ', 'The candidates  Ekuru Aukot (Third Way Alliance), independents Japheth Kaluyu and Michael Wainaina  said NASA leader Raila Odinga and JPs Uhuru Kenyatta cannot end corruption, tribalism and the problems facing the nation because they are contributors.', ' ', 'Candidates Cyrus Jirongo (United Democratic Party), Abduba Dida (Alliance for Real Change) and Joseph Nyaga (Independent) snubbed the debate.', ' ', 'Kenya needs a no-nonsense leader. We dont want a Chief Executive Officer of the country who throws his hands in the air and says What should I do? when confronted with accountability questions. We have had a leadership that tolerates bad manners, including tribalism, Aukot said.', ' ', 'He said the country has the best laws and institutions to fight corruption, but lack of political goodwill has impeded the war on graft.', ' ', 'Aukot expressed concern that we sanitise corruption, instead of bringing perpetrators to book.', ' ', 'The candidates agreed that problems facing the country can only be brought to an end by Kenyans by rejecting NASA and Jubilee leaders, who thrive politically on negative ethnicity.', ' ', 'We should get rid of political kingpins in Jubilee and NASA for mobilising people around tribalism. Leadership is inclusion and others look at it as tribalism. I want 70 per cent of the youth and 50 per cent of women to be included in leadership, Wainaina said.', ' ', 'He added that politics of ethnicity, impunity and mediocrity by leaders involved in mega scandals has contributed to Kenyas problems.', ' ', 'Kaluyu said if elected, he would ensure every Kenyan, regardless of their tribe, is equally involved in nation-building.', ' ', 'They highlighted mega plans to bring back the country on the growth path based on their manifestos, which cover education, poverty eradication, health, infrastructure, protection of environment and zero-telerance to corruption.', ' ', 'Corruption started in 1963 when land meant to settle IDPs was stolen by powerful individuals in government, Aukot said.', ' ', 'They promised to revolutionise education by introducing reforms that will ensure public schools offer quality education.', ' ', 'Wainaina promised to modernise and professionalise schools by ensuring teachers are well paid and the public schools improved.', ' ', 'Even if you change the education curriculum frequently and you dont modernise the teaching profession, standards will never improve in this country. The problem is not curriculum, but how we teach, he said.', ' ', 'The trio pledged to conserve wildlife by fighting poaching and protecting parks from landgrabbers.', ' ', 'Aukot said his administration will severely punish landgrabbers who encroachon national parks.', ' ', 'I will invest in maintenance of our parks and fight poaching because the vice has, over the years, gone unpunished in this country, he said.', ' ', 'Wainaina said: If you take care of the people, the people will take care of wildlife.', ' ', 'The said individuals in the Jubilee administration have benefitted from numerous problems facing the country and it does not deserve another five years.', ' ', 'Corruption remains our biggest challenge because the beneficiaries are highly placed in government, Kaluyu said.', '\n']"
http://www.the-star.co.ke/news/2017/07/25/hiv-prevention-ring-trial-a-success-among-us-teens_c1604165,HIV-prevention ring trial a success among US teens,nan,"Jul. 25, 2017, 6:00 pm","['A vaginal ring to prevent HIV infection is popular with teenage girls, US scientists say.', 'Women and girls aged 15-24 account for a fifth of all new HIV infections globally. Nearly 1,000 are infected every day in sub-Saharan Africa.', 'Experts say it frees women from relying on men to wear condoms and allows them to protect themselves confidentially.', 'Dr Anthony Fauci, the director of the US National Institute of Allergy and Infectious Diseases, told the BBC: ""If you can give women the opportunity to protect themselves in a way that is completely confidential - that\'s a long and big step to helping them.', '""In societies where women are, unfortunately but true, somewhat second-class citizens, that makes women extremely vulnerable to getting infected with HIV.""', 'The flexible ring, similar in size to the contraceptive diaphragm, releases an antiretroviral drug called dapivirine for a month.', 'But scientists were unsure it would work in teenagers, who can be notoriously difficult when it comes to health advice.', 'The six-month US trial gave the ring to 96 sexually active girls aged 15 to 17, who had not used it before.', 'Data presented at the IAS Conference on HIV Science, showed:', ""There were some concerns before the trial that the girls' partners would not like the feel of the ring, but it reportedly enhanced pleasure."", 'Prof Sharon Hillier, one of the researchers at the University of Pittsburgh School of Medicine, said: ""HIV doesn\'t distinguish between a 16-year-old and an 18-year-old.', '""Access to safe and effective HIV prevention shouldn\'t either, young women of all ages deserve to be protected.""', 'There are now plans to test the ring with teenagers in Africa.', 'If the ring gets regulatory approval, it would be the first method of prevention exclusively for women.', '\n']"
http://www.the-star.co.ke/news/2017/07/25/tanzanian-charged-after-calling-magufuli-dictator_c1603799,Tanzanian charged after calling Magufuli dictator,nan,"Jul. 25, 2017, 12:00 pm","[' A prominent opposition politician in Tanzania has been charged with using abusive language against President Magufuli after he allegedly called him a dictator and accused him of making government appointments based on favouritism and nepotism.', 'Tundu Lissu of the main opposition Chadema party has been in police custody since Thursday after a video of him purportedly making the comments was widely circulated on social media. ', 'He is due to make a second court appearance on Thursday to press for bail.', 'In court on Monday, the prosecution said Lissu should be refused bail as he has repeatedly made seditious remarks.', 'However, his lawyer denies this, arguing that the allegations against him are unproven. ', 'Magufuli has been increasingly accused by his critics of intolerance since he won elections by a landslide in 2015. ', 'But his supporters say he is tackling corruption, and guaranteeing stability in the East African state. ', '\n']"
http://www.the-star.co.ke/news/2017/07/25/rescue-all-chibok-girls-ensure-they-study-un-urges-nigeria_c1603650,"Rescue all Chibok girls, ensure they study, UN urges Nigeria",nan,"Jul. 25, 2017, 12:00 pm","['A United Nations human rights committee called on the Nigerian government on Monday to step up efforts to rescue all women and girls abducted by Boko Haram and to ensure they return to school without stigma.', 'Roughly 100 of the 270 girls abducted by the militants at their secondary school in Chibok in northeast Nigeria in April 2014 have been released and another 60 have escaped, but about 100 are still believed to be in captivity.', 'Nigeria was one of eight countries whose records were examined by the UN Committee on the Elimination of Discrimination against Women at a three-week session.', 'Nigeria should ""intensify its efforts to rescue all women and girls abducted by Boko Haram insurgents, ensure their rehabilitation and integration into society and provide them and their families with access to psychological and other rehabilitation services,"" said the UN panel of 23 experts.', 'Boko Haram has killed 20,000 people and displaced more than two million during a seven-year insurgency aimed at creating an Islamic caliphate. Although the Chibok girls are the most high-profile case, Boko Haram has kidnapped thousands of adults and children, many of whose cases are neglected, aid groups say.', 'Girls who were abducted by Boko Haram from Chibok and Damasak in Borno State in April and November 2014, ""continue to be subjected to rape, sexual slavery, forced marriage and impregnation by Boko Haram insurgents,"" the panel said.', ""Nigeria's presidency referred a request for comment to the ministry of women's affairs. The ministry was not immediately available for comment. In May, Nigerian officials said that the Chibok girls found last year would be going back to school in September."", '""Of course we commended (Nigeria) for the rescue of 100 of them who are currently, we\'re told, kept in Abuja, going through psycho-social counselling,"" panel member Hilary Gbedemah told Reuters.', 'Many girls in the northeast have dropped out of school due to the insurgency and schools must be secured to protect students, the panel said.', 'Reporting and writing by Stephanie Nebehay; additional reporting by Alexis Akwagyiram in Lagos; Editing by Robin Pomeroy', '\n']"
http://www.the-star.co.ke/news/2017/07/25/chiefs-death-sparks-suspicion-among-baringo-laikipia-security_c1603521,"Chief's death sparks suspicion among Baringo, Laikipia security officials",nan,"Jul. 25, 2017, 9:00 am","['The mysterious death of a chief has raised suspicion among residents and administration officials in Baringo and Laikipia counties.', ""Ng'elecha location chief Grisson Kokoo disappeared last Tuesday and was found a day later in Olmiran range, Laikipia. His body was riddled with bullet wounds."", 'Both counties have been prone to bandit attacks and so-called land invasions that have left tens dead or injured, and hundreds displaced.', 'Area chiefs want the government to stop accusing them for the attacks, saying the State would rather lay them off than harass or arrest them for allegedly protecting bandits.', '""Chiefs are just as innocent like any other peaceful resident, while a criminal who owns illegal guns lives in the bush and plans attacks of his own without involving anybody,"" Yudah Losutan, former Ng\'inyang councillor told the Star on phone on Tuesday.', '""Sometimes chiefs disappear mysteriously and later they are found dead. So we are left wondering if it is the government or the bandits who kill them,"" he said in reference to Kokoo\'s death.', 'Losutan said if a chief fails to deliver his or her duties they can be sacked and replaced instead.', ""He said Kokoo's death has raised fear among residents that bandit attacks are taking a dangerous turn."", ""Reports indicate the chief was called that evening at 6pm by unknown people to record a statement at Ng'elecha police post."", '""We followed up the next day and we found his lifeless body sprayed with bullets in the bush,"" Losutan said.', 'Last Thursday, Paka location chief Moses Dike was reportedly taken to an unknown police station for questioning then released.', 'It is alleged he was arrested following a bandit attack where six police officers and four Tugen herders were killed in Mochogoi at the border of Baringo and Laikipia counties last Wednesday.', 'Baringo county commissioner Peter Okwanyo denied the claims, and issued an arrest order against two other chiefs namely Philip Aremo of Makany-Korosi location and Samson Kala of Amaya location.', 'The commissioner said apart from refusing to record a statement, Aremo and Amaya switched off their phones.', '""This proves further that they have crucial information pertaining to the attacks, so I am ordering police to get them from their hideouts,"" Okwanyo added.', 'But Losutan said more needs to be done as residents are fleeing the volatile area.', '""Instead of beefing up security, the Kenya Defence Forces and police officers are now busy hunting down innocent residents and more so chiefs,"" he said.', '{PHOTOS}Baringo residents welcome KDF, say police operation was futile', '\n']"
