http://www.the-star.co.ke/news/2017/07/15/state-upgrades-garissa-roads-for-sh600-million_c1596983,State upgrades Garissa roads for Sh600 million,www.the-star.co.ke › Local News › North Eastern,"Jul. 15, 2017, 12:00 am","['The state has spent more than Sh600 million to re-carpet major roads in Garissa town.', '\n', 'Kenya Urban Roads Authority acting general manager for special projects Eng. Abdulrashid Mohamed told journalists more than four kilometres of dilapidated roads have been upgraded.', '\n', 'He spoke yesterday in Garissa town.', '\n', 'The sections of the road that have been completed include Biashara Street and Posta, Ngamia, Garissa Ndogo, Sankuri and Deka Buri roads.', '\n', 'Mohamed said the projects are part of the 10,000 kilometres of roads the Jubilee administration promised to re-carpet or construct during its first term in office.', '\n', 'KURA is also undertaking other urban roads projects at a cost of Sh89 million and they are expected to be complete within 18 months, he said.', '\n', 'The official said similar projects are ongoing in Wajir, including a bypass.', '\n', ' Mohamed said, however, that encroachment on road reserves causes problems during construction and leaves no space for pedestrian walk ways within the towns.', '\n', 'I am urging the urban residents to keep off the road reserves for their own benefit. These roads are being improved because of them, he added.', '\n']"
http://www.the-star.co.ke/news/2017/07/15/moi-referral-hospital-to-hire-more-nurses-as-strike-over-cba-bites_c1597558,Moi Referral hospital to hire more nurses as strike over CBA bites,www.the-star.co.ke › Latest News,"Jul. 15, 2017, 6:00 pm","[""The Moi Teaching and Referral Hospital in Eldoret is seeking to hire more nurses as the ongoing nurses' strike continues to bite."", 'CEO of the hospital Dr Wilson Aruasa has advertised 70 vacancies to fill up slots in Job group M9.', 'Successful candidates will be paid about Sh47,000.', 'Applications will close on July 26.', '""The successful candidates will be entitled to applicable allowances in the job group M9,"" said Dr Aruasa.', 'The move comes as more than 800 nurses at the hospital remain out of work.', 'They have been out of work for the last 50 days demanding the implementation of their collective bargaining agreement.', 'The CBA to gives them better pay and allowances.', 'Chairman of the nurses union at the hospital Kennedy Orangi said they have no problem with the hospital hiring more nurses but the CBA demand still stands.', '""We need more nurses to help improve services and they too will benefit from the CBA we are demanding"", Orangi said.', 'Orangi said President Kenyatta and his Deputy William Ruto should stop focusing on their reelection campaigns and intervene to help end the strike. ', '""Patients have suffered for too long and it\'s time the government takes us seriously because we will not resume work without the CBA.', 'The nurses union is accusing the Salaries and Remuneration Commission of delaying the implementation of the CBA.', '\n']"
http://www.the-star.co.ke/news/2017/07/15/corridors-of-power_c1596926,CORRIDORS OF POWER,www.the-star.co.ke › National News,"Jul. 15, 2017, 12:30 am","[""NAIROBI Senator Mike Sonko, who has had a very non-visible campaign, is said to have formed a new team to run his campaign. The team, which consists of number crunchers, policy wonks, and media experts, is working to deliver the governor seat for Sonko. They include political scientist Onchari Oyieyo. On top of the campaign is Erastus Wamugo, a known political operative with a reputation for creativity and discipline. Wamugo has served as an adviser to different senior government officials in President Uhuru Kenyattas administration. The team is working closely with former Vivo Energy boss Polycarp Igathe, Sonko's running mate. Sonko is said to be building an image of having professionals around him."", ' ******', ""TRUST politicians to be smart. In this case, Jubilee Party's team Mbele Iko Sawa (All Clear Ahead) has been touring the country to campaign for President Uhuru Kenyatta. The team comprises politicians as well as civil servants. The team has a way of trolling the opposition. First, it always follows in NASA footsteps. Second, it knows how to use social media to push their agenda. For instance, it has used pictures to demonstrate its strength and popularity countrywide. In areas where people did not turn out in large numbers, they have posted pictures of hyped activities on the podium or close-ups. The team was also expecting funds from JP, but it seems the deal was not honoured."", ' *******', ""NASA is closely monitoring activities in the Jubilee strategy campaigns and they are planning to release a dossier on how Jubilee plans to compromise the next elections. Officials who spoke to Corridors said the dossier touches on the IEBCs independence. Our mole added, We have audio, video and pictures from our private investigators who are working closely with the people in the national security machine. This report is the reason opposition chief Raila Odinga has presented the exact numbers of ghost voters and their names in the voters' register. "", ' *******', ""SOME of the officials at ODM have been fighting hard to be involved in NASA activities. The secretariat officials have been left out in the cold after Raila Odinga focussed on the country's top seat and all activities are centred in NASA. Some have tried to engage Railas new advisers  but in vain."", ' ******', 'CUSTOMERS at a local bank are a worried lot. On Thursday, they were heard complaining that they cannot access their money, leading to a lot of speculation in this campaign period. Some say the bank had a direct interest in politics by sponsoring certain candidates in the August 8 polls.', '\n']"
http://www.the-star.co.ke/news/2017/07/15/focus-on-cholera-kot-tell-dp-ruto-over-running-mates-debate-question_c1597489,"Focus on cholera, KOT tell DP Ruto over running mates' debate question",www.the-star.co.ke › Latest News,"Jul. 15, 2017, 12:00 pm","['Kenyans on Twitter are not amused by a tweet posted by DP William Ruto indicating that he did not know running mates will have a debate.', ' ', ""The running mates' debate between Ruto and NASA co-principal Kalonzo Musyoka is scheduled take place on July 17 at Catholic University of Eastern Africa."", ' ', '""Just seen news alert that there will be a debate of running mates. Is it true?"" Ruto said on his twitter page on Friday.', ' ', 'The post, that attracted 448 retweets and 531 replies by press time, left many Kenyans asking him where he was when the announcement was made.', ' ', '""It\'s clear you guys don\'t live in Kenya or you simply realise debates will not just help you. Things are thick,"" a user identified as Majani Chasia said.', ' ', 'Brian Macheran said: ""We were busy looking for unga in all retailers and yet we are aware.. sasa unajifanya hujui ndio usiende.""', ' ', '""I need you to answer Kenyans what you did with our tax.""', ' ', '""...were you not informed about the debate?"" Peter Kamuyu posed.', ' ', 'Collins Muthama said: ""Why not? Does someone have cold feet? We need politics to be about real issues and not tribal divisions and party affiliations.""', ' ', 'But other users asked Ruto to focus on Cholera outbreak that was reported in his Weston hotel in June.', ' ', 'Cabinet Secretaries Henry Rotich (Treasury) and Adan Mohammed (Industrialisation) are among at least 70 patients admitted in Nairobi hospitals over suspect cholera cases.', ' ', ' ', 'For the Weston case, sick doctors posted laboratory results on social media showing they tested positive for cholera.', ' ', 'They possibly contracted the disease at the hotel where they had been attending a week-long health conference.', ' ', ' ', '""At this rate DP, kindly form a committee to investigate the Cholera outbreak in our country please,"" user Kennedy said.', ' ', 'Waithaka Mugo said: ""There is a kipindupindu outbreak and you are here wondering about a running mate debate?? Lopsided priorities.... #busybodies.""', ' ', '""At this time we can only confirm the issue of running stomachs in GoK corridors,"" Nyarotho said.', ' ', 'Sultan said: ""Hope you will be able to tell Kenyans of the source of this cheeky cholera that targets only the perceived elites in the government.""', ' ', 'Other users told Ruto to ac off with Kalonzo noting that he could outline what he is planning to do for Kenyans.', ' ', '""I will be happy to see you against kalonzo,"" Benjamin Kiplagat said.', ' ', 'Bryan Bett said: ""You will destroy and rebuild Kalonzo in that debate.""', ' ', '""Even if you do tell white lies, you are a good debater and have the power to convince hence i have no doubt you will carry the day big,"" Collins Nalo said.', ' ', ' ', '\n']"
http://www.the-star.co.ke/news/2017/07/15/mburu-and-zakayo-moot-plot-to-retain-the-3000m-crown_c1597160,"Mburu and Zakayo moot plot to retain the 3,000m crown",www.the-star.co.ke › Sport › Sports Local,"Jul. 15, 2017, 12:45 am","['Kenyan duo of Stanley Mburu and Edward Zakayo have vowed to embrace team work to ensure the country retains the 3000m title when the IAAF World Under-18 Championships come to a close at the Moi Stadium, Kasarani tomorrow.', 'Mburu qualified for the final after placing second in Heat One in a time of 7:59.54 behind Ethiopias Selemon Barega (7:55.54).', 'Zakayo timed 8:04.85 to win Heat Two in a gun-to-tape performance in Wednesdays action and head into the final as clear favourites.', 'Mburu, Form Four student at Rasheri High School in Nyandarua, said: We ran shoulder-to-shoulder with Barega and realised that we had opened a gap. I then decided to slow down because I still have a final to run..', 'What I wanted was to test endurance and gauge sprint finish. It is a little bit tough but I think with clear planning and good strategy, we will top the podium, he added.', 'The 18-year old boy is drawing inspiration from the two-time World Cross Country champion Geoffrey Kamworor.', ' Kamworor is my role model. I like his running style because he is good at mind games and knows how to plan his game well. I want to emulate him, Mburu added.', 'Zakayo, a Form One student at Kapsait High School, said he will be cautious in the final, having been stepped on thrice while competing in Heat 2.', 'The guy from Ethiopia kept stepping on me despite continuously warning him to watch his steps. The Heats opened our eyes for the final which will require a well planned game-plan if we are to secure both medals (gold and silver), Zakayo said.', 'Richard Kimunyan and Davis Kiplangat earned Kenya gold and silver in the previous championships in Cali, Colombia.', '\n']"
http://www.the-star.co.ke/news/2017/07/15/zimbabwes-first-lady-injures-ankle-in-freak-car-accident_c1597541,"Zimbabwe's first lady injures ankle in ""freak"" car accident",www.the-star.co.ke › Latest News,"Jul. 15, 2017, 3:00 pm","["" Zimbabwean President Robert Mugabe's wife Grace was injured in what officials called a freak accident as she left the airport with her husband on Saturday following their return from Singapore, state television reported. "", 'Mugabe had gone to Singapore on July 7 for a medical check, his third such trip this year and was accompanied by his wife. ', 'State television ZBC quoted Mugabe\'s spokesman George Charamba saying that the veteran leader\'s wife ""suffered some soft tissue bruising on the right ankle as a result of a freak car incident at the Harare International Airport soon after arrival"" from Singapore. ', '""The accident occurred as the First Family was about to leave the airport for the residence,"" ZBC reported on its website, without giving details of what happened. ', 'Grace Mugabe was taken to a local hospital where she was treated for the bruises and discharged. ', 'The report did not say whether Grace was travelling in the same car with Mugabe although the two usually use the same presidential limousine when travelling together. ', 'Charamba could not be reached for comment when contacted by Reuters. ', '""At the time of her discharge, she complained of pain from the hurt ankle,"" ZBC said, adding that Mugabe, his daughter and son-in-law, accompanied Grace to the hospital. ', '\n']"
http://www.the-star.co.ke/news/2017/07/15/maawy-stable-after-al-shabaab-attack-outlines-lapsset-spatial-plans_c1597157,"Maawy stable after al Shabaab attack, outlines Lapsset spatial plans",www.the-star.co.ke › National News,"Jul. 15, 2017, 12:30 am","['Public Works PS Mariam El-Maawy is in stable condition after she successfully underwent an operation at the Nairobi Hospital yesterday.', ' ', 'Maawy was flown to Nairobi on Thursday evening after she was rescued by the Kenya Defence Forces when al Shaabab militants briefly abducted her.', ' ', 'Yesterday, Interior PS Karanja Kibicho said his colleague was doing well.', ' ', 'She is stable and responding well to treatment, Kibicho told the Star.', ' ', 'On Thursday, the PS had a fruitful engagement with players on the multi billion-shilling Lapsset flagship project, going on in Lamu, before the attack by al Shabaab.', ' ', 'Maawy, who was in a jovial mood, thanked participants for attending the meeting. She said it was crucial in the development of the county, and asked them to be ambassadors of the project.', ' ', 'In her speech, the PS outlined key government initiatives in line with Lapsset. The project is beginning to take shape and is expected to begin operations once the first berths are complete next year.', ' ', 'Maawy said the counties are beginning to embrace the transformation dream by coming up with spatial plans with key components of Lapsset. They include resort cities, roads and industrial parks.', ' ', 'The Lamu spatial plan was launched on July 12 in Mkunguni Square at a function attended by the PS.', ' ', 'Speaking to journalists during the public participation meeting called by Lapsset on Thursday, she said investors are keen on investing in Lamu because of the development.', ' ', 'Maawy told them to make good use of their land and not sell it cheaply as its value is rising each day.', ' ', 'The area earmarked for industrial development in Lamu county alone covers a stretch of 700 square kilometres.', ' ', 'Maawy also showed the public some of the projects being implemented by the national government, as reflected in the Presidential delivery unit reports.', ' ', 'They include the tarmacking of the 135-km Garsen Witu Lamu road at a cost of Sh10 billion. The PS said tarmacking will begin soon.', ' ', 'Other key projects are, improvement to bitumen standard of Sh11 billion Mokowe township roads and upgrading of health facilities.', ' ', 'She said Lapsset is bigger than the SGR, and once complete will enable Lamu to compete with Dubai, Amsterdam and Singapore.', ' ', 'A port town never stops growing, Lapsset holds the future of the Lamu people. They shall get jobs, she said.', ' ', 'The ships that will dock at Lamu port will be bigger than those in Mombasa.', '\n']"
http://www.the-star.co.ke/news/2017/07/15/is-nasa-plotting-to-postpone-the-august-8-polls_c1595642,Is NASA plotting to postpone the August 8 polls?,www.the-star.co.ke › Siasa,"Jul. 15, 2017, 12:00 am","['I have listened carefully to the different narratives attributed to Jubilee and NASA on whether the IEBC is prepared to conduct the August 8 polls.', 'NASA wants Kenyans to believe that the electoral commission is ill-prepared. But the opposition has filed many court cases, creating a lot of hurdles for the IEBC to adequately prepare for the election.', 'On Wednesday, NASA flagbearer Raila Odinga said there is increased mobilisation of the military forces in favour of President Kenyattas Jubilee. ', 'He raised similar claims a month ago, where he alleged that the government was recruiting and training some members of the military and police to work as Jubilee agents. This is purely built on speculation. No tangible evidence has been adduced. ', 'The other move regards the queries on the credibility of the the audit of the national voter register, which was carried out by the internationally accredited and renowned audit firm KPMG.', 'If NASA has its way, then it means the August 8 election will likely be postponed. The date of the election is factored in the Constitution, and can only be altered through a constitutional amendment. This leads to the question, are the concerns raised by NASA so weighty to warrant this constitutional amendment? ', 'The leadership of Jubilee wants the election on August 8 because they strongly believe in the Constitution and the rule of law.', 'For me, NASAs stand is bound to raise queries. First, most of their claims are propaganda and meant to mislead and incite Kenyans. When they say members of the disciplined forces are being recruited to man the election and fail to prove the claims, such a message is designed to trigger violence. In the countdown to the 2007 polls, the NASA flagbearer read the same script about use of AP officers. I dont need to revisit what happened thereafter.', 'A friend of mine told me a few days ago that Raila has sensed defeat. This explains why NASA is coming up with all manner of excuses that do not really add up. A time has come for security agencies to deal with politicians beating the drums of war. This is the only way to avert a repeat of the 2007 chaos.', 'He further noted, Raila wants the election to be postponed so that he can force President Uhuru to accommodate him in a caretaker or interim government.', 'My response was simple and clear. If this is the card Raila and his brigade are playing, it is doomed to fail because if the election is postponed, the incumbent government will continue to govern until the polls are held.', 'For the sake of argument, let us assume the election is postponed. For NASA, it will be a big shame if it still ends up losing. ', 'For me, the concerns NASA has raised are not strong enough to warrant the postponement of the election. These are issues that can be sorted out if formally brought to the attention of the electoral commission.', 'The IEBC has always demonstrated readiness to listen to them. It has invited the NASA principals to a number of meetings and gave an opportunity to present their grievances.', 'Notably, NASA, which then operated under the banner of Cord, played a vital role in recruiting, vetting and appointment of the new IEBC commissioners. This process would be preceded by the mass action they organised to push for the hounding out of the Issack Hassan-led commission from office. Again, Raila and his brigade didnt bother to substantiate their allegations that the Hassan team manipulated the results of the 2013 polls in favour of UhuRuto.', 'It is worth recalling that Raila lost his petition when they took the matter to the Supreme Court. The highest court in the land upheld Jubilees victory. Notably, Raila had played a key role in forming the Hassan team as the Prime Minister. Does this mean he will only support and trust a team that declares him President?', 'Ours is a participatory democracy where power comes from the people. ', 'Therefore, he should refocus his energy on seeking the mandate of the people. The days when leaders would use short cuts to power and force a Nusu Mkate government are long gone.', '\n']"
http://www.the-star.co.ke/news/2017/07/15/my-bold-manifesto-stunned-you-unveil-yours-mutua-tells-ndeti_c1596944,"My bold manifesto stunned you, unveil yours, Mutua tells Ndeti",www.the-star.co.ke › Local News › North Eastern,"Jul. 15, 2017, 12:00 am","['Machakos Governor Alfred Mutua has warned politicians against inciting their supporters to violence.', 'He said Kenyans must refuse to be used as agents of violence by politicians as happened in the 2007 general election.', 'We want peace during and after the election, Mutua said.', 'He spoke during campaign rallies in Masinga subcounty. Mutua said he is rooting for peace in Machakos.', 'He campaigned in Kangonde, Kikuumini, Kaewa, Kivuthi, Kivaa and Masinga towns.', 'The Maendeleo Chap Chap party leader accused Wiper governor candidate Wavinya Ndeti of engaging in empty rhetorics.', 'He said she lacks a development agenda. ', 'She has said my manifesto is ambitious yet she has not unveiled hers. Wavinya has no agenda for the people of Machakos, Mutua said.', 'Mutua said she ... was just stunned by its [his manifestos] contents.', 'campaign blitz', 'He told his opponents to brace for a resounding defeat on August 8.', 'Mutua has been on a weeklong campaign blitz. He urged voters to reelect him for another term.', 'In Mwala, Mutua launched Sh40 million interest-free banking for women. Mutua said each of the 40 wards will receive Sh1 million for small-scale traders. My government is committed to ensuring that small-scale traders are propped up to earn a living. I have also ordered an immediate halt to levies imposed on small traders, he said.', 'Mutua was accompanied by his wife Lilian Nganga. ', 'He said his manifesto is people-driven.', 'It is a manifesto of the present and the future. It is positive and optimistic, Mutua said. ', 'He also campaigned in Makutano ma Mwala, Mbiuni and Kathama towns.', 'Mutua said of Ndeti, She is just a project of forces out to derail my desire to offer transformative leadership. ', 'He asked Ndeti to make public her manifesto if she is up to the task.', 'He urged voters to elect his MCC party candidates so he will have a team to work with. Mutua said his party had emerged among the top three in the political arena.', '\n']"
http://www.the-star.co.ke/news/2017/07/15/pope-francis-tacks-no-whining-sign-on-his-apartment-door_c1597335,"Pope Francis tacks ""No Whining"" sign on his apartment door",www.the-star.co.ke › Latest News,"Jul. 15, 2017, 9:00 am","[' If anyone had any doubts how Pope Francis feels about people who always complain, the answer is now tacked to the door of his frugal suite in a Vatican residence: ""No Whining"".', 'Under the explicit warning, the red-and-white Italian language sign goes on to say that ""violators are subject to a syndrome of always feeling like a victim and the consequent reduction of your sense of humour and capacity to solve problems"".', ""A picture of the sign was posted on the Vatican Insider website and its presence on the pope's door confirmed to Reuters by its editor-in-chief Andrea Tornielli, an author who is close to Francis and has interviewed him several times."", ""The sign is adorned with the international symbol for 'no' - a backslash in a circle."", 'It adds: ""The penalty is doubled if the violation take place in the presence of children. To get the best out of yourself, concentrate on your potential and not on your limitations.""', 'Then the closing zinger: ""Stop complaining and take steps to improve your life"".', 'The sign was given to the pope recently by Italian psychologist and self-help author Salvo Noe. Francis promised Noe he would put it up in his office for a laugh.', 'Francis has had no shortage of complainers in the Vatican and in the Church since his election in 2013. He has tried to steer the 1.2 billion-member Church on a more inclusive and merciful path, angering conservatives who say he his sowing doctrinal confusion.', 'One recent episode involved German Cardinal Gerhard Mueller, a German whom thepope removed last month from his post as Vatican doctrinal chief at the end of a five-year term.', 'Mueller, who disagrees with the pope on a number of issues, apparently expected his mandate to be renewed automatically.', 'Mueller later told a German newspaper that the way he was treated was ""unacceptable"". ', '\n']"
