http://www.the-star.co.ke/news/2017/07/04/focus-turns-to-mugs-mug-after-two-action-packed-weekends_c1590353,Focus turns to Mugs Mug after two action packed weekends,www.the-star.co.ke › Sport › Sports Local,"Jul. 04, 2017, 9:00 am","['After two weekends of action-packed polo came at the Nairobi Polo Club, players and ponies now turn their attention to prestigious Mugs Mug Cup.', 'The two circuits of 2017 Kenya Polo Association tournaments were successful but also had minor mishaps. Handicap -2 Mina Stienblad who was turning out for Samurai fell off her pony on Friday and sustained minor injuries on her shoulder. She, however, returned to action on Sunday.', 'On the first weekend (June 23-25), handicap 2.5 Martin Waiganjo too, fell off his horse and despite landing on his head, he escaped unhurt and continued to play in the tournament. We have had a successful two weeks of magnificent polo action. It concluded well and we are grateful, said Nairobi Polo Club chairman Philip Arungah.', 'The club will now have low activities on the pitch as they host the Kenya International high goal tournament set for September 15 to 17 and 22 to 24 respectively. High handicapped players will fly in from South America, Europe and South Africa to beef up teams like its been the tradition.', 'Focus now shifts to Mugs Mug Cup set for July 20 and 23 at the Manyatta Polo Club in Gilgil. Players have slightly over two weeks to prepare for this top calibre extravaganza.', 'Meanwhile, Samsung S7 weathered all odds to claim The Overseas Motor Trade Bowl at the Nairobi Polo Club at the weekend, beating Sandstorm 8-4.5 in the finals. Faraji ran away with the Welby Cup after clubbing Sapphire Salute 4-2 in the subsidiary category, while Samurai clipped Ultimate Security in a high scoring match 12-11.', 'Stutti was voted the most valuable player of the tournament and was awarded the Boots and All Trophy, donated by former Kenyan international weight-lifter the late Rolf Schmidt. He was so instrumental in Samsung S7s victory with a hat trick to his name. The best playing pony award went to Kimoi Moi-owned 10 year-old stallion Amore Moi.']"
http://www.the-star.co.ke/news/2017/07/04/weekly-outlook-at-the-nse_c1590277,Weekly outlook at the NSE,www.the-star.co.ke › Business › Local,"Jul. 04, 2017, 7:00 am","['The big Bbreaking story this morning which was that the Abraaj Group has agreed to buy Java House from Emerging Capital Partners ECP bought 90 per cent of Java House in May 2012, with Ashley retaining the remaining 10 per cent. They have grown the company from 13 Nairobi outlets in early 2012 to 60 across Kenya, Uganda and Rwanda. Ashish Patel, the head of Abraajs east Africa office, said the group was likely to hold Java for about five years and during that time would like to grow it to several multiples of its current size.', ""We have geographical opportunities, we have different themed opportunities, he said. The Kenyan market is not just about coffee.'' "", 'The Abraaj Group says Java House Serves 320,000 guest per month. ', 'The price was not disclosed but is expected to be around $100m. A listing at the NSE must be part of the Abraaj Plan. ', ""SA's Global Credit Ratings has withdrawn the national scale ratings assigned to Nakumatt Holdings. "", 'Thika Road Mall (TRM), attached large amounts of the supermarkets goods and equipment seeking to recover Sh51 million in rent arrears.', 'Its fair to say we have a perfect storm happening in Kenya, with elections, a credit crunch, @Nakumatt  the Wall Street Journal quoted a Patel. ', 'Barclays Bank announced the shuttering of seven branches. ', 'Safaricom has appointed Kenya Commercial Bank Group as a trust account holder for its mobile financial service M-Pesa.', 'The Nairobi All Share closed 0.29 points lower at Sh152.63. After running up to a 23 month high, the All Share has posted a four session losing streak. The Nairobi NSE20 Index closed 23.77 points lower at 3583.41.', 'Equity Turnover was lackadaisical at 394.793 million.', 'Williamson Tea reported full year earnings where it reported a full year loss after tax of Sh261.59 million compared to a full year profit of Sh482.74 million the previous year. Williamson Tea said this in their commentary:', ""''Prices have been generally weak through the year but as very high crops were followed by low crops, prices increased in the final quarter of the year.''"", 'Williamson trades at an egregious discount to its net asset value. Williamson Tea rowed back 5.26 per cent to close at Sh183.00 on 28,500 shares traded. ', 'Safaricom was the most actively traded share at the Exchange and firmed 1.1 per cent to close at Sh23.00 and traded 8.144m shares. Safaricom is solidly underpinned at 20.10 per cent and will proceed towards Sh28.00, in my opinion. ', 'WPP-ScanGroup eased 1.23 per cent to close at 20.00 and traded good volume of 1.699 million shares. ScanGroup is 6.66 per cent over five sessions and on meaningful volumes. ', ""Uchumi firmed +2.32% to close at 2.20 and was trading limit up 9.30 per cent and at Sh2.35 at the finish Line. The news emanating out of Nakumatt surely was the catalyst for today's good volume of 1.275 million shares higher. Kenya Airways rebounded +2.97 per cent to close at Sh5.20."", 'Co-operative Bank corrected 12.83 per cent lower to close at Sh14.85 and after the bonus share issue closed last Friday, and traded 1.34 million shares. KCB Group closed unchanged at Sh37.75 and traded 796,800 shares with better offers by a Factor of four to one. Barclays Bank eased 1.01 per cent on light volume to close at Sh9.85. Barclays Bank is +8.24 per cent in 2017. ', 'Albert Mugo, MD KenGen, said since 2012, over 500 innovation ideas have been submitted through the G2G Innovation Seminar with 98 undergoing implementation, This has resulted in revenue generation and cost savings amounting to over Ksh1 billion in the last financial year. KenGen rebounded +2.51 per cent to close a 8.15 and traded 614,500 shares. Kenyan has posted a blistering first half return of 40.51 per cent. ', 'Bamburi Cement turned 1.61 per cent higher to close at Sh189.00 and traded 142,500 shares. Bamburi Cement is 18.12 per cent in 2017. ']"
http://www.the-star.co.ke/news/2017/07/04/kenya-israel-partner-to-protect-forests_c1589894,"Kenya, Israel partner to protect forests",www.the-star.co.ke › National News,"Jul. 04, 2017, 6:00 am","['The Environment ministry has signed an MoU with the Jewish National Fund to share knowledge and expertise on planting forests in dry climates.', 'Speaking in Jerusalem last week during the signing ceremony, Environment CS Judi Wakhungu said Kenya will borrow technology from Israel.', 'This, she said, will improve soil conservation, capture rain runoff, monitor precipitation, create forest land guidelines, and engage the public in forest conservation. ', 'Drylands are home to 2.5 billion people ... and cover 40 per cent of the worlds land surface. They are also home to the most disenfranchised and marginalised people in the world, she said. ', 'The government is struggling to increase forest cover. It has made a commitment to restore 5.1 million hectares of forests.\n']"
http://www.the-star.co.ke/news/2017/07/04/uhuru-to-ride-on-water-projects-to-woo-machakos-to-reelect-him_c1589895,Uhuru to ride on water projects to woo Machakos to reelect him,www.the-star.co.ke › Local News › North Eastern,"Jul. 04, 2017, 9:00 am","['Water, roads and provision of free maternity will be among the highlights of the Presidents visit to Machakos county today. ', 'President Uhuru Kenyatta was scheduled to visit the county on Sunday but the visit was postponed to today, county commissioner Matilda Waswa said.', 'A Presidential advance team inspected various water projects in Matungulu and Yatta constituencies on Friday, ahead of the Presidents visit.', 'Uhuru is also expected to inspect the ongoing construction of the Konza-Kangundo road.', 'Some residents told the Star yesterday that the implementation of key projects such as the Yatta Canal and the Ngalalya water project in Matungulu by the national government improved their lives.', 'The Ngalalya project is expected to serve 28,000 residents across Matungulu and Kangundo constituencies once the piping is done, project coordinator Faith Muindi said.', 'Residents used to walk more than 5km to fetch water before the project was initiated, she added.', 'Muindi urged the government to give more water pipes for the distribution of the commodity.', 'We need more pipes, about 25,000 pipes, to connect the water to the homesteads because we now have the main line, she said.', 'Although water is largely a devolved function, Uhuru, in 2015, supplemented the county water budget with Sh1.5 billion to go towards the distribution of water.', 'The national government has also financed the rehabilitation of the 58km Yatta Canal at a cost of Sh2.5 billion. It is complete and stretches from the Thika River across the Yatta plateau to the River Mwita-Syano, which flows into Kitui county.', ' It is expected to serve more than 500,000 people, mostly farmers who will use it for irrigation.', 'Last year, a local farmer established a flower farm worth Sh2 billion near the canal. The farmer has already hired 400 workers, thus creating employment for residents.', 'In his tour today, the President will first address residents of Ekalakala and Matuu towns in Masinga and Yatta constituencies, respectively, before flying to Kangundo DEB Primary School for another rally.', 'He will later proceed to Kenol to inaugurate the KenolNgoleni road in Kathiani constituency, then proceed to Machakos town for a major rally at Kenyatta Stadium.']"
http://www.the-star.co.ke/news/2017/07/04/baringo-poor-call-for-food-help-amid-rising-hunger-thousands-helpless_c1589997,Baringo poor call for food help amid rising hunger — thousands helpless,www.the-star.co.ke › National News,"Jul. 04, 2017, 7:00 am","['Baringo residents have pleaded for relief food as the drought persists. They have requested the government to help as thousands starve. The residents yesterday said the problem might worsen if no action is taken. The worst-hit areas include Yatya, Chemoe, Kapau, Gulal, Chesawach, Akoret, Ameyan, Katikit, Natan, Riongo, Mogotio and Naudo. People, especially the elderly, children and women, are helpless. Many of them have been left alone at home as other family members look for water and pasture, Mary Chemulo, a mother of seven from Mogotio, said, adding that all rivers have dried up.']"
http://www.the-star.co.ke/news/2017/07/04/father-seeks-answers-from-state-as-son-is-abducted-in-mombasa_c1590352,Father seeks answers from state as son is abducted in Mombasa,www.the-star.co.ke › Latest News,"Jul. 04, 2017, 6:00 pm","['A father is looking for his 35-year-old son who\nwent missing on Saturday as witnesses claim he was grabbed from his\nworkplace by unknown men who were waiting in a car. ', 'Rashid Tewa told the Star his son, Faraj, who\nworks as an attendant at a petrol station in Barsheba, Mombasa, could have been\nkidnapped by state agencies.', ' ', 'The watchman at the petrol station said he saw\nmany men in two cars, a Pajero and a Probox, parked along the road opposite the\npetrol station where my son works, Tewa told journalists from Haki Africa offices on Monday.', ' ', 'He said the watchman then saw men coming out of\nthe Toyota Probox, grabbed Faraj, dumped him in the car and sped off, while\nother men who were standing just outside the Pajero with rifles in their hands\nwatched.', ' ', 'The incident happened at around 6.30pm on Saturday.\n', ' ', 'Faraj is married with two children and the couple is expecting their third child.', ' ', 'Tewa said they reported the matter at Nyali police\nstation.', ' ', 'We have looked for him in all the police stations,\nhospitals and mortuaries in Mombasa but we have not found him.', ' ', 'The state is responsible for the safety of all\ncitizens. They should tell us how this has happened and where they are with the\ninvestigation, said Tewa.', ' ', 'Haki Africa program officer Francis Auma said they\nwill assist the police in the investigations.', ' ', 'This matter had subsided but we feel it is coming\nup again. Kisauni is most notorious, said Auma.', ' ', 'Last year, Haki Africa released a report indicated\nthey had recorded 84 killings and disappearances at Coast over the previous two\nyears.', ' ', 'We do not know who did this but the incident has\nall the hall marks of a state agency, said Auma.', ' ', 'Auma said they will move to court for an habeas\ncorpus.', ' ', 'The human rights defender said politics has\ndistracted the attention of most Kenyans but we will not lose focus of our\nwork in defending human rights.', ' ', 'Police are yet to comment on the matter after\nseveral calls to the police bosses in Mombasa went unanswered.', ' ', '\n']"
http://www.the-star.co.ke/news/2017/07/04/be-transparent-in-your-work-to-avoid-suspicion-bishop-korir-urges-iebc_c1590184,"Be transparent in your work to avoid suspicion, Bishop Korir urges IEBC",www.the-star.co.ke › National News,"Jul. 04, 2017, 6:00 am","['An Eldoret cleric has urged the IEBC to be transparent in its work to avoid arousing suspicion among Kenyans ahead of next months polls.', 'Eldoret Catholic Diocese bishop Cornelius Korir asked the IEBC to build confidence among electoral stakeholders to assure Kenyans of free and fair polls.', 'He said if the IEBC had provided the necessary information on the tender for printing ballot papers, it would have avoided the current lawsuit.', 'Korir warned that suspicions may lead to rejection of results and plunge the country into electoral chaos similar to 2007-08.', 'He spoke at the Sacred Heart Catholic Church in Iten, Elgeyo Marakwet, on Sunday. Korir called on Kenyans to maintain peace during the electioneering.', 'We are urging Kenyans not to be swayed by political euphoria, but ensure they maintain peace and judge politicians based on their manifestos, he said.', ' We as Christians should be role models in the promotion of peace and cohesiveness in the country by avoiding being lured into animosity.', 'Korir (pictured) urged Christians to avoid being enticed with handouts from politicians to influence their voting, saying they should not compromise their convictions at the altar of money. ', 'He expressed concern that politicians are dishing out money to buy votes, instead of providing food for starving residents.', 'I urge Kenyans to look at the bigger picture. We want politicians dishing out money to use the cash to buy food to starving Kenyans. ', '\n']"
http://www.the-star.co.ke/news/2017/07/04/be-objective-report-truth-journalists-told_c1590017,"Be objective, report truth, journalists told",www.the-star.co.ke › National News,"Jul. 04, 2017, 6:00 am","['The media should stop fuelling political conflicts in the counties and instead report facts objectively, the IEBC has said.', 'Siaya returning officer Ruth Kalundu said journalists must report facts.', 'It appears there is a well-coordinated and spirited move by sections of the media to depict ongoing campaigns in a bad light and we will not endure this, she told journalists after meeting Siaya politicians at the IEBC office.', 'Kalundu said most stories about the Siaya chaos seemed to incite ODM candidates against independents.', 'We cannot allow this anymore. The media must advance the truth and explain the facts as they are to propagate the democracy and pragmatism the IEBC stands for, she said.', 'When Kenya burns, everyone in the country will be consumed, Kalundu said.', 'The IEBC has partnered with the police to arrest inciters.', 'Siaya county commissioner Josephine Onunga urged the media to be responsible and objective in reporting.', '\n']"
http://www.the-star.co.ke/news/2017/07/04/mburugu-wins-5th-edition-of-cba-group-series-at-royal_c1590242,Mburugu wins 5th edition of CBA Group series at Royal,www.the-star.co.ke › Sport › Sports Local,"Jul. 04, 2017, 9:00 am","['Playing off handicap 28, Royal Nairobi Golf Club lady golfer Catherine Mburugu shot an impressive 41 stableford points to emerge the winner of the Commercial Bank of Africa sponsored golf tournament at the par 72 course.', 'Catherine Mburugu sunk 22 point in the front nine and followed it with a sure 18 points in the back nine to wrap up a day of good outing at the oldest golf club in the country. Shaukatali Gulam Hussein was second and took the mens winners position after carding 20 points in the first nine and 20 in the second for a total of 40 points. The handicap 23 was elated after the win and assured his fans that he will be back to take the pole position. The mens runner up position went to handicap 18, David Mugun, who shot a total of 40 point but was runner up on count back. The home golfer was in good shape considering his handicap and the high score he shot.', 'The lady winner position was picked by Jessica Kang playing of handicap 22 with a good 36 points of 14 in the front nine and 22 in the back nine. ', 'Women runner up position was Nancy Karimi with a fine 35 points of 19 and 16. The guest winners position was picked by Mbuvi Ngunze of Karen with a score of 30 stableford points. Peter Kiguru from Sigona Golf Club was the staff winners position after carding 30 points. The CBA golf series has been going on and features some of the top amateurs in every club the tournament is held.']"
http://www.the-star.co.ke/news/2017/07/04/help-uphold-the-dignity-of-transgender-people-lawyer-rachier-urges_c1590231,"Help uphold the dignity of transgender people, lawyer Rachier urges judges",www.the-star.co.ke › National News,"Jul. 04, 2017, 6:00 am","['Judges have been urged to assist in upholding the dignity of transgender and intersex persons. Lawyer Ambrose Rachier yesterday told the judges they should start interpreting the laws about people whose gender cannot be defined. He spoke during a judges conference in Mombasa. Rachier highlighted a case in which a transgender was sexually assaulted by fellow prisoners after he was detained at a male prison. The victim, identified as Muasya, had both male and female organs, but considered herself more female than male. Rachier said the law has not protected the third gender and such people have ended up being discriminated against and stigmatised. Even in the airports or hotels, we are asked: Are you female or male? Where do we leave people with two genitalia or who have an inner female, but their looks betray them as male, he said.']"
http://www.the-star.co.ke/news/2017/07/04/kitale-pupil-14-arrested-for-killing-schoolmate-after-quarrel_c1590642,"Kitale pupil, 14, arrested for killing schoolmate after quarrel",www.the-star.co.ke › Latest News,"Jul. 04, 2017, 9:00 am","['A 14-year-old pupil was arrested in Kitale town on Monday for allegedly killing a schoolmate by hitting him on the head with a blunt object.', 'Attacker Sammy Sikinga and victim Musa Achi studied at Kimeloi Primary & Secondary School in Kesogon.', 'Trans Nzoia West OCPD Jackson Mwenga said Sikinga was a class eight pupil and Achi a form two student.', 'The pupil is said to have struck Achi, 15, on the head following a quarrel, causing him to lose consciousness.', 'We rushed him to hospital but he succumbed to severe head injuries, Mwenga said.', 'We traced the suspect who had escaped to another village and arrested him. He is helping us with investigations.""', ""Achi's father, 47-year-old James Ekoro, said Mwenga and Achi fought before the attack."", 'It seems my son hit him so hard that he retaliated using a club,"" said Ekoro.', '\n']"
