http://www.the-star.co.ke/news/2017/07/18/compel-iebc-to-allow-public-scrutiny-of-voters-register-activist-tells_c1599403,"Compel IEBC to allow public scrutiny of voters register, activist tells court",www.the-star.co.ke › Latest News,"Jul. 18, 2017, 3:00 pm","['A new legal challenge aimed at forcing the IEBC to open the voters register for scrutiny has been launched at the High court.', 'Activist Gladwell Otieno petitioned the court on Tuesday to compel the electoral agency to publish the register for public inspection.', 'The activist told the court there are inconsistencies in numbers declared by the IEBC.', '""There are noted inconsistencies in numbers declared by IEBC. It is only fair and just the actual status is ascertained,"" she says in her application filed just 20 days to the August 8 voting day.', '""It will be fair and just to allow the register voters to be subjected to public inspection...This will enable the applicant to ascertain the actual number of registered voters in affected regions.""', 'Otieno, who is Africog founder and executive director, also wants the court to prohibit the commission from deploying the register before it is scrutinised.', 'She is also seeking to compel IEBC to gazette the final register per polling station but wants it stopped from distributing the register to returning officers pending determination of the case.', ""Otieno's argument is that Section 6 of the Election Act requires that the register be opened up for inspection within 90 days to a general election."", 'But she noted that despite her requests, the commission has declined to publish the register as required by law or even take into account submissions by concerned persons.', '""The continued non-observance of provisions of the law constitute a threat to the rights and freedoms for a free and fair election.""', 'She noted failure by the electoral agency to meet scrutiny demands would be an affront to principles of the electoral system as espoused in article 81 of the constitution.', 'The applicant further says she has legitimate expectations that the commission will, at all times, be guided by the law.', 'Otieno wants the suit expedited to enable ""an electoral process that is transparent and administered in an impartial manner"".', '\n']"
http://www.the-star.co.ke/news/2017/07/18/iten-road-to-be-renamed-biwott_c1598701,Iten road to be renamed Biwott,www.the-star.co.ke › National News,"Jul. 18, 2017, 1:00 am","['Two streets in Iten town will be renamed in honour of veteran politician Nicholas Biwott. Biwott died on July 11.', 'He has contributed socially, economically and politically to the growth of Elgeyo Marakwet county.', 'Governor Alex Tolgos said the county will also support plans to give Biwott a heroes send off at his Toot home, Chebior sublocation, near Kaptarakwa centre, Keiyo South, on Thursday.', 'We will name a street and a road after him because everyone knows his contribution to our county, the governor said. ', 'Tolgos said burial plans are going on well at the home where Biwott had indicated he should to be buried.', 'Biwott, popularly known as Total Man or Karnet in Kalenjin, will be laid to rest next to the graves of his parents, the late Mzee Cheserem Biwott and Mother Maria Soti. President Uhuru Kenyatta, Deputy President William Ruto, NASA flagbearer Raila Odinga, and Kanu chairman Gideon Moi are among those expected at the burial. ', 'Officials at Biwotts owned or co-owned firms will also attend.', 'Secretary of the funeral committee in Eldoret, Albert Kochei, who is also the speaker of the Elgeyo Marakwet assembly, said Biwotts body will be flown to the Eldoret Airstrip on Wednesday at 10am.', 'There will be a procession to escort the body by road to his home, Kochei said. ', 'The procession will pass through Eldoret to Biwotts home, more than 50 kilometres from the town.', 'The funeral ceremony will be conducted at Maria Soti Girls Secondary School, three kilometres from Biwotts Toot village. An event management firm has been hired to help plan the event.', ' Biwotts daughter Esther Koimet with some family members have travelled to their rural home to oversee burial arrangements.']"
http://www.the-star.co.ke/news/2017/07/18/vote-for-me-for-better-nakuru-county-economy-lee-tells-electorate_c1598338,"Vote for me for better Nakuru county economy, Lee tells electorate",www.the-star.co.ke › Local News › Rift Valley,"Jul. 18, 2017, 2:00 am","['Nakuru Jubilee Party governor nominee Lee Kinyanjui has said if elected he will improve the countys economy.', 'Kinyanjui yesterday said Nakuru has great potential to grow economically, but poor planning has hurt development.', 'He said currently, the Nakuru county government spends 90 per cent of the budget on county workers salaries.', 'I will work to improve the county revenue because this county has the capacity needed to grow if only we can have good planning, he said. ', 'Speaking during his campaign tour in Mau Narok, Kinyanjui said his administration will build storage facilities to help farmers store their produce after harvest.', 'He said for a long time large-scale farmers have been suffering since there are no storage facilities in many subcounties. ', 'Kinyanjui said he will strengthen the Agriculture department extension officers to improve services in the 11 subcounties.', 'Kinyanjui said it is only through empowering farmers that the county can ensure food security.', 'He urged Mau Narok reisdents to turn up in huge numbers and vote for Jubilee. He said President Uhuru Kenyatta and Deputy President William Ruto have done a great job and they deserve a second term in office to complete the pending projects.', '\n']"
http://www.the-star.co.ke/news/2017/07/18/why-close-big-hotels-spread-cholera-defiant-food-vendors_c1598266,Why close? Big hotels spread cholera – defiant food vendors,www.the-star.co.ke › Local News › Nairobi,"Jul. 18, 2017, 2:00 am","['Roadside food sellers and unlicensed water vendors have defied the Nairobi governments orders to close, following a number of cholera cases.', 'The county on Saturday banned open-air cooking and ordered the closure of all eateries operating without food-handling certificates, to contain the spread of the disease. ', 'Some 336 cholera cases have been reported since May.', 'First ask the big hotels to close, thats where cholera came from not here, roadside food seller Jenipher Kimondo in Baba Dogo, said.', 'On June 22, more than 50 people were hospitalised with cholera after eating food served at Weston Hotel during a health conference. ', 'Treasury CS Henry Rotich and his Industrialist counterpart Adan Mohammed were among 30 people treated for cholera-like symptoms after they ate food at a trade event at the KICC last Wednesday.', 'Kimondo said she has not received any communication from county officials who frequent her business.', 'They come here every day, but they have never told me to close. Why should we close? she said.', 'In Jericho and Bahati estates, water vendors are still selling the scarce commodity for as high as Sh80 per 20-litre jerrycan.', 'Asked where they get it, a vendor said, We are supplied by water tankers that come here everyday. They say they buy from Nairobi Water.', 'Since January many residents have been relying on vendors because of the shortage due to drought. They cannot ascertain the source or safety of the water they receive from the hawkers.', 'Contaminated food and water are the major causes of the disease, which authorities say has killed three people. ', 'On Sunday, Health executive Bearnard Muia said county public health officers had started a crackdown on unlicensed food sellers and water hawkers. ', '\n']"
http://www.the-star.co.ke/news/2017/07/18/why-mas-visit-is-a-big-deal_c1598700,Why Ma’s visit is a big deal,www.the-star.co.ke › Business › Local,"Jul. 18, 2017, 2:00 am","[""Jack Ma, the Founder of AliBaba, is visiting Nairobi this week. This is a big deal. Ma's story is truly an extraordinary and aspirational one. "", 'In 1994, Ma heard about the Internet. In early 1995, he went to the US and with his friends\' help he got introduced to the Internet. During his first encounter he searched the word ""beer"". ', '""In 1999, I gathered 18 people in my apartment and spoke to them for two hours about my vision. Everyone put their money on the table, and that got us $60,000 to start Alibaba,"" he said. Today, Jack Ma\'s Alibaba has a market Cap of $388.86 billion. That\'s called \'\'value creation\'\' plain and simple. ', 'Safaricom closed unchanged at Sh23.00 and traded 19.30 milion shares worth Sh444.85 milllion. I am of the belief that we are on the cusp of lift-off in the eCommerce space and that Safaricom are about to build as effective an eCommerce highway as their Information highway. Not convinced that shareholders have grasped tis blue-sky opportunity that Safaricom sits atop.', 'Kenya Airways issued a notice of an extraordinary general meeting, to be held at KQ Pride Centre, off Airport North Road, Embakasi, Nairobi on 7 August, 2017 at 10.00 am for the purposes of considering and, if thought fit, passing the following resolution as a Special Resolution. ', 'Stanbic Holdings rallied 4.60 per cent to close at Sh79.50 and traded 320,100 shares.', ""National Bank pushed on 1.37 per cent to close at Sh11.05 and is 53.47 per cent this year with all of that acceleration coming after Jaindi Kisero's article re KCB's interest. ""]"
http://www.the-star.co.ke/news/2017/07/18/kingi-is-johos-puppet-thats-why-kilifi-has-not-developed-kambi-says_c1598524,"Kingi is Joho’s puppet, that’s why Kilifi has not developed, Kambi says",www.the-star.co.ke › National News,"Jul. 18, 2017, 1:00 am","['Kilifi Governor Amason Kingi is Mombasa Governor Hassan Johos puppet and does not have the interest of Kilifi people at heart, governor hopeful Kazungu Kambi has said.', ' ', 'On Saturday, Kambi said Kingi is being micromanaged by Joho and the two county chiefs lack an agenda for their electorate.', ' ', 'This is why Kilifi has not developed as much as it should have, despite it receiving almost Sh19 billion from the national government and local revenue annually since 2013, the aspirant said.', ' ', 'Kingi acts on instructions given to him by Joho, who lost direction long ago, Kambi said.', ' ', 'We need Kadu Asili to deliver Kilifi and the Coast at large, he added.', ' ', 'Kambi and Kingi have been engaging in a verbal war as the race for the top seat hots up.', ' ', 'Analysts say Kambi (Kadu Asili) may have overtaken Jubilees Gideon Mungaro in the race for Kilifi governor.', ' ', 'Kingi has labelled Kambi a Jubilee project planted by Deputy President William Ruto.', ' ', 'On June 25, Kingi said the former CS failed twice as Kaloleni MP and later as minister in the Jubilee administration.', ' ', 'Kambi was in URP in 2013. He lost and really criticised Kadu Asili, but now wants to become governor in the same party he was against. He just wants to use the party as a ladder to ascend to power, he said in Malindi.', '\n']"
http://www.the-star.co.ke/news/2017/07/18/well-ensure-there-is-no-poll-chaos-in-kitui-official_c1598420,We’ll ensure there is no poll chaos in Kitui – official,www.the-star.co.ke › Local News › North Eastern,"Jul. 18, 2017, 2:00 am","['Kitui county commissioner Boaz Cherutich yesterday assured residents measures have been put in place to avert election violence, despite the county having been listed as a chaos hotspot. He clarified Kitui was not identified as a hotspot because politicians are violent, but because of banditry attacks that sporadically erupt at the countys border with Tana River.\n']"
http://www.the-star.co.ke/news/2017/07/18/raila-is-ready-for-debate-let-uhuru-confirm-stand-lone_c1598639,"Raila is ready for debate, let Uhuru confirm stand – Lone",www.the-star.co.ke › National News,"Jul. 18, 2017, 1:00 am","['NASA Presidential candidate Raila Odinga is ready to engage President Uhuru in a debate and it is not too late for the President to agree to a debate, Railas personal adviser Salim Lone has said.', 'The President had opted out from the debate, as Jubilee Party vice chairman David Murathe said the organisers did not consult him. ', 'Raila had also ducked the debate over the format, but has reconsidered his decision.', 'Yesterday, Raila told Uhuru to reconsider, confirming that the opposition is ready to participate in the debate once the President changes his mind.', 'NASA is still ready to take part in the proposed debates as soon as Jubilee engages in agreeing on the ground rules that President Kenyatta used as an excuse to duck, Lone said in a statement.', 'The Presidential Debate Commission, which is organising the debates, has been engaging the candidates campaign team in the recent weeks to agree on the format and ground rules.', 'Jubilee is yet to confirm if its candidate will take part in the debate and by yesterday the party had not communicated to the organisers on what debate format would be acceptable to them.', 'The withdrawal of key candidates is threatening to paralyse both presidential and running mate debates for this years election.', 'Yesterday, the much-hyped Deputy Presidential debate was almost a flop after top candidates failed to turn up, accusing the organisers of not informing them.', 'The organisers denied the claims and went ahead with the debate, notwithstanding the conspicuous snub by key candidates.', 'We are going ahead as planned and whoever shows up will be hosted and will debate. That is our approach, organising committee chairman Wachira Waruru told the Star hours before the debate.', 'Both Deputy President William Ruto and NASA presidential running mate Kalonzo Musyoka gave the function at Catholic University of Eastern Africa a wide berth.', 'Whereas Ruto was engaged in campaigns at the Coast alongside Uhuru, Kalonzo is out of the country.', 'The two said they only learnt of the debates through the media.', 'I am surprised no one has engaged me on the debate. Courtesy demands that date, time, rules of engagement, would have been made available, Ruto tweeted.', 'Waruru, however, maintained that the organising committee reached out to the candidates and they were all aware of every step of the preparations.', 'We wrote letters to all the candidates. The letters were received and signed for by their offices. We are surprised by that claim, he said.']"
http://www.the-star.co.ke/news/2017/07/18/anc-mp-denounces-disgraceful-zuma-as-sa-marks-mandela-day_c1599667,ANC MP denounces 'disgraceful' Zuma as SA marks Mandela Day,www.the-star.co.ke › World,"Jul. 18, 2017, 6:00 pm","['An ANC backbencher branded\nSouth African President Jacob Zuma a disgrace on Tuesday, adding\none of his own MPs to the long list of detractors of all colours\nand political stripes who want an end to his eight\nscandal-plagued years in office.', ""In a breach of party discipline that reveals the depth of\nanger within the African National Congress (ANC), Makhosi Khoza,\na strident 47-year-old Zulu academic, chose Nelson Mandela's\nbirthday to denounce Zuma as an insult to the memory of\ndemocratic South Africa's founding father."", '""I am here to defend the ANC mission, and not a\ndishonourable and disgraceful leader,"" Khoza told a conference\nof civil society groups, unions and business leaders pushing for\nZuma\'s removal in a no-confidence vote next month.', 'The 75-year-old\'s time on power has been marked by economic\nstagnation and scandal, from a $16 million state-funded\n""security upgrade"" at his home to allegations of graft involving\nhis friends the Guptas, a family of Indian-born businessmen.', 'Both Zuma and the Guptas have denied any wrongdoing.', ""Echoing the private, moral anguish of many ANC cadres who\nhave watched Africa's oldest liberation movement decline under\nZuma, Khoza - an ANC supporter since the age of 12 - said she\ncould no longer follow the orders of a flawed leadership."", '""The dilemma I had is this: what if such directives are\nmorally bankrupt? What if such directives are directionless?\nWhat if such directives reflect arrogance, dishonesty,\ndenialism?""', 'Zuma faces the no-confidence motion on Aug. 8, the ninth\ntime the opposition will have tried to unseat him by peeling off\ndissidents from the ruling party, whose majority has so far\nprotected him by closing ranks.', ""Next month's vote could be different: the Constitutional\nCourt has cleared the way for the Speaker to allow a secret\nballot, though it is not certain she will."", ""Khoza has made clear she will break ranks. If 49 of the\nANC's 249 MPs follow suit, Zuma could be out."", 'Khoza said she did not know how many others would follow her\nlead, saying intimidation was preventing many from coming\nforward.', 'Mcebisi Jonas, a deputy finance minister axed by Zuma in\nMarch, told Reuters it was a ""big number"". He has since resigned\nas an MP.', ""One other ANC MP has told Reuters they would vote for Zuma's\nremoval in a secret ballot. The South African Communist Party,\nwhose 17 MPs back the ANC in parliament, said in April Zuma\nshould resign."", ""'Clever blacks'"", ""Although Khoza's stance has brought her recognition, it has\ncome at a price."", 'Last week, she received a death threat saying she had 21\ndays left to live, evidence, she said, of the regression of\nSouth African public life since the heady idealism of the early\ndays of the ""Rainbow Nation"" born in 1994.', '""One does not expect this in a democratic, constitutional\nSouth Africa,"" she told Reuters in an interview, saying it\nsmacked of the dirty tricks, threats and murder against\nopponents that predominated under apartheid.', '""I\'m taken back to the 1980s,"" she said, recalling fighting\nand assassinations in her native KwaZulu-Natal. ""I had my home\nburnt down. I lost relatives. To relive the moment 23 years\nafter democracy is unsettling.""', 'Khoza, an expert in Zulu linguisitics who holds a PhD in\npublic administration, also ripped into Zuma\'s apparent disdain\nfor African intellectuals, as shown by his dismissal in 2012 of\ndissenting voices as the prattlings of ""clever blacks"".', ""Zuma's formal education ended at primary school."", '""I am black. I am clever. I am smart, I am educated,"" Khoza\nsaid, to cheers from the crowd. ""Therefore there is absolutely\nnothing wrong with me.""', 'ANC chief whip Jackson Mthembu referred queries about\nKhoza\'s comments to the ANC. ""I don\'t respond to Makhosi Khoza,""\nhe said.', 'ANC spokesman Zizi Kodwa and Zuma spokesman Bongani\nNgqulunga did not answer their phones.', '\n']"
http://www.the-star.co.ke/news/2017/07/18/wambora-kivuti-and-njiru-snub-embu-governor-debate_c1597706,"Wambora, Kivuti and Njiru snub Embu governor debate",www.the-star.co.ke › Local News › North Eastern,"Jul. 18, 2017, 2:00 am","['Embu Governor Martin Wambora, Senator Lenny Kivuti and former PS Cyrus Njiru snubbed an eagerly awaited governor debate at the weekend.', ' ', 'The well-attended debate was held at the University of Embu on Saturday. Wambora and Kivuti opted to instead campaign across the county.', ' ', 'Njiru attended former Interior CS Joseph Nkaisserys burial.', ' ', 'The debate was sponsored by the The Kenya Alliance of Resident Associations in collaboration with the Civil Society Urban Development Platform.', ' ', 'Two hundred representatives of various sectors were invited to engage the candidates.', ' ', 'During the debate, which took place from 2pm to 6pm, only World Bank consultant Kithinji Kiragu, who is seeking the top seat on the PNU ticket, entrepreneur Leonard Muriuki (Narc Kenya) and psychiatrist Njagi Kumantha (DP) attended.', ' ', 'Wambora and Kivuti, who had reportedly excused themselves because they had to attend to crucial business held campaigns in Manyatta and Karurumo respectively.', ' ', 'Clerics, business leaders, politicians, members of civil society, youth and womens representatives attended the event.', ' ', 'Attendees expressed their displeasure at the candidates decision to skip the event.', ' ', 'If they ran away from us today when we wanted to engage them on matters of concern to us, will they really involve us in public participation if they are elected to office? an attendee said.', ' ', 'Candidates were told to explain how they would develop the county if elected.', ' ', 'They accused Wambora of poor governance and corruption.', ' ', 'Kiragu said kickbacks were paid for almost every project the county undertook.', ' ', 'That is why well-established contractors who could afford the bribes were considered and the poor youths were left out, he said.', ' ', 'Kiragu claimed Wambora had left the leadership of the county in the hands of family members and close friends. ', ' ', 'Kumantha said there is a lot of corruption in the county.', ' ', 'He said whenever surveys are done on the counties with the highest levels of corruption, Embu always ranks high in the list.', ' ', 'Kumantha said this has ruined the countys image and scared away investors.', ' ', 'Muriuki said youths and women have been bypassed during the awarding of tenders.', ' ', 'He promised to change the situation if elected.', ' ', 'The candidates decried the alleged state of poor health services, infrastructure and agriculture.', ' ', 'He said agriculture is the backbone of the countys economy and should not be neglected.', '\n']"
http://www.the-star.co.ke/news/2017/07/18/insurer-signs-partnership-with-super-speciality-indian-hospitals_c1598606,Insurer signs partnership with super speciality Indian hospitals,www.the-star.co.ke › Business › Local,"Jul. 18, 2017, 2:00 am","['Resolution Insurance Group has signed a partnership with five Indian hospitals to offer direct access to specialized treatment to members.', '\n', 'The MoU will provide patients with direct access to advanced care for treatment of cancer, organ transplants, cardiac and orthopedic treatment services in super speciality hospitals including Max Healthcare, Apollo Group, Artemis Hospitals, Fortis Healthcare and BLK Hospital in India. ', '\n', 'The partnership kicked off with a visit by a team of medical experts, including cardiologists, bariatric and surgical gastroenterologist, joint replacement and arthroscopic surgeons from partner BLK Hospital in New Delhi, India on a diagnostic camp.', '\n', 'The event gave the insured an opportunity to access information and as well get specialized consultation on diseases such as hypertension, cancer and back pain.', '\n']"
http://www.the-star.co.ke/news/2017/07/18/nurses-refuse-to-end-strike-despite-getting-june-pay-march-to-offices_c1598459,"Nurses refuse to end strike despite getting June pay, march to offices of CoG",www.the-star.co.ke › National News,"Jul. 18, 2017, 1:00 am","['Striking nurses have received their full June salaries, although they worked for only four days last month. ', 'But that good-will gesture wont persuade them to return to work. Only signing the CBA will end the strike that began on June 5, they say.', 'Yesterday, nurses marched from town to the Council of Governors offices at Delta House in Nairobi to press for the signing of the CBA agreed in May.', 'Only five counties have not paid nurses, but the union said those counties have promised to pay this week.', 'The nurses will not change their positions and their resolve not to work without the CBA. We are telling the governors  Turkana Governor Josphat Nanok, Kisiis James Ongwae, Kisumus Jack Ranguma and others  go campaign, get elected or not. We shall remain right here, Opetu said.', 'The CoG said nurses were paid for work not done as a show of good faith so they could resume work as the CBA negotiations continue.', 'The strike started while the SRC was evaluating the draft CBA developed by the nurses union and governors.', 'Most people have received their June salaries and the remaining counties have promised to pay, Kenya National Union of Nurses deputy secretary general Maurice Opetu said.', 'Opetu said demonstrations now will be held from the CoG offices, until the governors agree to sign the CBA.', 'He said nurses and governors had agreed to sign the CBA on July 11, but they could not find the governors representatives and they have not been told why county chiefs did not turn up. ', ' Last week, council CEO Jacqueline Mogeni wrote to the KNUN, asking them to return to negotiations so the CBA discussions are finalised.', ' Mogeni noted the SRC had declined to approve the draft CBA, which means the two sides need to come together to make some adjustments.', ' We also responded noting we are ready for talks. But we will only talk on how the CBA can be signed, Opetu told the Star.', 'CoG has already termed the nurses strike illegal, saying the procedure, which entails giving a legal notice from the union, was not followed.', 'Some health facilities have also brought in interns to assist patients, but the union says this is illegal.', 'It is illegal and wrong for medical interns to work without guidance or supervision by a qualified nurse, Opetu said. ', 'The contentious CBA gives nurses allowances of Sh15,400 (risk), Sh5,000 (extraneous), Sh5,000 (responsibility) and Sh50,000 (uniform) per year.', 'The SRC said implementing the Sh40 billion agreement is unrealistic as figures quoted were exaggerated. ', '\n']"
