http://www.the-star.co.ke/news/2017/07/18/video-ncic-tracks-social-media-hate-mongers-cops-warn-of-arrests_c1598491,"[VIDEO] NCIC tracks social media hate mongers, cops warn of arrests",www.the-star.co.ke › National News,"Jul. 18, 2017, 1:00 am","['Security agencies yesterday put internet hate mongers on notice as they launched online investigations to bring culprits to book.', '\n', '\n', 'The National Police Service, the National Cohesion and Integration Commission and the Communication Authority of Kenya have partnered to track down sources of messages that could fuel violence.', '\n', 'In January, the NCIC announced it would recruit a social media investigations officer with a background in information technology and two others to work as social media monitors ahead of the August 8 General Election.', '\n', 'Yesterday, an Eldoret college student was charged with hate speech and ethnic contempt.', '\n', 'Meshack Korir appeared before chief magistrate Charles Obulutsa. He is said to have posted an inciting message on his Facebook page.', '\n', 'Korirs lawyer Christopher Mitei pleaded for lenient bond terms, but Obulutsa said the case was serious and cannot be taken lightly with the country heading to the polls.', '\n', 'Korir was released on Sh1 million bond or Sh500,000 cash bail.', '\n', 'Obulutsa said the case is serious and should be heard before the upcoming polls. It will be heard on August 1.', '\n', 'You posted on your open source page, known as Facebook, the following message  Watu wahame waende wakafanye upuzi Central. Wamesikia kuna Wakalee kwao?  which was calculated to stir up ethnic hatred between the Kalenjins and the Kikuyus, the charge sheet reads.', '\n', 'The anti-hate agencies have mapped social media as a major catalyst that could stir violence.', '\n', 'The NCIC has mapped 21 social media groups hosted on WhatsApp.', '\n', 'They are targetted for spreading hate.', '\n', 'The agencies met with the private sector and called for peaceful polls.', '\n', 'Acting Interior CS Fred Matiangi said the National Police Service had cracked the whip on online hate mongers and will soon arrest them.', '\n', 'We will not tolerate anything that can disrupt our peace. Weve put police on the alert in areas where those spreading hate speech will be arrested, he said.', '\n', 'Matiangi urged human rights groups to join in the war on incitment and hate speech.', '\n', 'We know in our quest for peace and arresting those propagating hate, the human rights groups will come out to victimise the agencies for human rights violation. We want to tell them we wont let our peace be in jeopardy, he said.', '\n', 'NCIC boss Francis ole Kaparo said the commission is also keen on monitoring those heckling in public rallies. He said they might request CA to shut down social media should its use pose a threat.', '\n']"
http://www.the-star.co.ke/news/2017/07/18/new-police-bosses-take-over-in-uasin-gishu-and-trans-nzoia_c1598244,New police bosses take over in Uasin Gishu and Trans Nzoia,www.the-star.co.ke › Local News › Rift Valley,"Jul. 18, 2017, 2:00 am","['The new Trans Nzoia and Uasin Gishu county police commanders have reported to duty following their reshuffle early this month.', 'Samson ole Kine has taken over in Kitale as the Trans Nzoia County Commander, replacing Lilian Okembo who was promoted and moved to police headquarters in Nairobi. ', 'Augustine Ndumbi from General Service Unit headquarters is the new commander in Uasin Gishu. Previously, he commandedoperations in the banditry- hit Baringo county.', 'Uasin Gishu County Commissioner Abdi Hassan yesterday told journalists in Eldoret police have stepped up security for hte August 8 polls. He said they have been adequately equipped to monitor hate speech.', 'We will not condone lawlessness. Security teams are working to ensure peace is maintained throughout the electioneering period, Hassan said.', 'The commissioner said anyone propagating hate speech or inciting the public would be punished.', 'We have received gadgets to record all speeches at meetings. Candidates who found engaging in hate speech would face the music, he said.', 'Hassan said all politicans speeches are being recorded. He said the recordings will be used to investigate hate speech. Security teams will meet candidates to discuss peace and security. ', ' All candidates should alert police about their meetings to make proper security arrangements, said Hassan. Heurged candidates to stick to the codes of conduct they signed.', 'We will not allow what happened here in 2007-08 to happen again. We have done a lot of work to reunite communities and no one can take us back to that dark history, Hassan said.', 'Hassan says extra police will be deployed in all areas during campainging because of terror threats. We will have adequate security and are mapping strategies to deal with lawbreakers, he said. ', '\n']"
http://www.the-star.co.ke/news/2017/07/18/court-quashes-bribery-case-against-nairobi-county-chief-of-staff_c1599621,Court quashes bribery case against Nairobi county chief of staff,www.the-star.co.ke › Latest News,"Jul. 18, 2017, 6:00 pm","['The High Court has quashed criminal proceedings against Nairobi county chief of staff George Wainaina.', ' ', 'Wainaina was charged with bribing Nairobi Senator Mike Sonko to reportedly silence him from blowing the whistle on corruption in City Hall.', ' ', 'He denied that on January 5, 2016 he offered a Sh1 million bribe to Sonko as inducement.', ' ', 'The bribe was allegedly made to stop Sonko from pursuing a matter where senior officers were constructing private and development houses using public funds.', ' ', 'Wainaina was charged alongside his secretary Roselyn Oluoch and was out on a Sh1 million bond.', ' ', ' ', 'But Judge Joseph Onguto on Tuesday termed the case an abuse of court process and the criminal justice system.', ' ', ""Onguto also prohibited the Chief Magistrate's court from continuing with the case."", ' ', 'Wainaina has moved to the High Court to stop his prosecution, saying at the time EACC recommended it there were no commissioners or chairpersons in office.', ' ', '""The petitioner has done enough to show that int he absence of EACC commissioners and in the said circumstances, this case was not objective enough and could not have been recommended to the DPP."" the judge said.', '\n']"
http://www.the-star.co.ke/news/2017/07/18/bungoma-odm-leaders-split-on-calls-to-back-wetangulas-senator-bid_c1599073,Bungoma ODM leaders split on calls to back Wetang'ula's senator bid,www.the-star.co.ke › Latest News,"Jul. 18, 2017, 9:00 am","[""Two ODM leaders in Bungoma have pledged to support NASA co-principal Moses Wetang'ula in his bid to recapture the senator seat."", ""The lot said they will heed to NASA presidential candidate Raila Odinga's plea that ODM candidate Bonny Nyongesa steps down."", 'County organising secretary Eric Wambasi and his Webuye East counterpart Richard Namisi said they will not support Nyongesa.', ""They told journalists on Monday that they will follow Raila's advice for no opposition to Wetang'ula's bid."", ""The legislator is also competing with ANC's David Makali who has put a spirited campaign against his bid."", '""We agree with Raila on his call that Nyongesa steps down for Wetang\'ula who shelved his presidential ambitions."" ', ""In a recent tout of the county, Raila urged the radio journalist to shelve his bid for Wetang'ula, saying the aspirant will be considered for a post if NASA forms the next government."", ""Makali was told he will have an opening when Wetangul'a relinquishes the Senator post to take up a role in the NASA government should the coalition defeat President Uhuru Kenyatta and DP William Ruto"", 'Wambasi said they are in agreement that the Ford Kenya party leader be re-elected following his performance as Senate minority leader.', 'The group also lashed out at county ODM chairman Ali Balala, accusing him of working with Jubilee leaders.', 'But Balala dismissed the sentiments saying they did not speak on behalf of ODM.', 'He claimed Wambasi had quit ODM long ago and has been working with Ford Kenya.', '""Nyongesa will be on the ballot on August 8. If they (Ford-K) believe their candidate is strong, why ask for backing?""', ""Nyongesa dismissed officials backing Wetang'ula, claiming they have been paid to push the 'retrogressive agenda'."", '""The two are not ODM officials. They cannot purport to speak on behalf of the party. Only the chairman is authorised to do so,"" he said.', ""On Monday, Kakamega Governor Wycliffe Oparanya told Wetang'ula to stop forcing ODM candidates to step down for Ford Kenya."", 'ODM is also fronting Alfred Khangati to vie against the incumbent Kenneth Lusaka of the Jubilee Party.', '\n']"
http://www.the-star.co.ke/news/2017/07/18/ex-civic-leader-joins-race-for-nakuru-speaker_c1598386,Ex-civic leader joins race for Nakuru speaker,www.the-star.co.ke › Local News › Rift Valley,"Jul. 18, 2017, 2:00 am","['The battle for Speaker of the Nakuru County Assembly has intensified and lawyers and businessmen dominate the race.', 'Former nominated councillor and one-time parliamentary aspirant Zack Njeru (pictured) is the latest entrant. Five other candidates have thrown their hats in the ring. The winner will replace Susan Kihika who will be going for the Nakuru Senate seat during the August 8 General Election. ', 'Njeru 51, who ran unsuccessfully for the position in 2013, is optimistic he will be elected because of his experience.', ' I have a lot to do for the county. I am able to fill the gap left by the former speaker. I will fight corruption and reduce the bloated staff at the assembly and also fast-track pending Bills, Njeru said.', 'The contest is likely to be betweenJubilee and NASA parties, which have the majority seats in the assembly. The aspirants are pinning their hopes on the candidates to be elected in the 55 wards and 22 set to be nominated.The candidates have been holding meetings with county leaders to lobby for the seat.', 'I have not begun lobbying for the seat, but I strongly believe I have what it takes to serve Nakuru people, the Nakuru East ward administrator said.', 'Other candidates are Joel Maina, Waithanji Mutiti, Joseph Malinda, John Githui and Peter Bore.', 'The list of contenders is expected to increase. Electing the speaker is usually the first business of the House after the General Election. Speakers do not have to be elected lawmakers. The speaker is considered the third most powerful in the county set-up.', '\n']"
http://www.the-star.co.ke/news/2017/07/18/being-vegetarian-not-always-healthy-plant-based-diet-may-raise-risk-of_c1599021,Being vegetarian not always healthy: Plant-based diet may raise risk of heart disease,www.the-star.co.ke › Latest News › Off Beat,"Jul. 18, 2017, 9:00 am","['Vegetarian diets are widely touted as a healthier option than eating meat.', ""Eating a vegetarian diet isn't always healthy and some may increase the risk of heart disease, scientists say."", 'But experts said that it can lead to a higher risk of heart disease  if vegetarians eat lots of refined grains, potatoes and sweets, and indulge in sweetened drinks.', 'Researchers from Harvard University designed separate diets which focused on plant food with a reduced animal food intake and a vegetarian diet that emphasised the intake of healthy plant foods such as whole grains, fruits and vegetables.', 'They also studied a third which was based on unhealthy diet of less healthy plant foods like refined grains.', 'Dr Ambika Satija, a postdoctoral fellow at the Harvard T.H. Chan School of Public Health said: ""When we examined the associations of the three food categories with heart disease risk, we found that healthy plant foods were associated with lower risk, whereas less healthy plant foods and animal foods were associated with higher risk.""', '""It\'s apparent that there is a wide variation in the nutritional quality of plant foods, making it crucial to take into consideration the quality of foods in a plant-based diet.""', 'How was the study carried out?', 'Researchers studies samples from more than 200,000 participants and followed up with a questionnaire every two years for 20 years on their lifestyle, health behaviours and medical history.', 'Lead author Dr Satija chose to exclude participants with coronary heart disease, stroke, cancer and coronary artery surgery.', 'A follow-up ', '\n']"
http://www.the-star.co.ke/news/2017/07/18/tana-residents-told-to-vote_c1598390,TANA RESIDENTS TOLD TO VOTE,www.the-star.co.ke › Local News › North Eastern,"Jul. 18, 2017, 2:00 am","['Tana River county commissioner Kaburu Kaimba has told residents living in Kasiluni and near the border not to use insecurity as an excuse not to vote.', 'On Sunday he said enough security will be provided starting on the eve of Voting Day.\n']"
http://www.the-star.co.ke/news/2017/07/18/sonko-kicks-off-20-day-campaign-blitz-as-race-gets-to-homestretch_c1598977,Sonko kicks off 20-day campaign blitz as race gets to homestretch,www.the-star.co.ke › Latest News,"Jul. 18, 2017, 9:00 am","['Nairobi Jubilee governor candidate Mike Sonko and his running mate Polycarp Igathe have kicked off a 20-day campaign blitz.', ' ', 'After what they have described as a ""strategic holdout"", the duo has swung into action and is touring different parts of the city.', ' ', 'The move aims at ensuring that they set the pace ahead of their manifesto launch this weekend.', ' ', 'On Monday, Igathe, who left the corporate world to join politics, scoured Gikomba market where his main message was creating new market spaces.', ' ', 'He also visited Dagoretti South where he also interacted with traders and outlined the plans they have for the area.', ' ', 'Igathe is seen as a key addition to the Jubilee Party ticket to secure the Mt Kenya and Rift Valley vote.', ' ', 'The two regions largely back President Uhuru Kenyatta and Deputy President William Ruto who are seeking a second term in office.', ' ', 'He is also seen as a value-addition to Sonko who has been seen more of a politician than a manager.', ' ', 'Since last week, Sonko combed through Roysambu, Kasarani, Ruaraka, and the larger Embakasi.', ' ', '""He did what he does best,"" Eric Omwenga, a political scientist following Nairobi County politics, said on Tuesday.', ' ', '""Sonko is a tremendously talented ground mobiliser whose gifts even Uhuru and Ruto have been utilising for a long time.""', ' ', '""He is arguably the best mobiliser alive today if you look at politicians in his age bracket,"" Omwenga said.', ' ', 'Sonko got more than 800,000 votes during the 2013 senator contest beating Bishop Margaret Wanjiru by more than 300,000 votes.', ' ', 'Political observers note that Sonko is a front runner in the Nairobi race if the investment he has made among the residents is anything to go by.', ' ', 'As the campaigns head into the home stretch, it remains to be seen whether the Sonko-Igathe combination can floor the incumbent Evans Kidero.', ' ', 'The Jubilee brigade have accused the governor of presiding over grand corruption at City Hall.', ' ', 'Kidero is also facing competition from Independents Peter Kenneth and Miguna Miguna.', ' ', ' ', '\n']"
http://www.the-star.co.ke/news/2017/07/18/boda-boda-rider-bags-sh5m-prize-in-lotto_c1598533,Boda boda rider bags Sh5m prize in Lotto,www.the-star.co.ke › Sport › Sports Local,"Jul. 18, 2017, 2:00 am","['A boda boda rider Cosmas Kabole became Lottos 186th millionaire and 20th multi-millionaire after winning Sh5m in the third Power draw held last Saturday.', 'The euphoria was shared by two other winners, Samuel Maina and Petro Kiplagat, who split a Sh1.2 million windfall, with each taking home Sh600,000', 'Kabole, who is happily married with a two-year-old son, received the amazing news while preparing dinner as his wife had travelled up-country.', 'The 28-year-old was taken aback with the news and couldnt hide his excitement as he immediately shared it with his wife who was in Kakamega at the time.', 'He is thinking of buying a plot and building a home. He also hopes to assist his wife to pursue a career in hairdressing.']"
http://www.the-star.co.ke/news/2017/07/18/equity-cage-thunder-in-league-encounter_c1598588,Equity cage Thunder in league encounter,www.the-star.co.ke › Sport › Sports Local,"Jul. 18, 2017, 2:00 am","['EQUITY Bank got their act together, hitting Thunder 83-6 in a Premier League clash at Nyayo Stadium gymnasium.', 'New signing Kevin Chogo tormented his old team hitting 19 points while Irungu Maina shot 12 for the bankers, ahead 38-22 at the break. Patrick Koriana managed the losers 23. United States International University (USIU) beat Zetech University 68-61, behind game high of 29 points from Alex Ramazani.', 'Kenya Ports Authority (KPA) dismissed the visiting Kenya College of accountancy (KCA) University 76-63. Leaders Ulinzi Warriors clobbered Trailblazers 80-54.', 'Women champions Equity Bank had little trouble, easily hitting Kenyatta University Oryx 71-26.', 'In Mumias, Kenya Ports Authority whipped Western Delight 102-37 to keep their unbeaten run alive. Doreen Nyagah nailed 19 points and Florence Mbithe scored 13 as Co-op Bank of Kenya hit Eagle wings 70-43. Lucy Machuma had 14 for the losers. Melissa Akinyi added 15 as USIU completed the double over Strathmore University with a 54-39 win.']"
http://www.the-star.co.ke/news/2017/07/18/pressure-mounting-at-thika-says-muyoti_c1598811,"Pressure mounting at Thika, says Muyoti",www.the-star.co.ke › Sport › Sports Local,"Jul. 18, 2017, 2:00 am","['Thika United coach Nicholas Muyoti has conceded that he is under pressure to get a win for the club. Under his leadership, the milkmen have played seven matches, losing once and drawing the rest. Despite putting up a decent display, the Thika-based club have found it hard to bag maximum points when it matters. Muyoti is confident though, fortunes will turn around.', 'In our kind of job, if you do not win, definitely you will be under pressure and I am not an exception. I feel the pressure of not winning but I do not want to turn it to players. I want to continue helping them deliver. With the way we are playing, I am confident we will deliver, Muyoti said.', 'When I took over, we had a problem of conceding goals but we have since worked on this effectively. Now it is a matter of shaping up the striking force.', 'Thika United are currently placed in the 17th position with 13 points.']"
http://www.the-star.co.ke/news/2017/07/18/ford-k-odm-turf-wars-likely-to-dominate-railas-bungoma-tour_c1599153,"Ford-K, ODM turf wars likely to dominate Raila's Bungoma tour",www.the-star.co.ke › Latest News,"Jul. 18, 2017, 9:00 am","[""The rivalry pitting Ford Kenya and ODM candidates is likely to take centre stage during NASA flag bearer Raila Odinga's tour of Bungoma."", 'Raila will be in the county on Wednesday to popularise his presidential bid against his arch competitor President Uhuru Kenyatta.', 'The team has been making inroads in the county and has backed the re-election of Governor Kenneth Lusaka of Jubilee Party.', 'The ODM leader will be in the county amid sharp division among NASA affiliate parties which have vowed to face off in the August 8 polls.', ""The differences played out loudly during Raila's last trip when youths allied to ODM and Ford Kenya clashed at his rally on June 24."", ""Supporters of Wycliffe Wangamati and ODM's Alfred Khang'ati openly differed when the NASA leader asked residents to back Khang'ati."", 'Bungoma is the home turf of NASA co-principal Moses Wetangula who is defending his senator seat under his Ford Kenya party', ""Wetang'ula has implored upon ODM candidates to step down for them citing his decision to relinquish the presidency bid for Raila."", ""Kakamega Governor Wycliffe Oparanya, who is also the deputy party leader, cautioned against the Bungoma senator's move."", '""Ford Kenya is unpopular and wants to ride on our strength to win seats,"" Oparanya said when he led ODM campaigns in the region last weekend.', 'Ford Kenya and ODM supporters have been exchanging harsh words on social media ahead of the rally.', ""ODM Chairman Majimbo Okumu accused Wetang'ula's party of trying to hoodwink Raila to endorse their candidates."", '""Nobody will be endorsed. Let people face each other on the ballot. Let them stop getting power through the back door,"" he said.', ""Majimbo said ODM's intervention is what helped the legislator win the by-election which was also contested by Muskari Kombo."", 'Raila is expected to host rallies in Kimilili and Webuye amid his warning that unless NASA candidates work together, Jubilee will win.', 'Political commentator Isaac Wanjekeche on Tuesday said the rally is most likely to be like the last one addressed by Raila.', '""I am seeing a situation where parties will want to show their grip on the region,"" he said.', '\n']"
http://www.the-star.co.ke/news/2017/07/18/opponents-plan-to-disrupt-nasa-rally-blame-me-oyugi_c1598431,"Opponents plan to disrupt NASA rally, blame me – Oyugi",www.the-star.co.ke › Local News › Nyanza,"Jul. 18, 2017, 2:00 am","['Homa Bay governor aspirant Oyugi Magwanga yesterday said his opponents plan to disrupt a NASA rally today and blame it on him.', 'He said he has shared the information with the IEBC and police.', 'Presidential candidate Raila Odinga and Musalia Mudavadi are expected to lead the NASA brigade. Magwanga, an independent candidate, will face Governor Cyprian Awiti of ODM, Medo Misama, an independent and Tom Alila of Jubilee. I would like to urge all the county residents to put aside our political differences and welcome Baba to Homa Bay, read a statement from Magwanga to newsrooms.', 'Despite the fact that I am vying as an independent candidate, I respect and support Railas candidature for President. Raila is our only hope for change and development in Kenya. ', 'Magwanga said on Sunday his opponents distributed T-shirts branded Team Tiacha to youths paid to cause havoc during Railas rallies. ', 'Homa Bay people are peaceful and we shall overwhelmingly vote for Raila. Any person who will want to use todays rally to portray us negatively should be dealt with accordingly, reads the statement.']"
http://www.the-star.co.ke/news/2017/07/18/move-in-on-hate-speech-but-protect-freedoms_c1598685,"Move in on hate speech, but protect freedoms",www.the-star.co.ke › Opinion › Leader,"Jul. 18, 2017, 2:00 am","['Internet\nhate mongers have been put on notice as monitoring agencies shift focus to\ntracking down sources of messages that could fan the flames of violence.', ' ', 'The\nNational Police Service, National Cohesion and Integration Commission and the\nCommunications Authority of Kenya seem to be finally moving in concert and\ntaking deterrent action.', ' ', 'Social\nmedia monitoring ahead of the General Election has been necessitated by\nastonishing levels of hate speech and other vitriol.', ' ', 'Yesterday,\na college student in Eldoret was charged for hate speech and ethnic contempt,\nfollowing messages he posted on his Facebook account.', ' ', 'He\nwas released on bond Sh1 million bond and cash bail of Sh500,000. The case will\nbe heard on August 1. ', ' ', 'The\nNCIC has mapped 21 WhatsApp groups for intensified hate speech monitoring.', ' ', 'Whereas\nsocial media use should at all times be responsible, the authorities need to\ntake the greatest care that they do not take away citizens rights to free expression\nand communication.', ' ', 'Fair\ncomment needs to be protected at all times. ', '\n']"
