http://www.the-star.co.ke/news/2017/07/04/ict-chiefs-return-splits-iebc-as-nasa-protests_c1590271,ICT chief’s return splits IEBC as NASA protests,www.the-star.co.ke › National News,"Jul. 04, 2017, 6:00 am","['Suspended IT director James Muhati has quietly returned to the IEBC under a cloud of suspicion that has split bosses with slightly over a month to the General Election.', ' ', 'The Star has established that some IEBC commissioners were opposed to the reinstatement of Muhati, who was kicked out following accusations he had refused to cooperate in the audit of ICT systems.', ' ', 'NASA has opposed the return of Muhati, a former head of information systems at Kenya Airways, over claims he is partisan.', ' ', 'In a statement to newsrooms, Railas advisor, Salim Lone, said Muhati should remain under suspension.', ' ', 'While Mr Muhatis suspension was publicly announced by the chairman, his reinstatement has been done in an opaque way, with Kenyans in the dark as to whether he was properly investigated as the commission had promised to do... If he is cleared, the commission should state clearly by who? Lone said.', ' ', 'Yesterday, IEBC communication manager Andrew Limo confirmed Muhati had resumed work, but said the commission is yet to discuss the investigation report.', ' ', 'He said he is not aware of any split in the commission over the decision to reinstate Muhati.', ' ', 'I dont think he would have been brought back if it was not a unanimous commission decision. At the end of the day, it must have been minuted and it must have been agreed that he comes back. In all decisions people may have different views, but in a democracy, its said the majority will have their way. It happens in every boardroom, Limo said.', ' ', 'It has also emerged IEBC procurement director Lawy Aura, who was sent on compulsory leave, will not return to the Commission after all.', ' ', 'Aura was seconded to the IEBC from Treasury, where he is said to have returned after the IEBC purge.', ' ', 'Limo said the commission has no powers to sack an individual they did not employ.', ' ', 'He [Aura] was seconded from Treasury so he went back to Treasury. That is why we used the word relieved of his duties.We cannot sack somebody we did not employ, he said.', ' ', 'The reinstatement of the IEBC boss comes at a time when NASA is pushing the IEBC to put its house in order to avoid technology failure like it happened in 2013.', ' ', 'In a terse letter to IEBC Chairman Wafula Chebukati recently, NASA asked the commission to explain the precautions it has put in place to protect the results transmission system.', '\n']"
http://www.the-star.co.ke/news/2017/07/04/thugs-from-7-families-terrorise-village-no-go-zone-after-dark_c1590019,"Thugs from 7 families terrorise village, no-go zone after dark",www.the-star.co.ke › Local News › Central,"Jul. 04, 2017, 9:00 am","['The streets of Kwambira village are becoming no-go zones after 8pm.', '\n', 'Residents say marauding gangs start attacking people from as early as 7.30pm, usually on the notorious Biashara Street. ', '\n', 'Cases of robbery, theft and mugging are on the rise.', '\n', 'Residents say the criminals are armed with knives, clubs, whips and metal bars and rob them of mobile phones, money and other valuables daily.', '\n', 'I met them when I was going home. They told me, Excuse me, Lady. I stopped, but they took out a knife and ordered me to hand over my handbag, ransacked it and stole money, mobile phone, sweets and a necklace, Miriam Waceke said.', '\n', 'It was 8pm late last month. Waceke, who has moved out of her rented house, says she was ordered to pick her bag and go home quietly.', '\n', 'family ties', '\n', 'She reported the theft to the police but was told these cases are normal but residents do not report them for fear of families becoming enemies.', '\n', 'A resident, who didnt want to be named, said the criminals are from seven extended families that have dominated the area. Their young children are friends. ', '\n', 'When someone is robbed and reports the incident to the police, they end up not following up on the case when they discover that the robber was a son of his cousin or a neighbour, he said. ', '\n', 'Area deputy county commissioner David Kiprop has urged the residents to report the criminals, saying they will be investigated.', '\n', 'Our security personnel are well trained to handle residents information with confidentiality, he said on Sunday.', '\n', 'Kiprop said criminals thrive when residents do not report them to police. ', '\n']"
http://www.the-star.co.ke/news/2017/07/04/grotesque-lamb-with-human-features-stirs-fear_c1590038,Grotesque lamb with ‘human’ features stirs fear,www.the-star.co.ke › Local News › Central,"Jul. 04, 2017, 9:00 am","['Residents in Gatundu South on Friday came from far and wide to see a stillborn deformed lamb they said had human features.', '\n', 'Waweru Wanyoike said he was called by his elderly neighbour Mary Muiruri to slaughter her sheep, which had died in labour.', '\n', 'I started to slaughter the dead sheep to remove the lamb, but I saw something I have never seen before. The lamb had features of a human being, with only a few hairy patches on the neck, he told the Star.', '\n', 'At least 300 people flocked to the homestead in Karembu village, Kiamwangi location, to see the creature as word spread.', '\n', 'A veterinary officer who visited the home said the deformation most likely occurred as a result of improper mutation. He said a man cannot impregnate a sheep.', '\n']"
http://www.the-star.co.ke/news/2017/07/04/longterm-investments-attract-more-investors_c1590317,Longterm investments attract more investors,www.the-star.co.ke › Business › Local,"Jul. 04, 2017, 7:00 am","['Kenya will attract more investors this election year compared to previous ones, thanks to long term investment strategies by local investment professionals supported by favourable investment policies by the government and infrastructure upgrade, Chartered Finance Analysts chief said yesterday.', '\n', 'Kenyas economy grew 4.7 per cent in the first quarter of this year, down from 5.9 per cent in the same period of 2016. It is however much better compared to 1992 when it shrunk by 0.82 and a growth of 0.5 per cent recorded in 2002, this according to Kenya National Bureau of Statistics.', '\n', 'Although the country recorded a high of 7.1 per cent in 2007, it shrunk to 1.7 per cent the following year due to election violence that saw at least 1300 killed while than 600,000 were displaced.', '\n', 'In his first official working visit to Kenya yesterday, CFA President Paul Smith asked investment professionals to ensure that their clients are having a pie of the ongoing scramble for Africa by providing them with sustainable and long term investment strategies that will yield value for money.', '\n', 'CFAs assurance is validated by the 2017 Earnest & Young (EY) investor attractiveness survey that ranked Kenya second most attractive investment destination in Africa after Morocco.', '\n', 'EYs Africa attractiveness index released two months ago scored Kenya in the long-term outlook in governance and human development,16 out of 20, economic diversification at 10 out of 20, infrastructure and logistics ( 16 out of 20 ) and improved business environment rating that stood at 10 out of 20.', '\n', 'The report adds that multinationals keen on reaching the thriving 180 million people East Africans are seeking to establish regional hubs in Kenya to take advantage of the free trade area that allows free movement of goods, people and capital across East Africa.', '\n', 'It revealed that investors have confidence in the potential displayed by the stable growth of the Kenyan Economy in the last four years with a big mass of consumers entering the middle income earners bracket, translating into a big number of Kenyans having a sustainable disposable income.', '\n']"
http://www.the-star.co.ke/news/2017/07/04/jps-nakuru-list-for-mca-and-mp-nominations-not-yet-approved-manyara_c1589929,JP’s Nakuru list for MCA and MP nominations not yet approved — Manyara,www.the-star.co.ke › Local News › Rift Valley,"Jul. 04, 2017, 9:00 am","[""Jubilee's Nakuru chairman David Manyara has said the\nlist submitted two weeks ago of those proposed for nomination has not been approved."", ' ', 'He said all names forwarded to the party headquarters in Nairobi are still being vetted before the final list is provided.', ' ', 'The first list that had been forwarded to the party for\nnomination of MCAs and Member of Parliament has not been approved, he said.', ' ', 'Speaking to the Star after a burial ceremony of the late\nbusinessman tycoon Peter Kinya, Manyara called on all Jubilee supporters and\nlosers to remain calm as the party looks in the matter.', ' ', 'Two weeks ago when the list of nomination liked to the public,\nthere was a heated debated with losers calling the Jubilee Party to ignore the\nnames which had been submitted by a cross section of county lawmakers.', ' ', 'Led by the chairman of aspirant of caucus Edwin Lesidai who\nfaulted the list, saying the distribution of names was biased and skewed.', ' ', 'He said the names which had been forwarded did not reflect\nthe real picture of the county which is cosmopolitan.', ' ', 'That list has names of some people who earlier served as\nnominated MCAs in the current assembly, we will not accept that list, he was\nquoted saying in a past press conference.', ' ', 'Lesidai also alleged that among the names submitted included\ngirlfriends and relatives to some of the MPs and other county leader.', ' ', 'However, the chairman of Jubilee in Nakuru County also said\nthe second list which was submitted after consultation with county leaders is\nalso not yet approved.', ' ', 'Nakuru county Jubilee nominee for governors position Lee\nKinyanjui maintained that the list of nomination must be done with the best interest\nat heart for the county.', ' ', 'Kinyanjui told Jubilee supporters in a recent meeting that\nthe names which should be in that list should be the will of Wanjiku and\nnothing else. ', '\n']"
http://www.the-star.co.ke/news/2017/07/04/eacc-freezes-accounts-sh200m-assets-of-top-homa-bay-officials_c1590828,"EACC freezes accounts, Sh200m assets of top Homa Bay officials",www.the-star.co.ke › Latest News,"Jul. 04, 2017, 12:00 pm","['The EACC has frozen accounts and property worth Sh200 million, allegedly acquired corruptly by top Homa Bay county officials.', ' ', 'The officials have been barred from transferring or dealing with money in their accounts pending further action by the commission. ', ' ', 'The assets include several prime properties in Homa Bay Town, Kisumu and Nairobi. Among them are homes and business premises that belong to the suspects.', ' ', 'The properties, which were purchased by funds whose sources have been traced to the assembly, were preserved by way of restrictions by EACC in accordance with section 76 of the Land Registration Act, No. 3 of 2012, read part of a court ruling. ', ' ', 'Assembly Clerk Kephas earlier requested the court to stop the commission from proceeding with the investigations. ', ' ', 'Kephas argued the assembly is a privileged establishment that cannot be investigated for any form of criminal acts. ', ' ', 'But EACC opposed the application and pleaded with the court for freedom to pursue the matter. ', ' ', 'The assemblies powers were never meant to make them sanctuaries of criminal activities but to allow them to discharge their duties of law making, oversight and representation in strict observance of the constitution and the law, read part of the affidavit filed by the commission. ', ' ', 'The anti-graft agency has submitted a fresh application to be allowed to transfer the case to the Anti-Corruption Court in Nairobi to speed up anti-corruption petitions. ', ' ', 'The commission has been investigating possible theft of the assemblys funds, amounting to more than Sh400 million. ', ' ', 'Early in March, while armed with a court order, the commissions detectives searched the offices and homes of some senior Homa Bay officials and stumbled upon evidence of massive looting of county funds. ', ' ', 'During the raid, several documents indicating massive fraud, bank statements, log books and title deeds were seized.', ' ', 'They are expected to form the foundation of the case against officials of the county led by Cyprian Awiti.', ' ', '\n']"
http://www.the-star.co.ke/news/2017/07/04/munya-to-abandon-uhuru-if-state-offi-cers-keep-harassing-locals_c1589925,"Munya to abandon Uhuru if state offi cers keep harassing locals, disrupting meetings",www.the-star.co.ke › Local News › North Eastern,"Jul. 04, 2017, 9:00 am","['Meru Governor Peter Munya has threatened to withdraw support for President Uhuru Kenyattas reelection if the regional administration continues intimidating his supporters.', 'He said the state machine is being used to sabotage his meetings in Meru. ', 'Munya spoke on Sunday at a meeting in Githongo, Central Imenti. The meeting was almost disrupted after police fired teargas to quell chaos.', 'I know there are some people who do not want this meeting to continue. They have been plotting on how to sabotage it, but we will continue, the former Council of Governors chairman said. ', 'Despite the teargas being lobbed, Munya went on with the meeting and named the individuals who cause chaos in his meetings. ', 'Why are these individuals not arrested, yet we have reported them to the authorities? It means they know who they are and what they are up to, he said.']"
http://www.the-star.co.ke/news/2017/07/04/i-dont-plan-to-evict-anyone-ill-prioritise-residents-ndeti_c1589936,"I don’t plan to evict anyone, I’ll prioritise residents – Ndeti",www.the-star.co.ke › Local News › North Eastern,"Jul. 04, 2017, 9:00 am","['Machakos Wiper governor nominee Wavinya Ndeti (pictured) has dismissed claims that she is planning to evict some communities in the county if elected.', 'Governor Alfred Mutua on Friday claimed Ndeti was planning to evict some communities from the county and said he had already written to the ICC prosecutor Fatou Bensouda to investigate Ndeti.', 'It is an act of civil provocation to strife and unrest reminiscent of the 2007 election violence, he said.', 'Speaking at Mitaboni Catholic Church on Sunday, Ndeti said her campaign slogan Andu Maitu Mbee translated to our people first meant that anyone residing in Machakos, regardless of tribe, will be given priority by her administration.', 'All I mean is that, contrary to the current scenario, where people from other counties have benefitted at the expense of the locals, my government will ensure that any local, regardless of his/her tribe, will be given priority, she said.', 'Ndeti said she is not bothered by Mutuas theatrics in writing to the ICC.']"
http://www.the-star.co.ke/news/2017/07/04/woman-rep-aspirants-pitch-for-garissa-vote_c1589846,Woman rep aspirants pitch for Garissa vote,www.the-star.co.ke › Local News › North Eastern,"Jul. 04, 2017, 9:00 am","['Garissa woman representative Kanu candidate Amina Keinan has said she will push for quality healthcare for county residents if elected.', 'Speaking during the launch of her manifesto at a Garissa hotel on Sunday evening, she said healthcare services in her county are way below the required standards. ', 'In African countries, healthcare is more of a money-making venture. Any system that puts profits ahead of patients makes medical care expensive and shambolic, Keinan said.', 'I will also improve education, agriculture, water supply, cohesion, harmony and tolerance among county residents. ', 'Keinan, who has lived in the US for 18 years has been criticised by her opponents, who say she is not in touch with the challenges facing her people. But she said she has a wealth of experience from abroad, adding the electorate will elect her on account of her experience and expertise.', 'Keinan will face off with incumbent Shukran Gure (Wiper), Anab Subow (Jubilee), Fatuma Kinsi (ODM), Ebla Sahal of ANC and Maryam Sheikh (Thirdway Alliance). ', ' On Saturday, only Kinsi and Sahal appeared for the debate at a Garissa hotel, organised by county youths. ', 'Sahal said if elected she will root for more funds to spur growth in marginalised counties. ', 'I will also create a resource centre where youths get information on jobs and necessary documents, she said. She will also ensure equal representation of women and youths.', 'Kinsi said she will engage companies to invest in Garissa to create jobs for youths.']"
http://www.the-star.co.ke/news/2017/07/04/migori-cops-back-my-rival-obado-says-ayacko_c1590098,"Migori cops back my rival Obado, says Ayacko",www.the-star.co.ke › National News,"Jul. 04, 2017, 7:00 am","['Migori governor aspirant on Independent ticket Ochilo Ayako has accused police in the county of supporting the incumbent Okoth Obado ahead of polls.', 'Speaking to the press in Migori town on Monday, the former cabinet minister said despite having numerous complaints and police statements issued in police stations by his supporters police are yet to take action.', 'Ayako said he is sure of winning the August 8 poll, which has seen Obados camp to panic and threaten his supporters across the county and trying to disrupt his rallies.', 'The governor, his bodyguards and several Administration Police officers including his in-laws who are armed have been intimidating my supporters despite lodging sveral complaints, nothing has been done, Ayako said.', 'Ayako said he has personally called the Migori county security team, but no action has been taken.', 'On Sunday Jacky Gard, a campaign manager of Ayako was assaulted by two known to her while walking in Awendo town by the road and reported the matter at Awendo Police station with nothing done to her.', 'Sadly the following day the same people came to report an incident at the same station and no action was taken by Awendo police station officers, he said.', 'Ayako pointed out that the perception by members of the public that police officers are supporting Obado through delays of taking action will lead to fear of August polls, not being free and fair.', 'At the same time Ayako called on Awendo RO Musa Olwalo to be transferred ahead of polls as he is related to the governor as they taught in the same school, are from the same clan and has shown hostility in their campaigns before.', 'We need the picking of presiding officers and their deputies to be transparent by the commission to be open to have free and fair campaigns, Ayako said.', 'But speaking to the press Obado director of press Nicholas Anyuor said the their supporters have also been harassed by Ayakos supporters and said claims that they have a hand in picking IEBC officials was far-fetched.', 'Migori AP Commander Daniel Rukunga said police in the county are neutral in handling election matter and urged Ayako to report any officers he accuses for discipline action to be taken.', 'Migori County police commander David Kirui said police have been neutral handling security concerns from all candidates in the county, but blamed politicians of having rallies without informing them.', 'He said they only receive complains in case of insecurity concerns, and said they will force politicians to record their venue for rallies with police for protection.', '\n']"
http://www.the-star.co.ke/news/2017/07/04/ncic-warns-against-misuse-of-internet-spreading-hate_c1589906,"NCIC warns against misuse of internet, spreading hate",www.the-star.co.ke › Local News › North Eastern,"Jul. 04, 2017, 9:00 am","['The public should use WhatsApp, Facebook and Twitter and other social media platforms responsibly and not to spread hate, NCIC commissioner Joseph Nyasongo has said.', 'The law is clear on freedom of expression and limitation, especially when it touches on propaganda for war, incitement to violence, hate speech and promotion of hatred among different groups, communities, races and faiths, he said.', 'Nyasongo spoke during the launch of Safe and responsible use of Internet guides in schools at the Kenya Institute of Curriculum Development, Nairobi, on Saturday.', 'As a commission, we are concerned with hate speech and ethnic content based on religions, communities, groups and races, he said.', 'The commission had scaled up its monitoring systems with other authorities to curb cyber crime before and after the August 8 General Election.', 'We are monitoring all these to avoid conflict and violence in the country. There should be no bloodshed, deaths, or destruction of property. No one should feel insecure during this period and after the polls, Nyasongo added.']"
http://www.the-star.co.ke/news/2017/07/04/call-off-august-polls-form-caretaker-government-says-peter-gichira_c1590910,"Call off August polls, form caretaker government, says Peter Gichira",www.the-star.co.ke › Latest News,"Jul. 04, 2017, 3:00 pm","['Independent presidential candidate Peter Gichira wants the August 8 general election called off and a caretaker government formed.', 'Gichira noted this is on grounds that the IEBC is ill-prepared for the election.', 'He said the caretaker government should start preparations for a new election in two years.', 'Among the tasks the candidate proposed is for this government is conducting a referendum to change the constitution.', 'He said the referendum should separate IEBC functions of registering voters and managing the register and elections.', 'Gichira demanded the resignation of electoral agency chairman Wafula Chebukati, chief executive Ezra Chiloba and all commissioners.', '""They are incompetent and dishonest and have on several occasions violated the constitution. IEBC\'s ill-preparedness is a recipe for chaos.""', ""The hopeful noted the risk of violent outbursts is high since issues on IEBC's preparedness and the commissioners' integrity have not been addressed."", '""We dont want to go into an election just for the sake of it. We want a proper election that must not result in the loss of innocent lives as was the case in 2007.""', ""Gichira cited the controversial Al Ghurair tender, irregularities in the audited voter's register and failure to conduct voter education as some of the grounds."", 'Addressing journalists at Laico Regency Hotel in Nairobi on Tuesday, he said the IEBC ""is not of sound mind"" yet this is required for a free and fair election next month.', '""A recent attempt by the IEBC to sanitise the voters register through the SMS number 70000 failed terribly. Dead and ghost voters have resurfaced,"" he said.', '""The referee has offered free resurrection orders for any willing dead to come out of their graves and vote,"" Gichira added.', ""The candidate shot to the limelight in May when he attempted to jump from the IEBC's offices at the Anniversary Towers. This was after the commission declined to clear him to run for the seat."", 'Gichira said the questionable procurement of voting kits and ballot papers, and voter register audit flaws show the polls body does not have good faith in its actions.', '""Kenyans must be afforded an enabling environment to vote leaders of their choice rather than have pre-determined winners pushed down their throats,"" he said.', '\n']"
http://www.the-star.co.ke/news/2017/07/04/male-model-tortured-murdered-because-of-tight-clothes-good-looks-in_c1590456,"Male model ‘tortured, murdered because of tight clothes, good looks’ in Iraq",www.the-star.co.ke › World,"Jul. 04, 2017, 6:00 am","['A male model was found tortured and murdered with his body dumped in the street over his what is thought to be his good looks and tight clothes.', 'Karar Nushi, who was studying at the Institute of Fine Arts in Baghdad, was receiving death threats, according to his fans, because of his hairstyle and the outfits he chose to wear.', 'His body was dumped in Palestine Street, north of the capital, covered in stab wounds and showing signs that he was brutally tortured before being killed.', 'On social media, his fans said anonymous thugs had messaged him to say they were going to kill him because they disapproved of his lifestyle, according to Iraqi News', 'Nushi, who donned flowing, blonde locks, was understood to have been preparing to take part in a male beauty pageant.', 'Mourners on social media paid tribute to the popular figure, with some blaming ISIS for spreading an ideology of hate throughout the country.', ""Islamist groups in Baghdad are said to be behind the murders of several murders in Iraq - many of them involving the victim's sexuality."", 'Homosexuality is illegal under strict Islamic Sharia law, which ISIS abide by, and several gay men have been known to be executed by the terror group simply for their sexual orientation.', '\n']"
