http://www.the-star.co.ke/news/2017/07/20/ekuru-accuses-nasa-of-plot-to-rig-polls-with-tanzanian-tallying-centre_c1601230,Ekuru accuses NASA of plot to rig polls with Tanzanian tallying centre,www.the-star.co.ke › Latest News,"Jul. 20, 2017, 6:00 pm","['Presidential candidate Ekuru Aukot has raised concern over alleged plans by the NASA coalition to set up a tallying centre in Tanzania.', ""The Thirdway Alliance flag bearer made the remarks amid speculation that Raila Odinga's coalition has established a tallying centre in Kigamboni area, Tanzania."", ""Aukot noted that it has brought suspicions over Raila's relations with Tanzanian President John Magufuli."", '""We feel this continues to undermine our electoral management processes, trust and faith in our institutions, the independence of IEBC and the security of our nation,"" he said in a statement on Thursday.', 'Aukot also welcomed the Court of Appeal ruling allowing Al Ghurair to continue printing presidential ballot papers.', 'But he asked IEBC to ensure counting and sealing of all presidential ballot papers and strict supervision of the same.', '""IEBC should have unique and random serialisation and security features so that ballot papers in one constituency cannot be used in another,"" he said.', 'He also said that IEBC should appoint an international logistics company with ""end-to-end visibility and tracking system"", to monitor and track movement of presidential ballot papers during the entire freight from the printer to the constituency headquarters.', '""Access of the said tracking system should be availed to all Presidential Agents and selected observers,"" the presidential hopeful said.', 'There are 20 days left to the general election.', 'There has been concern that remarks by politicians are likely to fuel conflict.', 'Earlier in the day, Raila issued a list of officers allegedly deployed to rig the elections.', '\n']"
http://www.the-star.co.ke/news/2017/07/20/madonna-blocks-sale-of-intimate-items-at-auction_c1600509,Madonna blocks sale of intimate items at auction,www.the-star.co.ke › Latest News,"Jul. 20, 2017, 3:00 am","['A US judge has halted an auction of personal items of Madonna, after she said her privacy was violated.', 'New York Justice Gerald Lebovits set a full hearing for 6 September, banning auction house Gotta Have Rock and Roll from holding a sale in the meantime.', ""Madonna's underwear, a chequebook, a hairbrush, photos and a break-up letter from the late rapper Tupac Shakur had been among the scheduled lots."", 'The pop superstar said her possessions had been stolen by a former friend.', ""Tupac's letter, in which the rapper suggests he broke up with Madonna because of her race, was expected to fetch as much as $400,000 (307,000)."", 'The letter is dated 15 January 1995 and was penned while Tupac was serving a prison sentence for sexual assault, 18 months before he was shot dead. Both artists were then at the height of their fame.', '\n']"
http://www.the-star.co.ke/news/2017/07/20/mudavadi-slams-dp-for-dismissing-land-report_c1599672,Mudavadi slams DP for dismissing land report,www.the-star.co.ke › Local News › Western,"Jul. 20, 2017, 2:00 am","[' ', '\n']"
http://www.the-star.co.ke/news/2017/07/20/nyongo-accuses-ranguma-of-using-kisumu-funds-to-buy-imperial-hotel_c1600684,Nyong'o accuses Ranguma of using Kisumu funds to buy Imperial Hotel,www.the-star.co.ke › Latest News,"Jul. 20, 2017, 12:00 pm","[""Kisumu Senator Anyang' Nyong'o has accused Governor Jack Ranguma of embezzling millions of shillings meant for county development."", ""Nyong'o alleged Ranguma has used county funds to buy Imperial Hotel, a three-star facility in the Kisumu CBD."", 'He said if elected, his administration will conduct an assets and liabilities audit to recover looted public property and other resources.', '""My administration will ensure those involved in corruption are arrested and charged,"" he said.', '""We are focused and determined to recover illegally acquired wealth for the benefit of residents.""', ""He issued the remarks on Wednesday during NASA campaigns at Kisumu's Kenyatta sports grounds."", 'But Imperial Hotel general manager Michael Kamau dismissed the claims saying the establishment is owned by the Gilani family.', '""Ranguma has no relationship with the hotel. He only comes here for services and pays just like other esteemed clients.""', 'He termed the remarks political propaganda against a premise which has employed many and generates revenue for the county.', 'The Senator further faulted Ranguma for poor development and failure to tackle massive corruption in his administration.', ""Nyong'o, who chairs the Senate Public Accountants Committee, said Kisumu has received billions of shillings yet there is no tangible development there."", '""We must stand up and elect leaders who can truly champion devolution for the benefit of residents,"" he said.', 'Nyongo further said the Governor does not deserve another term after failing to deliver the development agenda he promised in 2013.', '""We gave him the mandate to steer development growth and to protect public resources but he has failed. He should therefore pack and go home.""', 'Ranguma, an independent candidate, has denied the corruption allegations on several occasions.', 'The Governor maintains he is committed to development and an end to corruption.', 'He said he invited EACC and other government agencies to conduct lifestyle audits on county staff following the claims.', 'Ranguma, who is seeking a second term, will face off with David Wayiera (ALP), PC Owino Omollo (ANC) and Atieno Otieno (Jubilee Party) in the August 8 poll. ', '\n']"
http://www.the-star.co.ke/news/2017/07/20/sportpesa-consider-move-to-uganda-following-invitation_c1600383,SportPesa consider move to Uganda following invitation,www.the-star.co.ke › Sport › Sports Local,"Jul. 20, 2017, 2:00 am","['Sportpesa are considering expanding their wings to Kampala after an invitation by the Ugandan minister for Youth and Children Affair Florence Nakiwala Kiyingi.', ' ', 'Kiyingi went to Dar Es Saalam, Tanzania to watch Gor Mahia take on English Premier League side Everton in an international friendly match organised by Sportpesa and personally extend an invitation to the betting firm to extend their business Kampala.', ' ', 'We are here to start the dialogue between Sportpesa and Uganda football to ensure that we participate in the East African League (The Sportpesa Super Cup) and also to ensure that Sportpesa comes to Uganda to invest in the Ugandan league,said Kiyingi.', ' ', 'Just like in Kenya, the Ugandan parliament recently passed a bill of 35 per cent tax that is awaiting consent by the President.', ' ', 'This, she says, is not to raise money for the Uganda government, but to demotivate people from going into irresponsible gambling and gaming.', ' ', 'So we are reversing the trend as the ministry responsible for young people. I have made it a point to look for people to invest in sports, give the youth employment. We can discuss on ways to reduce the interest in tax (for those investing in sports) so as to promote sports in general. This is why the government of Uganda is inviting Sportpesa to Kampala, she added.', ' ', 'I take Sportpesa to be an investor and not really a business person. So we want them to come down to Uganda and together we look at the regulation further.', ' ', 'We are going to look at Sportpesa in isolation because it is coming with a heavy weight of promoting football, investing in academies, investing in young people, giving them employment. It is beyond betting, it is beyond gaming. So we are looking at the other side of investment and then we shall make sure that we down and dialogue, explained Kiyingi.', ' ', 'Kiyingi said that if Sportpesa was to put the same amount of investment in football like in Kenya and Tanzania, then Uganda football will grow in leaps and bounds because what Uganda lacks now is adequate sponsors.', ' ', 'The talent is there, the morale is there, the demand is overwhelming but what is missing is the capital injection in football in general and branding.', ' ', 'If Sportpesa land in Uganda it will take nine months before they start operations as per the regulations.', ' ', 'All that might change as a delegation from Sportpesa head to Uganda this month for discussions with the Uganda government and if successful, they will meet with President Yoweri Museveni to fast track the process.', ' ', 'Kiyingi, who is also the chairperson of Express Football Club in Uganda, is hopeful that all will be concluded successfully before planning starts for the next Sportpesa Super Cup to be played in Kenya in June of 2017.', '\n']"
http://www.the-star.co.ke/news/2017/07/20/missing-baringo-chief-found-dead-in-laikipia-body-sprayed-with-bullets_c1600681,"Missing Baringo chief found dead in Laikipia, body sprayed with bullets",www.the-star.co.ke › Latest News,"Jul. 20, 2017, 9:00 am","['A Baringo chief who went missing on Tuesday has been found dead in a bush at Olmoran range in Laikipia county.', ""Grisson Kokoo's body, which had bullet wounds in the stomach and head, was discovered on Wednesday."", ""The Ng'elecha chief was reportedly called by unknown people who asked him to record a statement with police."", ""He left his home to record the statement at Ng'elecha police post at around 6pm but did not return."", '""We found his body dumped in the forest and sprayed with bullets,"" Benson Wendot, a relative, said.', 'The body was taken to Nyahururu hospital mortuary pending investigations.', 'Wendot said they fear he might have been hijacked and killed by armed bandits from a neighboring community.', ""The chief's death has raised fears of the escalation of retaliatory attacks in Baringo and Laikipia counties."", 'Mochongoi in Baringo South and the border of Laikipia were tense on Thursday following the mysterious killing of the chief.', 'Baringo county commissioner Peter Okwanyo denied claims the administrator had been booked for arrest.', '""We were not aware of this,"" he said, noting he only ordered the arrest of chiefs Philip Aremo of Korosi location and Samson Kala of Amaya location.', 'The two are linked to cases of frequent bandit attacks in the region.', 'Paka sub-location chief Musa Dike also went missing after he was allegedly arrested by people posing as police officers.', ""He was last seen at Ng'inyang in Baringo East last Thursday."", '\n']"
http://www.the-star.co.ke/news/2017/07/20/caroli-omondis-brother-goes-up-against-mbadi_c1600176,Caroli Omondi’s brother goes up against Mbadi,www.the-star.co.ke › Local News › Nyanza,"Jul. 20, 2017, 2:00 am","['Peter Ocholla, the brother of former PM Raila Odingas Chief of Staff Caroli Omondi, is out to wrest the Suba South MP seat from ODM chairman John Mbadi (pictured). He is running on the Ford Kenya ticket. Ocholla yesterday said Mbadi does not deserve to be reelected. Its difficult to give Mbadi another term after his dismal performance. The majority of residents still lack water, he said. Ocholla, who was accompanied by Omondi, told residents he will make their lives better if elected. Omondi lost to Mbadi in the ODM primaries. He urged voters to back his brother.', '\n']"
http://www.the-star.co.ke/news/2017/07/20/two-missing-after-lamu-al-shabaab-attack-found-dead_c1600997,Two missing after Lamu al Shabaab attack found dead,www.the-star.co.ke › Latest News,"Jul. 20, 2017, 3:00 pm","['The bodies of two people who went missing in Mararani village, Lamu county, on Wednesday have been found.', 'The bodies which had gunshot wounds were found by police officers at Sankuri in Basuba ward on Thursday.', 'It is suspected they were dumped in the area by al Shabaab militants.', 'The two were heading to Mararani from Kiunga at the time they were reportedly abducted. ', 'Sankuri is almost 3km from Ota, where a police lorry ran over a landmine on June 28, leaving four officers and four pupils dead.', 'The bodies were taken to Mararani for burial.', 'Residents reported hearing gunshots that lasted about an hour at around 6pm on the day the two people went missing.', 'Locals had earlier reported that the two could not be found and that their phones had been switched off.', 'This comes a day after Linda Boni Operation director James Seriani was moved and replaced by Lamu county commissioner Joseph Kanyiri. ', 'Seriani led the operation since it was launched by the late Interior CS Joseph Nkaissery in 2015.', 'The government has issued severe warning against al Shabaab saying they will be killed just as they are killing members of the public.', '\n']"
http://www.the-star.co.ke/news/2017/07/20/backing-nasa-is-like-flogging-a-dead-horse-kitui-aspirant-says_c1599216,"Backing NASA is like flogging a dead horse, Kitui aspirant says",www.the-star.co.ke › Local News › North Eastern,"Jul. 20, 2017, 2:00 am","[""Kitui Central residents should back President Uhuru Kenyattas reelection because if the vote for NASA's Raila Odinga, they risk remaining in the opposition abyss for the next five years."", ' ', 'Jubilee MP nominee Moses Banda said backing NASA is like ""flogging a dead horse"", as Uhuru will win the August 8 General Election.', ' ', 'The safest bet for Kitui people is to join him in the Jubilee bandwagon, he said.', ' ', 'Kambas must not follow the euphoria associated to NASA political alliance and lose the chance in the next government of President Uhuru Kenyatta. There is neither pride or gain in being outside the mainstream government,"" Banda said.', ' ', 'He spoke on Monday in Iloi village, Kitui township ward, as he sought to popularise his bid and campaign for Uhuru.', ' ', 'The aspirant has pledged to deliver at least 10,000 votes from the constituency for the President.', ' ', 'Banda asked Kitui Central residents to shun the appetite for cash handouts that have over the years allegedly seen them elect unworthy leaders.', ' ', '""People are poor because they have accepted cash handouts from dishonest politicians who later obsess with recouping the money they give out at the expense of serving voters,"" he said.', ' ', 'Banda urged residents to vote for him for a structure-based leadership where they will have a say in decision-making and managing resources.', ' ', '""I will form development committees in each of the villages in Kitui Central. The committees of between 20 and 30 people will be all-inclusive. The professionals, the elderly, people living with disability, youth and women will be integral parts of these committees,"" he said.', ' ', ""Banda said his leadership will breed a culture of transparency where decisions on the use of funds, including CDF, women's and youths funds, and bursaries will be decided by the people."", '\n']"
http://www.the-star.co.ke/news/2017/07/20/australian-university-seeking-to-enroll-professional-students_c1600318,Australian university seeking to enroll professional students,www.the-star.co.ke › Business › Local,"Jul. 20, 2017, 1:00 am","['Australias Edith Cowen University will next week hold a student recruitment week in Kenya to provide students with opportunities to further their studies in the top university.', '\n', 'ECU Week will be conducted in partnership with Australian Education Consultants between July 26 and 28 and showcase some of the varsitys schools including arts and humanities, business and law, engineering, nursing and midwifery and science.', '\n', 'ECU are hoping to link their academics with local education institutions with the view to forming associations for collaborative research and, or recruitment from colleges to undergraduate programmes or undergraduates to masters programmes at ECU, AEC director Mahul Shah said in a statement.', '\n', 'During the ECU Week academic staff will be showcasing areas of university studies and provide the Kenyan professional community with an opportunity to participate in seminars and workshops. ', '\n', 'AEC represents 33 universities and 31 colleges and is the largest and oldest student recruitment agency for Australia in Africa.', '\n', 'The agency assists at least 500 students annually from Kenya to further their studies in Australia.', '\n']"
http://www.the-star.co.ke/news/2017/07/20/nigerian-court-orders-seizure-of-former-oil-ministers-sh39b-property_c1601029,Nigerian court orders seizure of former oil minister's Sh3.9b property,www.the-star.co.ke › Latest News,"Jul. 20, 2017, 3:00 pm","['A Nigerian court has ordered that a $37.5 million (Sh3.9 billion) property owned by former oil minister Diezani Alison-Madueke be seized, the state news agency said, as she faces charges of corruption and money laundering.', 'The US Justice Department filed a civil complaint last Friday aimed at recovering about $144 million (Sh15 billion) in assets allegedly obtained through bribes to Alison-Madueke, petroleum minister from 2010 to 2015 under the presidency of Goodluck Jonathan.', ""Alison-Madueke's whereabouts are unclear, but she was last known to be in Britain."", ""In April, she was charged in absentia with money laundering by Nigeria's financial crimes agency. She had previously denied to Reuters any wrongdoing when questioned about missing public funds and corruption allegations."", ""On Wednesday the Federal High Court in the commercial capital Lagos issued the order over Alison-Madueke's property in the city's upmarket Banana Island district which she bought in 2013, the News Agency of Nigeria (NAN) said."", 'It also ordered a temporary freeze on sums of $2.74 million (Sh284.8 million) and 84.54 million naira ($269,000, Sh27.9 million) that were said to be part of the rent collected on the property.', 'The temporary seizure orders were made following an application to the court by the Economic and Financial Crimes Commission (EFCC).', 'Anselem Ozioko, the barrister representing EFCC, told the court that the financial crimes agency suspected the property was acquired with the proceeds of alleged illegal activities. ', '\n']"
http://www.the-star.co.ke/news/2017/07/20/muranga-keeps-eye-on-four-towns-over-cholera-alert_c1600224,Murang’a keeps eye on four towns over cholera alert,www.the-star.co.ke › Local News › Central,"Jul. 20, 2017, 1:00 am","[""Public health officials in Murang'a county are on the look-out, following\nseveral cases of cholera that have been reported in Nairobi."", 'Two weeks ago, a patient in Kabati town tested positive for cholera.', ' ', ""Four towns in which the disease was previously reported have now been put\nunder strict surveillance to control a break-out if it occurs. The towns are Kabati, Kenol, Maragua and Murang'a."", ' ', 'County public health officer John Mwaniki said the department has started inspecting eateries in the seven subcounties and\noutlawed hawking of food in towns.', ' ', 'Two years ago, two people died and hundreds were hospitalised in Kabati, Kandara subcounty, following a cholera outbreak.', ' ', 'The county government was forced to\nopen a makeshift medical camp at Nguthuru Dispensary as local health\nfacilities were overwhelmed by the sick, who continued\nto stream in every day.', ' ', 'Mwaniki said the department has started distributing 100,000 water purifying tablets in the county, and testing and certifying food handlers.', ' ', 'We have realised that some food\nhandlers have obtained their medical licences through unscrupulous means, he added.', ' ', 'Food hawkers\npleaded with the county government to allow them continue their trade, as it is their source of livelihood.', ' ', 'Joyce Wanja, a food hawker in\nMukuyu market, Muranga town, said majority of them have obtained all the\nrequired certifications to operate.', ' ', 'We prepare and sell our foods in a\nhygienic environment and I doubt they can cause any disease, she said.', '\n']"
http://www.the-star.co.ke/news/2017/07/20/rowdy-group-stones-jubilee-campaign-team_c1599876,Rowdy group stones Jubilee campaign team,www.the-star.co.ke › Local News › Nyanza,"Jul. 20, 2017, 2:00 am","['Youths allied to Jubilee in Kisii county were attacked by goons chanting pro-NASA slogans as they addressed supporters in Ogembo town.', ' ', 'The group led by Antony Kibagendi had pitched camp in South Mugirango, Bomachoge Chache and Bomachoge Borabu constituencies on Tuesday.', ' ', 'In Ogembo town, they received a hostile reception as a rowdy group stoned the Jubilee campaign caravan.', ' ', 'Kibagendi condemned the attack. He claimed that somebody in the opposition had paid the goons to attack them.', ' ', 'We will not be cowed. It is unfortunate that somebody paid goons to disrupt our peaceful campaigns, he said.', ' ', 'Jubilee county interim chairman Sammy Nyairo also condemned the incident, saying everybody is free to campaign in any part of the region.', ' ', 'Nyairo called on police to arrest the attackers.', ' ', 'He said the era of throwing stones was long gone and has no place in a civilised society.', ' ', 'It is primitive for somebody to pay people to disrupt a peaceful campaign. Im urging the police to track down the culprits, Nyairo said.', ' ', 'Jubilee presidential campaigns cordinator in Kisii and Nyamira counties Samuel Nyangeso also castigated the the attack.', ' ', 'Nyangeso called for peaceful campaigns in the remaining days before the election, saying chaos dont add value.', ' ', 'The group urged residents to elect Senator Chris Obure as governor, Charles Nyachae as senator and Doris Donya Aburi as the woman representative.', ' ', 'Kibagendi said the community was assured of development if it remained in government.', ' ', 'We are not leaving anything to chance in the few days left of the campaign period. We are going to move across the county to ensure that President Kenyatta and DP William Ruto are reelected, Kibagendi said.', ' ', 'He called on the youth to shun leaders who misuse them for their selfish political gain.', '\n']"
http://www.the-star.co.ke/news/2017/07/20/new-mombasa-roads-to-reduce-traffic-in-busy-city_c1600114,New Mombasa roads to reduce traffic in busy city,www.the-star.co.ke › National News,"Jul. 20, 2017, 12:00 am","['President Uhuru Kenyatta yesterday commissioned the construction of the long-awaited 11.3km Changamwe-Mariakani dual carriageway meant to ease congestion on the busy Mombasa-Nairobi highway.', ' ', 'Traffic at the Makupa Causeway, Changamwe roundabout, Jomvu, Miritini and Mazeras, along the highway, has been a nightmare for motorists.', ' ', 'Boost business, improve lives', ' ', 'Uhuru said the Jubilee administration is keen to open up Mombasa for increased business.', ' ', 'Our aim is to improve the lives of citizens by improving the economy. We are doing the work, he said in Changamwe.', ' ', 'The investment on infrastructure, especially at the port, will ensure Kenya favourably competes economically with other nations.', ' ', 'With the work we have done at the port, there will be no other port between Cairo and Durban that will be like the Mombasa Port, he said.', ' ', 'Youth in Mombasa have lacked jobs because of the poor infrastructure in the county.', ' ', 'Once these projects are complete, investors from China and other countries will camp in Kenya to do business and provide job opportunities for our youth, the President said.', ' ', 'The Sh6.1 billion dual carriageway, which will have six lanes from the Mombasa Island to Jomvu, and four lanes from Jomvu to Mariakani, will take approximately 30 months to complete, Transport CS James Macharia said.', ' ', 'The road handles 19,000 vehicles daily.', ' ', 'This project was long overdue. It is historic. For the first time we have a superhighway coming from Mombasa Island, Macharia said.', ' ', 'Interchanges will be constructed at Jomvu, Changamwe and Mikindani, the CS said.', ' ', 'Built many roads in Mombasa', ' ', 'Deputy President William Ruto said Airport-Changamwe-Mombasa Port road is 70 per cent complete.', ' ', 'The Jubilee government has invested at least Sh60 billion on roads in Mombasa, he said.', ' ', 'No other government has invested that much on roads in Mombasa county, Ruto said.', ' ', 'Next month, the government will start construction of a road that will connect Lunga Lunga with Miritini through the Dongo Kundu project, which will have two bridges, including a 1.4km bridge  the longest in East and Central Africa.', ' ', 'The tender for that road will be opened next month so that we can expand Mombasa, Ruto said.', '\n']"
http://www.the-star.co.ke/news/2017/07/20/devolution-best-gift-for-kenyans-aspirant_c1600049,Devolution best gift for Kenyans – aspirant,www.the-star.co.ke › Local News › North Eastern,"Jul. 20, 2017, 1:00 am","['Devolution is the best thing that has happened to wananchi as it has improved development at the grassroots and opened up opportunities for all Kenyans, Kangundo MP aspirant Kituku Nzioka has said.', 'We have seen what devolution can do. There has been hastened development in each county, he said.', 'The independent candidate spoke to journalists yesterday in Kangundo.', 'Nzioka said devolution is experiencing teething problems, which are expected as the county government bosses are learning on the job.', 'Some county governments started from scratch as they did not have any structures.', 'Nzioka said the 15 per cent of the national budget for devolution is insufficient and should be increased to at least 45 per cent.', 'He, however, criticised some governors and MCAs for taking advantage of devolution to loot public funds and derailing devolution.']"
