http://www.the-star.co.ke/news/2017/07/08/naivas-bets-on-food-chains-in-county-expansion_c1592916,Naivas bets on food chains in county expansion,www.the-star.co.ke › Business › Local,"Jul. 08, 2017, 12:00 am","['Naivas\nsupermarket is focusing on the food chain model as it plans to open seven new\noutlets in the country by the end of the year.', ' ', 'The\nexpansion plans will span three counties, including Nairobi, Kericho and Mombasa.', ' ', 'One such\nfood chain has already opened in Ridgeways, in Nairobi, at a cost of Sh250\nmillion.', ' ', 'The other\nsix food chains will each cost Sh100 million, funded by shareholders. The\ncompany said that the funds do not include loans.', ' ', 'There is\nvery high demand for food as population numbers soar. We have focused on\nopening these outlets in residential areas to make it convenient for shoppers,\nsaid Willy Kimani, Naivas chief operating officer, in an interview with the\nStar.', ' ', 'He said\nthe outlets will source fresh produce from local vendors. He said 60 per cent\nof the supplies will be fresh from the vendors, and will be packaged in Naivas branded\npackaging.', ' ', 'The rest of the supplies will be from manufacturers. Kimani said\nthe company resorted to the food chain model in order to meet the underserved\nneeds in the retail sector.', '\n']"
http://www.the-star.co.ke/news/2017/07/08/kenya-stun-uganda-to-qualify-for-u19-world-cup-2018_c1593245,Kenya stun Uganda to qualify for U19 World Cup 2018,www.the-star.co.ke › Sport,"Jul. 08, 2017, 12:00 pm","['The Kenyan bowling attack tore through Uganda dismissing them for a paltry 60 in 16.1 overs to set up the game for their batters.', 'With qualification coming down to net run rate, the Kenyans needed to chase the total down in 9 overs.', 'Needing 6.78 runs per over to win, the chase got off to a slow start as the hosts showed some sign of nerves. Thomas Ochieng took his team home in 8.3 overs to book their place in next years showpiece in New Zealand.', 'The Kenyans were made to work for their win against a spirited Ghanaian outfit while Uganda breezed past Botswana on Friday.', 'Kenya got off to a flying start with the ball as captain Sachin Budhia took 2 wickets in his first over. Ghana lost a further 3 wickets inside the first 10 overs and they never recovered.', ' They were eventually bowled out for 116 of 32.3 overs. Man of the match Sachin Budhia ending with impressive figures of 5/25 of 6.3 overs that included a maiden.', '\n']"
http://www.the-star.co.ke/news/2017/07/08/trending-the-siblings-who-stay-thrifting_c1591299,Trending: The Siblings who stay thrifting,www.the-star.co.ke › Sasa,"Jul. 08, 2017, 12:00 am","[""When you talk about Kenyan fashion mavericks, the first name that's likely to come up would be 2ManySiblings. But for those who still have no idea what those are, they are a sister-brother, post-street style duo made up of Velma Rossa and Papa Petit (also known as Oliver Asike)."", 'The street fashion duo has taken over the fashion scene by storm offering a fascinating collection of attires. Known for their fervent fondness for streetwear, they have gone an extra mile by packaging themselves as elements of art through photography.', 'Brilliantly diverse and innovative, the siblings have turned their absurd fashion statements into a phenomenon that many are now willing to emulate, offering a guide into street-style looks. For the duo, anything goes.', ""They've inspired a whole lot of youth to explore and boldly attempt something different and express their individuality. In some way, they have helped boost the sales of second-hand clothes, a major part of their wardrobe. "", 'A few years ago, when they started their popular Thrift Social installation, they could easily have passed for youngsters looking for unnecessary attention. But the show, which recently had its 12th edition, has grown to celebrate art, music and mostly fashion.', ""The event, whose success is owed to the sibling's brilliant concepts, is now one of Kenya's most anticipated shows. Every installation has a set theme that allows attendees to come up with their most innovative interpretation of the same. "", 'Their efforts have not been in vain as they continue to gain popularity around the world. Their shows, on different occasions, have been graced by sensational stars like South African creative Maitele Wawe, Belgian-born Petite Noir and Ghanaian DJ Steloo. It also attracts massive crowds of bloggers, models, entertainers, designers and artists.', 'As the siblings continue to advocate for individuality and thrifting, we expect them to continue bringing new ideas and trends.', '\n']"
http://www.the-star.co.ke/news/2017/07/08/book-review-how-kenya-can-recover-lost-ground-and-achieve-prosperity_c1592739,Book review: How Kenya can recover lost ground and achieve prosperity for all,www.the-star.co.ke › Siasa,"Jul. 08, 2017, 12:00 am","['THE QUEST FOR NATIONHOOD: ROADMAP TO OUR FUTURE', ' ', ' ', '132pp; 2017', ' ', 'Mountain Top Publishers,\nNairobi, Kenya ', ' ', 'It is is often assumed that Kenyans know their society and their country. But when it comes to political and economic knowledge of our society, we are often very badly off.', 'In many cases, we are told by friends and the media what they feel we ought to know and think, and we accept this as the gospel truth.', 'Not everything we hear is wrong, but never was there a time when it was more important for us to keep an open mind, to ask critical questions and to seek objective answers, without bias from preconceived notions.', 'This book by Raila Odinga, a leading Kenyan politician and reformer, is written with an open mind to seek answers to and shed light on what has been happening in Kenya, politically, socially and economically, since Independence, and to suggest a better way forward.', 'The book is written in easily comprehensible and straightforward, flowing English. It is not intended as a stick with which to beat Railas political opponents. Instead, it offers enlightenment through analysis and reflection, and gives thought-provoking answers to the question on the lips of almost every Kenyan today: Where did the rain start to beat us?', 'Railas analysis wades into history, uses similar experiences elsewhere to compare and contrast what has happened to us, and goes on to point out what we need to do to restore the deferred  not lost  dream we had at Independence, when we were full of optimism, hope, and faith in a bright future. ', 'The National Anthem we sang, as the Union Jack was lowered by the Duke of Edinburgh and our National Flag was raised by Jomo Kenyatta at midnight on December 12, 1963, was an anthem of faith in ourselves and commitment to our collective future in a society that fervently desired justice, peace, unity, liberty and prosperity, everywhere within our borders.', 'What happened to that dream? The dream is not lost. It is only deferred  thanks, as Raila points out, to those who have consistently struggled to recapture that old hope and optimism, and to build a democratic, just, fair and prosperous society.', 'He and others have worked for many years to liberate the people of Kenya from the yokes of political oppression, economic exploitation and social marginalisation. In farms, workplaces, professional offices and even prisons, seeds of hope have always been sown and re-sown by patriotic Kenyans who believe that a better Kenya is possible: The Kenya we deserve.', 'But this book is not about Raila per se or about any individual. It is about lost opportunities, and about the solutions Raila suggests will steady us as we regain our footing and reset ourselves on the path to prosperity.', 'The 2010 Constitution finally addressed these issues and laid down broad principles for lawmaking that would ensure equitable development, social justice, respect for human and peoples rights, the rule of law and devolved government.', 'Yet even with our new Constitution, things are not going well. Raila goes deeper to analyse what historically has been ailing our society, and where intervention is needed even under the new Constitution for universal life-enhancement.', 'He presents persuasive examples of other countries that have developed much faster than we have, and why this has been so. Even some of our peers in Africa are overtaking us, despite the fact that we had a good head start. Raila points out that, besides making the right economic choices in terms of trade and investments (which Kenya has not always done), these choices must be made on the solid bedrock of a society that is politically more equitable, just and inclusive, and these attributes can come only from good governance. The point is effectively made and well-illustrated. Amilcar Cabral, the revolutionary who sacrificed his life for the liberation of Cape Verde and Guinea Bissau, once said, Revolutionaries dont fight to liberate their societies because of the good and noble ideas they have in their heads. They do so to change the lives of the ordinary people for the better.', 'I remember the dark days of the Moi regime, when we used to meet clandestinely for hours, analysing the situation in Kenya and what we could do about it. This book offers some answers to those still pertinent questions, analysing why we are where we are today, where we ought to be, and the road we need to travel to build the Kenya we deserve. One point Raila makes is that the new Constitution is not the alpha and omega for solving all our political, social and economic problems. No Constitution can do that, because any constitution is only as good as its implementation.', 'Our colonial-inspired Independence Constitution was basically a document of convenience for the handover of power from the colonials to Kenyans. It was never approved by the Kenyan people  only by some of our leaders in London, who knew that they would alter it as soon as they could. And so it happened.', 'Based on the colonial system of control and repression, that early Constitution was radically changed many times over the ensuing years  not to improve it but to increase the power of the presidency and authoritarian rule. And it is this that has been at the centre of our political and economic woes.', 'As I have said, any Constitution is only as good as its implementation. And, unfortunately, we have seen this limitation in action since 2013, as the President has sought to sign into law Bills passed by the National Assembly but not debated in the Senate  in total contravention of the Constitution but typical of previous imperial presidents, who cared little about constitutions and law and order when they were defending their own interests.', 'At talks during the making of the new Constitution, Kenyans from all walks of life unanimously declared this imperial presidency the enemy of the people.', 'Raila makes a strong case, with carefully thought-out and clearly presented reasoning, for a parliamentary, rather than a presidential, system of government. He outlines why this would be a far better choice in upholding, implementing and securing the principles of good governance under our progressive Constitution.', 'His argument is compelling in persuading that this is a very serious consideration if we are ever to change the despair-ridden repetition of our countrys history.', 'Once again, his argument is not made dogmatically. He illustrates it with diverse historical examples, all of which shed greater light on the issue and put it into clear perspective.', 'This book is published just before the August 8 General Election, in which Raila is the presidential candidate for the National Super Alliance, a coalition of several political parties.', 'The books content clearly demonstrates that the candidate is focussed not merely on achieving state power but more importantly on what he and his administration should do with that power to turn Kenyas fortunes around. ', 'Raila is widely read and a deep philosophical thinker. Armed with an arsenal of knowledge from his reading and from his experience, he makes clear in his Little Orange Book the old pathways and roadblocks that Kenyans must leave behind, and the new paths they must take to achieve positive change for all.', 'Very competitively priced at Sh100, this elegantly produced and handily pocket-sized volume is a must-read for all Kenyans who care about our collective future. ', '\n']"
http://www.the-star.co.ke/news/2017/07/08/nasa-is-funded-by-cartels-who-want-to-rob-kenya-says-tuju_c1592964,"NASA is funded by cartels who want to rob Kenya, says Tuju",www.the-star.co.ke › National News,"Jul. 08, 2017, 12:00 am","['Sources funding the NASA presidential campaigns are causing jitters with the Jubilee side now claiming the opposition had struck a deal that would see the funders benefit from government projects after they take power.', 'This comes after a week of altercation between the Deputy President William Ruto and NASA co-principal Kalonzo Musyoka each denying being the first to associate with Jimi Wanjigi.', 'Kalonzo claimed Wanjigi was allied to the Jubilee government and even bankrolled the UhuRuto campaigns in 2013.', 'However, Ruto dismissed the claims, terming Wanjigi a corrupt man with heavy financial war chest that he made through shoddy deals.', 'Speaking at the Jubilee headquarters, secretary general Raphael Tuju hit out at the opposition, saying it was funded by individuals who had cut shoody deals to benefit them after they take office. Our country is on the brink of being ruined by a cartel, Tuju (pictured) said.', 'He said Wanjigi was a shadow beneficiary who benefitted from the Anglo Leasing and the Goldenberg scandals.', 'NASA is captive to corruption. Kalonzo Musyoka recently introduced Jimi Wanjigi as a prominent businessman. Can he tell Kenyans what business he does? Tuju said. He continued, They have prepared two manifestos - one to help the cartels funding them benefit from the taxpayers money. Speaking during the briefing Elgeyo Marakwet Senator Kipchumba Murkomen acknowledged that Wanjigi was a supporter of the Jubilee government in 2013.', '\n']"
http://www.the-star.co.ke/news/2017/07/08/video-uhuru-appoints-matiangi-acting-interior-cs-describes-nkaissery_c1593197,"[VIDEO] Uhuru appoints Matiang'i Acting Interior CS, describes Nkaissery as best performer",www.the-star.co.ke › Latest News,"Jul. 08, 2017, 9:00 am","['\n', '\n', '\n', '\n', '\n', '\n', '\n', '""We were discussing issues as late as 9:30 pm last night on peace and security of this country among Kenya\'s preparedness for Junior Athletics which commences in a few days,"" Uhuru said in a live broadcast to the nation. ', '\n', '""I send my condolences to his wife and children, his friends and the Maa community. I call on Kenyans to uphold peace in this difficult time. More details will be given on this untimely death,"" the President added.', '\n', 'Uhuru called on Kenyans to stand united as the results of the post-mortem are released.', '\n', '""His death comes at a critical time as we approach the general election. We assure all Kenyans that the nation is secure and our security forces are doing all they can to ensure our security,"" President Uhuru said.', '\n', '\n', '\n', ' ', '\n', ' ', '\n', ' ', '\n']"
http://www.the-star.co.ke/news/2017/07/08/ill-save-kenya-from-jaws-of-oppression-raila-says_c1592798,"I’ll save Kenya from jaws of oppression, Raila says",www.the-star.co.ke › National News,"Jul. 08, 2017, 12:00 am","['NASA presidential flagbearer Raila Odinga has pledged to continue of the fight of liberating Kenya from the jaws of oppression if he clinched the presidency next month. ', 'Speaking during a campaign rally at Kamukunji in Nairobi, Raila said that his team is will unite all Kenyans and address the plights of the citizens. ', 'He accused President Uhuru Kenyattas administration of failing to fulfi ll the dreams of the countrys forefathers by neglecting former free- dom fi ghters who fought for Kenyas independence.', ' Just like at Saba Saba, Kenyans have finally united and recognised that all communities are in the same precarious boat. Belonging to the presidents or deputy presidents communities has not brought you any security against destitution, said Raila.', ' He continued And so God will- ing, Nane Nane next month will also enter the national vocabulary as the beginning of a new era which united the entire nation and led us to a gen- uinely shared prosperity through our vast NASA coalition. ', 'Raila who was accompanied by his running mate Kalonzo Musyoka and NASA co-principals Musalia Muda- vadi and Moses Wetangula expressed optimism that they will dislodge the Jubilee government from power during the August 8, General Elections.', ' He accused President Kenyatta and his deputy William Ruto of entrenching dictatorship and detribalis- ing the countrys economy by failing to curb corruption. ', 'Jubilees disastrous reign will surely end next month. It is so utterly out of touch with the suffering of ordinary Kenyans that its manifesto last week offered a continuation of its policies, which have brought most of us to ruin, he said.', ' He said that many Kenyans have died along the journey of achieving democracy. ', 'Many of us were arrested and others killed. ', 'That is why we want to implement the dreams of our forefathers when we acquire power, he said. Kalonzo said that once it wins the next polls, NASA will form a just government that will deliver services to all Kenyans.', ' The third and the last liberation of this country has come. We have put in place clear policies to enable us run the next government smoothly, said Kalonzo.', ' At the same time, Raila appointed Machakos Senator Johnstone Muthama, Nairobi Governor Evans Kidero and his deputy Jonathan Mueke as heads of Nairobi county NASAs campaign secretariat.', '\n']"
http://www.the-star.co.ke/news/2017/07/08/pick-one-hopeful-for-seats-nasa-urged_c1592799,"Pick one hopeful for seats, NASA urged",www.the-star.co.ke › Local News › Rift Valley,"Jul. 08, 2017, 12:00 am","['Wiper leader Kalonzo Musyoka now wants his NASA co-principals Raila Odinga and Isaac Rutto to intervene over coalition aspirants seeking the same seats in the same counties.', 'Kalonzo has warned the coalition stands to lose some of the top seats if the aspirants race against each other. He said this will give Jubilee a head start in the General Election.', 'Kalonzo cited Narok, where CCM and ODM governor candidates are running against each other, giving incument and Jubilee nominee Samuel Tunai an advantage.', 'One of our candidates should step down otherwise Tunai will beat them and we do not want this as he has failed to deliver, he said.', 'Kalonzo spoke in Sampulai, Narok county, yesterday when he endorsed Wiper vice chairman Martin ole Kamwaro for Narok North MP.', 'He also endorsed Patrick Ntutu (CCM) for the Narok governor seat. Kamwaro said Wiper should be well represented in Narok. He said the constituency has been abandoned and has poor roads and farmers are unable to transport produce.', 'Kamwaro said it is time the community gets justice for past and present marginalisation from the previous and current governments.', 'CCM Narok woman representative candidate Lydia Ntimama lashed out at her ODM colleagues for thinking NASA belongs to them.', 'She said the party has five equal partners, and each should be given an opportunity to sell its policies. ODM members think they are superior. Failing to involve all members could cost us some of the top seats we seek, Ntimama said.', '\n']"
http://www.the-star.co.ke/news/2017/07/08/dealer-accused-of-fraudulently-evading-to-pay-sh46m-duty_c1592914,Dealer accused of fraudulently evading to pay Sh4.6m duty,www.the-star.co.ke › National News,"Jul. 08, 2017, 12:00 am","['A motor vehicle dealer was on Friday charged in a Nairobi court with fraudulent evasion of payment of duty amounting to over Sh4.6 million.', 'Ezekiel Rotich Kiplagat who is facing other several criminal cases denied the charge before Milimani senior principal magistrate Martha Mutuku.', 'The court heard that on May 15 2017 at National Bank of Kenya, the accused jointly with others already before court, fraudulently evaded the payment of duty amounting to Sh4,639,493 to the Commissioner of Customs for the imported vehicle vide entry No.2017MSA 6445589 dated April 26 2017.', 'The prosecution informed the court that the Rotich case would be consolidated with another similar case pending before another court.', 'He was granted him a bond of Sh1 million with a similar surety or cash bail of Sh500,000 pending the mention of the case on September 14.', '\n']"
http://www.the-star.co.ke/news/2017/07/08/maa-community-in-shock-after-nkaisserys-abrupt-death_c1593182,Maa community in shock after Nkaissery’s abrupt death,www.the-star.co.ke › Latest News,"Jul. 08, 2017, 9:00 am","['Grief has engulfed the entire Kajiado County following the unexpected death of Interior CS Joseph Nkaissery early this morning.', ""At his rural Bissil home, Kajiado Central sub-county, members of the Maa community who spoke to the Star said they are yet to come to terms with the news of their leader's demise."", 'Nkaissery, 67, died a few hours on Saturday morning after being admitted at the Karen Hospital.', ' ', 'The CS was scheduled to address a stalemate between the police and members of Keek-Onyokie herders.', '\n']"
http://www.the-star.co.ke/news/2017/07/08/movie-review-who-killed-tupac_c1590790,Movie Review: Who killed Tupac?,www.the-star.co.ke › Sasa,"Jul. 08, 2017, 12:00 am","[' ', '\n', 'Whilst the film tries desperately to tell the story of how one man became a legend, the audience attention is far preoccupied with the man playing the legend. Demetrius Shipp Jr makes his acting debut as Tupac. Shipp is not only the spitting image of Tupac; hes also the main reason why the film was not a flop. His performance is engaging as he embraces the passionate style of the late rapper. Like in many biopics produced without the involvement of the original persons, this film doesnt really unveil anything new or answer the age-old question: who killed Tupac?', '\n', 'Theres nothing better than watching a discussion on talk shows, watching the hosts give a variety of opinions and most importantly we wait for the dramatic moments when the hosts debates turn wild! For instance who cant remember the famous war of words between Rosie ODonnell and Elizabeth Hasselbeck on The View? If such a fight goes on on-screen, imagine what happens behind the scenes! Well we dont have to imagine any more. Thanks to Starr Jones, former host at The View, we can get a show that reveals all the cattiness that goes on off-screen. The show is loosely based on an all-female panel show like The View and The Talk.', '\n', 'The Lunch Hour is a show developed by long time journalist Maxine Robinson. On her panel is a Kibby- a former child star, Nina- a Pulitzer Prize winning journalist, Heather- a conservative and Mo- an eccentric comedian after Maxines job. The show is also produced by Maxines son Shawn. On screen the ladies are friends who have real conversations trying to empower other women but what happens behind the scenes is a whole other story. The drama between the women as they struggle to exist (or replace) each other is extremely hilarious. The show show is funny, satirical and sensational to watch.', '\n']"
