http://www.the-star.co.ke/news/2017/07/15/manifestos-nasas-proposal-for-radical-constitutional-change_c1596160,Manifestos: NASA’s proposal for radical constitutional change,www.the-star.co.ke › Siasa › Katiba Corner,"Jul. 15, 2017, 12:00 am","[' ', 'There is a tendency to treat party manifestos\nas a waste of time. Most Kenyans think\nthat no party is going to respect the manifesto if it wins. ', ' ', 'But they are  or should be  important. It is\nimportant that the voters have some idea of what parties promise. When a party\nis in government, its manifesto promises can be used as a mobilising tool,\nproviding a basis for demanding that it take certain action. And when the next\nelections come round, people should be asking whether the government actually\ndid what it undertook to do.', ' ', 'WHAT DO THEY HAVE TO\nDO WITH THE CONSTITUTION?', ' ', 'Our concern  for the purposes of Katiba Corner\n was with how far the manifestos show concern with and understanding of the Constitution,\nand a commitment to implementing it. Jubilee mentions it four times and the Thirdway\nAlliance Kenya 11. ', ' ', 'It is unnecessary to count the references in\nNASAs manifesto because it makes the Constitution central. Its foreword even\nsays, Even the most casual glance will not fail to notice that our platform is\nthe Constitution of Kenya 2010. We are the Coalition of the Constitution.\nThere is much emphasis on the national values, found especially in Article 10.\nIn fact, so familiar will this approach be to readers of Yash Ghais columns\nhere, that we feel obliged to make a disclaimer: No Ghais were involved in the\npreparation of the NASA manifesto!', ' ', 'We hope to return to some issues of the\nConstitution as revealed in the manifestos, whether explicitly or not, in some\nlater Katiba Corner. Here, however, we consider an issue that has attracted\nsome attention in the press. ', ' ', 'NASAS PLAN TO\nCHANGE THE SYSTEM OF GOVERNMENT', ' ', 'NASA proposes to amend the Constitution in a significant\nway, introducing what it describes as a hybrid system, as in the Bomas (National\nConstitutional Conference) draft Constitution. They say this would enhance\ncohesion, be more inclusive (as opposed to the current exclusive presidential\nsystem), give a chance to people from smaller communities to attain the highest\noffice in the country, and encourage power sharing. ', ' ', 'Bomas proposed what is usually called a\nparliamentary system. It would have been more like the system Kenya had in 1963\n before the first President Jomo Kenyatta decided that he wanted more power\nthan he had as Prime Minister, and persuaded Parliament to change the\nConstitution. ', ' ', 'In a parliamentary system, the people elect a\nparliament as we do now. But the head of government (the Prime Minister) is not\nseparately elected by the people. He or she must be a Member of Parliament (of\nthe National Assembly in our case). If one party gets more than half the seats,\nthat partys leader will be Prime Minister (PM). If necessary, the leader of (probably)\na large party may form a coalition or agreement with one or more other parties\nto ensure enough support. ', ' ', 'The really important characteristic of a\nparliamentary system is that the government remains in office only so long as\nit has the support of the peoples representatives in parliament. If a vote of\nno confidence is passed by parliament the PM must resign. The Bomas draft\nincluded this.', ' ', 'In most parliamentary systems, the ministers\n(now called Cabinet Secretaries) are also MPs. Bomas proposed that the\nMinisters would be members of the National Assembly, but that the Senate would\nhave to approve them. ', ' ', 'HEAD OF STATE IN A PARLIAMENTARY SYSTEM ', ' ', 'Parliamentary systems usually have a separate\nhead of state  a queen/king or president. Sometimes that head of state has no\nreal power, but formal functions only. Sometimes he or she has some powers that\nmight be used to exercise a bit of control over the government if they are\nbehaving unwisely or even becoming oppressive. The functions of the head of state are also usually thought to include\nbeing a national symbol of unity, and maybe a voice of reason and sound advice\nbased on personality, experience and moral authority. It can be useful to have\nsomeone to perform the ceremonial functions, leaving the PM to carry on the\nserious business of government.', ' ', 'Heads of state in parliamentary systems are (if\nnot hereditary) usually chosen by parliament. The Bomas draft was a bit unusual\nbecause it proposed that the president should be directly elected by the\npeople. This is the arrangement in Ireland, where it is felt that this gives\nthe President some extra strength as the peoples choice, even when the legal\npowers of the office are not great.', ' ', 'Bomas also would have given the President some\nextra powers. She [why not?] would have had the power to propose to the\nNational Assembly a vote of no confidence in the Prime Minister. She would\nannually address Parliament on the progress achieved in the realisation of the\nnational goals and values. She would have annually reported to Parliament on\nhow far the country had achieved its international obligations these would be\nmostly about human rights and the environment. She could have proposed new laws\nto Parliament. ', ' ', 'All these functions would give the President\nthe power to make his or her own decisions or judgments, not just to do what\nsomeone else says. They are quite unusual. But they do not go to the extent of\nallowing the President to make governmental decisions. They are all about\nhelping to keep the government, and parliament, on the right track  checks and\nbalances. For this reason it is not quite correct to describe this as a hybrid\nsystem as NASA does. That description is better reserved for systems like the\nFrench where the Prime Minister and the President both make decisions about\ngovernmental policy and action. ', ' ', 'The Constitution of Kenya Review Commission,\nBomas and the Committee of Experts all proposed a system rather like this. You\ncan see why NASA might favour it. A political party in the current Kenyan context\nis unlikely to form government alone. It will either be a sort of composite\nparty, or form a coalition after elections. With a parliamentary system it\ncould offer important roles for people from these various, ethnic groups  the Bomas draft included\ntwo Deputy Prime Ministers as well as fifteen to 20 ministers plus deputy ministers.', ' ', 'Another possible benefit is that the system\nfocuses less on the single top dog role of President, perhaps making\nelections less of a do-or-die affair.', ' ', 'SO WHY IS THIS NOT\nTHE SYSTEM WE HAVE? ', ' ', 'Partly, people find it hard to imagine a\ndifferent system and perhaps they saw this as something unusual (though\nparliamentary systems are found in over 60 countries in the world). After the\nnational coalition government of Mwai Kibaki and Raila Odinga following the 2007-08\npost-election violence, people seemed less enthusiastic about a parliamentary\nsystem. ', ' ', 'The Parliamentary Select Committee reviewing\nthe Committee of Experts draft actually changed a basically parliamentary\nsystem to the current US-style presidential one. And, though we do not know the\ndetailed dynamics of that meeting, it seems clear that ODM went along with it \nand cheerfully. The suspicion was that they then believed that ODM could win\nthe presidential prize. This was despite what had seemed to be the life-long\ncommitment to a parliamentary system of people like Raila , and even of our\ncurrent Deputy President, as he professed at a meeting during Bomas.', ' ', 'CONCLUSION', ' ', 'It must be clear that Yash Ghai has tended to\nfavour a parliamentary system. It does not necessarily follow that it makes\nsense to make another radical constitutional change at this stage. Sometime the\nimportant thing is to make the constitution you have work rather than to try\ntinkering with it.', ' ', 'And  a word of warning: It is not unusual for\npeople who have argued, even fought, for a new system of government, to change\ntheir minds if they manage to get into power under the old, once maligned\nsystem. After\nall, they seem to think, if they got into power through this system, maybe its\nnot so bad!', '\n']"
http://www.the-star.co.ke/news/2017/07/15/kenyas-jeruto-and-wambui-through-to-800-metres-fi-nal_c1597341,Kenya’s Jeruto and Wambui through to 800 metres fi nal,www.the-star.co.ke › Sport › Sports Local,"Jul. 15, 2017, 12:45 am","['Lydia Jeruto and Jackline Wambui cruised to the 800m final after winning their respective heats yesterday.', 'Jeruto clinched Heat 1, where she ran a tactful race to post 2:10.47 ahead of Polands Milena Korbut, who finished second in 2:11.31 and Lena Kieffer of Luxembourg, who placed second in 2:11.95. Zimbabwes Vimbayi Maisoreva (2:12.08), Israeli Sivan Auerbachand Turkeys Tugba Toptas (2:12.390 completed the top six places.', 'Wambui was in good form in Heat 2, fending off the challenge of Ethiopias Hirut Mesheba in the final 50 meters to top the race in 2:14.18 with Mesheba second in 2:14.45. Moroccos Chamaine Ismaili grabbed the qualifying spot after placing third in 2:14.80. Slovenias Kiara Lukan (2:15.51) and Monica Saltenyte of Lithuania (2:15.85) followed in that order.', '\n']"
http://www.the-star.co.ke/news/2017/07/15/determined-as-they-are-to-rig-jubilee-must-be-stopped_c1595572,"Determined as they are to rig, Jubilee must be stopped",www.the-star.co.ke › Siasa,"Jul. 15, 2017, 12:00 am","['The first US President after independence was elected in 1789. At the time, only White men who owned property could vote. But the 15th, 19th and 26th Amendments to the Constitution have since expanded the right of suffrage to all citizens over the age of 18. Presidential elections take place every four years, and the campaigns and the polls have evolved into a series of fiercely fought, and sometimes controversial, contests.', 'However, in none of these elections has there been violence associated with the outcome, not even in 2000, when many believed George W Bush rigged out Al Gore, mad as heck as was many a voter across the nation when the US Supreme Court granted Bush the victory.', 'Thats what you call a mature democracy: Flawed as it may be in all other respects, including presently having produced a president many, both within the country and across the globe, continue to scratch their heads wondering why.', 'Its a mature democracy nonetheless and so are others, where the will of the people as expressed by the majority is respected and held sacrosanct.', 'To be sure, the only one time peaceful transfer of power in the United States was threatened was late last year, when then presidential Republican candidate Donald Trump saw signs of impending loss and upped his ante in attacking the courts, and started blatantly lying that the only reason he would lose was because the elections were rigged against him, which was false and a made-up lie as one can be.', 'The reason he did this  as many rightly concluded  was because he was prepared to reject the loss and refuse to concede to his opponent Hillary Clinton, likely causing an outbreak of violence across the nation from among his mob of followers, many who were and are still armed to the teeth.', 'The country was spared the violence because Trump won in the unlikeliest of circumstances, and the country and the world is now suffering his presidency, short-lived as it might be.', 'Unfortunately, our beloved Kenya does not have a long history of peaceful transfer of power. Rather, what we have are presidents who cling to power until death does them apart as was the case for Jomo Kenyatta, or term limits as was the case for Daniel Moi and Mwai Kibaki.', 'President Uhuru Kenyatta now faces an angry and impoverished electorate that wants him out like yesterday but every indication is this man, like his father, Moi and Kibaki, is not interested in giving up power till death or term limits do him apart.', 'Every indication this far is that he is prepared to mobilise the state machine to rig himself back into office and, worse, unleash state forces to crush any attempt to protest his evil doing and if that means plunging the country into a civil war we avoided in 2008, so be it. This is according to what we can clearly read from his actions.', 'This is a looming tragedy that can only be avoided by the happenstance of three things:', 'First is for NASA leadership to remain strong, unwavering and committed to liberating the country from the bonds of corruption, impunity and economic suffocation.', 'Second, massive turnout of voters aligned to NASA to send a strong message to Uhuru that his time is up and, more importantly, let him and his henchmen not even think about rigging this election.', 'Third, the Supreme Court will be our last chance and only hope of preventing the country from plunging into a civil war were Uhuru and his henchmen to be reckless enough to try and force themselves back to power upon rejection at the polls.', 'In other words, the will of the people as expressed by the majority of those who will vote on August 8 must be respected and held sacrosanct, the absence of which shall be an outcome those ignoring or suppressing it will surely regret.', '\n']"
http://www.the-star.co.ke/news/2017/07/15/death-toll-6-as-3-more-bodies-are-found-after-shabaab-attack_c1597001,Death toll 6 as 3 more bodies are found after Shabaab attack,www.the-star.co.ke › Local News › Coast,"Jul. 15, 2017, 12:00 am","['The death toll in the latest al Shabaab terror attack in Lamu has risen to six.', 'That brings to 15 the death toll in Lamu terror attacks in seven days. On July 7 nine people were beheaded.', 'Al Shabaab have been intensifying their attacks in Lamu and elsewhere in the run-up to the August 8 General Election.', 'It is feared that frightened voters will not cast ballots.', 'In the latest attack on Thursday, Public Works PS Mariam El Maawy was kidnapped, wounded and suffered burns.', 'She was recovering on Friday in Nairobi after her rescue by KDF soldiers in a fierce firefight with 30 militants.', 'Her nephew, trainee pilot Arif Kassim, 21, is among the dead, according to an administrator who spoke on condition of anonymity.', 'His body was among three found on Friday at the Mpeketoni Subcounty Hospital in Lamu West.', 'That brought to six the death toll from the 3pm road attack at Milihoi.', 'The two other bodies are believed to be those of police officers, including the PSs personal bodyguard.', 'Kassim had been reported missing shortly after the attack. He had accompanied Maawy on her road trip to Witu, where she was to meet families displaced by terrorism. He was to complete his pilots course this year.', 'We are making burial arrangements at Aris home in Mokowe, the administrator said.', 'Meanwhile, unconfirmed reports indicate two bodies are those of KDF officers killed on Thursday as they rescued Maawy.', 'Police and military bosses have refused to comment on the reports.', 'Lamu county commissioner Joseph Kanyiri and Linda Boni Operation director James Seriani declined to comment.', 'Reports indicate that PS Maawy was not the target but was travelling in the vehicle that was attacked.', 'The PS was shot in the legs, shoulders and in the hands and abandoned, when the terrorists discovered they were being pursued by the KDF. She also suffered burns.', 'Their Pajero was hijacked and torched.', 'When contacted earlier, Seriani dismissed reports anyone was missing. He also denied that six KDF soldiers who rushed to rescue the PS died in a fierce exchange of fire.', 'Nobody is missing. No KDF officer was killed. Only two civilians were killed. No security officers were killed, Seriani had texted.', 'The operation to pursue the al Shabaab militants has been intensified. The terrorists fled into Boni Forest, their hideout.', 'On July 7, al Shabaab militants beheaded nine people in Lamu.', 'On July 5, Shabaab gunmen raided Pandanguo in Lamu county.', 'On June 16, four people died and 11 were injured in Mandera county when their PSV ran over an explosive.', 'On June 10, two Kenyans were publicly executed by al Shabaab in Bula Fulay village in Somalia for allegedly spying for Kenya.', 'The terrorists have moved south from Somalia, basing themselves in the vast Boni Forest from where they launch attacks and retreat.', 'Operation Linda Boni was launched in September 15 and despite repeated statements about success, it has failed to remove militants.', 'Kenya is now carrying out airstrikes in the forest.', '\n']"
http://www.the-star.co.ke/news/2017/07/15/im-alive-have-forgiven-my-social-media-killers-leonard-mambo-mbotela_c1597508,"I'm alive, have forgiven my social media 'killers' - Leonard Mambo Mbotela",www.the-star.co.ke › Latest News,"Jul. 15, 2017, 12:00 pm","['Veteran radio journalist Leornard Mbotela is alive, contrary to reports that he died in a road accident on Saturday.', ' ', 'Reports by social media bloggers indicated that Mbotela had died. Messages of condolences trickled after the false news spread.', ' ', 'But the journalist, famed for the ""Je huu ni ungwana"" show on KBC, said he is alive and has forgiven the person who started the rumors.', ' ', '""I forgive the person who crafted and peddled the false report that I perished in a road accident.""', ' ', '""He does not know what he is doing. May God forgive him,"" he said on live radio.', ' ', 'Mbotela said he is full of life adding: ""I thank God. I urge you to pray for me to live longer.""', ' ', ""The journalist said he has never received as many calls as witnessed after the 'bad rumour' spread."", ' ', '""International media houses all have called me to ascertain the accuracy of the online reports,"" he said.', ' ', '""I would like to confirm to KBC listeners, my fans and relatives that I Mbotela, I am alive currently speaking to you on radio.""', ' ', 'The bloggers, among them Cyprian Nyakundi, who also tweeted about his death apologised for the false information. ', ' ', '""If you had reposted the same story please delete and clarify that he is ok. Let\'s wish Mbotela a long life . He is a role model to many,"" Nyakundi said.', ' ', 'Abraham Mutai said: ""Again ladies and gentlemen, I apologise for incorrectly posting here about Leonard Mambo Mbotela. Errors are human. Mbotela is sound and OK.""', '\n']"
http://www.the-star.co.ke/news/2017/07/15/global-firm-moodys-gives-equity-bank-strong-rating_c1597159,Global firm Moody’s gives Equity Bank strong rating,www.the-star.co.ke › Business › Local,"Jul. 15, 2017, 12:30 am","['Local lender Equity Bank has the highest credit rating score of all Kenyan banks, says international rating agency Moodys Investors Service.', 'The global agency which assigns credit scores to companies, governments and municipalities based on their financial strength, gave Equity Bank a stable rating due to digital and agency banking initiatives that the lender has undertaken, that have in turn boosted profitability.', 'Moodys therefore expects that Equity Banks profitability metrics will remain strong, supported by its low cost funding, an increasing proportion of non-interest income, and an efficient cost structure with the extensive use of digital and alternative distribution channels, said Moodys in a release.', 'Equity Bank, on its part, said that the lender will continue with these strategies that are meant to make it navigate the tough lending environment.', 'The rating reflects the banks intrinsic credit strength, significant market size, acceptable risk management practices, profitable business model, prudent capital levels and support from its shareholders.', 'We continue to protect ourselves against slow business volumes by focusing on high margin plays and cutting on operational and funding costs, Equity Group chief executive officer James Mwangi said in a statement.', 'Moodys uses a rating scale that ranges from a high of Aaa to a low of C. The ratings provide investors with a system of grading by which to assess the creditworthiness of securities of a company or institution. Pension and other asset management firms are some of the investors that rely on credit rating scores to make investment decisions such as buying a companys stock or investing in corporate bonds.', 'Kenya Commercial Bank, Co-operative Bank are other Kenyan lenders that have been issued with credit ratings.', 'Other Kenyan companies that have been assigned ratings include Associated Steel Limited which recently received a stable rating from Global Credit Ratings of South Africa.', 'The credit worthiness of B1 means Equity Bank has capacity to meet its financial commitments.', 'However, adverse business, financial, or economic conditions are likely to impair its willingness to meet its financial commitments.', 'The highest grade of Aaa means extremely strong financial muscle while the least grade of C shows that the economy or firm is in default, hence very risky for investors.', 'The global credit rating agency has also assigned the bank Counterparty Risk Assessments of Ba3, global foreign-currency deposit ratings of B2 and b1 baseline credit assessments.', 'Locally, the bank has been assigned deposit ratings of Aa1 with a positive long term global deposit outlook, making it the best in the country.', 'Kenya Commercial Bank and Co-op Bank are ranked Aa2 on the Kenya national scale.', 'Moodys expects the banks profitability metrics to remain strong, supported by its low cost funding, an increasing proportion of non-interest income, and an efficient cost structure.', '\n']"
http://www.the-star.co.ke/news/2017/07/15/wanjala-promises-to-revive-projects-neglected-by-ababu_c1596846,Wanjala promises to revive projects neglected by Ababu,www.the-star.co.ke › National News,"Jul. 15, 2017, 12:00 am","['Former Budalangi MP Raphael Wanjala has promised to revive all his former projects neglected by MP Ababu Namwamba.', 'My CDF committee had allocated cash to buy land at Munani to build a primary school, but when the sitting MP took over from me in 2007, his CDF committee refused to implement it, he said.', 'Wanjala was addressing a rally at Munani trading centre on Thursday. Wanjala is trying to make a comeback.', 'Hes said even the Ruambwa-Mudembi rice irrigation scheme, which he launched, has failed to improve livelihoods.', 'I will turn the rice drier in Nadero village into a dispensary because Ruambwa residents have been trekking all the way to Ruambwa health centre in Siaya county for treatment, he said.', 'Wanjala was said he will move the rice drier closer to the rice fields. ', 'He said if elected he will allocate money to buy land for a secondary school.', ' Our children after sitting the KCSE exam are forced to seek admission in Siaya schools due to lack of a secondary school nearby. I will build one.`', '\n']"
http://www.the-star.co.ke/news/2017/07/15/girl15-dies-at-park-after-legal-high-reaction_c1597563,"Girl,15, dies at park after 'legal high reaction'",www.the-star.co.ke › World,"Jul. 15, 2017, 6:00 pm","['A 15-year-old girl has died after suffering an adverse reaction from a suspected ""legal high,"" police said.', 'She was found unconscious at about 04:50 BST at Bakers Park in Newton Abbot, Devon, and died later at Torbay Hospital.', 'Two other girls were also taken to hospital as a precaution.', 'The substance has not yet been identified, said Devon and Cornwall Police. Anyone with information is asked to contact the force.', 'A spokesman said: ""Police currently believe that both girls had taken a new psychoactive substance, more commonly referred to as \'legal highs\', and had suffered adverse reaction.""', 'Investigations are continuing and a cordon is in place at the scene.', 'Last year Totnes teenager Nathan Wood died after after taking the psychoactive drug N-Bomb.', 'Police called on parents to ""speak to your children about the dangers of drugs and (formerly known as) legal highs"".', '""They can cause death even if taken just once.""', '\n']"
http://www.the-star.co.ke/news/2017/07/15/gunmen-attack-congo-wildlife-reserve-us-journalist-2-guards-missing_c1597622,"Gunmen attack Congo wildlife reserve, U.S. journalist, 2 guards missing",www.the-star.co.ke › World,"Jul. 15, 2017, 6:00 pm","['Armed men attacked a group of journalists and park rangers in a remote east Congo wildlife reserve overnight, and an American journalist and two guards were missing, a local official said on Saturday.', 'The group attacked comprised the American and two Irish journalists and 13 Congolese park rangers. They were in the town of Mambasa in Okapi Wildlife Reserve, Mambasa territory administrator Alfred Bongwalanga told Reuters by telephone.', 'The two Irish journalists and all but two of the rangers had been found and were safe, he added. (Reporting by Benoit Nyemba; Writing and additional reporting by Tim Cocks in Dakar; Editing by Hugh Lawson)', '\n']"
