http://www.the-star.co.ke/news/2017/07/20/leopards-gotv-shield-match-against-bidco-pushed-to-next-week_c1600191,Leopards’ GOtv Shield match against Bidco pushed to next week,www.the-star.co.ke › Sport › Sports Local,"Jul. 20, 2017, 2:00 am","['The GOtv round of 16 clash pitting AFC Leopards and Bidco United earlier scheduled for this weekend has been postponed to July 26 following an appeal by the former giants. ', 'According to Leopards chairman Dan Mule, they are without three of their senior players, who jetted out of the country for Spain Tour with KPL All Stars.', 'After securing a spot in the round of 16 courtesy of their 2-0 win over National Super League side, Nairobi Stima, the 2013 champions set a date with Bidco United who sunk Rainforest by a similar margin to settle for the must win clash in the round of 16.', 'Mule said their key playersVincent Oburu, Robinson Kamura and Victor Majidare with the KPL All Stars team in Spain. As you are aware Oburu, Kamura and Majid left for Spain and they are strong pillars in our squad. They are reliable members of the squad whose contribution is key and their absence would have impacted negatively if the match wasnt postponed. The game will be played on July 26th at Thika Municipal Stadium and we hope all our players will be ready.', 'He added: The three mean a lot to Leopards. Fast-rising Oburu is the joint top scorer in the tournament with five goals; Kamura dictates the back four with Majid filling in for the departed skipper Bernard Mangoli left. Their contribution has been phenomenal thus far, catching the attention of the KPL All Stars selection panelist and earning call ups with the national team. ', 'The game will also see Leopards head coach Robert Matano face his former immediate employers Bidco, where he served before decamping to the den.']"
http://www.the-star.co.ke/news/2017/07/20/no-sex-abstinence-does-not-win-elections-votes-do-ruto-tells-raila_c1600643,"No sex? Abstinence does not win elections, votes do, Ruto tells Raila",www.the-star.co.ke › Latest News,"Jul. 20, 2017, 9:00 am","['NASA should look for votes to win the August 8 election, not abstain from sex as this guarantees nothing, Deputy President William Ruto has said.', ' ', 'Opposition presidential candidate has told supporters to avoid intercourse on the eve of election day, as a requirement for going to ""war"".', ' ', ' ', 'But Ruto said: ""It doesn\'t matter whether you don\'t sleep...whether you don\'t have sex...whatever you want. You can\'t win the election if you\'ve not looked for votes.""', ' ', 'Speaking during an interview on the Capital Breakfast Show on Thursday, he noted that to win, NASA chiefs must sell their agenda.', ' ', '""If you don\'t have enough votes it doesn\'t matter how much you protect few votes...they will not help you win an election,"" the DP said.', ' ', 'Raila, his four co-principals and other Opposition politicians have declared they will do whatever it takes to guard their votes at polling stations.', ' ', 'The Opposition chief has vied and lost three times before and has often complained of rigging. He said he will not do so again but this has not be case.', ' ', ' ', 'Ruto said NASA leaders have ""driven themselves into a hole"" and made supporters believes the March 4, 2013 general election was rigged.', ' ', '""I really sympathise with our competitors. They lost the elections because their votes were fewer than ours.""', ' ', '""NO MIRACLES WILL HAPPEN""', ' ', 'The DP further said the Opposition should not just sit pretty and wait for miracles to happen on August 8.', ' ', 'He also advised that the National Super Alliance re-fashion its game plan before the polls.', ' ', '""We won the last elections fair and square and we expected our friends to begin there. The first thing they needed to do was admit that they lost the elections,"" he said.', ' ', '""...instead of coming to terms with the fact that they lost, they manufactured a lie that they lost because the elections were stolen. It is a lie. I want to tell them, \'gentlemen, please help yourselves\'.""', ' ', 'Last year, Raila gave an account of how the last general election was rigged, saying commissioners called him and made a confession.', ' ', 'The ODM cief said anomalies were noticed in records the electoral commission submitted following a court order.', ' ', 'He told the Law Society of Kenya annual conference in Diani, Kwale county, that they have 900 pages of evidence of the rigging.', ' ', '""We did an analysis of the results in London. It showed something very interesting,"" he said noting 10 million people voted for MCAs, MPs, woman representatives, senators and governors each.', ' ', '""But 12 million people voted for the presidency,"" he said, terming this the anomaly they talked about when the electoral body released the poll results.""', ' ', '[VIDEO] Raila reveals IEBC confession of rigging in 2013 election', ' ', '\n']"
http://www.the-star.co.ke/news/2017/07/22/a-huge-and-positive-message-for-kenyan-youth-from-jack-ma_c1601657,A huge and positive message for Kenyan youth from Jack Ma,www.the-star.co.ke › Opinion › Leader,"Jul. 22, 2017, 12:00 am","['When Chinese business magnate Ma Yun (aka Jack Ma) came to\nNairobi this week, Kenyans sat up and paid attention. ', ' ', 'Speaking at the University of Nairobis Chandaria Hall to a\nrapt audience in an event that was broadcast live on TV, the founder and\nexecutive chairman of Alibaba Group, an Internet-based network of businesses,\nhad a special message for Kenyan youth. ', ' ', 'Dont just sit back and bemoan your setbacks and apparent\nlack of opportunities. With determination and action, you can surmount most\nhurdles and make a beeline for success.', ' ', 'Kenyans are keen readers of motivational books. Mas UoN\nevent, which was also attended by UNCTAD secretary general Mukhisa Kituyi, was\nthe official launch of the Empretec programme and motivation on two legs. ', ' ', 'Ma is UNCTADs Special Adviser for Youth Entrepreneurship\nand Small Business. ', ' ', 'When one of the worlds foremost entrepreneurs comes\ncalling, even bang in the middle of a General Election campaign, Kenyans pay\nkeen attention.', ' ', 'Lets hope young Kenyans now act on Mas words of wisdom.', '\n']"
http://www.the-star.co.ke/news/2017/07/20/trump-regrets-picking-sessions-as-attorney-general-ny-times_c1600543,Trump regrets picking Sessions as attorney general -NY Times,www.the-star.co.ke › World,"Jul. 20, 2017, 6:00 am","['US President Donald Trump said on Wednesday he would not have appointed Jeff Sessions as attorney general if he had known Sessions would recuse himself from the Russia investigation, according to a New York Times interview. ', '""Sessions should have never recused himself and if he was going to recuse himself he should have told me before he took the job and I would have picked somebody else,"" the Times quoted Trump as saying. ', ""Sessions recused himself in March from the probe into allegations of Russia's meddling in the 2016 US presidential election and possible ties between Russians and the Trump campaign. He did so after failing to disclose at his confirmation hearing that he had held meetings last year with Russia's ambassador. "", 'A Sessions spokesman declined a Reuters request for comment. ', ""There were media reports last month that Sessions, a former US senator who was an early supporter of Trump's campaign, had offered to resign because of tensions with Trump over the recusal. "", 'Trump also told the New York Times that a conversation he had with Russian President Vladimir Putin during a dinner at the Group of 20 summit in Germany earlier this month lasted about 15 minutes and was mostly about ""pleasantries."" That conversation has sparked controversy because it was only disclosed on Tuesday. ', 'Ian Bremmer, the president of political risk consultancy Eurasia Group, has said the meeting lasted about an hour. ', '\n']"
http://www.the-star.co.ke/news/2017/07/20/chili-farming-takes-root-in-west-pokot-after-proving-tolerant-to_c1597951,Chili farming takes root in West Pokot after proving tolerant to drought,www.the-star.co.ke › Lifestyle › Big Read,"Jul. 20, 2017, 1:00 am","['Red pepper farming is slowly taking root in West Pokot county, a predominantly semi-arid region often hit hard by drought.', ' ', 'Farmers are changing the trend and embracing drought-tolerant crops like chili. Our long and rough drive leads us to Sheila Cherops home in Kangorio village. She is among farmers who have taken up chili farming and other fruit crops in her one and a half acre of land.', ' ', 'The middle-aged mother of three says she completed her diploma course in social work and community development at the University of Eldoret two years ago, and because getting a job was difficult, she decided to concentrate on farming.', ' ', 'We bought this land in 2008 and decided to do fruit farming of water melon, paw paw, mangoes and bananas. Now we are also growing chili thanks to a programme by the Food Agricultural Organisation, which is supporting farmers in buying a water tank and doing drip irrigation to grow the crop, she says.', ' ', 'Cherop adds that pepper is ideal for her since the place is dry and there is water scarcity, but with drip irrigation, she can grow chili, which is tolerant to drought.', ' ', 'With the little water we get twice a week, I can store in the 8,000 litre tank and use some for my household needs and the rest for growing chili through the drip irrigation, Cherop says.', ' ', 'It is her first time to grow chili, and she has currently planted seedlings in a nursery ready for transplanting in a quarter acre. She says the ready market is a big motivation to farmers, who have signed a three-year contract with a company in Malindi. A kilogramme of dry pepper will be bought at Sh200.', ' ', 'All a farmer needs to do is plant chili and ensure good agronomic practices to meet the required quality and standard. After harvest, someone will come to buy it from us. This is an advantage for us, as marketing our farm produce such as papaw and water melons has always been a big challenge, since we can only sell them at the local market, where the price is often low, Cherop explains.', ' ', 'Germination of chili seeds takes an average of seven days in the nursery and two to three months to mature after transplanting.', ' ', 'I will be able to use little water by using the drip irrigation, unlike maize, which needs a lot of water, and I will be able to save more water and grow other fruits crops. Maize is also easily affected by diseases and pests, such as the armyworm, but chili has fewer diseases. I want to change from animal keeping because most of the livestock died during the recent prolonged drought and we could hardly afford school fees for our children, Cherop says.', ' ', 'TURNING POINT', ' ', 'Farmers in Ortum and Sebit in West Pokot county have not been left behind in chili farming, despite the harsh weather in the area.', ' ', 'Until last year, Pamela Chepkorir from Kasaka village was growing maize and onions in her two-acre farm. She says the price of onions went down as low as Sh10 a kilo due to an oversupply of onions in the local market. This is when she decided to stop growing onions and maize and try her hand at chili farming.', ' ', 'When I started planting onions, I would get about Sh80,000 from a quarter acre, but the price later declined to almost Sh25,000. This was my turning point and if I work hard, I know I can make a lot of money, since a kilo of dry pepper is selling at Sh200, she says.', ' ', 'Chepkorir says unlike onions, chili farming is labour-intensive and one only needs to weed and supply the crop with water using drip irrigation.', ' ', 'I do not need to spray chemicals or use any fertliser, I use manure to grow chili and there are few diseases. The only problem Im having is that of birds, but I use scarecrows to keep them off, says the mother of four.', ' ', 'Giuseppe De Bac, FAO project manager in West Pokot, said the three-year project, Increasing Quality and Production of Added Value Crops in West Pokot, is a $2 million (Sh2 billion) partnership between FAO and the Italian Cooperative.', ' ', 'He said FAO is providing technical assistance to enhance high production of chilli and also link the farmers to a ready market. The UN food agency is also supporting farmers in training on value addition to mangoes.', ' ', 'He says chili is an ideal crop for this region because it is drought-resistant and the 8,000 litres and drip irrigation kit being provided to about 150 households through the project will help fight drought in the area.', ' ', 'A farmer can harvest at least two kilos of chili per year per plant. We are also promoting the growing of soyabeans, fruits such as water melon and paw paws. The Rift and Kerio Valleys are known for fruit farming due to the favourable weather, he says.', ' ', 'The project started in 2015 until the end of this year and is targeting 2,000 farmers directly but more farmers indirectly.', ' ', 'He says at first, the farmers were not willing to embrace farming since traditionally, this is a community of pastoralists.', ' ', 'But through working with the county government, we have been able to convince them and many are seeing the benefits of farming, Giuseppe says.', ' ', 'The farmers are planting the African Bird Eye pepper variety, which is a perennial crop and can produce high yields for three to four years, after which the yields start reducing.', ' ', 'The advantage, he says, is that a farmer gets to save water and keep the moisture in the soil, adding that they should not do sprinkle irrigation.', ' ', 'Giuseppe says there is demand for chili, hence the reason they are linking farmers with buyers from Malindi.', ' ', 'Our biggest challenge is for farmers to produce chili that is of high quality for them to be in business, he adds.', ' ', 'TRAINED ON TRANSPLANTING', ' ', 'Glenda Andiema from La Fattoria Limited says they are in an agreement with 130 farmers in the area. La Fattoria is the company that has signed the contract with chili farmers in West Pokot, with 50 per cent of them being women. ', ' ', 'We give chili seeds to farmers and train them how to plant in the nurseries and transplant them in the farm. We also assure farmers of a ready market for their produce, she says.', ' ', 'The company has established a seed nursery in Sebit, and they have three buying centres in Sebet, Morpus and Ortum, where farmers will be required to take their chili harvest.', ' ', 'She explains that once farmers have harvested their red pepper, they will bring them to the buying centres, where the company will dry the produce for about two days. After that, the dry chili is transported to Malindi, packaged and exported to the European market.', ' ', 'Once the pepper is dry, we pay farmers their dues, depending on the kilos they harvested. This will be our first month to buy from farmers and we are expecting to have a good harvest, Andiema says.', ' ', 'Mercy Nekesa, also from La Fattoria, says they are hoping to get into contract with more farmers so they can have enough supply of chili for export.', ' ', 'In future, we would want to have the farmers forming groups so they can sell their produce in bulk and enjoy more profits, she adds.', ' ', 'New pawpaw variety yields 100 fruits a year', ' ', ' ', 'The Maradol pawpaw variety, which is originally from Cuba, was recently introduced by the Food Agricultural Organisation and has been taken up by the farmers.', ' ', 'Over 3,000 pawpaw seedlings have been planted since last year.', ' ', 'Esther Kilim, a farmer from Ortum, says she has cut down her indigenous pawpaw trees, which have been in her farm for many years until they could not produce anymore. She wants to replace it with the Maradol variety.', ' ', 'The indigenous variety we plant is tall and the fruits are few and small. This attribute makes it difficult for a child to climb high up in the tree to pick fruits, unlike the new variety, which is short and easy for a child to pick the fruits. I have seen from the demonstration farm how the new pawpaw variety produces many fruits and that is why I decided to plant then so I can sell and make more money, she says.', ' ', 'Giuseppe De Bac, FAO project manager in West Pokot, says he was impressed by the high production of the Maradol pawpaw fruit in the region.', ' ', 'The fertility of the soil and the heat are favourable for the pawpaw. A farmer only needs to water the plant and in about eight months from the time of planting, one can harvest about 50 fruits, he says, adding that production of the variety starts declining after three years and should be replaced with a new seedling.', ' ', 'It was first planted three years ago in a demonstration farm on trial basis, and since then, farmers from Ortum and Sebit have been cutting the indigenous pawpaw tree to plant the Maradol variety.', ' ', 'The new variety is dwarf, high yielding, produces reddish fruits, which have a high content of Vitamin A that is good for children.', ' ', 'He says the seeds can be recycled. After eating the fruit, the seeds can be dried and planted for six to seven times.', ' ', 'FRUIT FARMING POPULARITY', ' ', 'At Masol ward in West Pokot, most pastoralists are turning to horticulture and fruit farming. Ward administrator Aron Kibet says most residents are pastoralists and have relied on livestock for years.', ' ', 'This, he said, is changing thanks to the intervention of development partners like FAO, who have introduced fruit farming.', ' ', 'The region has a favourable climate for cultivation of fruits. The soil is fertile for growing fruits such as pawpaw and with enough water, such fruits can produce more, Kibet says.', ' ', 'He says cattle rustling has reduced and now young people are more involved in farming. They have realised they can use the money from farming to buy animals, he says.', ' ', 'Some of the common pawpaw varieties grown in Kenya, according to the Agriculture ministry, include the solo variety, which produces small, round sweet fruits with uniform size and shape. It is popular for both export and local market.', ' ', 'Others include the mountain variety grown at high altitudes with small fruits only suitable for jam and preserves. There is also the sunrise variety that produces smooth, pear-shaped fruits of high quality, weighing 400 to 650 grams.', ' ', 'The red royale is an improved breed that is also high yielding. And then there is the propagated papaya using tissue culture, which is disease-resistant, high yielding and easy to maintain and harvest since the trees are short.', '\n']"
http://www.the-star.co.ke/news/2017/07/20/cholera-outbreak-kot-roast-cs-mailu-for-skipping-weston-in-closure_c1600584,Cholera outbreak: KOT roast CS Mailu for skipping Weston in closure orders,www.the-star.co.ke › Latest News,"Jul. 20, 2017, 9:00 am","['The Health ministry has defended Weston hotel after Kenyans on social media questioned why it was not closed over Cholera outbreak.', 'The two popular city hotels are said to have supplied food at public functions during which cholera cases were reported. ', 'However, Weston Hotel -owned by Deputy President William Ruto, was not closed on grounds the food it served the affected was outsourced.', 'Doctors who attended a conference at the hotel posted laboratory results on social media showing they tested positive for cholera.', 'The ministry on Thursday said via twitter: ""Weston incidence was as a result of outsourced food.""', ""This angered Kenyans on twitter who tasked Mailu to explain why the hotel was not closed and yet it was 'the carrier of Cholera'."", '""Instead of Mailu closing Weston hotel he closes vibandas which have never heard any case of cholera,"" Kelvin Kalz, a twitter user, said.', 'Agot Bonface said: ""Power corrupts. CS Mailu orders closure of Jacaranda & San Valencia hotels. Weston Hotel, the genesis of #CholeraNairobi is untouched.""', '""So @WilliamsRuto Weston hotel can continue spreading cholera endangering peoples lives but go unmentioned?,"" Shaw Grady said.', '@Waambui said: ""Maybe Health CS Mailu is only closing those hotels that have no license to spread cholera. Weston Hotel must be having one.""', '""Weston Hotel was the first Hotel to propagate kipindupindu. It has been excluded from the list of hotels closed. Anyway... Cartels!,"" said Abraham Mutai.', 'Weston outsourced food', '""It is common knowledge that hotels don\'t allow food and drinks from outside,"" @Jarnner said.', 'Peter Okong\'o said: ""This absolute rubbish. Hotels make money from conferencing, food and accommodation. Can you imagine Serena ordering food from Kosewe\'s?""', '""If you start playing Tom and Jerry games with cholera, then be assured it is here to stay. Be courageous and shut down Weston!,"" Jack Otieno Odunga said.', 'Daisy Amdany said: ""Are you guys sober? Someone needs to sue you people for criminal negligence and for taking Kenyans for fools!""', 'At least 79 people with confirmed cases of cholera are being treated in various Nairobi hospitals.', '""Authorities are setting up 10 more treatment centres to deal with the outbreak,"" Mailu told a news conference on Wednesday.', 'Some 101 patients are admitted at Kenyatta National Hospital.', 'On Tuesday, the Health ministry cancelled the medical certificates of all food handlers to contain the cholera outbreak that has hit Nairobi.', 'Medical services director Jackson Kioko directed all county health departments to conduct fresh medical examinations.', 'Kenya has suffered several waves of cholera since 1971, according to World Health Organization.', 'An outbreak in March last year killed 216 people across the country and left at least 13,000 hospitalised.', '\n']"
http://www.the-star.co.ke/news/2017/07/20/afc-ordered-to-settle-squatters-in-taveta_c1600317,AFC ordered to settle squatters in Taveta,www.the-star.co.ke › National News,"Jul. 20, 2017, 12:00 am","['President Uhuru Kenyatta on Wednesday ordered the Agricultural Finance Corporation to settle squatters living on its land in Taveta in four villages.', '\n', 'The villages are Kimorigo, Mrabani, Eldoro and Python Hill. ', '\n', 'Speaking in Taveta town, Uhuru said his government has delivered on its promise to settle squatters in the region. ', '\n', 'We have told AFC that since those living on the land are poor people, who cannot purchase the land, they should give them the land where they have built and also issue title deeds to them. The land will be issued for free, he said.', '\n', 'He said the government will negotiate with AFC to reduce the cost of the extra land.', '\n', 'The villagers live on 1,000 acres of the AFC land.', '\n']"
