http://www.the-star.co.ke/news/2017/07/08/matiangi-imposes-three-month-dusk-to-dawn-curfew-in-lamu-tana-river_c1593356,"Matiang'i imposes three month dusk to dawn curfew in Lamu, Tana River and Garissa counties",www.the-star.co.ke › Latest News,"Jul. 08, 2017, 6:00 pm","['Acting Interior CS Fred Matiangi has imposed a three month dawn to dusk curfew in Lamu, Tana River and Garissa counties to contain al Shabaab.', ""In a gazette notice, Matiang'i on Saturday said the order shall be effected from July 9 to October 9, 2017."", 'President Uhuru Kenyatta chaired a National Security Council meeting earlier in the day. ', 'The council declared parts of three counties and the surrounding environs as disturbed and dangerous areas.', '""This order shall apply during the hours of darkness between the period of 6.30pm in the evening and 6.30am in the morning,"" Matiang\'i said.', 'Holugho Border Point, Galmagala, Sangailu, Masalani, Bodehei, Milimani, Baure, Basuba, Mangai and Maralani are among the areas where the curfew will apply.', 'Other areas include Ijara, Hola, Garsen, Kipini, Kiunga and Ishakani/ Dar-es-Salaam Border Point.', ""Matiang'i however said the curfew excludes the Islands of Lamu, Manda and Pate."", '""Every person who resides within this Sub-Counties shall except under and in accordance with the terms and conditions of a written permit granted by the respective Deputy County Commissioner of the affected areas, remain indoors in the premises at which they reside or at such other premises as may be authorised,"" he said.', ""Matiang'i's order comes barely a day after nine people were on Friday night massacred by suspected al-Shabaab militants in Jima and Poromoko villages in Lamu county."", 'The victims, all men, were slaughtered using knives.', 'Jima Village is about two kilometres from Pandanguo where al-Shabaab militants attacked a police station and killed three officers on Wednesday morning.', ""Police said the militants had ransacked farms at Jima looking for 'non-Muslims' but did not find them since majority had fled following the Wednesday attack in Pandanguo."", '\n']"
http://www.the-star.co.ke/news/2017/07/08/dont-criticise-raila-focus-on-your-campaign-ababu-urged_c1592684,"Don’t criticise Raila, focus on your campaign, Ababu urged",www.the-star.co.ke › Local News › Western,"Jul. 08, 2017, 12:00 am","['Budalangi MP and Labour Party of Kenyas Ababu Namwamba has been told to stop attacking ODM leader Raila Odinga, who has nothing against him.', 'ODM supporters at Ganga trading centre in Bwiri ward, Funyula constituency, led by Bwiri ward ODM coordinator Thomas Buluma, said the NASA flagbearer has nothing against Namwamba. We fail to comprehend why the Budalangi legislator is going round talking ill of a person who has nothing against him, instead of campaigning for Jubilee and himself, the supporters said. They said the former Prime Minister has what it takes to be Kenyas President and those saying he is unfit are daydreamers.', 'We want to tell off those claiming he is unsuitable for the top seat. They have a sinister agenda against Raila, said the ODM coordinator.', 'The supporters say even Jesus Christ was criticised, but still emerged victorious.', 'Namwamba said Raila will never win the presidency. He addressed Bunyala South residents at Mau Mau trading centre after handing over AP houses funded by the Budalangi CDF kitty.', 'Namwamba told Raila to stop bragging that he started and designed the Sigiri bridge project when he was Roads minister. He accused the opposition chief of politicising the Sigiri bridge collapse on June 26. The legislator termed the collapse an act of sabotage by rivals, especially those in Railas ODM party, but announced construction will be completed before the end of the year. ', 'The MP also said the former PM used the opportunity to enrich himself and develop Nyanza, which he says benefitted through the construction of tarmac roads, Bondo University and expansion of the Kisumu airport.', 'Namwamba, the former ODM secretary general has since embarked on a marathon campaign at the grassroots to ensure Raila has no supporters in Budalangi. ODM supporters have said they are confident Raila will win the presidency.', '\n']"
http://www.the-star.co.ke/news/2017/07/08/i-left-odm-because-it-had-nothing-to-offer-says-mwazo_c1592787,"I left ODM because it had nothing to offer, says Mwazo",www.the-star.co.ke › Local News › Coast,"Jul. 08, 2017, 12:00 am","['Taita Taveta Jubilee governor candidate Dan Mwazo (pictured) has revealed the reasons why he decamped from ODM. ', 'He told a rally in Buguta on Thursday that ODM has nothing to offer Taita Taveta residents.', 'The rally was attended by DP William Ruto, Tourism CS Najib Balala, Taveta MP Naomi Shaban and Taita Taveta woman representative Joyce Lay.', 'I was there for 10 years and all what we did was just gambling. We are no longer fools to continue gambling with our future. A good dad is the one who comes back home with a loaf of bread for his children, Mwazo said.', 'He said the county will deliver more than 120,000 votes for President Uhuru Kenyatta.', 'Lay said the region is set to benefit from development projects if they vote for Jubilee.', '\n']"
http://www.the-star.co.ke/news/2017/07/08/no-more-candidates-names-in-electronic-system-says-iebc_c1592979,"No more candidates’ names in electronic system, says IEBC",www.the-star.co.ke › National News,"Jul. 08, 2017, 12:00 am","['Aspirants whose names are not in the Candidate Registration and Management System will not have their results transmitted electronically, the IEBC has said.', 'The electoral agency on Friday announced that adding more names to the candidates list will delay the August 8 General Election.', 'IEBC chairman Wafula Chebukati said, however, the commission will have a few additional candidates approved by the court participate in the polls.', 'He said the additional candidates will participate in the process, but their results will not be issued through the results transmission system.', 'We are currently printing ballot papers and there is a possibility of having candidates being approved late. We shall have their results issued, but not through the results transmission system. This is the only way we can navigate this issue to avoid locking them out, Chebukati said.', 'Rather than risk the realisation of the entire polls on August 8, the commission has resolved that no further amendments to the candidates list and the register of voters shall be introduced at this stage.', 'He said despite having the CRMS in place, the commission will use voter identification to authenticate voters, check voter turnout and curb election fraud.', 'The integrated electronic system will ensure a secure, verifiable, transparent and reliable electoral system, Chebukati said.', 'The IEBC has assured it will recruit and train poll officials, print and distribute ballot papers and other materials, test the technology and carry out all other critical activities on time.', 'Chebukati said they are currently recruiting polling officials countrywide and has received more than 982,381 applications.', 'Political parties are expected to submit to the commission names of their national and county chief agents on or before July 24.', 'The electoral agency has urged the public to be vigilant in ensuring that credibility of the register of voters is protected at all times.', 'We wish to clarify that the accuracy of the 2017 the register of voters depends on the implementation of the outcome of the verification exercise that was undertaken between May 10-June 9 this year and the recommendations by KPMG following the audit of the register of voters, Chebukati said.', 'He said the KPMG audit showed the register of voters had 171,476 records as invalid IDs, compared to the National Registration Bureau Register.', '\n']"
http://www.the-star.co.ke/news/2017/07/08/nkaisserys-wife-admitted-after-sudden-death-of-the-cs_c1593212,Nkaissery's wife admitted after sudden death of the CS,www.the-star.co.ke › Latest News,"Jul. 08, 2017, 9:00 am","[""Interior CS Joseph Nkaissery's wife has been admitted to a Nairobi hospital after the abrupt death of her husband early today."", ""Hellen Nkaissery was rushed to hospital after developing high blood pressure on receiving news of her husband's death at the Karen Hospital."", 'Kajiado Central MP Elijah Memusi, however, said Hellen was stable and is being monitored by medics.', 'The CS, 67, died a few hours after being admitted to the hospital on Saturday morning.', 'Head of public service Joseph Kinyua confirmed the death in a statement to the newsrooms.', 'It is with deep sorrow and shock that we announce the sudden death of Interior CS Joseph Nkaissery, the country will be updated as more information becomes available,"" the statement read.', '\n']"
http://www.the-star.co.ke/news/2017/07/08/muslim-clerics-throw-weight-behind-jama_c1592735,Muslim clerics throw weight behind Jama,www.the-star.co.ke › Local News › North Eastern,"Jul. 08, 2017, 12:00 am","['Garissa Governor Nathif Jama received a major boost in his reelection bid on Friday after 400 Muslim clerics endorsed him. ', 'The Muslim leaders headed by Mohamed Gedi threw their weight behind Jama, saying he established peaceful co-existence and promoted cohesion among communities.', 'The endorsement by the clerics is significant because the clerics command respect among residents.', 'On behalf of my fellow clerics, we have unanimously agreed to support the governor. We will reach out to our people to re-elect him, said Gedi.', 'This comes amid allegations that the governors Sh5.2 billion account had been frozen. A story published in the Nation last week said the Ethics and Anti-Corruption Commission had successfully asked the High Court to freeze Jamas account at the First Community Bank.', 'However, in letter dated July 5 that surfaced online yesterday, written by the commissions CEO Halakhe Waqo, the anti-corruption agency distanced itself from the Nation report, saying it was not the source of the information.', 'The letter says,The commission undertook investigations on the alleged misappropriation of Sh5.2 billion after it received reports supported by a bank statement from a complainant on Monday June 26. ', 'The commission therefore deeply regrets the anxiety and frustration this has caused and strongly assures you it will remain impartial, fair and Just in carrying out constitutional mandate.', 'Jama denounced the allegations, saying such statements were likely to undermine peace and tranquility among the residents of Garissa.', 'Its unfortunate independent institutions can stoop low and are now being used by self-seeking politicians to harass their opponents whom they see as their threat. This trend should be stopped, he said.', '\n']"
http://www.the-star.co.ke/news/2017/07/08/uhuru-and-raila-are-two-sides-of-same-coin-nyagah-running-mate_c1592878,Uhuru and Raila are two sides of same coin - Nyagah running mate,www.the-star.co.ke › National News,"Jul. 08, 2017, 12:00 am","['Jubilee presidential flag bearer Uhuru Kenyatta and his NASA counterpart Raila Odinga have been castigated for continuously confronting each other in political arguments instead of addressing the concerns of Kenyans.', 'Speaking to the Star yesterday, presidential aspirant Joseph Nyagahs running mate Moses Marango said the two  Raila and Uhuru  are not fit to present alternative leadership for the country, terming them as two sides of the same coin.', 'COST OF LIVING GOES UP', 'The cost of living has gone up yet these two people are busy bashing each other. They are creating a euphoria for the sake of earning political mileage. It is for this reason that Kenyans are gradually realising the alternative is a peaceful independent candidate Joseph Nyagah who is capable of delivering Kenyans from this quagmire, Marango said.', 'failed to contain democracy', 'He said the pair have failed to nurture democracy in their parties and allowed dictatorship to be entrenched during nominations. The Jubilee party leader [Uhuru Kenyatta] allowed dictatorship to be embraced by his deputy, who ensured his sycophants won the nominations. In Nyanza, if you are not close to Raila Odinga, you were definitely doomed to lose the nominations, Marango claimed.', 'Both NASA and Jubilee leaders have psychologically prepared their supporters for the outcome of the August 8 General Election.', 'Marango said NASA has been saying it will garner more than 10 million votes, while Jubilee has told its rivals to accept the outcome of the election.', 'prepared voters for results', 'Whether NASA will lose the election fairly or unfairly, they have prepared their supporters to reject the election results. Uhuru has challenged NASA to come clean and confirm they would accept the election results should they lose, the deputy president hopeful said.', 'He said the two politicians have over the years had the chance to transform the country but failed.', 'Marango called on all the presidential candidates to disclose their campaign financiers and have their accounts audited in the interest of accountability.', 'He appealed to the IEBC and other government agencies to lock out candidates who have benefited from corrupt funding.', 'Nyagah launched his nationwide presidential campaign in Nairobi on Saturday. Nyagah was born in 1948. He was the Minister of Cooperative Development and Marketing during the Grand Coalition government. Nyagah was also a member of ODMs Pentagon in the lead up to the 2007 General Election.', '\n']"
http://www.the-star.co.ke/news/2017/07/08/i-didnt-hire-youths-to-disrupt-munyas-rallies-mca-hopeful_c1591897,I didn’t hire youths to disrupt Munya’s rallies - MCA hopeful,www.the-star.co.ke › Local News › North Eastern,"Jul. 08, 2017, 12:00 am","['A municipality MCA aspirant from Meru town has disputed claims by Governor Peter Munya that he is being used to disrupt his meetings.', 'Kenneth Mutuma (pictured), who is vying on the Mazingira Greens Party ticket, has said his life is in danger after Munyas comments. He urged Meru police to boost his security because I might be attacked by Munyas supporters. He spoke at a press briefing on Wednesday. Mutuma said Munya should apologise for his remarks. ', 'I heard Governor Munya claimed that I have been transporting youths to his function with sinister motives. This is completely false. I dont own a vehicle and neither do I have political clout to compete with the governor. I am only vying for MCA. How can I be able to compete with the former Council of Governors chairman? he said.', '\n']"
http://www.the-star.co.ke/news/2017/07/08/stanchart-unveils-sme-training-programme-for-clients_c1592919,Stanchart unveils SME training programme for clients,www.the-star.co.ke › Business › Local,"Jul. 08, 2017, 12:00 am","['Standard Chartered Bank yesterday unveiled a programme aimed at educating small and medium enterprises as they seek to scale up their businesses.', ' ', 'The initiative dubbed Business Banking Clients Recognition Program is set to engage the lenders customers in entrepreneurship and financial skills workshops.', ' ', 'The programme will be run in conjunction with Kenya Association of Manufacturers, Kenya Investment Authority alongside Strathmore business school.', ' ', 'Through our partnership with Strathmore our clients will attend capacity building training and workshops equipping them with skills needed to grow business, StanChart head of retail banking David Idoru said.', ' ', 'Last month, the tier-one lender announced plans to increase SME funding by 30 per cent this year, targeting to loan more than Sh12 billion to the sector to improve their capacity in cash management, trade finance and technology.', ' ', 'KenInvest will link the businesses to trade opportunities on the Asian Trade corridor complemented by Study trips to the region. The bank will facilitate the Kenyan delegates to meet and network with SME counterparts in China, Malaysia and Singapore.', '\n']"
http://www.the-star.co.ke/news/2017/07/08/nasas-round-one-victory-in-ballot-paper-printing-case_c1593020,NASA’s round one victory in ballot paper printing case,www.the-star.co.ke › National News,"Jul. 08, 2017, 12:00 am","['NASA yesterday came out to clear the air that it has only one manifesto that was launched on Tuesday last week.', 'In a a press statement, NASA presidential candidate Raila Odingas adviser Salim Lone said there is a simpler version of the main manifesto that was meant to help Kenyans digest it easily.', 'To ensure a wider understanding of what the Manifesto specifically offered Kenyans, the Coalition felt that a shorter and more easily readable and digestible version was needed, he said. He added, This version would spell out what the tangible developmental deliverables under a NASA government would be, which were not included in the manifesto itself as the manifesto was more of a visionary and goal-oriented document which did not focus on many specific deliverables.', 'Lone said the manifesto was written by the presidential secretariat and denied claims that it was done by business cartels. The task of producing this simpler version was assigned to the NASA presidential secretariat, not to any business cartel. This shorter version was titled Road to the Kenyan Dream: Implementing Our Manifesto, he said.', 'Once this version was completed, the five principals met in an extensive session to review it, and approved its content. But it also asked that it be gone through carefully to omit any of the deliverables that were not in full harmony with the Manifesto. This was in fact done and some items were deleted from the implementation document, he said.', 'Lone said there are efforts in the media to discredit their presidential campaign, saying it is an indication the coalition is pulling well ahead of Jubilee.', '\n']"
http://www.the-star.co.ke/news/2017/07/08/video-kiunjuri-calls-off-tana-river-relief-distribution-tour-to-mourn_c1593217,[VIDEO] Kiunjuri calls off Tana River relief distribution tour to mourn Nkaissery,www.the-star.co.ke › Latest News,"Jul. 08, 2017, 9:00 am","['Devolution CS Mwangi Kiunjuri has cut off his two-day official tour of the Coast region following the sudden death of Joseph Nkaissery.', '\n', '\n', 'Kiunjuri who was on his second-day tour of Tana River county distributing relief food and implementing drought mitigation programme said he could not proceed following the death of his colleague.', '\n', 'He nearly broke down as he addressed journalists at the Ocean Beach Resort and Spa in Malindi on Saturday morning.', '\n', 'Kiunjuri said he learnt of the demise of Nkaissery with great shock.', '\n', 'Truly this country has lost a great Kenyan who was dedicated to his duty, he said.', '\n', 'Kiunjuri said the former Interior CS served with him as MP for 10 years, later as Assistant Minister and now they were together in the same cabinet.', '\n', 'He was committed, believed in the course of this country and in his duty, he would give advice however harsh it would be, he said.', '\n', 'The Devolution CS recalled how three weeks ago the late Nkaissery told him to tuck in his shirt when he went to his office to join him for security mission in Laikipia.', '\n', 'He was shocked that I was in his office and had not tucked in my shirt, Nkaissery would always tuck in his shirt, he said.', '\n', 'Kiunjuri said the relief distribution and drought mitigation programme had been called off until further notice.', '\n', '\n', '\n']"
http://www.the-star.co.ke/news/2017/07/08/police-cordon-nkaisserys-home-bomas-of-kenya-as-probe-begins_c1593293,"Police cordon Nkaissery's home, Bomas of Kenya as probe begins",www.the-star.co.ke › Latest News,"Jul. 08, 2017, 3:00 pm","['Detectives have commenced investigations into the sudden death of Interior CS Joseph Nkaissery.', ' ', ""The officers have cordoned off the CS's Nairobi home in Hardy, Karen estate and Bomas of Kenya."", ' ', 'The two places are being swept clean to crosscheck for any evidence that may be linked to his death. ', ' ', 'Bomas of Kenya is one of the places that the CS spent time on Friday night before proceeding to his home.', ' ', '""Some of our colleagues have been sent to the CS\'s home and the lounge in Bomas to keep watch as investigations proceed,"" an officer from Hardy police station said.', ' ', ' ', ' ', 'The home of Interior CS Joseph Nkaissery at Karen Hardy, Nairobi. Photo/COURTESY', ' ', 'Nkaissery was last seen in public at the National Prayer Rally at the Uhuru Park, together with President Uhuru Kenyatta and other leaders.', ' ', 'He later left Uhuru Park after the rally, passed by his office at Harambee House and proceeded to Bomas.', ' ', ' ', 'Bomas of Kenya where the late CS Joseph Nkaissery is said to have been on Friday evening. Photo/COURTESY', ' ', 'The former Kajiado North MP later in the night had a meeting with President Uhuru on security issues on the upcoming IAAF Championships till 9:30 before proceeding home.', '\n']"
http://www.the-star.co.ke/news/2017/07/08/video-leaders-pay-tribute-to-nkaissery-describe-him-as-dedicated_c1593209,"[VIDEO] Leaders pay tribute to Nkaissery, describe him as dedicated leader",www.the-star.co.ke › Latest News,"Jul. 08, 2017, 9:00 am","['Leaders from across the political divide have mourned the abrupt death of Interior CS Joseph Nkaissery terming him a gallant soldier and a robust leader.', '\n', 'President Uhuru Kenyatta said on Saturday morning that the passing on of the CS was a big blow to Kenyans, his family, and the Maasai community.', '\n', '\n', '""I have personally lost a friend. We spent the entire day yesterday (Friday) praying for the peace of our nation. We held discussions with the CS as late as 9.30pm. Nkaissery was one of the best in my government,"" Uhuru said.', '\n', 'Foreign Affairs CS Amina Mohamed called for peace and harmony during ""this tough time"" of mourning.', '\n', 'She termed Nkaissery as a jolly and good-hearted leader in the three years she worked with him.', '\n', '\n', '""It is with shock and deep sorrow that I have learnt of the sudden demise of Cabinet colleague CS Joseph Nkaissery. May God comfort his family. He was always available for consultation and made our Cabinet engagements such an enjoyable experience. We worked in perfect concert.""', '\n', '""I\'m deeply saddened by the loss of our dear beloved colleague General Nkaissery. We will miss you greatly."" Information CS Joe Mucheru said in a tweet.', '\n', 'Nairobi Governor Evans Kidero termed Nkaissery as a friend saying the CS was in good health as they had spent the day together during the National prayers held at Uhuru Park on Friday.', '\n', '""I am deeply shocked at the news of General Nkaissery who I was with yesterday. Fare thee well General. My condolences to his family.""', '\n', '\n', 'UK High Commissioner to Kenya Nic Hailey referred to the CS as a great partner of Britain.', '\n', '""Very sad news. CS Nkaissery was a good friend and strong partner of the UK in working for our shared security and we mourn his untimely death.""', '\n', 'Kuresoi South MP Zakayo Cheruiyot, a former Permanent Secretary for Internal Security during retired President Daniel Mois regime said Nkaissery was a no-nonsense officer who restored peace in the country from Alshabaab militants', '\n', 'I heard the news of the loss of my long term friend whom I have known since he was a youth with sorrow. On behalf of my family, and Kuresoi constituents, I pray for the family so that God may strengthen them during this time, he said.', '\n', 'My friend who served the Nation with diligence died when the country needed him most. It will be hard to replace him, the former Rift Valley Deputy PC said.', '\n', 'Bungoma Senator Moses Wetangula expressed shock at the loss of the CS, referring to him as a statesman, a patriot, a respected leader, a neighbor.', '\n', '""Nkaissery was a man with a good heart, he never carried grudges and made friends across the political divide with ease. Even as he passes on, it\'s without a doubt that Joseph Nkaissery has left an indelible mark on the political landscape in Kenya."" Wetangula said.', '\n', 'ODM political affair secretary and Ugunja MP said Nkaissery was a respected leader, dedicated to the service of the nation.', '\n', '""My condolences to the Nkaissery family. I differed with him many times on political issues but I respected his opinion all the same. My last encounter with him was in early June when he appeared before us at the Parliamentary Committee on National Security,"" he said.', '\n', '\n', '\n', 'More', '\n', ' ', '\n', '\n', '\n']"
