http://www.the-star.co.ke/news/2017/07/04/mavoko-parents-neglecting-kids-for-petty-handouts-from-politicians_c1590534,Mavoko parents neglecting kids for ‘petty’ handouts from politicians,www.the-star.co.ke › Latest News,"Jul. 04, 2017, 3:00 pm","['Parents from Mavoko have been accused of neglecting their children to attend political rallies for small handouts.', ' ', 'Athi River deputy county commissioner Geoffrey Omoding said they are paid as little as Sh300 per day to attend the rallies.', ' ', 'I wonder where politicians get locals to fill five to eight 60-passenger buses in Athi River. This happens for all rallies and political events, even on weekdays, Omoding said.', ' ', 'He said a majority of youths, women and men from the areas have abandoned their responsibilities leading to high cases of child neglect.', ' ', 'The situation is serious. Some men, women and youths leave their houses as early as 8 am and return even at midnight on a daily basis.""', ' ', ""He spoke on Friday after flagging off a peace walk organised by Wenami community-based organisation at St Jude's Catholic Church in Athi River town."", ' ', 'Omoding said the situation had resulted in a higher number of children loitering in Athi River and Mlolongo towns while others had resorted to crime.', ' ', 'Many parents leave their little children alone at home unattended to attend political meetings, events and rallies. We will not tolerate this, he said.', ' ', 'We are aware that some children have resorted to drugs and crime due to neglect. A number have dropped out of school.""', ' ', 'The deputy commissioner said legal action will be taken against all parents who neglect their children in the sub-county.', ' ', 'If we get information that there is a child who has been neglected anywhere within Mavoko, action will be taken against the parents, guardians and caretakers. We will arrest whoever is concerned...all children must be protected.""', ' ', 'Omoding noted no family can survive on the ""seasonal, petty handouts"" from politicians.', ' ', 'He said the idle public should not allow themselves to be lured into hooliganism by politicians and their agents.', ' ', 'We are well prepared to deal with them. Peace must prevail now and after the elections.""', ' ', '\n']"
http://www.the-star.co.ke/news/2017/07/04/bak-dream-big_c1590324,BAK dream big,www.the-star.co.ke › Sport › Sports Local,"Jul. 04, 2017, 9:00 am","['Plans are afoot to hold an international boxing championship in December featuring national team boxers against the rest of Africa.', 'Boxing Association of Kenya (BAK) chairman John Kameta said all gold medalists and some losers during the Africa Boxing Championship in Congo-Brazzaville, most of whom fought against Kenyans in quarters and semis, will be invited to for the event tentatively set for December at Kenyatta International Convention Centre, Nairobi.', 'This will no doubt be an appropriate way to gauge the preparedness of our boxers prior to international events rather than just waiting for big tournaments and qualifiers, said Kameta.', 'Kameta said they are yet to settle on a budget for the gigantic occasion but hinted that BAK is sourcing for corporate sponsorship to fund the occasion that will remain an annual event. The boxing supremo revealed that their main objective will be to run a tournament that will not only offer locals the requisite exposure but also earn them a living prior to the season closer. The boxing night should earn each participating boxer Sh500,000 if all goes well and will remain an annual event in our calendar, said Kameta. He said the boxing night will also parade a number of legendary boxers who will receive some tokens from the association.', 'Many of our local retired boxers have been languishing in oblivion so we want to play a leading role in acknowledging their distinguished service to the country in their heydays. We have boxing legends like Joseph (Akhasamba), Philip Waruinge, Dick Tiger Murunga and Steve Muchoki who are hardly appreciated yet they have done this nation proud. We also want to use them as role models for our upcoming crop of boxers and make them be part of the boxing family, added Kameta.', 'To run the International boxing night, Kameta said they have decided to skip the Machakos leg of the national league, meaning the competition will revert to the five event format instead of six. Kameta said they intend to invite top CEOs to night of boxing for them to identify with the sport. It will be a big dinner night with which we shall sell and brand tables to meet our financial obligations, he said.', 'Meanwhile, Kameta announced that BAK requires a budget of Sh3.6million to send the three-man team to the AIBA World Boxing Championships 2017 slated for August 25 to September 3 in Hamburg, Germany. The budget, which he said excludes training fees, will include accommodation, air tickets, boxer and official allowances as well as other incidentals like visa fees. Kenya has three slots at the prestigious championships.', 'During the recent Africa Championships, Kenya qualified three boxers in Shaffi Bakari (light-fly), Nick Okoth (lightweight) and middleweight John Kyalo qualified to the 2017 AIBA World Championships. We are very excited with the fact that we have some of our boxers going to the big stage. We hope to continue in the same spirit and fashion, said Kameta.']"
http://www.the-star.co.ke/news/2017/07/04/deliver-fair-ruling-to-stop-crisis-kandara-mp-asks-court-on-ballot_c1589652,"Deliver fair ruling to stop crisis, Kandara MP asks court on ballot tender lawsuit",www.the-star.co.ke › Local News › Central,"Jul. 04, 2017, 7:00 am","['Kandara MP Alice Wahome has asked judges hearing the ballot printing tender case to deliver a ruling that will ensure the August 8 vote goes on as planned. ', '\n', 'Wahome said delaying the election will cause a constitutional crisis, which might destabilise the country and scare away investors. ', '\n', 'The court does not work in a vacuum; the judgment cannot be delivered in a vacuum. Courts operate in a political, socioeconomic environment. The court should be mindful of Kenyans who have been preparing and are now ready for the election, the MP said. She said it is the duty of the IEBC to conduct a free and fair election without interference from outside forces. ', '\n', 'Speaking at St Peters Kandara Boys Secondary School on Saturday, Wahome asked the court to dismiss the suit by the opposition, which seeks to have the printing tender awarded to Al Ghurair company cancelled.', '\n']"
http://www.the-star.co.ke/news/2017/07/04/insurer-picks-veterans-for-ceos-of-subsidiaries_c1590200,Insurer picks veterans for CEOs of subsidiaries,www.the-star.co.ke › Business › Local,"Jul. 04, 2017, 7:00 am","['Financial service provider Apollo Group has appointed long serving senior manager Catherine Karimi to head the APA Life Assurance, and Vinod Bharatan as CEO of APA Insurance and its subsidiaries.', '\n', 'Bharatan, has 35 years experience at United India Insurance Company. ', '\n', 'He recently left Kenindia Assurance Company where he was managing director and chief executive officer. ', '\n', 'He worked in numerous states throughout India, in charge of various branches, divisions and regions until 2013 when he joined Kenindia Assurance Company as managing director and chief executive officer.', '\n', 'Karimi has over 18 years track record in the insurance industry in Kenya, where she has strengthened the businesses she has worked in and introduced innovative products and services.', '\n', 'These two executives bring on board a proven track record of success in the Kenyan insurance industry. We are confident of their ability to steer the business to greater heights, Apollo Group CEO, Ashok Shah said in a statement.', '\n']"
http://www.the-star.co.ke/news/2017/07/04/poor-equipment-cripples-lamu-fishing-industry_c1589987,Poor equipment ‘cripples’ Lamu fishing industry,www.the-star.co.ke › Local News › Coast,"Jul. 04, 2017, 9:00 am","['Stakeholders in the fisheries industry in Lamu met last Sunday to discuss ways to grow the sector to attain international standards.', 'The event was organised by the national government under the Blue Economy Initiative, whose main objective is to equip fishermen and encourage fishing to grow economies.', 'Five hundred stakeholders, including fishermen and Beach Management Units officials, attended the event.', 'County Fisheries executive Grace Mburu cited the lack of modern infrastructure as the main issue crippling the sector.', 'She said the county has set aside Sh26 million to build a landing site in Mokowe town.', 'It will be used to temporarily store fish once they are brought in from the ocean awaiting marketing.', '\n']"
http://www.the-star.co.ke/news/2017/07/04/ruto-not-welcome-in-homa-bay-kajwang_c1590228,Ruto not welcome in Homa Bay – Kajwang’,www.the-star.co.ke › National News,"Jul. 04, 2017, 6:00 am","['Political bickering has emerged between ODM and Jubilee politicians over President Uhuru Kenyattas Homa Bay tour.', ' ', 'Speaking in Homa Bay town on Sunday, Senator Moses Kajwang urged the President to leave behind DP William Ruto during the tour.', ' ', 'Kajwang did not disclose the reason why Ruto should not accompany the President.', ' ', 'We welcome him but he should exclude Ruto in his entourage, Kajwang said.', ' ', 'Uhuru is expected to commission a number of national government projects.', ' ', 'Karachuonyo MP James Rege and the county Jubilee co-coordinator Odhiambo Makowiti accused the senator of perpetrating prejudice.', ' ', 'Rege said such comments should be avoided.', '\n']"
http://www.the-star.co.ke/news/2017/07/04/wako-still-supports-me-not-ojaamong-says-otuoma_c1589951,"Wako still supports me, not Ojaamong, says Otuoma",www.the-star.co.ke › Local News › Western,"Jul. 04, 2017, 9:00 am","['Funyula MP Paul Otuoma has dismissed reports that Senator Amos Wako has defected\nfrom his camp to back Busia Governor Sospeter Ojaamong.', ' ', 'Otuoma is running against Ojaamong as independent candidate.', ' ', '""The\nreports that Wako is now vouching for the six-piece voting pattern for ODM is part of\nthe propaganda by Ojaamong after sensing defeat and it will not work,"" Otuoma said yesterday.', ' Wako was handed a direct ticket by ODM to defend his seat.', ' ', 'Otuoma chose to run as\nan independent after shambolic ODM primaries in which Ojaamong was\ndeclared winner. ', ' ', 'I\nhave talked to Wako and he is solidly in my camp, because he knows what the people\nof Busia wants in leadership, he said.', ' ', 'Wako\nhad previously declared he would not support Ojaamong, but concentrate on his\nreelection.', ' ', 'We want NASA presidential candidate Raila Odinga not to\nlose even one vote. If we start quarreling within NASA, Raila will lose the\npresidency, he was reported to have said.', ' ', 'Political pundits opine the Busia race could be determined by the tribal matrix as it would most\nlikely pit Luhyas against Tesos.', ' ', 'But Otuoma yesterday\nsaid the tribal talk was misplaced as residents of Busia, including Tesos were\nsimply angered by the dismal performance by Ojaamong.', ' ', 'He should stop hiding\nin the tribal formations and tell the people what he did for them for the last\nfour years in office as governor, he said..', '\n']"
http://www.the-star.co.ke/news/2017/07/04/stop-playing-politics-with-our-compensation-bondo-idps-tell-jubilee_c1590702,"Stop playing politics with our compensation, Bondo IDPs tell Jubilee",www.the-star.co.ke › Latest News,"Jul. 04, 2017, 3:00 pm","['IDPs from Bondo sub-county have warned the Jubilee administration against playing politics with their compensation issue.', 'The victims of 2007/8 the post-election violence asked the government to let them be if it is not ready to compensate them.', 'They told journalists in Bondo on Monday that they have questions on why only a few IDPs were compensated in the region and a majority of them sidelined.', 'James Ngesa, Bondo IDPs coordinator, said the criteria used by the government to select beneficiaries from Nyanza region was suspicious.', '""Why sideline more than 900 people who were displaced if the move to compensate us is genuine?"" he asked.', 'He added the amount of money they are being given is not enough enough and that it is easy to sense someone is playing politics with the initiative.', 'Ngesa further revealed that out of the few individuals whose KCB accounts have been credited with Sh50,000, forty are not IDPs.', '""The list from the bank contains names of people we do not know. We only know of IDPs in the original list that was presented to the government in 2009. The rest are Jubilee sympathisers.""', 'He said the Ministry of Interior, which was in charge of compensation, should explain to them why their issue is being politicised.', 'Ngesa said they have been forced to demand explanations from Bondo deputy county commissioner Richard Ajwang.', '""We are going to meet him on Wednesday. We want explanations on discrepancies in the list and when the remaining IDPs will receive their compensation.""', 'He addressed the press flanked by Usigu IDPs coordinator Francis Mayeya, who said they will hold demonstrations in Bondo town over the matter.', '""We want our plight addressed peacefully. We don\'t want a repeat of violence especially now that we are approaching elections.""', 'During his last tour of the Gusii region, President Uhuru Kenyatta compensated integrated IDPs in Nyamira and Kisii counties.', 'He paid IDPS from Kisii Sh358 million and those from Nyamira Sh470 million during the two-day tour.', 'ODM leaders complained that the head of state was only bribing voters through the ""late payment"".', '\n']"
http://www.the-star.co.ke/news/2017/07/04/kimani-ichungwa-to-retain-kikuyu-mp-seat-unopposed_c1591149,Kimani Ichung'wa to retain Kikuyu MP seat unopposed,www.the-star.co.ke › Latest News,"Jul. 04, 2017, 6:00 pm","[""Kikuyu MP Kimani Ichung'wa will be the first member of the 12th Parliament to retain his seat unopposed."", ' ', 'Kimani is the only candidate listed for the Kikuyu MP seat in a gazette notice published by the IEBC on Tuesday.', ' ', '""All Glory and Honour to the Almighty Lord. In serving my Kikuyu people faithfully, I serve my God fulfilling his wish and purpose of my life."" The MP tweeted on his official account.', ' ', 'Kimani, who was elected on the now defunct TNA in 2013, was seeking for re-election under the Jubilee party.', ' ', 'He has served as vice chair of the Public Investments Committee (PIC) in Parliament and is considered a prominent public personality in Kiambus political circles.', ' ', ' ', 'He also is a member of the committee of Powers and Privileges and the Departmental Committee on Agriculture, Livestock and Co-operatives in Parliament.', ' ', ""Ichung'wa was vocal in challenging Kiambu Governor William Kabogo's leadership and is considered to be eyeing the governor seat in 2022."", ' ', 'The 40-year-old studied at Strathmores school of Accounting and graduated from the University of Nairobi with an Honours degree in Economics.', ' ', ' ', '\n']"
http://www.the-star.co.ke/news/2017/07/04/8-years-1-for-each-stab-wound-inflicted-on-a-rival-lover-at-moi_c1590043,8 years — 1 for each stab wound inflicted on a rival lover at Moi,www.the-star.co.ke › Local News › Rift Valley,"Jul. 04, 2017, 9:00 am","['Too many university students are being killed over love affairs, a magistrate said as he sentenced a hospitality student to eight years in prison for killing a love rival.', 'Chief magistrate Charles Obulutsa yesterday ruled that Dickson Mutemi fatally stabbed Stephen Mututho eight times and will serve a year for each stab wound.', 'Mutemi, 20, killed his fellow Moi University student in Eldoret in a fight over a girlfriend on March 21 last year.', 'The deceased was stabbed eight times using a kitchen knife from the room of your girlfriend. For each stab, the court is going to give you one year. That means eight years imprisonment with the right of appeal in 14 days, Obulutsa ruled.', 'Obulutsa said eight years was lenient because the maximum sentence was life imprisonment.', 'The student pleaded that he is young and should be given a lenient sentence.', ' Obulutsa said it was a national concern that many students are losing their lives at universities because of love affairs that have nothing to with education that took them to the institutions.', 'The slaying occurred at the Pioneer Hotel where the girlfiend, identified as Faith Bwire, was staying.', 'Mutemi read a lengthy plea, asking for a non- custodial sentence to enable him to complete his studies and reform, but the court declined.', 'The unfortunate part is that Mututho is gone but for you its possible to serve the sentence. Then you can return to resume normal life, Obulutsa said.', 'You are taking the hospitality course that trains you to be hospitable to people, who are not friendly, and be able to control your anger. Stephen is gone and whatever sentence this court gives will not bring him back, Obulutsa said.', 'He said Mutemi had not tried to reach out to Mututhos family, saying the grave offence called for a deterrent sentence.', 'Though we may sympathise with your circumstances, the offence is serious. Its noted you are a first offender. The deceased passed away in a very agonising manner and other students wanted to kill you. Were it not for quick police action, you would also be dead, the magistrate said.', 'Mutemi asked whether there was an option of a fine. Obulutsa said theres no price tag for a life.', 'The magistrate said Mutemi can study in prison. ', 'Thats possible. Prison authorities will organise that. There are people who have learned and graduated from prison.']"
http://www.the-star.co.ke/news/2017/07/04/mwinyi-has-nothing-to-show-for-time-in-office-mitau_c1589868,Mwinyi has nothing to show for time in office – Mitau,www.the-star.co.ke › Local News › Coast,"Jul. 04, 2017, 9:00 am","['Changamwe MP aspirant Peterson Mitau has criticised incumbent legislator Omar Mwinyi, saying he has no development record to show for the time he has been in office.', 'He said Mwinyi has sensed defeat and has decided to spread smear campaigns against him.', 'Mitau has been carrying out rallies and road shows every week, since he was cleared to run as an independent by the IEBC.', 'He was initially in Wiper, but bolted out after he was allegedly rigged out by Wiper secretary general Hassan Omar. Omar has distanced himself from the accusation. Mitau claimed Daniel Muange was awarded the Wiper ticket, despite taking number three during the party primaries.', 'On Saturday in Bomu, Changamwe, Mitau said Mwinyi has been spreading rumours that he is being financed by President Uhuru Kenyatta to unseat him. Mwinyi is in ODM.', 'But Mwinyi said, Mitau can say anything he wants. Let him say whatever he feels good about, but we are not in the same league. We will never be in the same league.', 'He spoke to the Star on the phone yesterday.', '\n']"
http://www.the-star.co.ke/news/2017/07/04/chipera-boy-pledge-to-create-jobs-if-elected-next-month_c1589945,"Chipera, Boy pledge to create jobs if elected next month",www.the-star.co.ke › Local News › Coast,"Jul. 04, 2017, 9:00 am","['Kwale ODM candidates for governor and senator positions Issa Chipera and Issa Juma Boy, respectively, took their election campaigns to Jogoo Grounds in Gombato/Bongwe. ', 'They took a swipe at the current administration, saying it has failed to eliminate poverty and unemployment.', ' Chipera promised to create jobs by ensuring there is a conducive environment for investors to establish industries in the county. We also have a problem with poor health facilities and lack of water. This will be solved once you elect ODM leaders, he said.', 'Chipera said school fees for all bright students will be paid by the county government once he is elected.', 'His running mate, Simeon Mkalla, who ditched Wiper candidate Chirau Mwakwere, said the current administration has done little compared to other counties. When you go to Kilifi, there are very many tarmacked roads, but in Kwale we have none, he said.', 'Senate candidate Boy condemned those discrediting him, saying he is going for the seat as inheritance from his brother. When did we start inheriting seats for representation? You decided to nominate me and thats why they fear I will defeat them, he said.', '\n']"
http://www.the-star.co.ke/news/2017/07/04/jericho-start-second-leg-with-win-over-meltah_c1590177,Jericho start second leg with win over Meltah,www.the-star.co.ke › Sport › Sports Local,"Jul. 04, 2017, 9:00 am","['A comfortable 3-1 away victory over Meltah Kabiria FC ensured Jericho FC kick-started their Sportrpesa Super 8 Premier League second leg on a bright note on Sunday afternoon at Riruta BP Stadium in Kawangware.', 'First half opener from Antony Njeru in the 19th minutes broke the deadlock for the visitors who got their second and third goals in the second period through former KCB man Orneal Omondi (58) and Kevin Oreso (83). The win, however, doesnt do much for the Thomas Okongo men who stay unmoved at fourth place on the log but with an improved 32 points from 16 rounds of matches. Coach Okongo was proud of the slick performance from his charges and dedicated the win to their departed veteran coach and ex-Kenya International Bernard Makambo Agunda, who died last week. Meltah, who were at the end of the unlucky score line, netted their only goal of the match through Dalton Musa and their coach Simon Gicheru slammed his midfield for slumbering on the job. Meltah remain stagnant at ninth place on 21 points.', 'Hot favourites and league commanding boys Kawangware United made it clear that they still have the designs on the title after edging out East Conference minnows Macmillan 2-1 at BP grounds. Leading scorer Francis Thairu pushed his tally to 12 after finding the back of the net for the West Conference side in the 20th minute before Daniel Muturis second half goal rounded off the win, which brings Kawangwares tally to 39 points six points clear of second placed NYSA who have a game in hand.']"
http://www.the-star.co.ke/news/2017/07/04/publishing-opinion-polls-recipe-for-election-chaos-clergyman-warns_c1590895,"Publishing opinion polls recipe for election chaos, clergyman warns",www.the-star.co.ke › Latest News,"Jul. 04, 2017, 3:00 pm","['A Bungoma bishop has warned against the publication of opinion polls projecting the likely results of the August 8 polls.', ' ', 'Bishop Shiundu Wasike of Reformed Catholic Church said the surveys might play a role in stoking animosities between communities.', ' ', 'He said some groups may turn against each other and resort to violence in the event of dissatisfaction with the outcome.', ' ', 'The clergyman noted opinion polls played a big role in fueling the 2007/08 post-election violence which left over 1,300 dead and at least 650,000 displaced.', ' ', '""Some candidates who were perceived to be winning lost. This did not go down well with voters, triggering violence.""', ' ', 'Wasike added that some of the companies conducting the opinion polls are paid by politicians to present doctored.', ' ', '""I want to humbly caution those who do these polls that they are likely to cause of violence leading to bloodshed,"" he said.', ' ', 'The clergyman urged politicians to take note of the EU observers warning that the country might be plunged into chaos during the election.', ' ', ' ', ' ', 'In this regard, Wasike urged leaders to be careful with the statements they issue.', ' ', 'He told journalists the country cannot go back to the dark days of 2007/8 as healing has taken place.', ' ', '""We lost lives and property worth millions. Since we have healed as a country, we should not dare walk that route again,"" he noted on Tuesday.', '\n']"
